{"run":201,"commit":"25d729b","metric":2633,"metrics":{},"status":"keep","description":"Cleaned `crates/aspen-cli/src/bin/aspen-cli/commands/hooks.rs`: hook CLI now uses predicate-style JSON naming, routes wall-clock deadline reads through an explicit boundary helper for remote hook triggers, replaces swap-prone `&str` parameters with a request struct, and adds command-boundary invariants across list/metrics/trigger/create-url/trigger-url paths. Fresh-target-dir repo-owned workspace metric dropped from 2650 to 2633 (-17).","timestamp":1776563442698,"segment":2,"confidence":8.367854183927092,"iterationTokens":19459,"asi":{"hypothesis":"`crates/aspen-cli/src/bin/aspen-cli/commands/hooks.rs` matched the same honest late-stage CLI pattern as earlier command files—boolean `json` locals, zero-assert RPC wrappers, one swap-prone remote trigger helper, and direct deadline reads—so a focused helper/invariant cleanup should remove its remaining local warnings without changing hook behavior.","lessons":"This was another good repetitive CLI target: targeted `cargo check -p aspen-cli` stayed green and the hooks file went warning-free under package-local Tiger Style before the cold workspace run. `autoresearch.md` is still absent, so resume context must continue to come from git log plus `autoresearch.jsonl`, and post-keep HEAD/status still need manual verification because the tool banner is not trustworthy here.","next_action_hint":"Verify keep reality again, then mine `/tmp/aspen-tigerstyle-log.7E203C` for the next current dense repo-owned hotspot. Best next honest targets likely include `crates/aspen-forge-web/src/templates.rs`, `crates/aspen-blob/src/{replication/manager.rs,store/iroh_store.rs}`, `crates/aspen-jobs/src/job.rs`, `crates/aspen-federation/src/sync/client.rs`, or the remaining `deploy_wait` split in `crates/aspen-cli/src/bin/aspen-cli/commands/cluster.rs`."}}
{"run":202,"commit":"25d729b","metric":2632,"metrics":{},"status":"keep","description":"Finished the last local Tiger Style warning in `crates/aspen-cli/src/bin/aspen-cli/commands/cluster.rs`: deploy wait now delegates timeout/final-output/RPC-error/status-response handling to focused helpers, replacing the overlong polling helper with smaller bounded pieces while preserving deploy CLI behavior. Fresh-target-dir repo-owned workspace metric dropped from 2633 to 2632 (-1).","timestamp":1776563836786,"segment":2,"confidence":8.319604612850082,"iterationTokens":28326,"asi":{"hypothesis":"The remaining `deploy_wait` length tail in `crates/aspen-cli/src/bin/aspen-cli/commands/cluster.rs` was an honest but tiny cleanup opportunity: splitting timeout/final-state/status handling into focused helpers should remove the last file-local warning without changing deploy polling semantics.","lessons":"Even one-warning cleanup can still produce a real cold-workspace drop when the target is deterministic and locally verified first. `cargo tigerstyle check -p aspen-cli` is still the right cheap guard before burning a full cold-workspace run on these late-stage micro-fixes.","next_action_hint":"Verify keep reality again, then pick the next best honest hotspot from `/tmp/aspen-tigerstyle-log.IGJBey`: likely `crates/aspen-forge-web/src/templates.rs`, `crates/aspen-blob/src/{replication/manager.rs,store/iroh_store.rs}`, `crates/aspen-jobs/src/job.rs`, or another repetitive CLI file like `contacts.rs` or `blob.rs` if you want more low-risk tail harvesting."}}
{"run":203,"commit":"25d729b","metric":2618,"metrics":{},"status":"keep","description":"Cleaned `crates/aspen-cli/src/bin/aspen-cli/commands/contacts.rs`: contacts CLI now adds explicit command-boundary invariants across create/delete/get/update/list/search/import/export/group handlers and uses one helper for non-JSON vCard/error printing, removing the local assertion-density and conditional-nesting warning tail without changing contacts RPC behavior. Fresh-target-dir repo-owned workspace metric dropped from 2632 to 2618 (-14).","timestamp":1776564199436,"segment":2,"confidence":8.278688524590164,"iterationTokens":18696,"asi":{"hypothesis":"`crates/aspen-cli/src/bin/aspen-cli/commands/contacts.rs` matched the same honest repetitive CLI pattern as the recent command-file cleanups—many short zero-assert RPC wrappers plus two nested output branches—so adding real invariants and one small output helper should clear the local warning tail cheaply without changing contacts semantics.","lessons":"Contacts was another good low-risk late-stage target: targeted `cargo check -p aspen-cli` stayed green and the file-local Tiger Style slice went to zero before the cold workspace run. `autoresearch.md` is still absent, so resume context remains git log plus `autoresearch.jsonl`, and post-keep commit reality still must be verified manually because the tool banner can claim a commit even when HEAD does not move.","next_action_hint":"Verify keep reality again, then choose the next honest hotspot from `/tmp/aspen-tigerstyle-log.pnMcCO`. Good options now include `crates/aspen-forge-web/src/templates.rs`, `crates/aspen-blob/src/{replication/manager.rs,store/iroh_store.rs}`, `crates/aspen-jobs/src/job.rs`, or another repetitive CLI tail like `crates/aspen-cli/src/bin/aspen-cli/commands/blob.rs`."}}
{"run":204,"commit":"25d729b","metric":2604,"metrics":{},"status":"keep","description":"Cleaned `crates/aspen-cli/src/bin/aspen-cli/commands/blob.rs`: blob CLI now uses `max_results` naming for list limits, adds command-boundary invariants across add/get/has/list/protect/delete/download/status/repair handlers, and flattens the blob-get output path handling without changing blob RPC behavior. Fresh-target-dir repo-owned workspace metric dropped from 2618 to 2604 (-14).","timestamp":1776564470458,"segment":2,"confidence":8.184764991896273,"iterationTokens":14604,"asi":{"hypothesis":"`crates/aspen-cli/src/bin/aspen-cli/commands/blob.rs` matched the same honest repetitive CLI pattern as other recent command-file targets—one quantity-name field, many zero-assert RPC wrappers, and one nested output path in `blob_get`—so local invariant cleanup should remove the file-local warning tail without changing blob semantics.","lessons":"Blob was another good low-risk late-stage target: targeted `cargo check -p aspen-cli` stayed green and the file-local Tiger Style output went clean before the cold workspace benchmark. Repetitive command files are still yielding real gains, but keep verifying HEAD/status manually after `log_experiment` because the tool banner still overstates commit reality in this repo state.","next_action_hint":"Verify keep reality again, then continue with the next honest hotspot from `/tmp/aspen-tigerstyle-log.SVS5f2`: likely `crates/aspen-forge-web/src/templates.rs`, `crates/aspen-forge/src/git/unified.rs`, `crates/aspen-blob/src/{replication/manager.rs,store/iroh_store.rs}`, or `crates/aspen-jobs/src/job.rs`."}}
{"run":205,"commit":"25d729b","metric":2588,"metrics":{},"status":"keep","description":"Cleaned a first dense slice of `crates/aspen-forge-web/src/templates.rs`: shared repo-tab rendering now centralizes assertions, overview/file/commit/pipeline/job/cluster templates gained command-boundary invariants, log pages pre-reserve line capacity, and checked helpers now handle line-number and pagination arithmetic. Fresh-target-dir repo-owned workspace metric dropped from 2604 to 2588 (-16).","timestamp":1776564819982,"segment":2,"confidence":8.08,"iterationTokens":30438,"asi":{"hypothesis":"`crates/aspen-forge-web/src/templates.rs` had a dense honest Tiger Style cluster centered on zero-assert template builders plus a few unchecked pagination/size helpers, so a first pass adding small checked helpers and boundary invariants should remove a double-digit slice without changing rendered behavior.","lessons":"The forge-web templates hotspot is real and still profitable: targeted `cargo check -p aspen-forge-web` stayed green, and package-local Tiger Style on `templates.rs` fell from 34 warnings to 18 before the cold workspace run. Big template files can yield honest gains without benchmark gaming when the cleanup stays structural—assertions, helper extraction, reserves, and saturating arithmetic only.","next_action_hint":"Verify keep reality again, then continue mining `/tmp/aspen-tigerstyle-log.At3WzU`. Remaining `templates.rs` tail still includes the overlong `commit_detail`, several swap-prone `&str` helpers, one conditional-depth site, and a few unchecked subtraction/reserve issues; after that, next dense files remain `crates/aspen-forge/src/git/unified.rs`, `crates/aspen-blob/src/{replication/manager.rs,store/iroh_store.rs}`, and `crates/aspen-jobs/src/job.rs`."}}
{"run":206,"commit":"25d729b","metric":2576,"metrics":{},"status":"keep","description":"Cleaned a second `crates/aspen-forge-web/src/templates.rs` slice: repo overview/file browser/blob view now use typed parameter structs instead of swap-prone `&str` clusters, issue/job/tree helper paths now use typed draft/context structs, author and duration formatting use checked subtraction, and breadcrumb building reserves capacity up front. Fresh-target-dir repo-owned workspace metric dropped from 2588 to 2576 (-12).","timestamp":1776565238309,"segment":2,"confidence":7.977883096366509,"iterationTokens":4502,"asi":{"hypothesis":"The remaining easy `templates.rs` tail still had several swap-prone `&str` helper signatures plus a few unchecked subtraction/reserve sites, so switching those helpers to typed context structs and checked arithmetic should remove another double-digit slice without changing rendered HTML semantics.","lessons":"The forge-web templates hotspot continues to pay honestly across multiple passes: after fixing ENOSPC by clearing stale `/tmp/aspen-tigerstyle-target.*` and rerunning on a healthy tmpfs, the same code passed cleanly and improved further. When a fresh-target-dir benchmark suddenly fails near the end, inspect for environment issues like disk pressure before logging a discard or crash.","next_action_hint":"Verify keep reality again, then continue mining `/tmp/aspen-tigerstyle-log.5WiIIU`. Remaining `templates.rs` tail is now much smaller—mainly the overlong `commit_detail`, one conditional-depth site, and a few remaining swap-prone helpers—after which the next dense honest hotspots remain `crates/aspen-forge/src/git/unified.rs`, `crates/aspen-blob/src/{replication/manager.rs,store/iroh_store.rs}`, and `crates/aspen-jobs/src/job.rs`.","env_issue":"First cold rerun hit ENOSPC writing incremental query cache under /tmp despite a better metric; cleaned stale /tmp tigerstyle targets/logs and reran successfully before logging."}}
{"run":207,"commit":"25d729b","metric":0,"metrics":{},"status":"crash","description":"Cold workspace benchmark command failed after cargo finished: the heredoc invoked Python incorrectly (`python <<'PY' \"$log\"`), so Python tried to execute the Tiger Style log file and raised a `SyntaxError`. No usable workspace metric for the routes cleanup from this run.","timestamp":1776566298703,"segment":2,"confidence":7.977883096366509,"iterationTokens":4502,"asi":{"hypothesis":"Current dirty batch plus the new `aspen-forge-web/src/routes.rs` dispatch/assertion cleanup should reduce the fresh-target-dir repo-owned Tiger Style workspace count below 2576.","rollback_reason":"Benchmark wrapper bug, not code signal: Python received the log path as the script instead of reading the heredoc program.","next_action_hint":"Rerun the same cold benchmark with `python - \"$log\" <<'PY' ...` so the parser reads the cargo log as input instead of executing it."}}
{"run":208,"commit":"25d729b","metric":2536,"metrics":{},"status":"keep","description":"Kept an honest `aspen-forge-web/src/routes.rs` cleanup on top of the current dirty batch: request parsing now flows through typed parsed-route helpers, GET/POST dispatch split into smaller bounded functions, and route handlers add real command-boundary invariants for repo/tree/blob/commit/CI/login/raw-blob paths without changing forge-web behavior. Fresh-target-dir repo-owned workspace metric dropped from 2576 to 2536 (-40).","timestamp":1776566508618,"segment":2,"confidence":7.878315132605304,"iterationTokens":7504,"asi":{"hypothesis":"`crates/aspen-forge-web/src/routes.rs` still had a dense route-handler cluster—one overlong dispatcher plus many zero-assert page handlers—so splitting dispatch and adding real request/response invariants should remove a few dozen workspace-visible warning sites without changing web semantics.","lessons":"Forge-web routes were better ROI than the remaining templates tail: one refactor cleared the file-local Tiger Style warnings entirely and moved the full-workspace metric by 40. Benchmark wrapper must use `python - \"$log\" <<'PY' ...`; the previous heredoc form executed the log file as Python and produced a bogus crash.","next_action_hint":"Verify HEAD/status again, then mine `/tmp/aspen-tigerstyle-log.lGZr1T`. Best next honest dense targets now look like `crates/aspen-client-api/src/messages/mod.rs`, `crates/aspen-testing-madsim/src/madsim_tester/mod.rs`, `crates/aspen-jobs/src/worker.rs`, `crates/aspen-sql/src/stream.rs`, `crates/aspen-fuse/src/fs/operations.rs`, or `crates/aspen-federation/src/sync/client.rs`.","benchmark_log":"/tmp/aspen-tigerstyle-log.lGZr1T"}}
{"run":209,"commit":"25d729b","metric":2531,"metrics":{},"status":"keep","description":"Kept an honest `crates/aspen-jobs/src/worker.rs` cleanup on top of the current dirty batch: worker-pool lock ordering is documented, semaphore/job-timeout naming is clearer, worker poll/claim/finalize paths are split into smaller helpers with real invariants, and the local worker execution flow stays behavior-preserving. Fresh-target-dir repo-owned workspace metric dropped from 2536 to 2531 (-5).","timestamp":1776567017445,"segment":2,"confidence":7.745398773006135,"iterationTokens":41239,"asi":{"hypothesis":"`crates/aspen-jobs/src/worker.rs` still had a small but real late-stage Tiger Style cluster around lock-order docs, quantity-style local names, and overlong helper flow, so splitting the worker loop/execution path into focused helpers should shave a few workspace-visible sites without changing job semantics.","lessons":"Package-local lint spot checks can understate the current workspace-visible tail if the grep truncates before the target file; inspect the full benchmark log before assuming a file is clean. Current full-workspace log still shows a larger remaining `worker.rs` backlog (ambient clock reads, wide helper signatures, loop-bound visibility), so this first pass only harvested the easy slice.","next_action_hint":"Verify HEAD/status again, then mine `/tmp/aspen-tigerstyle-log.2HzKvD`. Best next honest dense targets remain `crates/aspen-client-api/src/messages/mod.rs`, `crates/aspen-testing-madsim/src/madsim_tester/mod.rs`, `crates/aspen-sql/src/stream.rs`, `crates/aspen-fuse/src/fs/operations.rs`, `crates/aspen-federation/src/sync/client.rs`, or a deeper second pass in `crates/aspen-jobs/src/worker.rs` now that the easy surface warnings are gone.","benchmark_log":"/tmp/aspen-tigerstyle-log.2HzKvD"}}
{"run":210,"commit":"25d729b","metric":2518,"metrics":{},"status":"keep","description":"Kept an honest `crates/aspen-federation/src/sync/client.rs` cleanup on top of the current dirty batch: sync deadlines now flow through one explicit monotonic boundary helper, stage timeout/error context pairs use a typed `StageContext` instead of swap-prone `&str` arguments, handshake/sync request paths are split into smaller helpers, and list/state/push/session paths gained real invariants without changing federation wire semantics. Fresh-target-dir repo-owned workspace metric dropped from 2531 to 2518 (-13).","timestamp":1776567584627,"segment":2,"confidence":7.727620504973221,"iterationTokens":46492,"asi":{"hypothesis":"`crates/aspen-federation/src/sync/client.rs` still had a dense late-stage cluster around direct monotonic clock reads, swap-prone timeout/error context arguments, and overlong request helpers; boundary/context structs plus helper extraction should remove a real double-digit slice without benchmark cheating.","lessons":"A typed context object is an honest way to remove same-type-parameter warnings in async I/O helpers while also making call sites clearer. Also, package-local Tiger Style still showed remaining client.rs warnings after the refactor, but the full cold-workspace benchmark confirmed this pass removed a meaningful visible slice.","next_action_hint":"Verify HEAD/status again, then mine `/tmp/aspen-tigerstyle-log.SUEAWM`. Best next honest dense targets now look like `crates/aspen-client-api/src/messages/mod.rs`, `crates/aspen-testing-madsim/src/madsim_tester/mod.rs`, `crates/aspen-sql/src/stream.rs`, `crates/aspen-fuse/src/fs/operations.rs`, `crates/aspen-jobs/src/worker.rs`, `crates/aspen-testing-patchbay/src/node.rs`, or `crates/aspen-cli/src/bin/aspen-cli/commands/git.rs`.","benchmark_log":"/tmp/aspen-tigerstyle-log.SUEAWM"}}
{"type":"config","name":"Aspen Tiger Style cleanup from durable checkpoint","metricName":"repo_owned_tigerstyle_violations","metricUnit":"","bestDirection":"lower"}
{"run":211,"commit":"0f7a119","metric":2488,"metrics":{},"status":"keep","description":"Reinitialized the Tiger Style loop from the durable checkpoint, then cleaned `crates/aspen-jobs/src/job.rs` and its DLQ call sites: added an explicit UTC boundary helper, switched retry/redrive counters and retry-index conversion to saturating/checked math, replaced the implicit dependency-failure default with `FailCascade`, and renamed `DLQ*` types to `Dlq*`. Cold repo-owned workspace warning sites measured 2488.","timestamp":1776569111430,"segment":3,"confidence":null,"iterationTokens":383}
{"run":212,"commit":"4739813","metric":2472,"metrics":{},"status":"keep","description":"Cleaned `crates/aspen-jobs/src/parse.rs` without changing schedule syntax: added an explicit UTC boundary helper for `at:` parsing, replaced unchecked duration multiplication/addition with checked helpers plus typed raw-input context, converted the prefix dispatcher to early-return parsing with real invariants, and renamed duration-parser state to clearer non-quantity names. Cold repo-owned workspace warning sites dropped from 2488 to 2472.","timestamp":1776569669592,"segment":3,"confidence":null,"iterationTokens":37515}
{"run":213,"commit":"5761e05","metric":2452,"metrics":{},"status":"keep","description":"Cleaned `crates/aspen-fuse/src/fs/operations.rs` without changing FUSE semantics: replaced unchecked file-size and buffered-offset casts with checked conversions, centralized internal-child filtering and statfs block constants, pre-sized xattr name buffers, logged non-fatal cleanup/prefetch errors instead of discarding `Result`s, and renamed xattr/directory entry locals to clearer predicate/index names. Cold repo-owned workspace warning sites dropped from 2472 to 2452.","timestamp":1776570096347,"segment":3,"confidence":2.25,"iterationTokens":32385}
{"run":214,"commit":"828417e","metric":2435,"metrics":{},"status":"keep","description":"Cleaned `crates/aspen-testing-patchbay/src/node.rs` plus a small supporting `InMemoryLogStore::new()` helper: patchbay node bootstrap now uses explicit trust-disabled init config, reply sends log dropped receivers instead of discarding `Result`s, command handling flows through a typed loop context and smaller init/read/write helpers, and the test harness uses explicit openraft config construction via `Config::build`. Cold repo-owned workspace warning sites dropped from 2452 to 2435.","timestamp":1776570512062,"segment":3,"confidence":2.9444444444444446,"iterationTokens":37579}
{"run":215,"commit":"f29a844","metric":2419,"metrics":{},"status":"keep","description":"Cleaned `crates/aspen-client/src/watch.rs`: batched watch-event converters now use a typed commit-metadata struct instead of swap-prone `u64` parameter groups, transaction conversion pre-reserves capacity and records real invariants, the event reader reports dropped end-of-stream sends explicitly and uses a visible iteration bound, and the public pending-count accessor now returns `u32`. Cold repo-owned workspace warning sites dropped from 2435 to 2419.","timestamp":1776570874202,"segment":3,"confidence":3.45,"iterationTokens":20343}
{"run":216,"commit":"9a3c2dc","metric":0,"metrics":{},"status":"crash","description":"Fresh baseline benchmark command was malformed on this checkpoint: cargo-tigerstyle now rejects passthrough `--message-format` because output format is extension-managed, so the run exited before linting and measured nothing.","timestamp":1776876167511,"segment":3,"confidence":3.45,"iterationTokens":20343,"asi":{"hypothesis":"Re-establish a cold repo-owned Tiger Style baseline on the current checkpoint after stashing unrelated staged OpenSpec work.","rollback_reason":"Benchmark wrapper passed forbidden passthrough args (`--message-format short`), so cargo exited before producing any usable warning signal.","next_action_hint":"Rerun the cold benchmark with only `--target-dir` passed through, then resume from the refreshed top-file histogram."}}
