{"type":"config","name":"Aspen Tiger Style cleanup to zero violations","metricName":"tigerstyle_violations","metricUnit":"","bestDirection":"lower"}
{"run":1,"commit":"bd486f3","metric":1331,"metrics":{},"status":"checks_failed","description":"Baseline `cargo tigerstyle check`: 1331 Tiger Style diagnostics across workspace; first visible hotspots in crates/aspen-disk, crates/aspen-constants, and vendored openraft test code. Need pick tractable repo-owned warnings first and likely avoid vendor overfitting.","timestamp":1776362297662,"segment":0,"confidence":null,"iterationTokens":137,"asi":{"hypothesis":"Baseline workspace Tiger Style run gives current violation count and hotspot map before fixes.","rollback_reason":"No code changes yet; baseline fails because existing Tiger Style diagnostics are present.","next_action_hint":"Classify warnings into repo-owned vs vendor/generated noise, then fix a small owned slice and rerun."}}
{"run":2,"commit":"bd486f3","metric":1419,"metrics":{},"status":"keep","description":"Fixed Tiger Style warnings in crates/aspen-disk and crates/aspen-constants (overflow-prone constant arithmetic, assertion density, and compound assertion). Warm-cache workspace count rose because touching aspen-constants forced downstream crates to rebuild and exposed 142 previously cached diagnostics; keep change, then reset to a cold full-workspace metric.","timestamp":1776362569471,"segment":0,"confidence":null,"iterationTokens":45485,"asi":{"hypothesis":"Cleaning a small shared-constants slice should remove easy Tiger Style warnings without semantic change.","measurement_caveat":"Warm-cache `cargo tigerstyle check` is not stable: editing a shared crate causes downstream warnings to appear that cached runs had hidden.","lessons":"Repo-owned fixes in aspen-disk and aspen-constants are good; need cold target dir or clean build for trustworthy workspace counts.","next_action_hint":"Start a new experiment baseline using a fresh target dir for full-workspace Tiger Style counts, then continue fixing the highest-yield repo-owned crates."}}
{"type":"config","name":"Aspen Tiger Style cleanup to zero violations (cold full workspace)","metricName":"tigerstyle_violations","metricUnit":"","bestDirection":"lower"}
{"run":3,"commit":"bd486f3","metric":1330,"metrics":{},"status":"checks_failed","description":"Cold full-workspace baseline with fresh target dir: 1330 warning diagnostics from `cargo tigerstyle check`. Biggest hotspots remain vendored openraft plus repo-owned crates like aspen-layer, aspen-ci-core, aspen-testing-core, aspen-kv-types, and aspen-trust.","timestamp":1776362678733,"segment":1,"confidence":null,"iterationTokens":320,"asi":{"hypothesis":"Fresh target dir gives stable full-workspace Tiger Style count without cargo incremental hiding downstream diagnostics.","rollback_reason":"Baseline only; no intended source changes for this run.","next_action_hint":"Pick a high-yield repo-owned slice with many easy fixes and low semantic risk, likely aspen-layer tuple decoding/tests or aspen-ci-core constant/config warnings, then rerun cold workspace check."}}
{"run":4,"commit":"bd486f3","metric":1284,"metrics":{},"status":"keep","description":"Refactored crates/aspen-layer/src/tuple/decoding.rs to use saturating index math, bounded slice helpers, explicit local bounds, and denser invariants. Cold full-workspace Tiger Style count dropped from 1330 to 1284 (-46).","timestamp":1776362966629,"segment":1,"confidence":null,"iterationTokens":50969,"asi":{"hypothesis":"aspen-layer tuple decoding has many mechanical Tiger Style violations that can be removed without changing tuple semantics.","lessons":"Shared helpers (`ElementOffsets`, `DecodeRange`, `read_exact_bytes`) collapse many overflow warnings at once. Fresh target dir keeps workspace counts honest.","next_action_hint":"Continue in aspen-layer next: tuple/encoding.rs, tuple_type.rs, and test assertion cleanup, or switch to another high-yield repo-owned hotspot like aspen-ci-core."}}
{"run":5,"commit":"bd486f3","metric":1264,"metrics":{},"status":"keep","description":"Trimmed more aspen-layer violations: tuple/encoding.rs now uses bounded arithmetic and assertion checks; subspace/index helpers avoid ignored results and split compound assertions. Cold full-workspace Tiger Style count dropped from 1284 to 1264 (-20).","timestamp":1776363185534,"segment":1,"confidence":3.3,"iterationTokens":34958,"asi":{"hypothesis":"Finish the easy mechanical aspen-layer follow-up warnings before switching crates.","lessons":"One crate still yields good returns: aspen-layer lib warnings fell again, with cheap fixes in encoding/subspace/index helpers.","next_action_hint":"Either finish remaining aspen-layer test/local-name warnings or move to another repo-owned hotspot with >=20 warnings, likely aspen-trust or aspen-kv-types."}}
{"run":6,"commit":"bd486f3","metric":1244,"metrics":{},"status":"keep","description":"Cleaned crates/aspen-kv-types/src/validation.rs: replaced platform-dependent casts with saturating size conversion, split long validation logic into bounded helpers, removed ambiguous same-type helper params, and fixed test-side overflow cases. Cold full-workspace Tiger Style count dropped from 1264 to 1244 (-20).","timestamp":1776363498934,"segment":1,"confidence":4.3,"iterationTokens":11200,"asi":{"hypothesis":"aspen-kv-types validation has low-risk mechanical Tiger Style violations that can be removed without changing API semantics.","lessons":"Small validation crates are good yield: one file removed 20 workspace diagnostics cleanly.","next_action_hint":"Target next repo-owned hotspot with concentrated warnings, likely aspen-trust gf256/shamir or aspen-testing-core lib, then rerun cold workspace check."}}
{"run":7,"commit":"bd486f3","metric":1155,"metrics":{},"status":"keep","description":"Cleaned a large aspen-trust slice: removed many unsafe casts/unwraps in gf256, shamir, chain, envelope, nonce, reencrypt, and trust integration/property tests; renamed Shamir coordinate errors and tightened bounded math. Cold full-workspace Tiger Style count dropped from 1244 to 1155 (-89).","timestamp":1776365744102,"segment":1,"confidence":8.75,"iterationTokens":11200}
{"run":8,"commit":"bd486f3","metric":1140,"metrics":{},"status":"keep","description":"Trimmed aspen-testing-core fault injection and harness warnings: bounded atomic increments, bounded wait loop clock helper, clearer predicate naming, reserved transaction result capacity, and safer scan/transaction limit conversions. Cold full-workspace Tiger Style count dropped from 1155 to 1140 (-15).","timestamp":1776365982703,"segment":1,"confidence":3.5849056603773586,"iterationTokens":23411}
{"run":9,"commit":"bd486f3","metric":1107,"metrics":{},"status":"keep","description":"Resumed loop from autoresearch.jsonl + git log (repo-local autoresearch.md is absent) and targeted a real CI-core slice instead of lint-suppressing: resource helpers/tests now use saturating byte arithmetic, timeout overflow test uses bounded setup, and pipeline config validation reserves dependency maps plus clearer predicate names. Cold full-workspace Tiger Style count dropped from 1140 to 1107 (-33).","timestamp":1776366378982,"segment":1,"confidence":2.5930232558139537,"iterationTokens":36442}
{"run":10,"commit":"bd486f3","metric":1096,"metrics":{},"status":"keep","description":"Continued CI-core cleanup with non-cheating fixes: added bounded debug invariants and clearer index/count naming in verified pipeline logic, replaced ambiguous deploy test helper parameters with a small fixture struct, and added extra local assertions to several deploy validation tests. Cold full-workspace Tiger Style count dropped from 1107 to 1096 (-11).","timestamp":1776366549520,"segment":1,"confidence":3.140939597315436,"iterationTokens":20292}
{"run":11,"commit":"bd486f3","metric":0,"metrics":{},"status":"crash","description":"Bad benchmark invocation: passed `--workspace` through `cargo tigerstyle check` even though the subcommand already targets the workspace, so cargo check rejected duplicate `--workspace` before linting. No code signal from this run.","timestamp":1776367249821,"segment":1,"confidence":3.140939597315436,"iterationTokens":20292,"asi":{"hypothesis":"Cold full-workspace Tiger Style count after explicit serde-default helpers in CI config and small trust/resource cleanups should drop below 1096.","rollback_reason":"Benchmark command was malformed (`--workspace` duplicated by cargo-tigerstyle), so the run measured nothing useful.","next_action_hint":"Rerun the cold benchmark with only `--target-dir` and `--message-format short` passed through to cargo check."}}
{"run":12,"commit":"bd486f3","metric":0,"metrics":{},"status":"crash","description":"Cold benchmark command ran, but it measured the wrong thing: autoresearch changes live in the staged index while the worktree was reset to HEAD, and the naive `: warning:` counter inflated the metric to 5694. No comparable signal against the 1096 baseline.","timestamp":1776367415623,"segment":1,"confidence":3.140939597315436,"iterationTokens":3730,"asi":{"hypothesis":"Applying the staged Tiger Style cleanup slice to the worktree, then rerunning a cold full-workspace count with a baseline-compatible warning counter, should show a real drop below 1096.","rollback_reason":"Measurement invalid: worktree/index mismatch meant the candidate edits were absent at runtime, and the counting method overcounted warning output relative to previous runs.","next_action_hint":"Restore staged changes into the worktree, use the same counting method as prior runs, then rerun the cold benchmark before deciding keep/discard."}}
{"type":"config","name":"Aspen repo-owned Tiger Style cleanup (cold workspace warning sites)","metricName":"repo_owned_tigerstyle_violations","metricUnit":"","bestDirection":"lower"}
{"run":13,"commit":"bd486f3","metric":5105,"metrics":{},"status":"keep","description":"Rebased autoresearch onto a stable cold-workspace metric that counts repo-owned Tiger Style warning sites (`crates/`, `src/`, `build.rs`) and excludes vendored/openraft diagnostics. After restoring the staged cleanup set into the worktree, the new baseline for continued cleanup is 5105 warning sites.","timestamp":1776367624722,"segment":2,"confidence":null,"iterationTokens":314,"asi":{"hypothesis":"A stable repo-owned warning-site counter will let the loop keep making progress even though the earlier workspace-wide count mixed vendor noise and ambiguous cargo-tigerstyle behavior.","lessons":"Staged-only autoresearch changes were not being benchmarked; restoring index -> worktree before run_experiment matters. The old full-warning counter overcounted vendor/openraft noise.","next_action_hint":"Target the next high-yield repo-owned hotspot on this new metric, likely `crates/aspen-ci-core/src/config/types.rs` implicit serde defaults and `crates/aspen-layer/src/tuple/tuple_type.rs` public `usize` API warnings, then rerun the cold repo-owned benchmark."}}
{"run":14,"commit":"bd486f3","metric":5077,"metrics":{},"status":"keep","description":"Removed a CI-core hotspot without suppressions: `config/types.rs` now uses explicit serde default helpers instead of implicit external defaults, `verified/resource.rs` renames quantity-like booleans, and `key_manager.rs` documents lock order in-struct. Cold repo-owned warning-site count dropped from 5105 to 5077 (-28).","timestamp":1776367984220,"segment":2,"confidence":null,"iterationTokens":10275,"asi":{"hypothesis":"Explicit serde default constructors in `crates/aspen-ci-core/src/config/types.rs` plus small naming/documentation cleanups should remove a concentrated batch of repo-owned Tiger Style findings.","lessons":"CI-core default-field warnings were cheap, real wins: helper functions for `Option`, `Vec`, `HashMap`, and nested config defaults collapsed a large warning cluster at once.","next_action_hint":"Continue with another concentrated repo-owned hotspot, likely `crates/aspen-layer/src/tuple/tuple_type.rs` public `usize` API warnings or `crates/aspen-ci-core/src/config/types.rs` recursive cycle checker warning."}}
{"run":15,"commit":"bd486f3","metric":5073,"metrics":{},"status":"keep","description":"Finished the `Tuple` public-API cleanup in `crates/aspen-layer/src/tuple/tuple_type.rs`: capacity, length, element index, and partial-consume counts now use fixed-width integers, and tuple tests adapt consumed-byte comparisons with bounded `u32` conversions. Cold repo-owned warning-site count dropped from 5077 to 5073 (-4).","timestamp":1776368303636,"segment":2,"confidence":8,"iterationTokens":14136,"asi":{"hypothesis":"Converting `Tuple`'s remaining public `usize` API to fixed-width types should remove the last four Tiger Style warnings in that file without breaking local callers.","lessons":"`aspen-layer` call sites were already narrow enough that `u32` tuple APIs compiled with only tiny test updates. One local temporary name (`capacity_slots`) re-triggered the quantity lint, so inlining the conversion avoided it cleanly.","next_action_hint":"Chase the next low-risk hotspot with >=5 warnings, likely the recursive cycle helper in `crates/aspen-ci-core/src/config/types.rs` or small quantity-name clusters in `crates/aspen-exec-cache/src/eviction.rs`."}}
{"run":16,"commit":"bd486f3","metric":5067,"metrics":{},"status":"keep","description":"Picked off another small repo-owned slice across crates: `build.rs` now reads command output fallibly instead of unwrap chains, `aspen-forge-protocol` uses explicit optional-string serde defaults for Nostr author metadata, and trust helpers switch remaining public `usize` counters/indexes to `u32`. Cold repo-owned warning-site count dropped from 5073 to 5067 (-6).","timestamp":1776368591367,"segment":2,"confidence":7.6,"iterationTokens":16652,"asi":{"hypothesis":"A cross-crate cleanup of trivial panic/default/public-usize warnings should shave a few more repo-owned Tiger Style sites with low semantic risk.","lessons":"Tiny multi-file slices are still worth it when each warning is mechanical and isolated. `aspen-trust` caller updates for fixed-width counters were local and compiled cleanly.","next_action_hint":"Next low-risk pass: tackle `crates/aspen-ci-core/src/config/types.rs` recursive dependency visitor warning or the remaining small trust/exec-cache API warnings before moving to larger hotspot crates like `aspen-plugin-api` or `aspen-dag`."}}
{"run":17,"commit":"bd486f3","metric":5066,"metrics":{},"status":"keep","description":"Replaced the recursive stage-cycle DFS in `crates/aspen-ci-core/src/config/types.rs` with an explicit stack walk and added a regression test for `build -> deploy -> build`. Cold repo-owned warning-site count dropped from 5067 to 5066 (-1).","timestamp":1776368812404,"segment":2,"confidence":6.5,"iterationTokens":25817,"asi":{"hypothesis":"The recursive dependency visitor warning in `crates/aspen-ci-core/src/config/types.rs` can be removed cleanly by switching to iterative DFS without changing cycle detection behavior.","lessons":"Iterative DFS preserved the same cycle path formatting with one focused regression test. Small single-warning fixes still move the repo-owned metric in a stable way.","next_action_hint":"Continue low-risk cleanup with remaining small hotspots, likely `crates/aspen-exec-cache/src/read_tracker.rs` quantity/public-usize warnings or a few `aspen-trust` API/parameter-order warnings before tackling larger crates."}}
{"run":18,"commit":"bd486f3","metric":5064,"metrics":{},"status":"keep","description":"Mirrored the root build-script hardening into `crates/aspen-cli/build.rs`: command output is now read through a fallible helper instead of nested unwrap fallbacks. Cold repo-owned warning-site count dropped from 5066 to 5064 (-2).","timestamp":1776368988292,"segment":2,"confidence":8.2,"iterationTokens":9072,"asi":{"hypothesis":"`crates/aspen-cli/build.rs` has the same low-risk unwrap pattern as the root build script, so porting the same helper should remove two repo-owned warning sites cleanly.","lessons":"Small duplicated build-script cleanup still pays off. Matching repeated patterns from earlier wins is good, but keep them behavior-preserving and benchmark against the same cold metric.","next_action_hint":"Next pass: inspect remaining duplicated build scripts or small repo-owned hotspots like `crates/aspen-exec-cache/src/read_tracker.rs` and `crates/aspen-trust` before moving into larger warning-heavy crates."}}
{"run":19,"commit":"bd486f3","metric":0,"metrics":{},"status":"crash","description":"Bad cold-benchmark invocation again: passed `--target-dir` before cargo-tigerstyle's `--`, so the subcommand rejected it before linting and the parsed metric was meaningless.","timestamp":1776371736799,"segment":2,"confidence":8.2,"iterationTokens":9072,"asi":{"hypothesis":"A fresh-target-dir repo-owned Tiger Style benchmark after the `aspen-exec-cache` read-tracker cleanup should drop below 5064.","rollback_reason":"Benchmark command was malformed; no useful lint signal.","next_action_hint":"Rerun with `cargo tigerstyle check -- --target-dir <tmpdir> --message-format short` so cargo-check receives the fresh target dir."}}
{"run":20,"commit":"bd486f3","metric":5059,"metrics":{},"status":"keep","description":"Cleaned `crates/aspen-exec-cache/src/read_tracker.rs`: renamed the boolean field to `is_enabled`, switched deterministic record ordering to `sort_unstable_by`, guarded `/proc/<pid>/stat` slicing with `.get(..)?`, and kept the crate green with targeted tests/checks. Repo-owned Tiger Style warning-site count dropped from 5064 to 5059 (-5).","timestamp":1776372052397,"segment":2,"confidence":7.666666666666667,"iterationTokens":8973,"asi":{"hypothesis":"A small `read_tracker.rs` cleanup should remove a few low-risk repo-owned Tiger Style findings without semantic change.","lessons":"`cargo tigerstyle check -- --message-format short` still emits `... warning:` lines, not `warning[...]`, and large output must be counted from a temp file/stream instead of shell variable capture.","next_action_hint":"Use a streamed benchmark command next time, then target the denser `crates/aspen-exec-cache/{eviction,executor,index,types}.rs` warnings or hop to `aspen-plugin-api` for a larger drop."}}
{"run":21,"commit":"bd486f3","metric":5042,"metrics":{},"status":"keep","description":"Refactored `crates/aspen-exec-cache/src/types.rs` hex helpers to remove arithmetic-heavy indexing: `to_hex` now uses chunked buffers plus `encode_hex_digit`, `from_hex` decodes via paired-byte chunks, and `hex_digit` uses checked/saturating math. Targeted exec-cache tests/checks stayed green, and the cold repo-owned Tiger Style warning-site count dropped from 5059 to 5042 (-17).","timestamp":1776372197571,"segment":2,"confidence":9,"iterationTokens":14131,"asi":{"hypothesis":"`aspen-exec-cache/src/types.rs` packs many low-risk arithmetic warnings into the hex encode/decode helpers, so a chunked rewrite should remove a dense cluster cleanly.","lessons":"For this benchmark, writing Tiger Style output to a temp file and counting there is stable and avoids shell `Argument list too long` failures from giant command-substitution output.","next_action_hint":"Stay in `aspen-exec-cache` next: `eviction.rs`, `executor.rs`, and `index.rs` still show several mechanical warnings and should yield another cheap drop before switching crates."}}
{"run":22,"commit":"bd486f3","metric":5032,"metrics":{},"status":"keep","description":"Refactored `crates/aspen-exec-cache/src/eviction.rs` into smaller helpers and an `EvictionParams` struct, reserved live-entry capacity, stopped discarding delete/blob-GC results silently, renamed byte-count locals with `_bytes`, and kept eviction tests/checks green. Cold repo-owned Tiger Style warning-site count dropped from 5042 to 5032 (-10).","timestamp":1776372421826,"segment":2,"confidence":10.428571428571429,"iterationTokens":13805,"asi":{"hypothesis":"`aspen-exec-cache/src/eviction.rs` still has a dense cluster of mechanical Tiger Style findings, so splitting the pass and making error handling explicit should remove another cheap batch.","lessons":"`aspen-exec-cache` remains high-yield: one focused file cleaned multiple lint classes at once (same-type params, discarded `Result`, growth-bound hints, and quantity naming).","next_action_hint":"Inspect `crates/aspen-exec-cache/src/{executor,index}.rs` next; both still have direct-system-time, discarded-result, and conversion warnings that should be tractable."}}
{"run":23,"commit":"bd486f3","metric":5023,"metrics":{},"status":"keep","description":"Cleaned remaining mechanical warnings across `crates/aspen-exec-cache/src/{executor,index,read_tracker}.rs`: isolated lookup timing behind a monotonic boundary helper, replaced narrowing/platform-size casts with checked conversions, and logged previously discarded KV maintenance errors. Full exec-cache tests/checks stayed green, and the cold repo-owned Tiger Style warning-site count dropped from 5032 to 5023 (-9).","timestamp":1776372688458,"segment":2,"confidence":8.2,"iterationTokens":20639,"asi":{"hypothesis":"A bundled cleanup of `executor.rs`, `index.rs`, and the remaining `read_tracker.rs` cast warnings should remove the next low-risk exec-cache warning cluster without changing semantics.","lessons":"Targeted crate-level Tiger Style runs are good triage: once only `eviction.rs` and `verified/cache_key.rs` remained in `aspen-exec-cache`, the bundled fix produced a predictable workspace drop. `autoresearch.md` is still absent in this repo, so resume context comes from `autoresearch.jsonl` plus git log.","next_action_hint":"Either finish `aspen-exec-cache` by addressing assertion-density warnings in `eviction.rs` and `verified/cache_key.rs`, or move to the next high-yield crate like `aspen-plugin-api` now that the easy exec-cache warnings are mostly gone."}}
