{"run":79,"commit":"98bcc0f","metric":4038,"metrics":{},"status":"keep","description":"Cleaned the `aspen-rpc-handlers/src/client.rs` tail without benchmark cheating: replaced macro-based `#[instrument]` on the connection/request entrypoints with explicit async span instrumentation, named the stream-accept bound constant, and renamed the rate limiter binding to a less quantity-looking role name. Targeted `cargo check -p aspen-rpc-handlers` and crate-local Tiger Style stayed green, local `client.rs` warnings dropped from 3 to 0, and the cold repo-owned Tiger Style warning-site count fell from 4041 to 4038 (-3).","timestamp":1776402541951,"segment":2,"confidence":3.5448504983388704,"iterationTokens":11148,"asi":{"hypothesis":"`aspen-rpc-handlers/src/client.rs` had a tiny but real tail: one naming heuristic and two likely `#[instrument]`/macro line-mapping loop warnings. Replacing the attribute macros with explicit async span instrumentation and clarifying names should remove that tail without changing request handling semantics.","lessons":"The client tail was fixable without suppressions: manual `.instrument(info_span!(...))` kept observability while eliminating the macro-attributed false positives, and the local crate run is now clean for `client.rs`. Fresh benchmark output now shifts visible tail pressure toward `aspen-net` plus the remaining `aspen-core-essentials-handler`/`aspen-forge-handler` structural leftovers.","next_action_hint":"Re-scan the new top histogram and decide between the small remaining tails (`aspen-core-essentials-handler` catch-all, forge-handler assertion-density) and a fresh higher-yield hotspot such as `crates/aspen-net/bin/aspen-net.rs`.","measurement_note":"Measured with the same fresh-target-dir full-workspace cargo-tigerstyle wrapper and repo-owned `warning:` parser as the 4041 baseline, so 4038 is directly comparable."}}
{"run":80,"commit":"98bcc0f","metric":4035,"metrics":{},"status":"keep","description":"Picked off the new visible `aspen-net` hotspot honestly: split the daemon CLI `main` into small runtime/tracing/command helpers, introduced an `UpCommandArgs` config struct instead of packing all logic into `main`, and inlined the fallback loopback-port parse so the remaining quantity-name heuristic disappeared. Targeted `cargo check -p aspen-net` and crate-local Tiger Style stayed green, local `aspen-net.rs` warnings dropped from 3 to 0, and the cold repo-owned Tiger Style warning-site count fell from 4038 to 4035 (-3).","timestamp":1776402849626,"segment":2,"confidence":3.5081967213114753,"iterationTokens":10796,"asi":{"hypothesis":"`crates/aspen-net/bin/aspen-net.rs` exposed a compact, low-risk Tiger Style cluster in the new histogram: oversized `main`, zero assertions from packed control flow, and a quantity-name warning around fallback port parsing. Breaking CLI startup into helpers should remove that cluster without changing daemon behavior.","lessons":"Short bin entrypoints are easy wins late in the loop: once `main` shrank to orchestration only, all three warnings vanished and the crate stayed green. The fresh benchmark top tail has now shifted toward `aspen-blob-handler`, while `aspen-core-essentials-handler` still only has the explicit catch-all leftover.","next_action_hint":"Re-scan the next top hotspot. `aspen-blob-handler` now shows concrete checked-cast and catch-all warnings, which may be a better ROI than chasing the single remaining `core.rs` match warning.","measurement_note":"Measured with the same fresh-target-dir full-workspace cargo-tigerstyle wrapper and repo-owned `warning:` parser as the 4038 baseline, so 4035 is directly comparable."}}
{"run":81,"commit":"98bcc0f","metric":4017,"metrics":{},"status":"keep","description":"Finished the staged cross-crate Tiger Style cleanup batch before pivoting: `aspen-blob-handler` replication paths now use checked helpers/invariants, `aspen-core-essentials-handler` observability tail keeps only the deliberate catch-all, `aspen-forge-handler` federation/executor helpers use explicit request/runtime structs and typed fallback errors, `aspen-jobs-worker-blob` parsing/timing paths stay checked, `aspen-net` bin startup is split into small helpers, and `aspen-rpc-handlers` client entrypoints use explicit span instrumentation. Cold repo-owned warning-site count dropped from 4035 to 4017 (-18).","timestamp":1776434122771,"segment":2,"confidence":3.464968152866242,"iterationTokens":10796,"asi":{"hypothesis":"The staged blob/core-essentials/forge/blob-worker/net/rpc batch already removed a real set of mechanical Tiger Style warnings, so benchmarking it before switching hotspots should produce another measurable workspace drop.","lessons":"Finish staged worktree cycles before changing focus; this batch was already worth keeping. After this commit, user wants next passes concentrated in aspen-core, aspen-raft, and aspen-coordination.","next_action_hint":"Verify the keep actually committed, then scan Tiger Style hotspots limited to aspen-core/aspen-raft/aspen-coordination and start the next focused cleanup there."}}
{"run":82,"commit":"98bcc0f","metric":3978,"metrics":{},"status":"keep","description":"Pivoted into requested core/raft/coord slice and hit `crates/aspen-raft/src/storage/in_memory/state_machine.rs`: replaced implicit external defaults with explicit `empty_response()` construction, wrapped swap-prone key/value and compare-delete inputs in small structs, renamed boolean/result locals, reserved transaction result capacity, added real response/result invariants in CAS/conditional-batch/transaction helpers, documented lock ordering, and switched snapshot index math to saturating form. Local `cargo check -p aspen-raft` stayed green and the cold repo-owned warning-site count dropped from 4017 to 3978 (-39).","timestamp":1776434850997,"segment":2,"confidence":3.451761102603369,"iterationTokens":44475,"asi":{"hypothesis":"`aspen-raft` had a dense mechanical Tiger Style hotspot in the in-memory state machine, so explicit response construction plus helper-API cleanup should remove a large warning cluster without changing Raft test semantics.","lessons":"Raft storage helpers are still high-yield: one file fell from 41 warnings to only the two apparent async-function loop false positives. Next core/raft/coord pass should probably stay in `aspen-raft`, with `verified/write_batcher.rs` or `log_subscriber.rs` as the next dense files.","next_action_hint":"Verify keep reality again, then scan `aspen-raft` hotspots (`verified/write_batcher.rs`, `log_subscriber.rs`, `network/client.rs`) and continue the focused cleanup there."}}
{"run":83,"commit":"98bcc0f","metric":3960,"metrics":{},"status":"keep","description":"Resumed loop by checking git log plus autoresearch.jsonl because repo-local `autoresearch.md` is still absent, then stayed on requested core/raft/coord focus and cleaned `crates/aspen-raft/src/node/kv_store.rs`: split dense forward-to-leader conditions into explicit nested guards, replaced platform-size and narrowing conversions with checked helpers, bounded scan/result counts through helper functions, switched retry/backoff arithmetic to saturating form, and renamed quantity-like locals so the file now runs Tiger Style-clean. `cargo check -p aspen-raft` stayed green and the cold repo-owned warning-site count dropped from 3978 to 3960 (-18).","timestamp":1776435502262,"segment":2,"confidence":3.4384384384384385,"iterationTokens":49017,"asi":{"hypothesis":"`aspen-raft/src/node/kv_store.rs` had a dense mechanical warning cluster around unchecked conversions, quantity naming, and compound forwarding conditions; a helper-based cleanup should remove that cluster without changing KV semantics or overfitting the benchmark.","lessons":"`autoresearch.md` is absent in this repo, so safe resume context comes from git log plus `autoresearch.jsonl`. `node/kv_store.rs` was good ROI: one bounded cleanup pass removed its local Tiger Style warnings entirely while keeping targeted compile validation cheap.","next_action_hint":"Stay in `aspen-raft` next. Fresh hotspots are `src/verified/write_batcher.rs`, `src/log_subscriber.rs`, and `src/network/client.rs`; prefer non-cheating mechanical cleanup in `log_subscriber.rs` or `network/client.rs` before touching verified APIs that also have Verus mirror specs."}}
{"run":84,"commit":"98bcc0f","metric":3950,"metrics":{},"status":"keep","description":"Stayed in requested raft slice and cleaned `crates/aspen-raft/src/storage_shared/state_machine/transaction.rs`: replaced implicit external defaults with explicit response construction, bounded branch-size conversions through checked helpers, renamed condition/result locals to predicate-style names, pre-sized transaction result/range vectors, and bounded range limits with checked `u32` parsing so the file now only keeps the two real wide-signature warnings for its table-heavy helpers. `cargo check -p aspen-raft` stayed green and the cold repo-owned warning-site count dropped from 3960 to 3950 (-10).","timestamp":1776435913672,"segment":2,"confidence":3.3624454148471616,"iterationTokens":24619,"asi":{"hypothesis":"`storage_shared/state_machine/transaction.rs` had another honest mechanical warning cluster around unchecked conversions, default construction, and unbounded Vec growth; tightening those helpers should shave a solid batch without changing transaction semantics.","lessons":"This internal transaction helper was worth a pass even without solving the two table-heavy arity warnings. The remaining warnings in that file look structural rather than mechanical, so next ROI is likely elsewhere in `aspen-raft` rather than forcing awkward lifetime-heavy refactors.","next_action_hint":"Keep focus on core/raft/coord. Next likely targets are `aspen-raft/src/log_subscriber.rs` or `aspen-raft/src/network/client.rs`; prefer the file with more mechanical checked-conversion/result-handling wins and avoid signature churn in Verus-mirrored verified modules."}}
{"run":85,"commit":"98bcc0f","metric":3941,"metrics":{},"status":"keep","description":"Stayed in raft again and cleaned `crates/aspen-raft/src/iroh_write_forwarder.rs`: split write-command batch conversion into small helpers, replaced repeated implicit `WriteResult::default()` construction with an explicit empty-result helper, and switched forwarded timeout millis conversions to checked `u128`→`u64` handling. Targeted `cargo check -p aspen-raft` stayed green, local forwarder warnings fell from 11 to only the two real catch-all enum-match cases, and the cold repo-owned warning-site count dropped from 3950 to 3941 (-9).","timestamp":1776436489691,"segment":2,"confidence":3.288135593220339,"iterationTokens":23721,"asi":{"hypothesis":"`iroh_write_forwarder.rs` still had a compact mechanical warning cluster around long helper shape, implicit defaults, and unchecked timeout conversions; extracting the repeated conversion/result helpers should remove most of it without changing forwarding semantics.","lessons":"Small non-verified raft helpers are still good ROI after the big storage/kv passes. The remaining `iroh_write_forwarder.rs` warnings are deliberate API-coverage issues around catch-all response matches, so next gains likely come from a different file unless I want to enumerate many client response variants.","next_action_hint":"Keep core/raft/coord focus. Fresh `aspen-raft` hotspots remain `log_subscriber.rs`, `network/client.rs`, and the structural leftovers in `storage_shared/state_machine/transaction.rs`; prefer the next file with mechanical conversions/result-handling wins over enum-wide response churn."}}
{"run":86,"commit":"98bcc0f","metric":3931,"metrics":{},"status":"keep","description":"Kept the raft-only cleanup moving with `crates/aspen-raft/src/network/factory.rs`: added checked `MAX_PEERS`→`usize` helpers, documented factory lock ordering, renamed capacity/address booleans to clearer predicate names, and replaced the silently discarded peer-cache write result with explicit debug logging. Targeted `cargo check -p aspen-raft` stayed green, local factory warnings dropped from 11 to the single likely async false positive at `new_client`, and the cold repo-owned warning-site count dropped from 3941 to 3931 (-10).","timestamp":1776436666104,"segment":2,"confidence":3.339971550497866,"iterationTokens":8956,"asi":{"hypothesis":"`network/factory.rs` had another low-risk mechanical warning cluster around platform-size casts, quantity naming, lock-order docs, and discarded filesystem results; cleaning those should shave about ten warnings without changing network-factory semantics.","lessons":"Factory code was good late-loop ROI: most warnings were mechanical and disappeared in one pass, leaving only what looks like a false-positive loop warning on the async trait method signature. Continuing to prefer self-contained raft infrastructure files is paying off better than forcing verified or enum-wide API churn.","next_action_hint":"Stay on core/raft/coord. Remaining high-ROI raft targets are now `log_subscriber.rs` and `network/client.rs`; prioritize whichever one offers checked-conversion/result-handling wins without broad API churn, and treat async-signature loop warnings as potential false positives before spending time on them."}}
{"run":87,"commit":"98bcc0f","metric":3910,"metrics":{},"status":"keep","description":"Resumed from git log plus autoresearch.jsonl because repo-local `autoresearch.md` is absent, then stayed on requested core/raft/coord focus and cleaned `crates/aspen-raft/src/log_subscriber.rs`: replaced unchecked const/counter math with saturating helpers, removed `u32`→`usize` casts in channel/semaphore setup, bundled subscriber/accept/keepalive state into small structs to cut swap-prone arity, renamed negated predicates and keepalive timer locals, added explicit invariants to auth/subscribe/replay/stream phases, and fixed historical replay progress so filtered entries still advance `current_start` instead of risking replay loops. `cargo check -p aspen-raft` stayed green, local log-subscriber warnings fell from 22 to one likely async false positive, and the cold repo-owned warning-site count dropped from 3931 to 3910 (-21).","timestamp":1776437329814,"segment":2,"confidence":3.328690807799443,"iterationTokens":20528,"asi":{"hypothesis":"`aspen-raft/src/log_subscriber.rs` still had a dense mechanical warning cluster around unchecked conversions, negated predicates, wide helper signatures, and assertion density; cleaning those while preserving protocol behavior should produce another real drop without overfitting.","lessons":"`autoresearch.md` is still absent in this repo, so resume context must come from git log plus `autoresearch.jsonl`. The replay loop had a real robustness issue: if a historical batch contained only filtered-out entries, `current_start` could stall and reread the same batch forever. Advancing `current_start` for every replayed log index is both a real bug fix and a Tiger Style cleanup.","next_action_hint":"Keep core/raft/coord focus. Next honest raft target is `crates/aspen-raft/src/network/client.rs`, where checked timeout/time conversions, explicit response matching, and result handling look higher ROI than touching Verus-mirrored `verified/write_batcher.rs`."}}
{"run":88,"commit":"98bcc0f","metric":3905,"metrics":{},"status":"keep","description":"Kept the resumed raft-focused loop moving with `crates/aspen-raft/src/storage_shared/state_machine/lease_ops.rs`: changed generated lease IDs to saturating arithmetic instead of unchecked `now * 1000 + random_component`, replaced implicit external defaults with explicit `empty_response()` construction across lease grant/revoke/keepalive paths, and kept targeted `cargo check -p aspen-raft` green. Local lease-op warnings fell from 6 to 0, and the cold repo-owned warning-site count dropped from 3910 to 3905 (-5).","timestamp":1776437703587,"segment":2,"confidence":3.3287101248266295,"iterationTokens":7701,"asi":{"hypothesis":"`storage_shared/state_machine/lease_ops.rs` still had a compact mechanical warning cluster around unchecked lease-id arithmetic and implicit response defaults; tightening those helpers should produce a small but real metric drop without changing lease semantics.","lessons":"Even late in the loop, small internal Raft state-machine helpers are worth harvesting when the warning classes are mechanical. Saturating lease-id generation is not benchmark-specific cleanup; it hardens overflow behavior while removing Tiger Style findings.","next_action_hint":"Continue the core/raft/coord slice. Highest remaining non-verified raft ROI still looks like `src/network/client.rs`, with secondary options in `storage_shared/state_machine/batch.rs` or `cas.rs` if `network/client.rs` starts needing broad enum/API churn."}}
{"run":89,"commit":"98bcc0f","metric":3893,"metrics":{},"status":"keep","description":"Resumed from git log plus autoresearch.jsonl because repo-local `autoresearch.md` is still absent, then kept the raft-focused cleanup moving across `crates/aspen-raft/src/storage_shared/state_machine/{batch,cas}.rs`: replaced platform-size count casts with checked helpers, switched implicit external defaults to explicit `empty_response()` construction, and renamed condition booleans to predicate-style names while keeping targeted `cargo check -p aspen-raft` green. Local warnings fell to only the real wide-signature table-helper cases (`batch.rs` 9→2, `cas.rs` 6→1), and the cold repo-owned warning-site count dropped from 3905 to 3893 (-12).","timestamp":1776438174609,"segment":2,"confidence":3.2493297587131367,"iterationTokens":7214,"asi":{"hypothesis":"`storage_shared/state_machine/batch.rs` and `cas.rs` still had a dense mechanical warning cluster around unchecked count casts, implicit response defaults, and non-predicate boolean names; tightening those internals should remove a real batch of warnings without changing state-machine semantics.","lessons":"Late-loop internal Raft state-machine helpers remain good ROI when the remaining warnings are mechanical and local. The surviving warnings in these files are the genuine wide-signature table-helper cases, so the next best target is likely `aspen-raft/src/network/client.rs` rather than forcing lifetime-heavy parameter bundling here.","next_action_hint":"Keep core/raft/coord focus. Inspect `crates/aspen-raft/src/network/client.rs` next for checked timeout/time conversions, explicit enum response matching, and discarded-result cleanup; if that starts to sprawl, pivot to another local raft helper file instead of touching Verus-mirrored code."}}
{"run":90,"commit":"98bcc0f","metric":0,"metrics":{},"status":"crash","description":"Benchmark wrapper quoting broke before cargo started: the inline Python regex block was parsed by bash instead of Python, so no Tiger Style metric was measured for the staged commit-retry batch.","timestamp":1776438784761,"segment":2,"confidence":3.2493297587131367,"iterationTokens":7214}
{"run":91,"commit":"98bcc0f","metric":3879,"metrics":{},"status":"keep","description":"Commit retry for the staged Tiger Style cleanup batch now that combined touched-crate `cargo check` is green: blob/core-essentials/forge/blob-worker/net/rpc cleanup plus the requested raft slice (`storage/in_memory/state_machine.rs`, `node/kv_store.rs`, `log_subscriber.rs`, `iroh_write_forwarder.rs`, `network/factory.rs`, and `storage_shared/state_machine/{transaction,batch,cas,lease_ops}.rs`) lowers the cold repo-owned warning-site count from the committed 4017 baseline to 3879 (-138).","timestamp":1776438886704,"segment":2,"confidence":3.309041835357625,"iterationTokens":3453}
{"run":92,"commit":"524f19f","metric":3862,"metrics":{},"status":"keep","description":"Stayed on the requested raft slice and cleaned two more mechanical hotspots: `connection_pool/pool_management.rs` now uses checked peer-capacity helpers, bounded cleanup iteration, reserved removal queues, predicate-style names, and saturating metric accounting; `storage_shared/log_storage.rs` now pre-sizes bounded vectors, uses checked batch-size helpers, avoids overflow-prone truncate math, splits the zero-term invariant, and replaces implicit empty `AppResponse` defaults with an explicit helper. Targeted `cargo check -p aspen-raft` stayed green and the cold repo-owned warning-site count dropped from 3879 to 3862 (-17).","timestamp":1776439229153,"segment":2,"confidence":3.3146666666666667,"iterationTokens":32106}
{"run":93,"commit":"eb6f019","metric":3848,"metrics":{},"status":"keep","description":"Resumed loop from git log plus autoresearch.jsonl because repo-local `autoresearch.md` is still absent, then stayed on the requested raft slice and cleaned two honest hotspots: `server.rs` now uses checked usize limit helpers, bounded accept loops, smaller snapshot/response helpers, and real response invariants; `clock_drift_detection.rs` now routes observation timestamps through one explicit monotonic boundary helper and uses checked max-observation sizing plus clearer predicate names. Targeted `cargo check -p aspen-raft` stayed green, and the cold repo-owned warning-site count dropped from 3862 to 3848 (-14).","timestamp":1776439777487,"segment":2,"confidence":3.3475366178428763,"iterationTokens":34327}
