{"run":351,"commit":"65d1d46","metric":1,"metrics":{},"status":"checks_failed","description":"Baseline for the explicit openraft lib macro Tiger Style slice: `cargo check -p openraft` stays green, and `openraft/openraft/src/lib.rs` currently has one production unique location—the `func_name!` helper macro still trims the closure suffix with raw `name.len() - 3` arithmetic.","timestamp":1776986116368,"segment":54,"confidence":null,"iterationTokens":368,"asi":{"hypothesis":"A tiny vendor-local slice on `openraft/src/lib.rs` can remove one broadly repeated raw-arithmetic site cheaply without changing macro behavior.","rollback_reason":"Baseline-only measurement on a new explicit local slice; no intended code changes for this cycle.","next_action_hint":"Replace the hard-coded `name.len() - 3` trim with a named suffix-length constant plus a saturating subtraction, then rerun the slice."}}
{"run":352,"commit":"28e6817","metric":0,"metrics":{},"status":"keep","description":"Finished the explicit openraft lib macro Tiger Style slice: the `func_name!` helper now uses a named `FUNCTION_SUFFIX_LEN` constant plus saturating subtraction instead of raw `name.len() - 3` arithmetic when trimming the helper function suffix. `cargo check -p openraft` stayed green, and the fixed `openraft/src/lib.rs` slice dropped from 1 to 0.","timestamp":1776986161963,"segment":54,"confidence":null,"iterationTokens":1123,"asi":{"hypothesis":"A tiny vendor-local `openraft/src/lib.rs` pass should remove the broadly repeated raw-arithmetic site in `func_name!` without affecting macro output.","lessons":"This was a cheap high-leverage vendored cleanup because one source line expanded into many repeated workspace findings. Small macro fixes can therefore be better ROI than chasing the largest raw file by repeated-hit count.","next_action_hint":"Verify the keep advanced HEAD, then refresh the full-workspace rail again; the repeated-hit top-file histogram should shrink even if the unique finding count only drops by one."}}
{"type":"config","name":"Aspen full-workspace Tiger Style cleanup (summary-index)","metricName":"workspace_tigerstyle_findings","metricUnit":"","bestDirection":"lower"}
{"run":353,"commit":"8edc429","metric":497,"metrics":{},"status":"keep","description":"Rebased the broad full-workspace Tiger Style rail after the openraft `func_name!` macro cleanup. The summary-index metric dropped from 498 to 497, and the repeated-hit hotspot list no longer includes `openraft/openraft/src/lib.rs`; the remaining frontier is now led by `openraft/openraft/src/core/raft_core.rs`, `src/testing/runtime/mod.rs`, `src/engine/engine_impl.rs`, `src/raft/mod.rs`, `src/replication/mod.rs`, and `src/config/config.rs`.","timestamp":1776986290203,"segment":55,"confidence":null,"iterationTokens":509,"asi":{"hypothesis":"Clearing the repeated raw-arithmetic macro site in `openraft/src/lib.rs` should still move the broad workspace rail, even if only by one unique location.","lessons":"This confirms the broad rail is sensitive to tiny vendored macro fixes when the same source line fans out across many expansions. The next ROI likely comes from a smaller openraft module with several mechanical findings rather than jumping straight into `raft_core.rs`.","next_action_hint":"Pick the next tractable openraft slice from the updated hotspot list—`openraft/openraft/src/config/config.rs` or `openraft/openraft/src/engine/log_id_list.rs` look more manageable than `raft_core.rs` for the next mechanical cleanup pass."}}
{"type":"config","name":"Openraft log id list production Tiger Style slice","metricName":"openraft_log_id_list_slice_findings","metricUnit":"","bestDirection":"lower"}
{"run":354,"commit":"8edc429","metric":17,"metrics":{},"status":"checks_failed","description":"Baseline for the explicit openraft log-id-list production Tiger Style slice: `cargo check -p openraft` stays green, and `openraft/openraft/src/engine/log_id_list.rs` currently has 17 production unique locations covering the stack-driven search loop, unbounded result growth, many raw index arithmetic sites, and one `unwrap()` in `by_last_leader()`.","timestamp":1776986504401,"segment":56,"confidence":null,"iterationTokens":376,"asi":{"hypothesis":"A focused internal slice on `openraft/src/engine/log_id_list.rs` is tractable because its remaining warnings are concentrated in a few list/index helpers rather than public API churn.","rollback_reason":"Baseline-only measurement on a new vendor-local slice; no intended code changes for this cycle.","next_action_hint":"Refactor the stack-driven search into a bounded `while let`/helper shape, reserve or bound result capacity, replace raw `l-1`/`i-1`/`+1` arithmetic with explicit helper branches, and remove the final `unwrap()` in `by_last_leader()` before rerunning the slice."}}
{"run":355,"commit":"1fd74b7","metric":0,"metrics":{},"status":"keep","description":"Finished the explicit openraft log-id-list production Tiger Style slice: `get_key_log_ids()` now uses bounded result/stack capacity, explicit index helpers, and clone-safe leader-id comparisons, while `append()`, `truncate()`, `ref_at()`, and `by_last_leader()` replace raw index arithmetic and the final `unwrap()` with named helpers and explicit branches. `cargo check -p openraft` and `cargo test -p openraft log_id_list --lib` stayed green, and the file-local Tiger Style slice dropped from 17 production unique locations to 0.","timestamp":1776988673562,"segment":56,"confidence":null,"iterationTokens":376,"asi":{"hypothesis":"A focused internal cleanup of `openraft/openraft/src/engine/log_id_list.rs` can eliminate its concentrated raw-index-arithmetic, unbounded-growth, and panic-style Tiger Style findings without changing log-id semantics.","lessons":"Comparing leader IDs through a small `last_result_leader_id()` helper avoids the type-inference problems from inline `Option` comparisons on references. The slice rail is now clean while the targeted openraft compile/test rails stay green.","next_action_hint":"Refresh the broad full-workspace summary-index rail next; the repeated-hit hotspot list should shrink now that `openraft/src/engine/log_id_list.rs` is clean, and the next tractable vendored targets are likely `openraft/src/config/config.rs` or another smaller non-test module rather than `raft_core.rs`."}}
{"type":"config","name":"Aspen full-workspace Tiger Style cleanup (summary-index)","metricName":"workspace_tigerstyle_findings","metricUnit":"","bestDirection":"lower"}
{"run":356,"commit":"1fd74b7","metric":0,"metrics":{},"status":"crash","description":"Broad full-workspace summary-index rerun misparsed the cargo-tigerstyle human output: the parser expected `F...` at column 0, but the real summary lines are left-padded (for example `  F464 ...`), so it reported a bogus zero metric even though the workspace log still contained 500+ findings. No code-signal from this run.","timestamp":1776988819595,"segment":57,"confidence":null,"iterationTokens":2140,"asi":{"hypothesis":"Rebasing the broad full-workspace summary-index rail after the openraft log-id-list cleanup should lower the 497-finding workspace frontier and refresh the repeated-hit hotspot list.","rollback_reason":"Benchmark parser bug: leading whitespace on summary lines caused the regex to miss every `F...` entry and emit an invalid zero metric.","next_action_hint":"Rerun the same fresh-target-dir workspace benchmark with a whitespace-tolerant `^\\s*F\\d+` parser (or strip each line before matching), then log the real summary-index value and top-file histogram.","error_detail":"The captured log at `/run/user/1555/tmp/aspen-tigerstyle-log.Vj05x7` clearly shows padded summary lines like `  F464 ...`, while the experiment parser required the `F` to start in column 0."}}
{"run":357,"commit":"1fd74b7","metric":502,"metrics":{},"status":"discard","description":"Corrected the broad full-workspace summary-index parser and reran the fresh-target-dir workspace rail after the `openraft/src/engine/log_id_list.rs` keep. The broad metric came back at 502 findings, which is worse than the prior 497 broad baseline even though the local log-id-list slice is now clean. Treat the openraft slice as a local win only; it does not improve the current broad workspace target.","timestamp":1776989013548,"segment":57,"confidence":null,"iterationTokens":2978,"asi":{"hypothesis":"Rebasing the broad full-workspace summary-index rail after the openraft log-id-list cleanup would lower the repeated-hit workspace frontier.","rollback_reason":"The corrected broad workspace metric regressed from the prior 497 baseline to 502, so this slice does not help the current broad target despite cleaning the local file.","next_action_hint":"Mine the broad log's top-file histogram and choose a different vendored openraft hotspot with enough repeated findings to move the workspace rail—likely `openraft/openraft/src/config/config.rs` or another smaller non-test module rather than `engine/log_id_list.rs`.","lessons":"Do not trust the first broad rerun after a slice change; the broad rail can move differently from a local file slice. Also, the summary-index parser must tolerate left-padded `F...` lines or it will fake a zero baseline."}}
{"type":"config","name":"Aspen full-workspace Tiger Style cleanup (summary-index, corrected parser)","metricName":"workspace_tigerstyle_findings","metricUnit":"","bestDirection":"lower"}
{"run":358,"commit":"0f95dda","metric":493,"metrics":{},"status":"keep","description":"Cleaned `openraft/openraft/src/storage/helper.rs` for the corrected broad workspace rail: `StorageHelper::new()` now uses explicit `PhantomData`, initial-state recovery routes missing node-id / snapshot-builder / last-applied cases through explicit storage errors, snapshot metadata uses an explicit match instead of hidden defaults, and reapply/membership scan loops now have bounded iteration counts, reserved result capacity, and saturating index math. `cargo check -p openraft` and `cargo test -p openraft --lib` stayed green, and the corrected fresh-target-dir full-workspace summary-index metric dropped from the prior valid 502 to 493 (-9).","timestamp":1776989299958,"segment":58,"confidence":null,"iterationTokens":493,"asi":{"hypothesis":"`openraft/openraft/src/storage/helper.rs` is a tractable broad-workspace hotspot because its repeated findings are concentrated in hidden defaults, unwraps, raw index arithmetic, and visibly unbounded chunk/membership loops.","lessons":"The broad rail responds better to internal helper cleanup that appears in common startup/recovery code than to the earlier `log_id_list.rs` slice. Bounded `for` loops derived from helper-computed chunk counts are an effective non-cheating fix for repeated `unbounded_loop` findings in vendored async helpers.","next_action_hint":"Stay on the corrected broad rail and target another tractable repeated-hit vendored file rather than the giant `raft_core.rs` frontier. Good next candidates are `openraft/openraft/src/config/config.rs`, `openraft/openraft/src/metrics/wait.rs`, or `openraft/openraft/src/engine/handler/replication_handler/mod.rs`, with `config/config.rs` still the smallest top-10 file by repeated-hit count."}}
{"run":359,"commit":"fb6a835","metric":479,"metrics":{},"status":"keep","description":"Cleaned `openraft/openraft/src/metrics/wait.rs` for the corrected broad workspace rail: the wait loop now uses an explicit deadline-bounded `while`, timeout locals carry unit-safe names, metrics/until tracing moved to explicit `.instrument(...)` spans, and the thin wrapper methods dropped the attr-macro false positives while preserving wait semantics. `cargo check -p openraft` and `cargo test -p openraft metrics::wait_test --lib` stayed green, and the corrected fresh-target-dir full-workspace summary-index metric dropped from 493 to 479 (-14).","timestamp":1776989520585,"segment":58,"confidence":null,"iterationTokens":13089,"asi":{"hypothesis":"`openraft/openraft/src/metrics/wait.rs` is a high-ROI broad-workspace target because most of its repeated findings are one real unbounded wait loop plus many attr-macro false positives on thin async wrappers.","lessons":"Explicit `.instrument(...)` spans are again an honest fix for Tiger Style's wrapper-level `unbounded_loop` false positives on async methods. Replacing `loop` with a deadline-bounded `while` in the core wait path removed the real loop warning without changing timeout behavior, and the file disappeared from the top-10 hotspot list afterward.","next_action_hint":"Stay on the corrected broad rail and keep picking tractable vendored openraft modules below the huge `raft_core.rs` frontier. `openraft/openraft/src/config/config.rs` and `openraft/openraft/src/engine/handler/replication_handler/mod.rs` are still the best medium-sized repeated-hit candidates."}}
{"run":360,"commit":"89644cc","metric":460,"metrics":{},"status":"keep","description":"Cleaned `openraft/openraft/src/engine/handler/replication_handler/mod.rs` for the corrected broad workspace rail: replication handlers now use explicit debug spans instead of `#[tracing::instrument]` on thin sync wrappers, missing progress entries report explicit warnings instead of panicking via `expect()`/`unwrap()`, replication-stream rebuild pre-reserves targets, `send_to_target()` fails closed without `unreachable!`, and purge logic now uses explicit `purge_upto` matching plus `is_in_use` naming. `cargo check -p openraft`, `cargo test -p openraft append_membership_test --lib`, and `cargo test -p openraft update_matching_test --lib` stayed green, and the corrected fresh-target-dir full-workspace summary-index metric dropped from 479 to 460 (-19).","timestamp":1776989862153,"segment":58,"confidence":2.357142857142857,"iterationTokens":22920,"asi":{"hypothesis":"`openraft/openraft/src/engine/handler/replication_handler/mod.rs` is a tractable broad-workspace hotspot because many of its repeated findings are attr-macro false positives plus a handful of panic/result-handling mechanics that can be fixed without changing replication behavior.","lessons":"Replacing `#[tracing::instrument]` on sync helper methods with explicit entered spans is again a high-ROI fix for repeated `unbounded_loop` false positives in vendored openraft. The real non-false-positive tail in this file was also mechanical: explicit missing-progress branches, reserved target capacity, and fail-closed `Inflight::None` handling cleaned it up without broad API churn.","next_action_hint":"Stay on the corrected broad rail and keep targeting tractable vendored openraft modules below the giant `raft_core.rs` frontier. The refreshed top candidates should now be `openraft/openraft/src/config/config.rs`, `openraft/openraft/src/engine/engine_impl.rs`, or another medium-sized mechanical file rather than jumping straight into `raft_core.rs`."}}
{"run":361,"commit":"0405818","metric":452,"metrics":{},"status":"keep","description":"Cleaned `openraft/openraft/src/engine/handler/log_handler/mod.rs` for the corrected broad workspace rail: log-handler methods now use explicit debug spans instead of `#[tracing::instrument]`, purge scheduling fails closed when `purge_upto` is unexpectedly absent, purge math now uses saturating add/sub helpers plus a named `max_keep_log_count`, and the remaining raw `purge_end - 1` arithmetic was replaced with an explicit `purge_log_index` branch. `cargo check -p openraft`, `cargo test -p openraft purge_log_test --lib`, and `cargo test -p openraft calc_purge_upto_test --lib` stayed green, and the corrected fresh-target-dir full-workspace summary-index metric dropped from 460 to 452 (-8).","timestamp":1776990039186,"segment":58,"confidence":3.037037037037037,"iterationTokens":11682,"asi":{"hypothesis":"`openraft/openraft/src/engine/handler/log_handler/mod.rs` is a good follow-up broad-workspace hotspot because its repeated findings are concentrated in a few tracing-wrapper false positives, one unwrap, and simple purge arithmetic.","lessons":"Small handler modules with repetitive `#[tracing::instrument]` annotations are still good ROI on the vendored openraft frontier: explicit entered spans plus saturating purge math removed nearly the whole file-local tail without public API churn. Late broad-workspace gains are smaller than the first big vendored slices, but they are still measurable and likely real on the corrected parser.","next_action_hint":"Keep the broad rail going with another medium-sized mechanical vendored file rather than jumping straight into `raft_core.rs`. Best next candidates remain `openraft/openraft/src/config/config.rs`, `openraft/openraft/src/core/sm/worker.rs`, or `openraft/openraft/src/raft/raft_inner.rs`; prefer whichever shows the highest ratio of mechanical warnings to API churn after a quick local inspection."}}
{"run":362,"commit":"0405818","metric":0,"metrics":{},"status":"crash","description":"Broad full-workspace rerun after the `openraft/src/core/sm/worker.rs` cleanup hit an environment failure, not a code failure: the fresh target dir under `/run/user/$UID/tmp` ran out of space while compiling dependencies, so cargo-tigerstyle printed a bogus zero-finding summary. No benchmark signal from this run.","timestamp":1776990300919,"segment":58,"confidence":3.037037037037037,"iterationTokens":21773,"asi":{"hypothesis":"The `openraft/openraft/src/core/sm/worker.rs` cleanup should reduce the corrected broad workspace metric by removing ignored-result, raw-arithmetic, and attr-macro false-positive findings.","rollback_reason":"Benchmark environment failed with `No space left on device` in `/run/user/$UID/tmp`, so the parsed zero metric is invalid.","next_action_hint":"Reapply the saved patch from `/tmp/aspen-openraft-worker-and-notes.patch`, rerun the broad benchmark with both `TMPDIR` and the fresh target dir rooted under disk-backed `/tmp`, then decide keep/discard from the real metric.","error_detail":"The captured log `/run/user/1555/tmp/aspen-tigerstyle-log.Ndxegu` shows `rustc-LLVM ERROR: IO failure on output stream: No space left on device` and linker failures writing into `/run/user/1555/tmp/aspen-tigerstyle-target.l9Afab`."}}
{"run":363,"commit":"33a7f2e","metric":443,"metrics":{},"status":"keep","description":"Cleaned `openraft/openraft/src/core/sm/worker.rs` for the corrected broad workspace rail: replaced `#[tracing::instrument]` on the async worker helpers with explicit spans, made ignored response sends log dropped receivers instead of discarding results, and switched the remaining `last.index() + 1` / `end - 1` math to saturating helpers. Targeted `cargo check -p openraft`, `cargo test -p openraft install_full_snapshot_test --lib`, and `cargo test -p openraft trigger_snapshot_test --lib` stayed green, and the corrected fresh-target-dir full-workspace summary-index metric dropped from 452 to 443 (-9).","timestamp":1776991624361,"segment":58,"confidence":2.9411764705882355,"iterationTokens":21773,"asi":{"hypothesis":"`openraft/openraft/src/core/sm/worker.rs` is a good corrected broad-workspace target because it combines several mechanical ignored-result/raw-arithmetic findings with a batch of `#[tracing::instrument]`-driven `unbounded_loop` false positives on async worker helpers.","lessons":"For the corrected broad workspace parser, summary-index lines are indented (`  F149 ...`), so the parser must match leading whitespace before `F<number>`. The worker cleanup was a real win: targeted openraft check/tests stayed green and the file’s remaining broad-rail tail fell to a single `unbounded_loop` hit on the main receive loop.","next_action_hint":"Stay on the corrected broad rail and keep targeting medium-size vendored openraft files with many mechanical findings before tackling `raft_core.rs`. The refreshed top candidates are `openraft/openraft/src/config/config.rs`, `openraft/openraft/src/engine/engine_impl.rs`, and `openraft/openraft/src/raft/mod.rs`; prefer one with explicit arithmetic/default/result-handling wins over the giant `raft_core.rs` frontier."}}
