{"run":175,"commit":"8fb71b9","metric":3079,"metrics":{},"status":"keep","description":"Kept an honest `crates/aspen-tui/src/ui/kv.rs` pass on top of the existing dirty batch: the KV/vault views now use explicit ratatui constructors plus small render invariants instead of implicit external defaults and zero-assert helper bodies. Fresh-target-dir repo-owned workspace metric dropped from 3104 to 3079 (-25).","timestamp":1776545728536,"segment":2,"confidence":9.82490272373541,"iterationTokens":20689,"asi":{"hypothesis":"`crates/aspen-tui/src/ui/kv.rs` still mirrored earlier TUI cleanup wins, so replacing ratatui defaults with explicit constructors and adding local render invariants should remove roughly twenty-five real workspace-visible warning sites without changing UI behavior.","lessons":"The remaining TUI UI files still behave like the earlier jobs/ci/sql/common cleanup: explicit `Layout::vertical/horizontal`, `Block::new`, and `Style::new` plus `debug_assert!` invariants remove a dense warning cluster cheaply. Keep auto-commit still needs manual verification because HEAD has previously stayed pinned after reported success.","next_action_hint":"Verify commit reality again, then mine the new 3079 histogram. Best next honest targets likely include `aspen-forge-web/src/templates.rs`, `aspen-blob/src/{replication/manager.rs,store/iroh_store.rs}`, `aspen-jobs/src/job.rs`, `aspen-secrets/src/pki/store.rs`, or another dense TUI/CLI file surfaced by the fresh log."}}
{"run":176,"commit":"8fb71b9","metric":3058,"metrics":{},"status":"keep","description":"Kept an honest `crates/aspen-secrets/src/pki/store.rs` cleanup on top of the dirty batch: PKI store time handling now flows through explicit helpers, certificate-param setup uses explicit rcgen constructors, SAN counting/reservation uses checked conversions and bounded capacity, and expiry/CRL math uses saturating helpers instead of raw casts/defaults/arithmetic. Fresh-target-dir repo-owned workspace metric dropped from 3079 to 3058 (-21).","timestamp":1776546210144,"segment":2,"confidence":9.786821705426357,"iterationTokens":31425,"asi":{"hypothesis":"`crates/aspen-secrets/src/pki/store.rs` still contained a dense mechanical cluster of direct clock reads, unchecked `u128`/`usize` conversions, implicit `CertificateParams::default()`, unreserved SAN vectors, and raw ms arithmetic; helper extraction should remove about twenty real workspace-visible warning sites without changing PKI semantics.","lessons":"PKI store cleanup paid off once isolated from the earlier regressing salvage bundle. Wrapping rcgen/time conversions in local helpers removes multiple warning classes at once, but plain `cargo check` in this repo still needs `#[allow(unknown_lints)]` next to bare Tiger Style allow attributes to avoid `unknown lint` noise.","next_action_hint":"Verify commit reality again, then mine the new 3058 histogram. Best next honest targets likely remain `aspen-forge-web/src/templates.rs`, `aspen-blob/src/{replication/manager.rs,store/iroh_store.rs}`, `aspen-jobs/src/job.rs`, `aspen-fuse/src/fs/operations.rs`, or another dense file from the fresh log."}}
{"run":177,"commit":"8fb71b9","metric":3038,"metrics":{},"status":"keep","description":"Resumed loop from missing repo-local `autoresearch.md` plus git log/autoresearch.jsonl context, then kept an honest `crates/aspen-cli/src/bin/aspen-cli/commands/patch.rs` cleanup on top of the current dirty batch: patch CLI now preserves `--limit` via `max_results`, uses predicate-style JSON naming, centralizes patch/detail/status rendering in typed helpers, and adds real local invariants without changing CLI behavior. Fresh-target-dir repo-owned workspace metric dropped from 3058 to 3038 (-20).","timestamp":1776546742286,"segment":2,"confidence":9.63740458015267,"iterationTokens":57224,"asi":{"hypothesis":"`crates/aspen-cli/src/bin/aspen-cli/commands/patch.rs` still had a dense mechanical cluster of boolean naming, one quantity name, zero-assert command handlers, a long detail function, and swap-prone string helper params; helper extraction should remove about twenty workspace-visible warning sites without changing patch CLI semantics.","lessons":"CLI command files remain good late-stage ROI when one pass can collapse several warning classes at once. `aspen-client-api::messages` already re-exports Forge patch types, so helper extraction can stay inside the CLI crate without adding a new dependency edge.","next_action_hint":"Verify commit reality again, then mine `/tmp/aspen-tigerstyle-log.wcwRbW`. Best next honest dense targets likely include `aspen-forge-web/src/templates.rs`, `aspen-blob/src/{replication/manager.rs,store/iroh_store.rs}`, `aspen-jobs/src/job.rs`, `aspen-fuse/src/fs/operations.rs`, or another top file from the fresh histogram."}}
{"run":178,"commit":"8fb71b9","metric":3018,"metrics":{},"status":"keep","description":"Kept an honest `crates/aspen-cli/src/bin/aspen-cli/commands/service.rs` cleanup on top of the current dirty batch: service CLI now preserves `--limit` through `max_instances`/`max_services`, uses predicate-style JSON naming, adds explicit local invariants to each command handler, and removes the remaining empty-tag catch-all without changing RPC behavior. Fresh-target-dir repo-owned workspace metric dropped from 3038 to 3018 (-20).","timestamp":1776547013120,"segment":2,"confidence":9.582542694497153,"iterationTokens":14376,"asi":{"hypothesis":"`crates/aspen-cli/src/bin/aspen-cli/commands/service.rs` had the same late-stage mechanical pattern as `patch.rs`—quantity names, boolean `json` params, zero-assert handlers, and one catch-all option match—so a focused naming/invariant pass should remove about twenty workspace-visible warning sites without changing service CLI semantics.","lessons":"These command modules are highly repetitive, so once one file is cleaned the next one can usually be normalized with the same honest pattern: preserve clap flags explicitly, rename internal booleans, and add small command-boundary invariants instead of lint suppression. Also, saving a `/tmp` patch before risky edits remains good insurance because the autoresearch keep path still does not advance HEAD here.","next_action_hint":"Verify commit reality again, then mine `/tmp/aspen-tigerstyle-log.SOzg1t`. Best next honest dense targets likely include `aspen-forge-web/src/templates.rs`, `aspen-blob/src/{replication/manager.rs,store/iroh_store.rs}`, `aspen-jobs/src/job.rs`, `aspen-fuse/src/fs/operations.rs`, `aspen-ci/src/checkout.rs`, or another CLI command file from the fresh histogram."}}
{"run":179,"commit":"8fb71b9","metric":2999,"metrics":{},"status":"keep","description":"Kept an honest `crates/aspen-cli/src/bin/aspen-cli/commands/peer.rs` cleanup on top of the current dirty batch: peer CLI now uses predicate-style JSON naming, adds explicit command-boundary invariants to each handler, and replaces the remaining empty-prefix catch-all with explicit `Some(_) | None` handling without changing federation RPC behavior. Fresh-target-dir repo-owned workspace metric dropped from 3018 to 2999 (-19).","timestamp":1776547250000,"segment":2,"confidence":9.47467166979362,"iterationTokens":11498,"asi":{"hypothesis":"`crates/aspen-cli/src/bin/aspen-cli/commands/peer.rs` had the same late-stage mechanical pattern as nearby CLI modules—boolean `json` params, zero-assert handlers, and one catch-all option match—so a focused invariant/naming pass should remove about twenty workspace-visible warning sites without changing peer CLI semantics.","lessons":"The CLI cleanup pattern keeps paying honestly across adjacent command files: rename internal booleans, preserve user-facing flags, add local invariants around request/response shaping, and make optional-input matches explicit instead of relying on `_`. Fresh-target-dir full-workspace measurement remains stable and still catches these small but real drops.","next_action_hint":"Verify commit reality again, then mine `/tmp/aspen-tigerstyle-log.CsHl9s`. Best next honest dense targets likely include `aspen-forge-web/src/templates.rs`, `aspen-blob/src/{replication/manager.rs,store/iroh_store.rs}`, `aspen-jobs/src/job.rs`, `aspen-fuse/src/fs/operations.rs`, `aspen-ci/src/checkout.rs`, or another remaining CLI command file like `discussion.rs` or `rwlock.rs`."}}
{"run":180,"commit":"8fb71b9","metric":2981,"metrics":{},"status":"keep","description":"Kept an honest `crates/aspen-cli/src/bin/aspen-cli/commands/discussion.rs` cleanup on top of the current dirty batch: discussion CLI now preserves `--limit` through `max_discussions`, uses predicate-style JSON naming, and adds explicit request/response invariants across list/create/show/reply/close/reopen/lock/unlock handlers without changing discussion RPC behavior. Fresh-target-dir repo-owned workspace metric dropped from 2999 to 2981 (-18).","timestamp":1776547444650,"segment":2,"confidence":9.369202226345083,"iterationTokens":10400,"asi":{"hypothesis":"`crates/aspen-cli/src/bin/aspen-cli/commands/discussion.rs` followed the same repetitive late-stage CLI warning pattern as `patch.rs`, `service.rs`, and `peer.rs`—one quantity name plus many boolean `json` and zero-assert handler warnings—so the same honest normalization should remove around eighteen workspace-visible sites without changing semantics.","lessons":"Adjacent CLI files keep yielding predictable real improvements when normalized with the same pattern, and compile-time type feedback catches incorrect assumptions quickly (here `ForgeDiscussionListResultResponse` has no `count` field, so the invariant had to attach directly to returned discussions). Keep path still needs manual HEAD verification because `log_experiment` success does not mean a real commit advanced.","next_action_hint":"Verify commit reality again, then mine `/tmp/aspen-tigerstyle-log.MwDKSA`. Best next honest dense targets likely include `aspen-forge-web/src/templates.rs`, `aspen-blob/src/{replication/manager.rs,store/iroh_store.rs}`, `aspen-jobs/src/job.rs`, `aspen-fuse/src/fs/operations.rs`, `aspen-ci/src/checkout.rs`, or another remaining CLI command file like `rwlock.rs`."}}
{"run":181,"commit":"8fb71b9","metric":2962,"metrics":{},"status":"keep","description":"Kept an honest `crates/aspen-cli/src/bin/aspen-cli/commands/rwlock.rs` cleanup on top of the current dirty batch: rwlock CLI now uses Tiger Style casing (`RwLockCommand`/`RwLockOutput`), predicate-style JSON naming, and explicit command-boundary invariants across read/write/try/release/downgrade/status handlers without changing distributed lock RPC behavior. Fresh-target-dir repo-owned workspace metric dropped from 2981 to 2962 (-19).","timestamp":1776547683945,"segment":2,"confidence":9.360518999073216,"iterationTokens":15353,"asi":{"hypothesis":"`crates/aspen-cli/src/bin/aspen-cli/commands/rwlock.rs` had one acronym-style naming pair plus the same repeated boolean `json` and zero-assert handler warnings as nearby CLI modules, so a focused rename/invariant pass should remove about nineteen workspace-visible sites without changing rwlock semantics.","lessons":"The late-stage CLI pattern still holds even when a file has an extra acronym lint: rename the internal types to Tiger Style casing, then normalize handler boundaries the same way as the other command files. Also, broad scripted replacements are fast but easy to overshoot; immediate compile feedback caught leftover `json` call sites before benchmarking.","next_action_hint":"Verify commit reality again, then mine `/tmp/aspen-tigerstyle-log.35IH74`. Best next honest dense targets likely include `aspen-forge-web/src/templates.rs`, `aspen-blob/src/{replication/manager.rs,store/iroh_store.rs}`, `aspen-jobs/src/job.rs`, `aspen-fuse/src/fs/operations.rs`, `aspen-ci/src/checkout.rs`, or another remaining CLI command file."}}
{"run":182,"commit":"8fb71b9","metric":2947,"metrics":{},"status":"keep","description":"Kept an honest `crates/aspen-cli/src/bin/aspen-cli/commands/issue.rs` cleanup on top of the current dirty batch: issue CLI now preserves `--limit` through `max_issues`, uses predicate-style JSON naming, and adds explicit request/output invariants across list/create/show/close/reopen/comment handlers without changing issue RPC behavior. Fresh-target-dir repo-owned workspace metric dropped from 2962 to 2947 (-15).","timestamp":1776547959460,"segment":2,"confidence":9.283088235294118,"iterationTokens":20656,"asi":{"hypothesis":"`crates/aspen-cli/src/bin/aspen-cli/commands/issue.rs` matched the same low-risk late-stage CLI pattern as the nearby patch/discussion/service modules, so renaming the internal limit/json bindings and adding real output invariants should remove about fifteen workspace-visible warning sites without changing issue semantics.","lessons":"The repeated CLI normalization pattern remains stable across modules, but broad scripted replacements need compile validation immediately after each pass to catch misses before benchmarking. Even with one remaining structural warning in a file, removing the repeated naming/assertion sites still gives a real full-workspace gain.","next_action_hint":"Verify commit reality again, then mine `/tmp/aspen-tigerstyle-log.pmyTMq`. Best next honest dense targets likely include `aspen-forge-web/src/templates.rs`, `aspen-blob/src/{replication/manager.rs,store/iroh_store.rs}`, `aspen-jobs/src/job.rs`, `aspen-fuse/src/fs/operations.rs`, `aspen-ci/src/checkout.rs`, or another remaining CLI command file."}}
{"run":183,"commit":"8fb71b9","metric":2910,"metrics":{},"status":"keep","description":"Kept an honest `crates/aspen-cli/src/bin/aspen-cli/commands/kv.rs` cleanup on top of the current dirty batch: preserved `--limit` via `max_results`, renamed repeated JSON flags to predicate-style names, replaced the `key=value` parser's unchecked slice math with checked bounds, and added command-boundary invariants across set/delete/cas/cad/scan/batch-write handlers without changing KV RPC behavior. Fresh-target-dir repo-owned workspace metric dropped from 2947 to 2910 (-37).","timestamp":1776548812534,"segment":2,"confidence":9.1901728844404,"iterationTokens":20656,"asi":{"hypothesis":"`crates/aspen-cli/src/bin/aspen-cli/commands/kv.rs` matched the same late-stage CLI warning pattern as nearby modules—quantity naming, boolean `json` params, one unchecked parser offset, and several zero-assert command handlers—so a focused normalization should remove a few dozen workspace-visible warning sites without changing KV semantics.","lessons":"The repeated CLI normalization pattern still works on denser command files: preserve clap flag names, rename only internal bindings, use checked index math in parsers, and add real boundary invariants. Local `cargo tigerstyle check -p aspen-cli` shows `commands/kv.rs` warning-free after the pass.","next_action_hint":"Verify keep reality again, then mine the fresh cold-workspace histogram. Best next honest dense targets now look like `aspen-sops-install-secrets/src/filesystem.rs`, `aspen-jobs-worker-maintenance/src/lib.rs`, `aspen-client/src/observability.rs`, `aspen-ci-executor-shell/src/agent/executor.rs`, or another remaining CLI file such as `commands/cluster.rs`."}}
{"run":184,"commit":"8fb71b9","metric":2894,"metrics":{},"status":"keep","description":"Resumed loop from missing repo-local `autoresearch.md` plus git log/context and kept an honest `crates/aspen-sops-install-secrets/src/filesystem.rs` cleanup on top of the current dirty batch: generation prep and change detection now use explicit input structs instead of swap-prone `&str`/bool groups, generation rollover uses saturating math, symlink ownership flows through a typed struct, restart/reload unit lists reserve bounded capacity, and filesystem helpers now carry real invariants without changing install-secrets behavior. Fresh-target-dir repo-owned workspace metric dropped from 2910 to 2894 (-16).","timestamp":1776549284091,"segment":2,"confidence":9.181818181818182,"iterationTokens":19791,"asi":{"hypothesis":"`crates/aspen-sops-install-secrets/src/filesystem.rs` had a real mechanical Tiger Style cluster—zero-assert helper bodies, swap-prone `&str`/bool/u32 parameters, unchecked generation arithmetic, and unreserved restart/reload vectors—so a typed-input refactor should remove a double-digit batch without changing secret-install semantics.","lessons":"`autoresearch.md` is still absent in this repo, so resume context must come from git log plus `autoresearch.jsonl`. Local `cargo check -p aspen-sops-install-secrets --bin sops-install-secrets` is currently blocked by a pre-existing unrelated `crates/aspen-secrets/src/sops/edit.rs` `tokio::process` feature error, but the full cold workspace benchmark stayed green and `filesystem.rs` itself no longer emits local Tiger Style warnings.","next_action_hint":"Verify keep reality again, then mine the fresh cold-workspace histogram. Best next honest dense targets now look like `aspen-jobs-worker-maintenance/src/lib.rs`, `aspen-client/src/observability.rs`, `aspen-ci-executor-shell/src/agent/executor.rs`, `aspen-federation/src/sync/client.rs`, or another remaining CLI file such as `commands/cluster.rs`.","error_detail":"Targeted package compile currently fails in unrelated dependency `crates/aspen-secrets/src/sops/edit.rs` because `tokio::process::Command` is referenced without the `process` feature."}}
{"run":185,"commit":"8fb71b9","metric":2874,"metrics":{},"status":"keep","description":"Stayed honest on the next dense hotspot and cleaned `crates/aspen-jobs-worker-maintenance/src/lib.rs`: maintenance job timing now flows through explicit monotonic/wall-clock helpers, blob-reference parsing moved into a checked helper instead of a 4-way condition chain, byte/tick accounting uses saturating arithmetic plus checked `usize`/`u128` conversions, and health-state booleans were renamed to predicate-style names without changing maintenance-worker behavior. Fresh-target-dir repo-owned workspace metric dropped from 2894 to 2874 (-20).","timestamp":1776549626185,"segment":2,"confidence":9.025915996425379,"iterationTokens":27045,"asi":{"hypothesis":"`crates/aspen-jobs-worker-maintenance/src/lib.rs` had a real mechanical Tiger Style cluster around direct clock reads, unchecked byte/time arithmetic, a dense blob-reference condition, and vague boolean names, so helper extraction plus saturating conversions should remove about twenty workspace-visible warning sites without changing job semantics.","lessons":"This crate was a good late-stage target: `cargo check -p aspen-jobs-worker-maintenance` stayed green and the file-local Tiger Style run went to zero after one pass. Explicit boundary helpers for wall-clock and monotonic timing keep the benchmark honest while avoiding repeated ambient-clock findings.","next_action_hint":"Verify keep reality again, then mine the fresh cold-workspace histogram. Best next honest dense targets now look like `crates/aspen-client/src/observability.rs`, `crates/aspen-ci-executor-shell/src/agent/executor.rs`, `crates/aspen-federation/src/sync/client.rs`, `crates/aspen-jobs/src/dlq_inspector.rs`, or another remaining CLI file such as `commands/cluster.rs`.","measurement_note":"Cold benchmark used the same fresh-target-dir full-workspace cargo-tigerstyle wrapper and repo-owned `warning:` parser as prior runs, so 2874 is directly comparable to the 2894 baseline."}}
{"run":186,"commit":"8fb71b9","metric":2855,"metrics":{},"status":"keep","description":"Stayed honest on `crates/aspen-client/src/observability.rs`: span timing now flows through explicit monotonic/wall-clock helpers, metric snapshots pre-reserve output capacity, ingest conversion uses checked `u128`/`u32` -> `u64`/`usize` helpers plus real invariants, both lock-heavy structs now document lock ordering, metric query uses an explicit request struct instead of a 7-argument API, and the observability builder now uses fixed-width `u32` for `max_spans`. Fresh-target-dir repo-owned workspace metric dropped from 2874 to 2855 (-19).","timestamp":1776549966233,"segment":2,"confidence":8.890845070422536,"iterationTokens":13000,"asi":{"hypothesis":"`crates/aspen-client/src/observability.rs` had a real mechanical Tiger Style cluster around ambient clock reads, unchecked duration/index conversions, undocumented lock ordering, vector growth without reserve, and wide public APIs, so boundary helpers plus small request/config structs should remove a double-digit batch without changing client observability semantics.","lessons":"This file cleaned up well with targeted helper extraction: `cargo check -p aspen-client` stayed green and the file-local Tiger Style run went to zero. Late-stage API cleanups can stay honest when they replace swap-prone argument lists and platform-sized public types with explicit request structs and fixed-width fields instead of suppressing lints.","next_action_hint":"Verify keep reality again, then mine the fresh cold-workspace histogram. Best next honest dense targets now look like `crates/aspen-ci-executor-shell/src/agent/executor.rs`, `crates/aspen-federation/src/sync/client.rs`, `crates/aspen-jobs/src/dlq_inspector.rs`, `crates/aspen-testing/src/suite_inventory.rs`, or another remaining CLI file such as `commands/cluster.rs`.","measurement_note":"Cold benchmark used the same fresh-target-dir full-workspace cargo-tigerstyle wrapper and repo-owned `warning:` parser as prior runs, so 2855 is directly comparable to the 2874 baseline."}}
