{"run":94,"commit":"4762913","metric":3840,"metrics":{},"status":"keep","description":"Stayed on the requested raft slice and cleaned `crates/aspen-raft/src/storage_validation.rs` without benchmark cheating: validation timing now goes through one explicit monotonic boundary helper, duration naming becomes `validation_elapsed`, log-gap checking uses checked successor math, suspicious snapshot bounds use saturating thresholds, and snapshot/vote/committed-state validation split into small helpers so the file is Tiger Style-clean while `cargo check -p aspen-raft --tests` stays green. Cold repo-owned warning-site count dropped from 3848 to 3840 (-8).","timestamp":1776440379929,"segment":2,"confidence":3.3643617021276597,"iterationTokens":16243}
{"run":95,"commit":"d9bea82","metric":3834,"metrics":{},"status":"keep","description":"Stayed on the requested raft slice and cleaned `crates/aspen-raft/src/storage/redb_store.rs` without benchmark cheating: bounded reader and historical replay vectors now pre-reserve through checked helpers, append batch preallocation uses a checked max-batch helper, truncate/chain verification use saturating predecessor math instead of raw `- 1`, and the new inclusive-range capacity helper keeps batch sizing explicit and portable. Targeted `cargo check -p aspen-raft` stayed green and the cold repo-owned warning-site count dropped from 3840 to 3834 (-6).","timestamp":1776440637468,"segment":2,"confidence":3.421265141318977,"iterationTokens":15790}
{"run":96,"commit":"7f79735","metric":3823,"metrics":{},"status":"keep","description":"Stayed on honest `aspen-raft` cleanup and trimmed two non-verified hotspots: `supervisor.rs` now routes restart-window timestamps through one explicit monotonic boundary helper, uses checked restart-count sizing, and replaces overflow-prone counter increments with saturating math; `storage_shared/snapshot.rs` now uses checked snapshot entry/size conversions, explicit bounded snapshot-entry insertion, and handles dropped snapshot broadcast subscribers without silently discarding `send` results. Targeted `cargo check -p aspen-raft` stayed green and the cold repo-owned warning-site count dropped from 3834 to 3823 (-11).","timestamp":1776440936010,"segment":2,"confidence":3.446236559139785,"iterationTokens":10304}
{"run":97,"commit":"05b156f","metric":3816,"metrics":{},"status":"keep","description":"Stayed on the honest `aspen-raft` slice and cleaned `crates/aspen-raft/src/write_batcher/batching.rs`: set/delete op sizing now uses checked byte-count helpers instead of raw `usize` addition/casts, batch-start timing goes through one explicit monotonic boundary helper, limit checks collapse into a pure `should_flush_before_enqueue` helper, and pending-byte accounting uses saturating math. Targeted `cargo check -p aspen-raft` stayed green and the cold repo-owned warning-site count dropped from 3823 to 3816 (-7).","timestamp":1776441347890,"segment":2,"confidence":3.4979647218453187,"iterationTokens":19989}
{"run":98,"commit":"de10299","metric":3811,"metrics":{},"status":"keep","description":"Kept the honest `aspen-raft` cleanup moving with `crates/aspen-raft/src/storage_shared/state_machine/delete.rs`: delete helpers now use explicit empty responses instead of external defaults, `Delete`/`DeleteMulti` boolean results use predicate-style names, and multi-delete limit checks convert `MAX_SETMULTI_KEYS` through a checked helper instead of raw platform-sized casts. Targeted `cargo check -p aspen-raft` stayed green and the cold repo-owned warning-site count dropped from 3816 to 3811 (-5).","timestamp":1776441508873,"segment":2,"confidence":3.574585635359116,"iterationTokens":6189}
{"run":99,"commit":"4140077","metric":3806,"metrics":{},"status":"keep","description":"Kept the honest `aspen-raft` cleanup moving with `crates/aspen-raft/src/storage_shared/state_machine/set.rs`: set/set-multi now take explicit input structs instead of swap-prone long parameter lists, multi-set bounds use checked helpers instead of raw `usize` casts, and success responses use explicit empty-response construction instead of external defaults. Updated dispatch/batch/transaction call sites to pass the new typed inputs. Targeted `cargo check -p aspen-raft` stayed green and the cold repo-owned warning-site count dropped from 3811 to 3806 (-5).","timestamp":1776441809773,"segment":2,"confidence":3.5540355677154585,"iterationTokens":12056}
{"run":100,"commit":"e657345","metric":3802,"metrics":{},"status":"keep","description":"Stayed on the honest `aspen-raft` slice and cleaned `crates/aspen-raft/src/storage_shared/kv.rs`: scan and TTL helpers now convert batch/result limits through checked `u32`→`usize` helpers, result vectors pre-reserve bounded capacity, and the scan limit local now uses a clearer `max_results` name instead of a quantity-ambiguous temporary. Targeted `cargo check -p aspen-raft` stayed green and the cold repo-owned warning-site count dropped from 3806 to 3802 (-4).","timestamp":1776441964084,"segment":2,"confidence":3.5311653116531163,"iterationTokens":6693}
{"run":101,"commit":"c3c3f0e","metric":3788,"metrics":{},"status":"keep","description":"Stayed on requested core/raft/coord focus and cleaned three honest `aspen-raft` hotspots together: `write_batcher/flush.rs` now uses checked batch counts, explicit monotonic timing, and explicit dropped-receiver logging; `write_batcher/command_conversion.rs` removes the aborting catch-all and bounds TTL/count math; `connection_pool/peer_connection.rs` adds explicit lock order docs, checked stream-capacity helpers, monotonic usage-time boundaries, and saturating active-stream counting. Targeted `cargo check -p aspen-raft` and crate-local Tiger Style stayed green, and the cold repo-owned warning-site count dropped from 3802 to 3788 (-14).","timestamp":1776442724265,"segment":2,"confidence":3.4521625163826997,"iterationTokens":6693,"asi":{"hypothesis":"A combined pass on nearby `aspen-raft` batching/peer-connection helpers should remove another real batch of mechanical Tiger Style warnings without touching verified modules or broad APIs.","lessons":"Bundling adjacent raft infrastructure files paid off: one staged `flush.rs` cleanup plus two new local passes produced a double-digit workspace drop. The next best ROI inside the requested slice likely sits in remaining non-verified raft/coordinator tails rather than Verus-mirrored `verified/*` modules.","next_action_hint":"Verify the auto-commit actually landed, then rescan only aspen-core/aspen-raft/aspen-coordination hotspots. Likely next targets: `aspen-raft/src/learner_promotion.rs`, `aspen-raft/src/storage_shared/{sm_trait,lease}.rs`, or a small `aspen-coordination` helper such as `queue/dequeue.rs`."}}
{"run":102,"commit":"c3c3f0e","metric":3780,"metrics":{},"status":"keep","description":"Kept the requested core/raft/coord focus on two more honest `aspen-raft` files: `learner_promotion.rs` now uses a clearer `NodeAlreadyVoter` error, documents lock order, and routes membership-change timestamps through one monotonic helper; `storage_shared/lease.rs` now bounds remaining-TTL conversion through checked helpers and reserves bounded lease vectors before growth. Targeted `cargo check -p aspen-raft` and crate-local Tiger Style stayed green, and the cold repo-owned warning-site count dropped from 3788 to 3780 (-8).","timestamp":1776442973009,"segment":2,"confidence":3.3629441624365484,"iterationTokens":31149,"asi":{"hypothesis":"A small follow-up pass on `learner_promotion.rs` and `storage_shared/lease.rs` should remove another batch of non-verified raft warnings without touching broader APIs.","lessons":"Late-loop raft infrastructure still has honest single-digit wins: naming/lock-order/time-boundary cleanup in learner promotion plus checked TTL/reservation helpers in lease storage produced a measurable workspace drop. The next ROI inside the requested slice likely comes from other non-verified tails like `storage_shared/sm_trait.rs`, `node/{cluster_controller,mod}.rs`, or a small coordination helper rather than the heavy `verified/*` files.","next_action_hint":"Verify commit reality again, then rescan aspen-core/aspen-raft/aspen-coordination hotspots. Prefer non-verified files with 3-5 warnings over the dense Verus-mirrored modules."}}
{"run":103,"commit":"c3c3f0e","metric":3776,"metrics":{},"status":"keep","description":"Stayed on the requested core/raft/coord slice and cleaned `crates/aspen-raft/src/storage_shared/sm_trait.rs`: snapshot-entry counts now use checked helpers instead of platform-size casts, snapshot integrity verification is spelled out in small early-return steps instead of a dense chained condition, and snapshot-installed broadcasts now handle dropped subscribers explicitly instead of discarding `send` results. Targeted `cargo check -p aspen-raft` and crate-local Tiger Style stayed green, and the cold repo-owned warning-site count dropped from 3780 to 3776 (-4).","timestamp":1776443259537,"segment":2,"confidence":3.3688212927756656,"iterationTokens":19690,"asi":{"hypothesis":"`storage_shared/sm_trait.rs` still had a compact mechanical warning cluster around checked snapshot counts, dense chained conditions, and discarded broadcast results; cleaning that file should produce another small real drop without touching verified modules.","lessons":"Even late in the loop, single-file non-verified raft cleanup keeps paying: `sm_trait.rs` went warning-free with helper extraction and explicit send handling. Remaining ROI in the requested slice likely comes from other 3-4 warning non-verified files or small coordination helpers, not the heavy `verified/*` backlog.","next_action_hint":"Verify commit reality again, then rescan aspen-core/aspen-raft/aspen-coordination hotspots. Good next bets: `node/cluster_controller.rs`, `queue/dequeue.rs`, or `semaphore.rs`."}}
{"run":104,"commit":"c3c3f0e","metric":3772,"metrics":{},"status":"keep","description":"Kept the requested core/raft/coord focus on `crates/aspen-raft/src/node/cluster_controller.rs`: initial-member map construction now collects directly instead of growing a `BTreeMap` in a loop, and all membership-operation timeout conversions now go through one checked `Duration -> u64` helper instead of unchecked `u128 -> u64` casts. Targeted `cargo check -p aspen-raft` and crate-local Tiger Style stayed green, and the cold repo-owned warning-site count dropped from 3776 to 3772 (-4).","timestamp":1776443468755,"segment":2,"confidence":3.3746835443037977,"iterationTokens":8665,"asi":{"hypothesis":"`node/cluster_controller.rs` still had a compact mechanical warning cluster around collection growth and timeout conversion casts; cleaning that file should yield another small real drop without broader API churn.","lessons":"Late-loop non-verified raft admin code still offers steady small wins when warnings are localized. Direct iterator collection plus one checked timeout helper removed the whole `cluster_controller.rs` tail cleanly.","next_action_hint":"Verify commit reality again, then decide between one small coordination pass (`queue/dequeue.rs` or `semaphore.rs`) and the next non-verified raft tail (`lib.rs`, `lease_cleanup.rs`, `node/health.rs`)."}}
{"run":105,"commit":"c3c3f0e","metric":3769,"metrics":{},"status":"keep","description":"Added one requested coordination pass on top of the raft batch: `crates/aspen-coordination/src/queue/dequeue.rs` now carries small dequeue/claim context structs instead of swap-prone wide helper signatures, and pending-group discovery pre-reserves bounded capacity from the scanned key list. Targeted `cargo check -p aspen-coordination` and crate-local Tiger Style stayed green, and the cold repo-owned warning-site count dropped from 3772 to 3769 (-3).","timestamp":1776443712113,"segment":2,"confidence":3.3610062893081762,"iterationTokens":10519,"asi":{"hypothesis":"A localized coordination cleanup in `queue/dequeue.rs` should remove its remaining wide-signature and bounded-growth warnings without changing dequeue semantics.","lessons":"Coordination still has cheap honest wins late in the loop: one local refactor removed the whole `queue/dequeue.rs` tail cleanly and widened the requested focus beyond raft. Remaining core/raft/coord ROI likely comes from similarly small non-verified files (`semaphore.rs`, `node/health.rs`, `lease_cleanup.rs`) before touching verified modules.","next_action_hint":"Verify commit reality again, then keep harvesting small non-verified core/raft/coord tails. `crates/aspen-coordination/src/semaphore.rs` and `crates/aspen-raft/src/{lease_cleanup,node/health,lib}.rs` are the obvious next candidates."}}
{"run":106,"commit":"c3c3f0e","metric":0,"metrics":{},"status":"crash","description":"Invalid cold-workspace benchmark: fresh target dir hit host disk exhaustion (`No space left on device` in `zstd-sys`/clang), so the wrapper printed a bogus zero-warning metric. No code-signal from this run.","timestamp":1776443978088,"segment":2,"confidence":3.3610062893081762,"iterationTokens":9054,"asi":{"hypothesis":"After the semaphore refactor, a fresh full-workspace Tiger Style benchmark should drop below 3769.","rollback_reason":"Benchmark environment failed with `No space left on device`, producing an unusable zero metric instead of a real workspace count.","next_action_hint":"Restore the staged patch if the crash path reverts it, clean old `/tmp/aspen-tigerstyle-target.*` artifacts, then rerun the same cold benchmark before making any keep/discard decision.","error_detail":"clang/zstd-sys failed while building into the fresh target dir under /tmp; parsed metric 0 is invalid and must not be kept."}}
{"run":107,"commit":"c3c3f0e","metric":3766,"metrics":{},"status":"keep","description":"Resumed from git log + autoresearch.jsonl because repo-local `autoresearch.md` is absent, then kept the requested core/raft/coord focus on `crates/aspen-coordination/src/semaphore.rs`: semaphore acquisition now carries a typed `SemaphoreAcquireRequest` instead of three swap-prone 6-arg helpers, and local tests now exercise the same request struct. After cleaning stale `/tmp/aspen-tigerstyle-target.*` artifacts and rerunning the cold workspace benchmark, the repo-owned warning-site count dropped from 3769 to 3766 (-3).","timestamp":1776444107272,"segment":2,"confidence":3.3475,"iterationTokens":4786,"asi":{"hypothesis":"A localized coordination cleanup in `semaphore.rs` should remove its remaining wide-signature warnings without changing semaphore semantics.","lessons":"Cold benchmark failures from disk pressure can fake a zero metric; clean stale target dirs and rerun rather than trusting that output. The actual semaphore refactor was still a real small win once measured on a healthy target dir.","next_action_hint":"Verify commit reality again, then keep harvesting small non-verified core/raft/coord tails. Best next candidates remain `aspen-raft/src/{lease_cleanup,node/health,lib}.rs` or a similar 3-4 warning coordination/helper file.","error_recovery":"One invalid run hit `No space left on device`; reran after cleaning /tmp and used only the successful measurement."}}
{"run":108,"commit":"c3c3f0e","metric":3762,"metrics":{},"status":"keep","description":"Kept the requested core/raft/coord loop moving with a small `crates/aspen-raft/src/lib.rs` pass: state-machine scan pagination now uses checked `u32 -> usize` conversion through one helper, and the local pagination temporaries were renamed away from quantity-heuristic hits while leaving scan semantics unchanged. Targeted `cargo check -p aspen-raft` and crate-local Tiger Style stayed green, and the cold repo-owned warning-site count dropped from 3766 to 3762 (-4).","timestamp":1776444369358,"segment":2,"confidence":3.3743718592964824,"iterationTokens":9458,"asi":{"hypothesis":"`aspen-raft/src/lib.rs` still had a small mechanical warning cluster around pagination variable naming and one platform-size cast; tightening that path should yield another real drop without API churn.","lessons":"Small root-module helpers in the requested slice still pay off late in the loop. Checked pagination conversion plus less ambiguous naming cleared the remaining `lib.rs` tail cleanly.","next_action_hint":"Verify commit reality again, then keep harvesting small non-verified core/raft/coord files. Best next bets are `aspen-raft/src/node/health.rs`, `aspen-raft/src/lease_cleanup.rs`, or another 2-3 warning helper before touching the large verified backlog."}}
{"run":109,"commit":"c3c3f0e","metric":3759,"metrics":{},"status":"keep","description":"Kept the requested core/raft/coord loop on another small non-verified raft tail: `crates/aspen-raft/src/node/health.rs` now uses a shutdown-bounded `while` monitor loop, a clearer timer name, and saturating failure-counter updates instead of unchecked atomic increment math. Targeted `cargo check -p aspen-raft` and crate-local Tiger Style stayed green, and the cold repo-owned warning-site count dropped from 3762 to 3759 (-3).","timestamp":1776444537291,"segment":2,"confidence":3.398989898989899,"iterationTokens":6527,"asi":{"hypothesis":"`node/health.rs` still had a small warning cluster around an intentionally long-lived monitor loop, quantity naming, and unchecked failure-counter increments; making the shutdown bound explicit should yield a real small drop without changing health semantics.","lessons":"Even daemon-style loops can be cleaned honestly without suppressions: making shutdown the visible loop bound satisfied Tiger Style and tightened semantics at the same time. Remaining ROI in the requested slice is still in the small non-verified files, not the heavy verified backlog.","next_action_hint":"Verify commit reality again, then keep harvesting core/raft/coord tails like `lease_cleanup.rs`, `server.rs`, or another 2-3 warning helper before considering verified-module work."}}
{"run":110,"commit":"c3c3f0e","metric":3755,"metrics":{},"status":"keep","description":"Kept the requested core/raft/coord loop on two more small non-verified raft tails: `node_failure_detection.rs` now uses a predicate-style tracked flag and an explicit monotonic timestamp helper for first-unreachable entries, while `node/membership_refresh.rs` routes debouncer timestamps through the same kind of monotonic helper and renames the update wait duration away from quantity-name lint hits. Targeted `cargo check -p aspen-raft` and crate-local Tiger Style stayed green, and the cold repo-owned warning-site count dropped from 3759 to 3755 (-4).","timestamp":1776444795006,"segment":2,"confidence":3.4482758620689653,"iterationTokens":16999,"asi":{"hypothesis":"A bundled pass on `node_failure_detection.rs` and `node/membership_refresh.rs` should remove their remaining naming/time-boundary warnings without changing peer-failure or address-refresh semantics.","lessons":"Small paired node-management files are still good late-loop ROI: two local monotonic-boundary/name cleanups produced another measurable drop with cheap validation. The next requested-slice wins are likely still in non-verified helpers (`lease_cleanup.rs`, `server.rs`, `registry/discovery.rs`) rather than the large verified modules.","next_action_hint":"Verify commit reality again, then keep harvesting 2-4 warning core/raft/coord files. Good next bets: `crates/aspen-coordination/src/registry/discovery.rs`, `crates/aspen-raft/src/lease_cleanup.rs`, or `crates/aspen-raft/src/server.rs`."}}
{"run":111,"commit":"c3c3f0e","metric":3753,"metrics":{},"status":"keep","description":"Extended the requested core/raft/coord pass into coordination discovery: `crates/aspen-coordination/src/registry/discovery.rs` now reserves bounded capacity for discovered instances/service-name sets and converts discovery limits through one checked helper instead of growing vectors opportunistically. Targeted `cargo check -p aspen-coordination` and crate-local Tiger Style stayed green, and the cold repo-owned warning-site count dropped from 3755 to 3753 (-2).","timestamp":1776444934299,"segment":2,"confidence":3.5025906735751295,"iterationTokens":2860,"asi":{"hypothesis":"A small capacity-bound cleanup in coordination service discovery should remove the remaining growth warnings without changing discovery semantics.","lessons":"Tiny coordination helpers still pay late in the loop when the warning class is mechanical. Reserving discovery/seen collections from the scanned-key count was enough to clear the file cleanly with cheap validation.","next_action_hint":"Verify commit reality again, then keep harvesting 2-3 warning core/raft/coord files such as `aspen-raft/src/lease_cleanup.rs`, `aspen-raft/src/server.rs`, or the next small coordination helper before considering heavier refactors."}}
