{"run":334,"commit":"8f012b9","metric":6,"metrics":{},"status":"checks_failed","description":"Refreshed the corrected non-test production Tiger Style workspace baseline after the RRULE keep. The broad summary-index parser now reports 6 remaining repo-owned non-test production locations, led by `crates/aspen-calendar/src/store.rs` (3) and `crates/aspen-contacts/src/vcard/serialize.rs` (2), with one more in `crates/aspen-calendar/src/ical/parse.rs` or `serialize.rs`.","timestamp":1776984646755,"segment":44,"confidence":null,"iterationTokens":567,"asi":{"hypothesis":"Refreshing the broad non-test production histogram after the RRULE keep will reveal the next honest small-file tails to finish.","rollback_reason":"Baseline-only measurement on the refreshed broad rail; no intended code changes for this cycle.","next_action_hint":"Take an explicit `aspen-calendar/src/store.rs` production slice next for the three visible sentinel-fallback sites, or quickly harvest the two-location contacts vCard serializer tail first if it looks cheaper."}}
{"type":"config","name":"Aspen calendar store production Tiger Style slice","metricName":"calendar_store_production_slice_findings","metricUnit":"","bestDirection":"lower"}
{"run":335,"commit":"8f012b9","metric":3,"metrics":{},"status":"checks_failed","description":"Baseline for the explicit aspen-calendar store production Tiger Style slice: `cargo test -p aspen-calendar --lib` stays green, and `crates/aspen-calendar/src/store.rs` currently has 3 non-test unique locations, all hidden sentinel fallbacks from `usize::try_from(...).unwrap_or(usize::MAX)` in list/search capacity setup and paginated scan preallocation.","timestamp":1776984690891,"segment":45,"confidence":null,"iterationTokens":474,"asi":{"hypothesis":"A narrow production-only `store.rs` slice will let us remove the remaining visible calendar-store sentinel fallbacks without touching tests.","rollback_reason":"Baseline-only measurement on a new explicit local slice; no intended code changes for this cycle.","next_action_hint":"Replace the three `unwrap_or(usize::MAX)` conversions with one explicit capacity helper returning `CalendarError` or a visible saturation branch, then rerun the slice."}}
{"run":336,"commit":"4622e3a","metric":0,"metrics":{},"status":"keep","description":"Finished the explicit aspen-calendar store production Tiger Style slice: list/search result capacities and paginated scan preallocation now use one explicit `u32`→`usize` saturation helper instead of hidden `unwrap_or(usize::MAX)` fallbacks. `cargo test -p aspen-calendar --lib` stayed green, and the fixed non-test `store.rs` slice dropped from 3 to 0 without touching tests.","timestamp":1776984772136,"segment":45,"confidence":null,"iterationTokens":474,"asi":{"hypothesis":"A tiny production-only `store.rs` pass replacing the three visible sentinel fallbacks with one explicit saturation helper should clear the whole slice cleanly.","lessons":"This was the expected small clean win: all remaining `store.rs` production findings were the same fallback pattern, so one helper removed the tail without semantic churn. Late-stage explicit slices are still worth doing when the remaining lines are mechanically uniform and locally testable.","next_action_hint":"Verify the keep advanced HEAD, then refresh the broad non-test production workspace baseline. The next honest tails should now be `aspen-contacts/src/vcard/serialize.rs` and a single remaining calendar parser/serializer line."}}
{"type":"config","name":"Aspen Tiger Style cleanup (non-test production workspace summary-index)","metricName":"non_test_production_tigerstyle_findings","metricUnit":"","bestDirection":"lower"}
{"run":337,"commit":"4622e3a","metric":3,"metrics":{},"status":"checks_failed","description":"Refreshed the corrected non-test production Tiger Style workspace baseline after the calendar-store keep. The broad summary-index parser now reports 3 remaining repo-owned non-test production locations, concentrated in `crates/aspen-contacts/src/vcard/serialize.rs` (2) plus one final calendar parser/serializer location in `crates/aspen-calendar/src/ical/parse.rs` or `serialize.rs`.","timestamp":1776984863620,"segment":46,"confidence":null,"iterationTokens":555,"asi":{"hypothesis":"Refreshing the broad non-test production histogram after the calendar-store keep will reveal the last small production tails to finish.","rollback_reason":"Baseline-only measurement on the refreshed broad rail; no intended code changes for this cycle.","next_action_hint":"Take the explicit `aspen-contacts/src/vcard/serialize.rs` production slice next because it is the densest remaining tail, then finish the last single-location calendar parser/serializer file."}}
{"type":"config","name":"Aspen contacts vCard serialize production Tiger Style slice","metricName":"contacts_vcard_serialize_slice_findings","metricUnit":"","bestDirection":"lower"}
{"run":338,"commit":"4622e3a","metric":1,"metrics":{},"status":"checks_failed","description":"Baseline for the explicit aspen-contacts vCard serialize production Tiger Style slice: `cargo test -p aspen-contacts --lib` stays green, and `crates/aspen-contacts/src/vcard/serialize.rs` currently has one non-test unique location where `serialize_vcard` is still overlong and assertion-light.","timestamp":1776984913065,"segment":47,"confidence":null,"iterationTokens":488,"asi":{"hypothesis":"A tiny production-only serializer slice will let us clear the last visible `serialize.rs` location by splitting `serialize_vcard` into smaller pure helpers with explicit invariants.","rollback_reason":"Baseline-only measurement on a new explicit local slice; no intended code changes for this cycle.","next_action_hint":"Extract the repeated email/phone/address/optional-field formatting into small pure helpers, replace the magic line-capacity literal with named constants, and add a couple of real serializer invariants before rerunning the slice."}}
{"run":339,"commit":"77bff4a","metric":0,"metrics":{},"status":"keep","description":"Finished the explicit aspen-contacts vCard serialize production Tiger Style slice: `serialize_vcard` now delegates email/phone/address/optional/custom-field formatting to small pure helpers, uses named vCard constants instead of magic literals, and asserts basic serializer invariants before joining lines. `cargo test -p aspen-contacts --lib` stayed green, and the fixed non-test `serialize.rs` slice dropped from 1 to 0.","timestamp":1776984981828,"segment":47,"confidence":null,"iterationTokens":3579,"asi":{"hypothesis":"Splitting the remaining overlong `serialize_vcard` function into small pure helpers with named constants and a few local invariants should clear the last visible production line in `serialize.rs`.","lessons":"This was a straightforward Tiger Style tail: once the serializer was decomposed into small helpers, both the length and assertion-density warnings disappeared together without touching tests. Named string/capacity constants are also a good way to remove late-stage magic literals while keeping pure formatting logic easy to read.","next_action_hint":"Verify the keep advanced HEAD, then refresh the broad non-test production baseline. After this, only the final calendar parser/serializer single-location tails should remain."}}
{"type":"config","name":"Aspen Tiger Style cleanup (non-test production workspace summary-index)","metricName":"non_test_production_tigerstyle_findings","metricUnit":"","bestDirection":"lower"}
{"run":340,"commit":"77bff4a","metric":2,"metrics":{},"status":"checks_failed","description":"Refreshed the corrected non-test production Tiger Style workspace baseline after the contacts serializer keep. The broad summary-index parser now reports 2 remaining repo-owned non-test production locations: one in `crates/aspen-calendar/src/ical/parse.rs` and one in `crates/aspen-calendar/src/ical/serialize.rs`.","timestamp":1776985062043,"segment":48,"confidence":null,"iterationTokens":555,"asi":{"hypothesis":"Refreshing the broad non-test production histogram after the contacts serializer keep will isolate the final two small calendar tails.","rollback_reason":"Baseline-only measurement on the refreshed broad rail; no intended code changes for this cycle.","next_action_hint":"Take the explicit `aspen-calendar` parser/serializer slices next; both remaining locations are tiny and should be finishable without touching tests."}}
{"type":"config","name":"Aspen calendar parse and serialize production Tiger Style slice","metricName":"calendar_parse_serialize_slice_findings","metricUnit":"","bestDirection":"lower"}
{"run":341,"commit":"77bff4a","metric":0,"metrics":{},"status":"crash","description":"Baseline wrapper for the explicit calendar parse+serialize slice was malformed: the double-quoted `bash -lc` command let inner Python string quotes terminate the shell string before cargo ran, so this cycle measured nothing useful.","timestamp":1776985139802,"segment":49,"confidence":null,"iterationTokens":549,"asi":{"hypothesis":"A single explicit slice covering the last two calendar production locations will give a stable finish rail for the remaining parser/serializer tails.","rollback_reason":"Benchmark command was malformed by shell quoting, so cargo never ran and the metric is invalid.","next_action_hint":"Rerun the same baseline with quote-safe Python strings inside the heredoc, then fix the two remaining sentinel-fallback conversions if the slice still shows 2.","error_detail":"`bash -c` failed near the Python line building `rel = f\"crates/aspen-calendar/src/ical/{...}.rs\"` before starting cargo."}}
{"run":342,"commit":"77bff4a","metric":0,"metrics":{},"status":"crash","description":"Second baseline wrapper attempt for the explicit calendar parse+serialize slice still measured nothing useful: the Python post-processor survived shell parsing this time, but the embedded f-string expression lost the literal group name and crashed with `NameError` after cargo finished.","timestamp":1776985163173,"segment":49,"confidence":null,"iterationTokens":1045,"asi":{"hypothesis":"A single explicit slice covering the last two calendar production locations is still the right stable rail for the remaining parser/serializer tails.","rollback_reason":"The benchmark post-processor crashed before emitting a valid metric, so this cycle is unusable.","next_action_hint":"Rerun with plain string concatenation instead of an f-string expression inside the Python parser, then proceed with the two-line cleanup if the slice is still at 2.","error_detail":"Python raised `NameError: name 'file' is not defined` while building the repo-relative path from the regex match."}}
{"run":343,"commit":"77bff4a","metric":2,"metrics":{},"status":"checks_failed","description":"Baseline for the explicit calendar parse+serialize production Tiger Style slice: `cargo test -p aspen-calendar --lib` stays green, and the slice currently has 2 non-test unique locations—one hidden `u64::try_from(...).unwrap_or(u64::MAX)` fallback in `ical/parse.rs` and one hidden `u32::try_from(...).unwrap_or(u32::MAX)` fallback in `ical/serialize.rs`.","timestamp":1776985182042,"segment":49,"confidence":null,"iterationTokens":1205,"asi":{"hypothesis":"A combined explicit slice over the final calendar parser/serializer tails will let us finish the last two remaining production findings together.","rollback_reason":"Baseline-only measurement on a new explicit local slice; no intended code changes for this cycle.","next_action_hint":"Replace both hidden fallback conversions with explicit saturation helpers or visible `match` branches, then rerun the slice."}}
{"run":344,"commit":"6f0a340","metric":0,"metrics":{},"status":"keep","description":"Finished the explicit calendar parse+serialize production Tiger Style slice: the final hidden `u64::try_from(...).unwrap_or(u64::MAX)` and `u32::try_from(...).unwrap_or(u32::MAX)` fallbacks in `ical/parse.rs` and `ical/serialize.rs` now use explicit saturation helpers with visible `match` branches. `cargo test -p aspen-calendar --lib` stayed green, and the fixed slice dropped from 2 to 0.","timestamp":1776985231421,"segment":49,"confidence":null,"iterationTokens":3872,"asi":{"hypothesis":"Replacing the last two hidden integer-conversion fallbacks in calendar parser/serializer helpers with explicit saturation branches should clear the slice completely without semantic churn.","lessons":"The remaining calendar tail really was just two mechanical sentinel-fallback sites. At this point the non-test production workspace rail should be at or near zero, so the next step is to refresh the broad baseline rather than guessing that the repo is clean.","next_action_hint":"Verify the keep advanced HEAD, then rerun the broad non-test production workspace summary-index baseline to confirm whether repo-owned Tiger Style production findings are now zero."}}
{"type":"config","name":"Aspen Tiger Style cleanup (non-test production workspace summary-index)","metricName":"non_test_production_tigerstyle_findings","metricUnit":"","bestDirection":"lower"}
{"run":345,"commit":"7dc17a1","metric":0,"metrics":{},"status":"keep","description":"Refreshed the corrected non-test production Tiger Style workspace baseline after the final calendar parser/serializer keeps, and the repo-owned non-test production rail is now clean: the summary-index parser reports 0 remaining locations under `crates/`, `src/`, or `build.rs`. The command still exits non-zero in this shell because `/etc/bash_logout` trips an unrelated unbound-variable error after cargo finishes, but the parsed Tiger Style metric itself is zero.","timestamp":1776985345549,"segment":50,"confidence":null,"iterationTokens":555,"asi":{"hypothesis":"After clearing the last visible calendar parser/serializer tails, the broad non-test production Tiger Style rail should hit zero.","lessons":"The Aspen-owned non-test production Tiger Style frontier is now exhausted on this branch. In this environment, broad benchmark wrappers may still exit 1 after successful cargo runs because `/etc/bash_logout` references an unset variable; trust the parsed metric and cargo log content rather than the final shell status alone.","next_action_hint":"Start a new experiment segment only if you want a broader target than Aspen-owned non-test production—for example the remaining full-workspace vendored Tiger Style tail. Do not pivot to test-only cleanup without explicit user direction."}}
{"type":"config","name":"Aspen full-workspace Tiger Style cleanup (summary-index)","metricName":"workspace_tigerstyle_findings","metricUnit":"","bestDirection":"lower"}
{"run":346,"commit":"7dc17a1","metric":507,"metrics":{},"status":"checks_failed","description":"Rebased onto a broader full-workspace Tiger Style rail after Aspen-owned non-test production reached zero. The current summary-index baseline is 507 unique non-test findings, dominated by vendored `openraft/openraft` sources such as `src/lib.rs`, `src/core/raft_core.rs`, and other engine/testing modules.","timestamp":1776985433279,"segment":51,"confidence":null,"iterationTokens":509,"asi":{"hypothesis":"Once Aspen-owned non-test production cleanup reaches zero, the next honest frontier is the remaining full-workspace vendored Tiger Style tail.","rollback_reason":"Baseline-only measurement on a newly broadened target; no intended code changes for this cycle.","next_action_hint":"Do not attack the 507-finding workspace rail blindly. Establish an explicit smaller vendored slice next—likely a single dense `openraft` file or one repeated warning family—before attempting another keep."}}
{"type":"config","name":"Openraft histogram production Tiger Style slice","metricName":"openraft_histogram_slice_findings","metricUnit":"","bestDirection":"lower"}
{"run":347,"commit":"7dc17a1","metric":11,"metrics":{},"status":"checks_failed","description":"Baseline for the explicit openraft histogram production Tiger Style slice: `cargo check -p openraft` stays green, and `openraft/openraft/src/base/histogram/histogram.rs` currently has 11 non-test unique locations covering raw arithmetic in bucket constants/math, unchecked division/modulo in group splitting, platform-dependent casts, and quantity-style local naming around bucket offsets.","timestamp":1776985633225,"segment":52,"confidence":null,"iterationTokens":480,"asi":{"hypothesis":"A focused production-only histogram slice is a tractable first vendored target after Aspen-owned non-test production reaches zero.","rollback_reason":"Baseline-only measurement on a new explicit vendor-local slice; no intended code changes for this cycle.","next_action_hint":"Replace the raw `- 1`/`66 - WIDTH`/`i - 4` arithmetic with named constants or saturating helpers, guard group split division explicitly, replace `as` casts with checked helpers, and rename offset locals to unit-bearing slot/index names before rerunning the slice."}}
{"run":348,"commit":"7dc17a1","metric":0,"metrics":{},"status":"crash","description":"The openraft histogram rerun produced a misleading slice metric because the post-processor matched any `histogram.rs:<line>` occurrence, including non-Tiger-Style diagnostics like a dead-code warning on `U64_BUCKET_GROUP_COUNT`. The real remaining tail is still the new helper at lines 190/195/196 (`ambiguous_params` plus unchecked division), so this cycle is not a trustworthy improvement yet.","timestamp":1776985837577,"segment":52,"confidence":null,"iterationTokens":2202,"asi":{"hypothesis":"The histogram slice should continue shrinking if the initial arithmetic/cast cleanup is followed by a small helper refactor.","rollback_reason":"Benchmark parser was too loose and counted non-Tiger-Style diagnostics, so the reported metric is invalid.","next_action_hint":"Tighten the parser to count only `F...` summary lines, inline the helper around `Histogram::GROUP_SIZE` to remove `ambiguous_params`, and rerun the explicit histogram slice before deciding keep/discard.","error_detail":"The parser counted `openraft/openraft/src/base/histogram/histogram.rs:44` from a non-F `dead_code` warning, while actual Tiger Style output still reported lines 190/195/196."}}
{"run":349,"commit":"ab97c5a","metric":0,"metrics":{},"status":"keep","description":"Finished the explicit openraft histogram production Tiger Style slice: histogram bucketing now uses named bucket constants, saturating conversion helpers, and a small `bucket_min_value_for_index()` core instead of raw `- 1`/`66 - WIDTH` arithmetic, `as` casts, and direct division/modulo on inline expressions. `cargo check -p openraft` stayed green, and the fixed non-test `histogram.rs` slice dropped from 11 to 0.","timestamp":1776985928150,"segment":52,"confidence":null,"iterationTokens":7369,"asi":{"hypothesis":"Refactoring the histogram bucket math into named constants plus tiny saturation helpers would clear the whole production tail without changing bucketing semantics.","lessons":"Vendored cleanup is tractable when the warning cluster is locally mechanical and the slice parser is strict about counting only `F...` summary lines. The histogram file was a good first openraft target because one compact refactor removed raw arithmetic, cast, division, and naming warnings together without touching tests.","next_action_hint":"Verify the keep advanced HEAD, then rebaseline the full-workspace Tiger Style rail to see how much of the 507-finding vendored frontier remains and pick the next highest-ROI openraft file from the updated unique-per-file histogram."}}
{"type":"config","name":"Aspen full-workspace Tiger Style cleanup (summary-index)","metricName":"workspace_tigerstyle_findings","metricUnit":"","bestDirection":"lower"}
{"run":350,"commit":"65d1d46","metric":498,"metrics":{},"status":"keep","description":"Rebased the broad full-workspace Tiger Style rail after the vendored histogram keep. The summary-index metric dropped from 507 to 498, confirming the openraft histogram slice removed real workspace-visible findings. The remaining frontier is still dominated by vendored `openraft/openraft`, especially `src/lib.rs`, `src/core/raft_core.rs`, `src/testing/runtime/mod.rs`, and several engine/raft modules.","timestamp":1776986015888,"segment":53,"confidence":null,"iterationTokens":509,"asi":{"hypothesis":"After cleaning one vendored openraft hotspot, the broad full-workspace rail should show a measurable drop and a clearer next-file ranking.","lessons":"The vendored histogram cleanup was broad-metric-real, not just slice-local. For the full-workspace rail, `top_files` counts repeated lint hits rather than unique `(path,line)` locations, so use it as a hotspot heuristic and confirm with a unique-per-file breakdown before choosing the next slice.","next_action_hint":"Compute an updated unique-per-file histogram for the full workspace, then choose the next tractable openraft file—likely a smaller mechanical slice such as `openraft/openraft/src/lib.rs` or `openraft/openraft/src/config/config.rs` before attacking `raft_core.rs`."}}
{"type":"config","name":"Openraft lib macro Tiger Style slice","metricName":"openraft_lib_macro_slice_findings","metricUnit":"","bestDirection":"lower"}
