{"run":67,"commit":"be1ccb6","metric":4198,"metrics":{},"status":"keep","description":"Cleaned `crates/aspen-testing-madsim/src/madsim_tester/network.rs` by switching public node indexes to `u32`, routing node-id math through checked helpers, and updating `fault_injection.rs` call sites to use bounded conversions. The targeted madsim crate stays green, and the cold repo-owned Tiger Style count dropped from 4241 to 4198 (-43).","timestamp":1776397139746,"segment":2,"confidence":3.556862745098039,"iterationTokens":20658,"asi":{"hypothesis":"`madsim_tester/network.rs` is a dense low-risk hotspot dominated by public `usize` APIs and unchecked node-id arithmetic, so moving to fixed-width node indexes plus checked helpers should remove a large warning cluster without changing simulation behavior.","lessons":"This file was an excellent yield target: one focused API/arithmetics pass cleared the entire `network.rs` warning list and also removed a few `fault_injection.rs` conversion warnings. Benchmark wrapper still needs `head`/SIGPIPE-safe reporting even when the parsed metric is valid.","next_action_hint":"Commit this kept madsim slice, then either keep harvesting `aspen-testing-madsim` in `cluster_ops.rs`/`fault_injection.rs` or pivot to other dense files from the fresh histogram like `aspen-forge-web/src/{templates,routes}.rs`.","measurement_note":"run_experiment exited 141 because the final top-files report piped into `head`, but the metric was emitted before that SIGPIPE and matches the parsed value."}}
{"run":68,"commit":"5f88064","metric":4171,"metrics":{},"status":"keep","description":"Cleaned `crates/aspen-testing-madsim/src/madsim_tester/fault_injection.rs` without benchmark cheating: centralized checked node-id/seed helpers, removed modulo/overflow-prone index math across BUGGIFY network-delay/drop/slow-storage paths, isolated loop timing behind a monotonic helper, and replaced discarded snapshot/probability-lock results with explicit handling. Targeted `cargo check -p aspen-testing-madsim` stayed green, the file's local Tiger Style warnings dropped to zero, and the cold repo-owned warning-site count fell from 4198 to 4171 (-27).","timestamp":1776397556253,"segment":2,"confidence":3.669941060903733,"iterationTokens":36990,"asi":{"hypothesis":"`fault_injection.rs` still held a dense low-risk cluster of Tiger Style warnings around unchecked node-id arithmetic, zero-unsafe modulo, direct monotonic clock reads, and panic-prone mutex handling; shared checked helpers should remove that cluster without changing BUGGIFY semantics.","lessons":"The BUGGIFY file was another good madsim target: one helper pass cleared all file-local Tiger Style warnings and improved the workspace metric materially. A Python-based top-file summary avoids the earlier SIGPIPE benchmark failure and keeps the measurement honest.","next_action_hint":"Stay in `aspen-testing-madsim` for another pass, likely `cluster_ops.rs`, or pivot to the equally dense non-madsim hotspots `crates/aspen-forge-web/src/{templates,routes}.rs` if the remaining cluster-ops fixes look too structural.","measurement_note":"Cold benchmark used a fresh target dir plus post-run file parsing, so the 4171 count is comparable with the prior 4198 baseline."}}
{"run":69,"commit":"283314b","metric":4148,"metrics":{},"status":"keep","description":"Took a bounded `crates/aspen-testing-madsim/src/madsim_tester/cluster_ops.rs` cleanup slice: centralized checked node-id/slot/backoff helpers, removed unchecked leader/membership index math, stopped silently discarding crash-time shutdown errors, bounded log-sync collection growth, and routed election/snapshot/metrics node lookup through checked conversions without changing madsim semantics. Targeted `cargo check -p aspen-testing-madsim` stayed green, cluster-ops warnings fell from 34 to 11 local findings, and the cold repo-owned warning-site count dropped from 4171 to 4148 (-23).","timestamp":1776398032255,"segment":2,"confidence":3.767716535433071,"iterationTokens":25109,"asi":{"hypothesis":"`cluster_ops.rs` still had a large low-risk warning slice around unchecked NodeId/index conversions, modulo backoff math, direct monotonic timing, and silent error drops; helper-based cleanup should remove a double-digit batch without forcing broad API churn.","lessons":"Staying in `aspen-testing-madsim` kept velocity high: the cluster-ops helper pass removed most non-API warnings while leaving the harder public-`usize` and restart-path `expect` issues isolated. The refreshed workspace top histogram now cleanly shifts focus to non-madsim hotspots like `aspen-forge-web`, `aspen-jobs-worker-blob`, `aspen-blob`, and `aspen-castore`.","next_action_hint":"Pivot to the next dense easy hotspot outside madsim—likely `crates/aspen-castore/src/server.rs` for discarded-result/loop-bound cleanup or `crates/aspen-forge-web/src/{routes,templates}.rs` for swap-prone parameter structs and bounded collection growth—rather than grinding the remaining structural cluster-ops API warnings.","measurement_note":"Used the same fresh-target-dir, post-run parsed benchmark wrapper as the prior run, so 4148 is directly comparable to the 4171 baseline."}}
{"run":70,"commit":"166b23d","metric":4130,"metrics":{},"status":"keep","description":"Cleaned a real `crates/aspen-castore/src/server.rs` slice: renamed backpressure/response booleans to predicate-style names, replaced many silently discarded response sends with explicit receiver-drop handling, converted irpc frame-size parsing to checked `u64`→`usize` conversion, and clarified byte-sized tracing fields without changing castore protocol behavior. Targeted `cargo check -p aspen-castore` stayed green, castore-server warnings fell from 27 to 9 local findings, and the cold repo-owned warning-site count dropped from 4148 to 4130 (-18).","timestamp":1776398476188,"segment":2,"confidence":3.7937743190661477,"iterationTokens":29510,"asi":{"hypothesis":"`aspen-castore/src/server.rs` still had a dense low-risk cluster of Tiger Style warnings around discarded send results, ambiguous boolean names, and unchecked frame-size conversion; handling those explicitly should reduce the workspace metric without overfitting or changing protocol semantics.","lessons":"Castore was a good non-madsim pivot: explicit receiver-drop handling removed a large local warning cluster quickly, while the remaining castore warnings are mostly structural async-loop/assertion-density issues. The workspace top histogram remains stable after the run, so the benchmark looks trustworthy.","next_action_hint":"Pivot to the next dense non-structural hotspot, likely `crates/aspen-forge-web/src/routes.rs` for swap-prone `&str` parameter groups and bounded collection growth, or `crates/aspen-jobs-worker-blob/src/lib.rs` / `crates/aspen-blob/src/store/iroh_store.rs` if they show similarly mechanical safety warnings.","measurement_note":"Fresh-target-dir full-workspace benchmark with parsed repo-owned warning sites matched prior methodology, so 4130 is directly comparable to the 4148 baseline."}}
{"run":71,"commit":"98bcc0f","metric":4098,"metrics":{},"status":"keep","description":"Cleaned `crates/aspen-jobs-worker-blob/src/lib.rs`: isolated monotonic timing behind one helper, replaced unchecked JPEG/PNG parsing with checked helpers plus explicit content-type detection helpers, renamed byte-sized locals, and removed the crate's remaining local Tiger Style warnings. Targeted `cargo check -p aspen-jobs-worker-blob` and crate-local Tiger Style stayed green, and the cold repo-owned warning-site count dropped from 4130 to 4098 (-32).","timestamp":1776399514865,"segment":2,"confidence":3.9182879377431905,"iterationTokens":29510,"asi":{"hypothesis":"`aspen-jobs-worker-blob/src/lib.rs` still had a dense mechanical warning cluster around ambient clock reads, unchecked image-header parsing, assertion density, and byte-count naming; helper-based cleanup should remove that cluster without changing worker behavior.","lessons":"Blob worker was a real hotspot: once the timing boundary and header parsing were split into checked helpers, the crate-local Tiger Style run went clean and the full cold workspace dropped by 32 warning sites. Assertion-density lint on the JPEG scanner needed meaningful debug assertions about segment bounds/lengths, not just smaller helper extraction.","next_action_hint":"Refresh the cold histogram and pivot to the next dense non-structural hotspot, likely `crates/aspen-forge-web/src/{routes,templates}.rs`, `crates/aspen-blob/src/store/iroh_store.rs`, or leftover `aspen-core-essentials-handler` catch-all matches.","measurement_note":"Cold benchmark used a fresh target dir plus repo-owned `warning:` line parsing from the captured cargo-tigerstyle log, matching the prior methodology."}}
{"run":72,"commit":"98bcc0f","metric":4084,"metrics":{},"status":"keep","description":"Trimmed a real `aspen-forge-handler` federation slice on top of the uncommitted blob-worker cleanup: fetch-refs and mirror helpers now use explicit target/origin structs instead of swap-prone string lists, mirror metadata writes use checked wall-clock helpers plus explicit error handling, federation fetch totals use saturating arithmetic, and the local ref-parse path now reserves bounded vectors. Targeted `cargo check -p aspen-forge-handler` stayed green, local federation warnings fell from 27 to 13, and the cold repo-owned Tiger Style warning-site count dropped from 4098 to 4084 (-14).","timestamp":1776400294916,"segment":2,"confidence":3.6792792792792794,"iterationTokens":65887,"asi":{"hypothesis":"`crates/aspen-forge-handler/src/handler/handlers/federation.rs` still had an honest cluster of Tiger Style warnings around swap-prone same-type params, too-many-arg helper signatures, silent write failures, direct wall-clock reads, unchecked total arithmetic, and unbounded vector growth; replacing those with small target/origin structs and explicit helpers should cut the cluster without changing federation behavior.","lessons":"The fetch/mirror helper slice was real signal: local federation warnings dropped sharply once `FetchRefsTarget`/`MirrorOrigin` carried the peer/fed-id/origin fields, and explicit mirror write/timestamp handling removed several mechanical warnings at once. Remaining `aspen-forge-handler` warnings are now mostly structural long-function/assertion-density items plus executor `unreachable!` sites, so next pass should either attack those deliberately or pivot to another cheap hotspot.","next_action_hint":"Either finish the low-hanging `aspen-forge-handler` tail by collapsing `handle_federation_pull{,_remote}` params into request/runtime structs and replacing executor `unreachable!` arms, or hop to `aspen-core-essentials-handler/src/core.rs` and `aspen-rpc-handlers/src/client.rs` for the small fresh histogram tail.","measurement_note":"Cold benchmark used the same fresh-target-dir wrapper and repo-owned `warning:` line parsing as the prior 4098 baseline, so 4084 is directly comparable."}}
{"run":73,"commit":"98bcc0f","metric":4070,"metrics":{},"status":"keep","description":"Kept pushing the same honest `aspen-forge-handler` slice: `executor.rs` now routes unexpected sub-family requests through a typed `UNEXPECTED_REQUEST_KIND` error helper instead of `unreachable!`, while the earlier federation helper struct/time/error-handling cleanup stays in place. Targeted `cargo check -p aspen-forge-handler` stayed green, local forge-handler warnings dropped from 39 to 25, and the cold repo-owned Tiger Style warning-site count fell from 4084 to 4070 (-14).","timestamp":1776400476834,"segment":2,"confidence":3.6443661971830985,"iterationTokens":11672,"asi":{"hypothesis":"The next cheap `aspen-forge-handler` win is the executor dispatch tail: replacing `unreachable!` fallback arms with explicit error responses should remove a double-digit batch of real Tiger Style warnings without changing successful request handling.","lessons":"Executor dispatch cleanup paid off immediately: the warning-visible `unreachable!` cluster disappeared and the forge-handler crate warning count fell again without touching the happy path. Remaining forge-handler findings are now mostly assertion-density/length/refactor work plus a few conversion/naming/default issues in `executor.rs` and pull handlers.","next_action_hint":"Stay in forge-handler only if a few more cheap mechanical fixes remain (`limit`/`offset` casts, explicit defaults, pull request structs). Otherwise pivot to fresh small tails in `aspen-core-essentials-handler/src/core.rs` or `aspen-rpc-handlers/src/client.rs`.","measurement_note":"Measured with the same fresh-target-dir full-workspace cargo-tigerstyle wrapper and repo-owned `warning:` line parser as the 4084 baseline, so 4070 is directly comparable."}}
{"run":74,"commit":"98bcc0f","metric":4060,"metrics":{},"status":"keep","description":"Finished the remaining cheap `aspen-forge-handler/executor.rs` mechanics on top of the earlier forge/blob cleanup: log and repo listing now use checked `u32`→`usize` pagination helpers with unit-safe names, diff helpers use predicate-style content flags, patch counts use bounded conversions plus invariants, and merge checks now spell out `GitMergeStrategy::MergeCommit` instead of implicit default. Targeted `cargo check -p aspen-forge-handler` stayed green, local forge-handler warnings dropped from 25 to 15, and the cold repo-owned Tiger Style warning-site count fell from 4070 to 4060 (-10).","timestamp":1776400851160,"segment":2,"confidence":3.7254901960784315,"iterationTokens":18107,"asi":{"hypothesis":"After the executor `unreachable!` cleanup, the next cheap forge-handler wins are the remaining mechanical executor warnings: unchecked pagination casts, ambiguous quantity names, implicit defaults, and a small assertion-density helper. Cleaning those should shave another batch without changing forge behavior.","lessons":"The forge-handler executor tail was still worth harvesting: one pass collapsed nearly all remaining executor-local warnings, leaving only the constructor arity and one conditional-nesting path. Checked conversion helpers plus predicate-style names continue to be honest high-yield Tiger Style work.","next_action_hint":"Forge-handler is near diminishing returns. Either finish the last two executor warnings plus `handle_federation_pull{,_remote}` structural warnings, or pivot to the fresh workspace tail in `aspen-core-essentials-handler/src/core.rs` and `aspen-rpc-handlers/src/client.rs`.","measurement_note":"Measured with the same fresh-target-dir full-workspace cargo-tigerstyle wrapper and repo-owned `warning:` parser as the 4070 baseline, so 4060 is directly comparable."}}
{"run":75,"commit":"98bcc0f","metric":4055,"metrics":{},"status":"keep","description":"Squeezed another honest forge-handler slice out of federation pull flow: `handle_federation_pull` now takes explicit request/runtime structs, mirror lookup and repo-id parsing moved into helpers, and remote-pull validation/errors are centralized instead of repeating wide argument lists. Targeted `cargo check -p aspen-forge-handler` stayed green, local forge-handler warnings dropped from 15 to 10, and the cold repo-owned Tiger Style warning-site count fell from 4060 to 4055 (-5).","timestamp":1776401211272,"segment":2,"confidence":3.633217993079585,"iterationTokens":17070,"asi":{"hypothesis":"Even after the executor and fetch/mirror helper cleanup, the federation pull path still carried a few mechanical Tiger Style warnings around wide parameter lists and repeated mirror/error parsing. Request/runtime structs plus small helper extraction should remove that tail without changing pull behavior.","lessons":"The pull-path refactor was smaller but real: centralizing mirror metadata lookup and repo-id parsing removed the remaining arity warnings cleanly, and forge-handler is now down to 10 local warnings. At this point the crate is mostly long-function/assertion-density work plus one executor conditional, so the next best ROI may be outside forge-handler.","next_action_hint":"Pivot soon unless one last cheap forge-handler warning is obvious. Fresh top tail still points at `aspen-core-essentials-handler/src/core.rs` and `aspen-rpc-handlers/src/client.rs`, with small but likely easy wins there.","measurement_note":"Measured with the same fresh-target-dir full-workspace cargo-tigerstyle wrapper and repo-owned `warning:` parser as the 4060 baseline, so 4055 is directly comparable."}}
{"run":76,"commit":"98bcc0f","metric":4053,"metrics":{},"status":"keep","description":"Finished the last cheap executor cleanup in `aspen-forge-handler`: constructor dependencies now travel through a small `ForgeServiceExecutorDeps` struct instead of a long argument list, and `NostrGetProfile` now parses/filters profile events in clear steps instead of one chained condition. Targeted `cargo check -p aspen-forge-handler` and crate-local Tiger Style stayed green, local forge-handler warnings dropped from 10 to 8, and the cold repo-owned Tiger Style warning-site count fell from 4055 to 4053 (-2).","timestamp":1776401612004,"segment":2,"confidence":3.633851468048359,"iterationTokens":17694,"asi":{"hypothesis":"There were still two easy executor warnings left after the earlier forge-handler passes: constructor arity and one overly dense Nostr profile condition. A tiny config struct plus stepwise event parsing should eliminate that tail without changing runtime behavior.","lessons":"Forge-handler executor is effectively harvested now: after this pass the crate-local Tiger Style run only reports the heavier federation assertion-density/length leftovers. Tiny endgame cleanups still move the global metric, but ROI is dropping versus the next crate-level hotspot.","next_action_hint":"Pivot away from forge-handler. Fresh benchmark tail still points at `aspen-core-essentials-handler/src/core.rs` and `aspen-rpc-handlers/src/client.rs`; the client file has only three warnings and may be the quickest next batch.","measurement_note":"Measured with the same fresh-target-dir full-workspace cargo-tigerstyle wrapper and repo-owned `warning:` parser as the 4055 baseline, so 4053 is directly comparable."}}
{"run":77,"commit":"98bcc0f","metric":4048,"metrics":{},"status":"keep","description":"Pivoted away from forge-handler for a quick `aspen-core-essentials-handler` pass: added real invariants to health/raft-metrics/metrics/trace-scan/metric-aggregation helpers so the low-risk core observability paths no longer rely on implicit assumptions. Targeted `cargo check -p aspen-core-essentials-handler` stayed green, local `core.rs` warnings dropped from 13 to 8, and the cold repo-owned Tiger Style warning-site count fell from 4053 to 4048 (-5).","timestamp":1776401862250,"segment":2,"confidence":3.558922558922559,"iterationTokens":10837,"asi":{"hypothesis":"The fresh tail in `crates/aspen-core-essentials-handler/src/core.rs` was mostly assertion-density on short observability helpers, so adding meaningful invariants there should shave several workspace warnings without changing handler behavior.","lessons":"Small observability helpers are good assertion-density cleanup targets: a handful of real postconditions and bound checks removed five warnings quickly while keeping the crate green. The remaining core.rs tail is now mostly alert-path assertion-density plus one catch-all request match.","next_action_hint":"Next cheap targets are likely the remaining `core.rs` alert helpers or the three small warnings in `aspen-rpc-handlers/src/client.rs`; both should beat grinding the heavier forge-handler leftovers.","measurement_note":"Measured with the same fresh-target-dir full-workspace cargo-tigerstyle wrapper and repo-owned `warning:` parser as the 4053 baseline, so 4048 is directly comparable."}}
{"run":78,"commit":"98bcc0f","metric":4041,"metrics":{},"status":"keep","description":"Finished most of the remaining `aspen-core-essentials-handler/src/core.rs` alert-helper tail: added real invariants to alert create/delete/list/get, metric window filtering, transition persistence, and alert evaluation so those paths no longer depend on implicit assumptions. Targeted `cargo check -p aspen-core-essentials-handler` and crate-local Tiger Style stayed green, local `core.rs` warnings dropped from 8 to 1, and the cold repo-owned Tiger Style warning-site count fell from 4048 to 4041 (-7).","timestamp":1776402227257,"segment":2,"confidence":3.5525876460767947,"iterationTokens":10837,"asi":{"hypothesis":"The remaining `core.rs` alert tail was mostly assertion-density on short alert helpers, so adding meaningful invariants around names, windows, counts, history bounds, and transition semantics should remove most of it without changing alert behavior.","lessons":"Alert-path assertion-density was a good follow-up target: one pass collapsed seven of the eight remaining `core.rs` warnings, leaving only the top-level catch-all request match. This confirms small observability/admin helpers remain good honest Tiger Style wins even late in the loop.","next_action_hint":"Next pass should likely pivot to `aspen-rpc-handlers/src/client.rs` for the three-warning tail, or revisit the single remaining `core.rs` catch-all if there is a non-cheating way to make request coverage explicit.","measurement_note":"Measured with the same fresh-target-dir full-workspace cargo-tigerstyle wrapper and repo-owned `warning:` parser as the 4048 baseline, so 4041 is directly comparable."}}
