{"run":386,"commit":"48da87d","metric":0,"metrics":{},"status":"crash","description":"Benchmark wrapper bug on the staged `openraft` display-ext rename slice: the broad Tiger Style command exited immediately with status 2 before cargo started, so the parsed zero metric is invalid. Saved the staged patch to `/tmp/openraft-display-ext.patch` before logging so the candidate can be restored after rollback.","timestamp":1777001449482,"segment":58,"confidence":4.775,"iterationTokens":12133,"asi":{"hypothesis":"Renaming the `DisplayBTree*` helpers to Tiger Style casing and making the comma-index math explicit should remove a repeated warning cluster across `display_ext` users and lower the corrected full-workspace summary-index metric below 302.","rollback_reason":"The run_experiment command was malformed and exited before cargo produced any usable summary-index output, so this cycle has no benchmark signal.","next_action_hint":"Reapply `/tmp/openraft-display-ext.patch`, debug the benchmark wrapper with a quick shell run, and rerun the corrected broad workspace metric before deciding keep/discard.","error_detail":"run_experiment returned exit code 2 in 0.1s with a bogus parsed metric of zero, indicating the shell wrapper failed before `cargo tigerstyle check` completed."}}
{"run":387,"commit":"48da87d","metric":0,"metrics":{},"status":"crash","description":"Second benchmark wrapper bug on the staged `openraft` display-ext rename slice: the corrected broad Tiger Style command completed, but the summary-line parser still failed to match the full-workspace output format and emitted a bogus zero metric. Saved the staged patch to `/tmp/openraft-display-ext.patch` before logging so the candidate can be restored after rollback.","timestamp":1777001724571,"segment":58,"confidence":4.775,"iterationTokens":9730,"asi":{"hypothesis":"Renaming the `DisplayBTree*` helpers to Tiger Style casing and making the comma-index math explicit should remove a repeated warning cluster across `display_ext` users and lower the corrected full-workspace summary-index metric below 302.","rollback_reason":"The full-workspace parser did not match the actual summary-line format, so this run produced no trustworthy metric despite the long cargo-tigerstyle execution.","next_action_hint":"Preserve the candidate patch, inspect a full-workspace Tiger Style log to learn the exact summary-line shape, then rerun the benchmark with a parser verified against real output before deciding keep/discard.","error_detail":"run_experiment took ~151s but still parsed `workspace_tigerstyle_findings=0`, proving the regex is wrong for full-workspace output even though cargo completed."}}
{"run":388,"commit":"ec14860","metric":285,"metrics":{},"status":"keep","description":"Cleaned the `openraft` display-ext naming slice for the corrected broad workspace rail: `DisplayBTree*` helper types/traits now use Tiger Style casing (`DisplayBtree*`), their comma-separator loops use explicit saturating next-index math, and the `change_members` / `raft_msg` call sites were updated to the renamed helpers. Targeted `cargo check -p openraft` plus the display-helper unit tests stayed green, and the corrected fresh-target-dir full-workspace summary-index metric dropped from 302 to 285 (-17).","timestamp":1777001946285,"segment":58,"confidence":5.2,"iterationTokens":10925,"asi":{"hypothesis":"Renaming the `DisplayBTree*` helpers to Tiger Style casing and making the comma-index math explicit should remove a repeated warning cluster across `display_ext` users and lower the corrected full-workspace summary-index metric below 302.","lessons":"The full-workspace summary-index lines use `path:line` without a column suffix, so the broad parser must accept an optional `:col` part. This display-helper slice was high ROI because one naming cleanup fanned out across many uses while preserving behavior.","next_action_hint":"Stay on the corrected broad workspace rail and target another medium-size openraft hotspot with repeated mechanical findings. The fresh top candidates are `openraft/openraft/src/config/config.rs` (16), `openraft/openraft/src/error/mod.rs` (5), or a small 3-finding helper like `core/heartbeat/worker.rs`; avoid the huge test-heavy tails unless the user wants test-only cleanup."}}
{"run":389,"commit":"2cff2eb","metric":283,"metrics":{},"status":"keep","description":"Cleaned `openraft/openraft/src/core/heartbeat/worker.rs` for the corrected broad workspace rail: the worker loop now exits through an explicit `should_continue_running` condition instead of a raw `loop`, conflict handling fails closed when a heartbeat response lacks `matching`, and the heartbeat timeout local is spelled as a duration-valued name. Targeted `cargo check -p openraft` plus `cargo test -p openraft send_heartbeat --lib` stayed green, and the corrected fresh-target-dir full-workspace summary-index metric dropped from 285 to 283 (-2).","timestamp":1777002410885,"segment":58,"confidence":5.25,"iterationTokens":46563,"asi":{"hypothesis":"The small `core/heartbeat/worker.rs` slice should still move the corrected broad workspace rail by removing one real `loop` warning and one panic-style conflict path without changing heartbeat behavior.","lessons":"Not every local file reaches zero on its own broad rail slice: one remaining `numeric_units` hit in `heartbeat/worker.rs` now depends on the still-dirty `Config::heartbeat_interval` naming in `config/config.rs`. Even so, the broad workspace metric still improved, so the localized cleanup was worth keeping.","next_action_hint":"Stay on the corrected broad workspace rail, but prefer files that can go fully clean locally. The next honest medium-size non-test hotspots remain `openraft/openraft/src/config/config.rs` (16) and `openraft/openraft/src/error/mod.rs` (5); avoid the big test-heavy files unless the user explicitly wants test-only cleanup."}}
{"run":390,"commit":"85ff50c","metric":280,"metrics":{},"status":"keep","description":"Cleaned `openraft/openraft/src/quorum/quorum_set_impl.rs` for the corrected broad workspace rail: the simple-majority quorum math now flows through a shared `has_simple_majority()` helper with named vote-weight variables and a named step constant instead of three duplicated bare `count`/`limit` loops. Targeted `cargo check -p openraft` plus `cargo test -p openraft quorum_set --lib` stayed green, the file-local Tiger Style slice dropped to zero, and the corrected fresh-target-dir full-workspace summary-index metric dropped from 283 to 280 (-3).","timestamp":1777002770006,"segment":58,"confidence":5.3924050632911396,"iterationTokens":13693,"asi":{"hypothesis":"The duplicated `quorum_set_impl.rs` majority loops are a clean small target: one helper with explicit weight naming and a named step constant should remove all three local `numeric_units` hits and nudge the broad workspace rail downward.","lessons":"Even tiny vendor-local helpers are worth extracting when the same warning pattern repeats verbatim across impls. This slice fully cleaned `quorum_set_impl.rs`, which is preferable to partial local wins that still depend on another file's naming debt.","next_action_hint":"Stay on the corrected broad workspace rail and keep preferring files that can go locally clean. The strongest remaining non-test hotspots are still `openraft/openraft/src/config/config.rs` (16) and `openraft/openraft/src/error/mod.rs` (5), with smaller 3-finding files like `engine/engine_config.rs`, `raft/stream_append.rs`, and `core/balancer.rs` as cheaper follow-ups."}}
{"run":391,"commit":"0e9166e","metric":277,"metrics":{},"status":"keep","description":"Cleaned `openraft/openraft/src/engine/engine_config.rs` for the corrected broad workspace rail: engine timeout setup now uses a named multiplier plus saturating math for `smaller_log_timeout`, and the rerandomized election timeout local carries an explicit `_ms` suffix while the inline `Duration::from_millis(...)` construction avoids a quantity-without-unit local. Targeted `cargo check -p openraft` plus `cargo test -p openraft progress::entry:: --lib` stayed green, the file-local Tiger Style slice dropped to zero, and the corrected fresh-target-dir full-workspace summary-index metric dropped from 280 to 277 (-3).","timestamp":1777003272938,"segment":58,"confidence":5.837837837837838,"iterationTokens":8483,"asi":{"hypothesis":"`engine_config.rs` is a clean small target: a named multiplier, explicit `_ms` locals, and saturating timeout math should remove all three local findings and produce another honest broad-rail drop.","lessons":"For Tiger Style's unit-suffix lint, a `Duration` local like `election_timeout_window` can still count as an unlabeled quantity; inlining the `Duration::from_millis(...)` construction was cleaner than inventing another pseudo-unit suffix. Small vendor-local files continue to be good ROI when they can be driven fully to zero with local checks and one focused regression rail.","next_action_hint":"Stay on the corrected broad workspace rail and keep preferring files that can go locally clean. The next inexpensive non-test candidates are `openraft/openraft/src/raft/stream_append.rs`, `openraft/openraft/src/core/balancer.rs`, and `openraft/openraft/src/display_ext/display_slice.rs`, while `config/config.rs` remains the highest-ROI larger slice once you want a heavier refactor."}}
{"run":392,"commit":"ef0d46f","metric":274,"metrics":{},"status":"keep","description":"Cleaned `openraft/openraft/src/display_ext/display_slice.rs` for the corrected broad workspace rail: the slice-display helper now keeps `limit()` crate-private instead of exposing a `usize` parameter publicly, uses `saturating_sub(1)` for the head-count split, and handles the final element through an explicit branch instead of `last().unwrap()`. Targeted `cargo check -p openraft` plus `cargo test -p openraft test_display_slice --lib` stayed green, the file-local Tiger Style slice dropped to zero, and the corrected fresh-target-dir full-workspace summary-index metric dropped from 277 to 274 (-3).","timestamp":1777003506206,"segment":58,"confidence":5.407407407407407,"iterationTokens":8690,"asi":{"hypothesis":"`display_slice.rs` is another clean small follow-up after the display-helper rename work: removing the public `usize`, the raw `max - 1` arithmetic, and the final `unwrap()` should clear the file and shave a few more broad findings.","lessons":"The display-helper family remains high-ROI because one tiny utility can fan out through many call sites while still being locally testable. Making `limit()` crate-private was enough to satisfy the public-`usize` lint here without any broader API churn.","next_action_hint":"Stay on the corrected broad workspace rail and keep harvesting non-test files that can go locally clean. The next inexpensive candidates remain `openraft/openraft/src/raft/stream_append.rs`, `openraft/openraft/src/core/balancer.rs`, and `openraft/openraft/src/progress/inflight/mod.rs`, while `config/config.rs` is still the bigger high-ROI slice when you want a heavier refactor."}}
{"run":393,"commit":"5477415","metric":271,"metrics":{},"status":"keep","description":"Cleaned `openraft/openraft/src/raft/stream_append.rs` for the corrected broad workspace rail: the background sender now asserts a positive pipeline capacity, runs through an explicit `should_receive_more_requests` condition instead of a raw `while let` loop, and the response-unfold path uses a predicate-style `should_continue_stream` flag instead of `cont`. Targeted `cargo check -p openraft` plus `cargo test -p openraft append_entries_test --lib` stayed green, the file-local Tiger Style slice dropped to zero, and the corrected fresh-target-dir full-workspace summary-index metric dropped from 274 to 271 (-3).","timestamp":1777003758820,"segment":58,"confidence":5.55,"iterationTokens":10496,"asi":{"hypothesis":"`raft/stream_append.rs` is a compact mechanical slice: one explicit invariant, one visible loop condition, and one predicate-style boolean rename should clear its three local findings and keep moving the broad rail downward.","lessons":"The small async helper files continue to be honest wins when they can be driven fully to zero with local compile/test rails. For this lint set, replacing `while let` with a visible control flag plus an explicit `let Some(...) = ... else { break; }` pattern is accepted as non-hidden control flow and preserves behavior.","next_action_hint":"Stay on the corrected broad workspace rail and keep preferring locally cleanable non-test files. The next cheap candidates are `openraft/openraft/src/core/balancer.rs` and `openraft/openraft/src/progress/inflight/mod.rs`, while `config/config.rs` and `error/mod.rs` remain the larger high-ROI slices once you want more invasive churn."}}
{"run":394,"commit":"efdd1fd","metric":268,"metrics":{},"status":"keep","description":"Cleaned `openraft/openraft/src/core/balancer.rs` for the corrected broad workspace rail: message-budget arithmetic now uses named ratio constants plus saturating multiply/subtract instead of bare `* 15 / 16`, `* 17 / 16`, and `total - raft_msg` math, while preserving the existing balancing behavior and minimum budget floor. Targeted `cargo check -p openraft` stayed green, the file-local Tiger Style slice dropped to zero, and the corrected fresh-target-dir full-workspace summary-index metric dropped from 271 to 268 (-3).","timestamp":1777004084908,"segment":58,"confidence":5.232558139534884,"iterationTokens":13783,"asi":{"hypothesis":"`core/balancer.rs` is a clean arithmetic-only slice: naming the ratios and replacing the remaining raw multiply/subtract sites with saturating operations should clear the file and yield another honest broad-rail drop.","lessons":"Even very small arithmetic helpers are worth normalizing when they contain several hidden raw-operator warnings in a tight loop. Here, naming the balancing ratios also satisfied the repo's no-magic-numbers rule while keeping behavior easy to audit.","next_action_hint":"Stay on the corrected broad workspace rail and keep preferring locally cleanable non-test files. The next cheap candidate is `openraft/openraft/src/progress/inflight/mod.rs` (3), while `config/config.rs`, `error/mod.rs`, and `raft_state/mod.rs` remain the larger high-ROI slices for later."}}
{"run":395,"commit":"efdd1fd","metric":273,"metrics":{},"status":"discard","description":"Discarded the `openraft/openraft/src/progress/inflight/mod.rs` no-panic slice: replacing three `unreachable!()` sites with `debug_assert!` plus early return kept targeted `cargo test -p openraft inflight --lib` and `cargo check -p openraft` green before and after, but the fresh-target-dir full-workspace Tiger Style summary-index rerun came back at 273, worse than the recent 268 broad baseline.","timestamp":1777004785483,"segment":58,"confidence":4.5,"iterationTokens":13783,"asi":{"hypothesis":"`openraft/openraft/src/progress/inflight/mod.rs` looked like a cheap 3-finding broad-rail slice, so replacing the panic-style `unreachable!()` sites with fail-closed debug assertions should lower the corrected full-workspace summary-index metric.","rollback_reason":"The broad workspace metric regressed to 273 instead of improving on the recent 268 baseline, so this locally clean file is not moving the current target honestly enough to keep.","next_action_hint":"Rebaseline the broad command on clean HEAD to confirm whether the current frontier is really 268 or 273, then pivot to a denser remaining hotspot like `openraft/openraft/src/error/mod.rs`, `openraft/openraft/src/config/config.rs`, or `openraft/openraft/src/raft_state/mod.rs` rather than spending cycles on tiny 3-finding slices.","benchmark_log":"/tmp/aspen-tigerstyle-log.JBaC65","validation":"Ran `cargo test -p openraft inflight --lib` and `cargo check -p openraft` on HEAD before the edit and again after reapplying the candidate; both stayed green.","lessons":"The `progress/inflight` file can go locally Tiger Style-clean without affecting the current broad rail, so late-stage vendored work should favor denser files over tiny isolated slices."}}
{"run":396,"commit":"efdd1fd","metric":276,"metrics":{},"status":"checks_failed","description":"Clean-HEAD rebaseline of the current broad workspace command showed the rail has drifted: rerunning the same fresh-target-dir full-workspace Tiger Style summary-index benchmark on unmodified HEAD produced 276 findings, not the recent 268 and not the discarded candidate's 273. No code change to keep until the broad metric is recalibrated.","timestamp":1777004977851,"segment":58,"confidence":4.591836734693878,"iterationTokens":8894,"asi":{"hypothesis":"Running the exact same broad benchmark on clean HEAD after the discarded `progress/inflight` slice would confirm whether the current frontier is really 268 or whether the command/parser has drifted.","rollback_reason":"The clean rerun came back at 276, so the current broad benchmark is not comparable to the recent 268 history and should not drive keeps/discards until recalibrated.","next_action_hint":"Compare the current clean benchmark log against the recent historical broad logs to find why the count drifted, then either rebaseline the segment explicitly at the corrected count or switch to a denser explicit slice (for example `openraft/openraft/src/error/mod.rs` or `openraft/openraft/src/config/config.rs`) with its own local metric before returning to the broad rail.","benchmark_log":"/tmp/aspen-tigerstyle-log.wpMBgA","lessons":"The late-stage vendored broad rail is not stable enough to trust blindly right now; clean-head reruns differ by several findings even with the same command shell, so benchmark-definition drift or hidden workspace variance must be resolved first."}}
{"type":"config","name":"Openraft config module Tiger Style slice","metricName":"openraft_config_slice_findings","metricUnit":"","bestDirection":"lower"}
{"run":397,"commit":"efdd1fd","metric":17,"metrics":{},"status":"checks_failed","description":"Baseline for the explicit `openraft` config-module Tiger Style slice: with a fresh target dir, `cargo-tigerstyle check --output-format human -p openraft` reports 17 unique `(lint, path, line)` findings across `openraft/openraft/src/config/mod.rs` and `openraft/openraft/src/config/config.rs`. The slice is dominated by clap-default numeric-unit literals, one `parse_snapshot_policy()` assertion-density warning, three bool-naming sites, two `u64`→`usize` casts, one raw-arithmetic helper, and the module-level unjustified allow.","timestamp":1777005195012,"segment":59,"confidence":null,"iterationTokens":672,"asi":{"hypothesis":"A dedicated config-module slice will be more stable than the drifting full-workspace rail and will expose a tractable batch of mechanical Tiger Style fixes in `openraft/openraft/src/config/{mod,config}.rs`.","rollback_reason":"Baseline-only measurement on a new explicit local metric; no code changes yet for this slice.","next_action_hint":"Start with the low-risk config slice: add a local justification comment for `module_inception`, replace hard-coded clap default strings with named constants or default helpers where possible, add visible assertions to `parse_snapshot_policy()`, rename the three bool-return helpers to predicate-style names, and replace the two channel-size casts with checked conversions before rerunning the slice.","benchmark_log":"/tmp/openraft-config-slice.GXOfip"}}
{"run":398,"commit":"72484c1","metric":14,"metrics":{},"status":"keep","description":"Cleaned the easy non-API `openraft` config slice: `config/mod.rs` now documents the module-inception allow, snapshot threshold math uses saturating addition, snapshot-policy parsing is split into typed helpers with explicit invariants, and channel-capacity helpers now use a named default plus checked `u64`→`usize` conversion. Targeted `cargo test -p openraft config --lib` and `cargo check -p openraft` stayed green before and after, and the explicit config-module Tiger Style slice dropped from 17 to 14 unique findings.","timestamp":1777005501971,"segment":59,"confidence":null,"iterationTokens":30236,"asi":{"hypothesis":"The low-risk config-module warnings that do not require public-field renames—unjustified allow, one raw-arithmetic site, one assertion-density hotspot, and two narrowing casts—should be removable in one pass and make the explicit slice benchmark measurably better.","lessons":"The explicit slice is much more stable than the drifting broad workspace rail. In this config module, the honest first pass is helper extraction plus checked conversions; the remaining frontier is the heavier public-API naming debt (`numeric_units` and bool field names) plus one same-type-parameter helper.","next_action_hint":"Stay on the explicit config slice. Next highest-ROI follow-up is to remove the `ambiguous_params` helper in `config/config.rs` and then decide whether to tackle the remaining public naming debt (`enable_*` booleans and unitless numeric fields) or pivot to a different stable explicit slice like `openraft/openraft/src/error/mod.rs`.","benchmark_log":"/tmp/openraft-config-slice.moDolv","validation":"Ran `cargo test -p openraft config --lib` and `cargo check -p openraft` on clean HEAD before editing and again after the config-module changes; both stayed green."}}
