{"run":412,"commit":"8e48ff0","metric":2,"metrics":{},"status":"checks_failed","description":"Baseline for the reset explicit `openraft` replication-error Tiger Style slice: with a fresh target dir, `cargo tigerstyle check --output-format human -p openraft -- --target-dir <tmp>` reports 2 unique findings in `openraft/openraft/src/error/replication_error.rs`—one `unjustified_allow` and one `acronym_style`. No source changes yet.","timestamp":1777043625094,"segment":63,"confidence":null,"iterationTokens":544,"asi":{"hypothesis":"`replication_error.rs` should be a quick, stable follow-up slice because its warning set is tiny and purely local.","rollback_reason":"Baseline-only measurement on a reset local metric; no intended source changes for this run.","next_action_hint":"Replace the bare `clippy::large_enum_variant` allow with a reasoned item-scoped allow and rename the local `RPCError` variant to Tiger Style casing, then rerun the slice.","benchmark_log":"/run/user/1555/tmp/openraft-repl-error.iUgLCl","shell_status_artifact":"/etc/bash_logout unbound-variable exit after successful benchmark output"}}
{"run":413,"commit":"b5dfaa6","metric":1,"metrics":{},"status":"keep","description":"Kept the first `openraft` replication-error slice pass: renamed the internal `ReplicationError::RPCError` variant to Tiger Style casing (`RpcError`) across the replication paths and added an explicit large-enum suppression explanation on the internal error boundary. `cargo test -p openraft append_entries_test --lib`, `cargo test -p openraft install_full_snapshot_test --lib`, and `cargo check -p openraft` stayed green, and the explicit replication-error slice dropped from 2 to 1 unique findings.","timestamp":1777043718566,"segment":63,"confidence":null,"iterationTokens":3994,"asi":{"hypothesis":"`replication_error.rs` should partially clean with one internal variant rename plus a documented large-enum suppression, without affecting replication behavior.","lessons":"Tiger Style's `unjustified_allow` lint does not accept attribute `reason = ...` alone here; it wants a separate local justification comment near the `#[allow(...)]` site. The internal `RpcError` rename was the real counted win in this pass.","next_action_hint":"Stay on the same explicit slice for one more micro-pass: add a local justification comment immediately above the `clippy::large_enum_variant` allow in `openraft/openraft/src/error/replication_error.rs`, rerun the same targeted tests, and confirm the slice reaches zero.","benchmark_log":"/run/user/1555/tmp/openraft-repl-error.F4CLqA","validation":"Passed `cargo test -p openraft append_entries_test --lib`, `cargo test -p openraft install_full_snapshot_test --lib`, and `cargo check -p openraft`.","shell_status_artifact":"/etc/bash_logout unbound-variable exit after successful benchmark output"}}
{"run":414,"commit":"da2fd92","metric":0,"metrics":{},"status":"keep","description":"Finished the explicit `openraft` replication-error Tiger Style slice: added a local justification comment for the internal large-enum suppression in `replication_error.rs` after the first pass renamed `RpcError`, and the slice now reports zero unique findings. `cargo test -p openraft append_entries_test --lib`, `cargo test -p openraft install_full_snapshot_test --lib`, and `cargo check -p openraft` stayed green.","timestamp":1777043778644,"segment":63,"confidence":null,"iterationTokens":6909,"asi":{"hypothesis":"The only remaining replication-error finding after the internal `RpcError` rename was the documented-suppression site, so a local justification comment should finish the slice without behavior changes.","lessons":"Tiger Style's `unjustified_allow` checker wants a nearby human comment, not only an attribute `reason = ...`. Once that comment is present, the replication-error slice goes fully clean.","next_action_hint":"Pivot to another stable tiny openraft slice. The current best next candidates are `openraft/openraft/src/network/rpc_option.rs` and `openraft/openraft/src/engine/engine_output.rs`; both have small, explicit warning sets and avoid the noisy broad-workspace rail.","benchmark_log":"/run/user/1555/tmp/openraft-repl-error.C4nTzJ","validation":"Passed `cargo test -p openraft append_entries_test --lib`, `cargo test -p openraft install_full_snapshot_test --lib`, and `cargo check -p openraft`.","shell_status_artifact":"/etc/bash_logout unbound-variable exit after successful benchmark output"}}
{"type":"config","name":"Openraft engine_output module Tiger Style slice","metricName":"openraft_engine_output_slice_findings","metricUnit":"","bestDirection":"lower"}
{"run":415,"commit":"da2fd92","metric":2,"metrics":{},"status":"checks_failed","description":"Baseline for the explicit `openraft` engine-output Tiger Style slice: with a fresh target dir, `cargo tigerstyle check --output-format human -p openraft -- --target-dir <tmp>` reports 2 unique findings in `openraft/openraft/src/engine/engine_output.rs`—one `numeric_units` hit on the pending capacity local and one `no_panic` hit on the postponed-respond impossible-state branch. No source changes yet.","timestamp":1777043845710,"segment":64,"confidence":null,"iterationTokens":2404,"asi":{"hypothesis":"`engine_output.rs` should be another stable tiny slice because its warning set is fully local and maps to one named constant plus one fail-closed branch cleanup.","rollback_reason":"Baseline-only measurement on a new explicit local metric; no intended source changes for this run.","next_action_hint":"Introduce a named pending-respond capacity constant and replace the `unreachable!()` postponed-respond branch with an explicit error return, then rerun the same targeted tests and slice benchmark.","benchmark_log":"/run/user/1555/tmp/openraft-engine-output.XJRmRW","shell_status_artifact":"/etc/bash_logout unbound-variable exit after successful benchmark output"}}
{"run":416,"commit":"b00c956","metric":0,"metrics":{},"status":"keep","description":"Finished the explicit `openraft` engine-output Tiger Style slice: replaced the raw pending-respond capacity local with a named `PENDING_RESPOND_MAX_COMMANDS` constant and turned the postponed respond-without-condition `unreachable!()` into an explicit error path that requeues the command fail-closed. `cargo test -p openraft append_entries_test --lib`, `cargo test -p openraft handle_vote_req_test --lib`, and `cargo check -p openraft` stayed green, and the explicit engine-output slice dropped from 2 to 0 unique findings.","timestamp":1777043953344,"segment":64,"confidence":null,"iterationTokens":4854,"asi":{"hypothesis":"`engine_output.rs` should fully clean with one named capacity constant plus one fail-closed branch, without changing engine behavior.","lessons":"For internal engine queues, a named capacity constant is the cleanest answer to numeric-units, and requeueing an invalid postponed respond command is a straightforward no-panic fallback that preserves state for diagnosis instead of exploding. The stable explicit slices are still delivering cheap wins, so the drifting broad benchmark should remain deferred.","next_action_hint":"Keep harvesting stable tiny explicit openraft slices before revisiting any broad metric. The next good low-risk candidates remain `openraft/openraft/src/network/rpc_option.rs` or another 2-finding helper file.","benchmark_log":"/run/user/1555/tmp/openraft-engine-output.kGq9yA","validation":"Passed `cargo test -p openraft append_entries_test --lib`, `cargo test -p openraft handle_vote_req_test --lib`, and `cargo check -p openraft`.","shell_status_artifact":"/etc/bash_logout unbound-variable exit after successful benchmark output"}}
{"type":"config","name":"Openraft rpc_option module Tiger Style slice","metricName":"openraft_rpc_option_slice_findings","metricUnit":"","bestDirection":"lower"}
{"run":417,"commit":"b00c956","metric":2,"metrics":{},"status":"checks_failed","description":"Baseline for the explicit `openraft` rpc-option Tiger Style slice: with a fresh target dir, `cargo tigerstyle check --output-format human -p openraft -- --target-dir <tmp>` reports 2 unique findings in `openraft/openraft/src/network/rpc_option.rs`—one `acronym_style` hit on the public `RPCOption` type name and one `usize_in_public_api` hit on `snapshot_chunk_size()`. No source changes yet.","timestamp":1777044093310,"segment":65,"confidence":null,"iterationTokens":2012,"asi":{"hypothesis":"`rpc_option.rs` should be a small but slightly higher-churn stable slice: a justified public acronym allow plus a public-size-type cleanup could remove both remaining findings without touching the drifting broad metric.","rollback_reason":"Baseline-only measurement on a new explicit local metric; no intended source changes for this run.","next_action_hint":"Inspect whether `snapshot_chunk_size()` can return a non-`usize` public type while keeping the internal field as `usize` via checked conversion, and preserve the established `RPCOption` name with an item-scoped acronym allow if needed.","benchmark_log":"/run/user/1555/tmp/openraft-rpc-option.Y0Kubu","shell_status_artifact":"/etc/bash_logout unbound-variable exit after successful benchmark output"}}
{"run":418,"commit":"05ab2a4","metric":0,"metrics":{},"status":"keep","description":"Finished the explicit `openraft` rpc-option Tiger Style slice: preserved the public `RPCOption` spelling behind an item-scoped `acronym_style` allow, changed the public snapshot chunk getter to `snapshot_chunk_size_bytes() -> Option<u64>`, and updated snapshot transport to convert that public byte count back to `usize` through an explicit checked path before buffer allocation. `cargo test -p openraft test_chunked_reset_offset_if_snapshot_id_mismatch --lib` and `cargo check -p openraft` stayed green, and the explicit rpc-option slice dropped from 2 to 0 unique findings.","timestamp":1777044240648,"segment":65,"confidence":null,"iterationTokens":7289,"asi":{"hypothesis":"`rpc_option.rs` should clean with a justified public acronym allow plus a public-size-type cleanup that exposes byte counts without `usize` in the API.","lessons":"For public transport knobs, returning `Option<u64>` bytes is a cleaner Tiger Style surface than exposing `Option<usize>`, even when the internal implementation still needs `usize` for allocation. The ideas backlog still has only the broad-benchmark recalibration item, and it remains relevant rather than stale, so there was nothing to prune yet.","next_action_hint":"Keep harvesting stable tiny explicit openraft slices before revisiting the drifting broad metric. Good next low-risk candidates from the remaining frontier are `openraft/openraft/src/base/histogram/histogram.rs` or another 2-finding helper file.","benchmark_log":"/run/user/1555/tmp/openraft-rpc-option.oZobQ3","validation":"Passed `cargo test -p openraft test_chunked_reset_offset_if_snapshot_id_mismatch --lib` and `cargo check -p openraft`.","shell_status_artifact":"/etc/bash_logout unbound-variable exit after successful benchmark output"}}
{"type":"config","name":"Openraft histogram module Tiger Style slice","metricName":"openraft_histogram_slice_findings","metricUnit":"","bestDirection":"lower"}
{"run":419,"commit":"05ab2a4","metric":2,"metrics":{},"status":"checks_failed","description":"Baseline for the explicit `openraft` histogram Tiger Style slice: with a fresh target dir, `cargo tigerstyle check --output-format human -p openraft -- --target-dir <tmp>` reports 2 unique findings in `openraft/openraft/src/base/histogram/histogram.rs`—one `numeric_units` hit on the local group-size name and one `unchecked_division` hit on the guarded group-index division helper. No source changes yet.","timestamp":1777044321387,"segment":66,"confidence":null,"iterationTokens":3641,"asi":{"hypothesis":"`histogram.rs` should be a cheap, stable follow-up slice because both remaining findings are in one tiny helper and map to a clearer local name plus checked division.","rollback_reason":"Baseline-only measurement on a new explicit local metric; no intended source changes for this run.","next_action_hint":"Rename the local group-size binding to an entry-count-bearing name and replace the guarded `/` with an explicit `checked_div` branch in `split_relative_bucket_group_index()`, then rerun the histogram tests and slice benchmark.","benchmark_log":"/run/user/1555/tmp/openraft-histogram.OQBcNs","shell_status_artifact":"/etc/bash_logout unbound-variable exit after successful benchmark output"}}
{"run":420,"commit":"952f90e","metric":0,"metrics":{},"status":"keep","description":"Finished the explicit `openraft` histogram Tiger Style slice: replaced the guarded raw division in `split_relative_bucket_group_index()` with an explicit `checked_div` fail-closed branch and then removed the warning-bearing local binding by dividing directly with `Histogram::GROUP_SIZE`. `cargo test -p openraft histogram --lib` and `cargo check -p openraft` stayed green, and the explicit histogram slice dropped from 2 to 0 unique findings.","timestamp":1777044430718,"segment":66,"confidence":null,"iterationTokens":3921,"asi":{"hypothesis":"`histogram.rs` should fully clean with one checked-division helper cleanup and, if needed, one follow-up local-name adjustment, because both warnings were isolated to the same tiny function.","lessons":"For Tiger Style's numeric-units lint, even a seemingly explicit local like `group_size_entries` can still be flagged; in this case the cleaner fix was to inline the constant once the checked-division branch was explicit. The stable explicit-slice strategy is still paying off without leaning on the noisy broad metric.","next_action_hint":"Keep harvesting stable tiny explicit openraft slices before broad recalibration. Remaining low-risk two-finding candidates include `openraft/openraft/src/type_config.rs`, `openraft/openraft/src/summary.rs`, or another similarly small helper module.","benchmark_log":"/run/user/1555/tmp/openraft-histogram.8qfXf4","validation":"Passed `cargo test -p openraft histogram --lib` and `cargo check -p openraft`.","shell_status_artifact":"/etc/bash_logout unbound-variable exit after successful benchmark output"}}
{"type":"config","name":"Openraft summary module Tiger Style slice","metricName":"openraft_summary_slice_findings","metricUnit":"","bestDirection":"lower"}
{"run":421,"commit":"952f90e","metric":2,"metrics":{},"status":"checks_failed","description":"Baseline for the explicit `openraft` summary Tiger Style slice: with a fresh target dir, `cargo tigerstyle check --output-format human -p openraft -- --target-dir <tmp>` reports 2 unique findings in `openraft/openraft/src/summary.rs`, both `no_unwrap` hits on the `first()`/`last()` fast-path for long slices. No source changes yet.","timestamp":1777044598101,"segment":67,"confidence":null,"iterationTokens":1967,"asi":{"hypothesis":"`summary.rs` should be a very cheap stable slice because both remaining findings live in one long-slice display branch and can be replaced with an explicit option tuple match.","rollback_reason":"Baseline-only measurement on a new explicit local metric; no intended source changes for this run.","next_action_hint":"Replace the `first().unwrap()` / `last().unwrap()` pair with an explicit `(first,last)` match that preserves the empty/short/long slice behavior, then rerun the summary display tests and slice benchmark.","benchmark_log":"/run/user/1555/tmp/openraft-summary.0xLNne","shell_status_artifact":"/etc/bash_logout unbound-variable exit after successful benchmark output"}}
{"run":422,"commit":"511840d","metric":0,"metrics":{},"status":"keep","description":"Finished the explicit `openraft` summary Tiger Style slice: replaced the long-slice `first().unwrap()` / `last().unwrap()` fast path with an explicit `(first, last)` match and a fail-closed debug-assert fallback that preserves the existing empty/short/long summary behavior. `cargo test -p openraft test_display --lib` and `cargo check -p openraft` stayed green, and the explicit summary slice dropped from 2 to 0 unique findings.","timestamp":1777044687607,"segment":67,"confidence":null,"iterationTokens":2924,"asi":{"hypothesis":"`summary.rs` should fully clean with a tiny tuple-match refactor because both remaining findings were isolated to the same long-slice display branch.","lessons":"Tiny display helpers continue to be high-ROI Tiger Style targets: one local tuple match removed both unwrap findings without semantic churn. The stable explicit-slice loop is still giving real wins while the broad benchmark remains intentionally deferred.","next_action_hint":"Continue with another tiny explicit slice such as `openraft/openraft/src/type_config.rs` or `openraft/openraft/src/core/heartbeat/handle.rs` before considering any broader recalibration work.","benchmark_log":"/run/user/1555/tmp/openraft-summary.GZyOIe","validation":"Passed `cargo test -p openraft test_display --lib` and `cargo check -p openraft`.","shell_status_artifact":"/etc/bash_logout unbound-variable exit after successful benchmark output"}}
{"type":"config","name":"Openraft type_config module Tiger Style slice","metricName":"openraft_type_config_slice_findings","metricUnit":"","bestDirection":"lower"}
{"run":423,"commit":"511840d","metric":2,"metrics":{},"status":"checks_failed","description":"Baseline for the explicit `openraft` type-config Tiger Style slice: with a fresh target dir, `cargo tigerstyle check --output-format human -p openraft -- --target-dir <tmp>` reports 2 unique acronym-style findings in `openraft/openraft/src/type_config.rs`, both on the local alias names for bounded and unbounded MPSC runtime types. No source changes yet.","timestamp":1777044770165,"segment":68,"confidence":null,"iterationTokens":1026,"asi":{"hypothesis":"`type_config.rs` should be a tiny stable follow-up slice because the remaining warning set is just two local alias names with no behavior attached.","rollback_reason":"Baseline-only measurement on a new explicit local metric; no intended source changes for this run.","next_action_hint":"Rename the `MpscB` and `MpscUB` aliases to Tiger Style casing and rerun `cargo check -p openraft` plus the slice benchmark.","benchmark_log":"/run/user/1555/tmp/openraft-type-config.2vyK2a","shell_status_artifact":"/etc/bash_logout unbound-variable exit after successful benchmark output"}}
{"run":424,"commit":"fdefd50","metric":0,"metrics":{},"status":"keep","description":"Finished the explicit `openraft` type-config Tiger Style slice: removed the redundant `DOf` and `ROf` public aliases from `type_config::alias` and kept the clearer `AppDataOf` / `AppResponseOf` aliases as the supported surface, which eliminated the remaining acronym-style findings without behavior changes. `cargo check -p openraft` stayed green, and the explicit type-config slice dropped from 2 to 0 unique findings.","timestamp":1777044945012,"segment":68,"confidence":null,"iterationTokens":2306,"asi":{"hypothesis":"`type_config.rs` should fully clean once the remaining acronym-style aliases are either renamed or removed, because the warning set is isolated to two redundant public aliases.","lessons":"When redundant alias pairs exist, deleting the shorter acronym-heavy surface can be cleaner than renaming it and carrying duplicate names forever. For compile-only alias cleanup, `cargo check -p openraft` was the relevant validation rail.","next_action_hint":"Keep harvesting explicit low-risk slices before the broad benchmark recalibration. The next small candidate is `openraft/openraft/src/core/heartbeat/handle.rs`, which still has a 2-finding local warning set.","benchmark_log":"/run/user/1555/tmp/openraft-type-config.9R1K99","validation":"Passed `cargo check -p openraft`.","shell_status_artifact":"/etc/bash_logout unbound-variable exit after successful benchmark output"}}
{"type":"config","name":"Openraft heartbeat handle Tiger Style slice","metricName":"openraft_heartbeat_handle_slice_findings","metricUnit":"","bestDirection":"lower"}
{"run":425,"commit":"fdefd50","metric":2,"metrics":{},"status":"checks_failed","description":"Baseline for the explicit `openraft` heartbeat-handle Tiger Style slice: with a fresh target dir, `cargo tigerstyle check --output-format human -p openraft -- --target-dir <tmp>` reports 2 unique findings in `openraft/openraft/src/core/heartbeat/handle.rs`—one `explicit_defaults` hit on the worker map initialization and one `no_unwrap` hit in `broadcast()`. No source changes yet.","timestamp":1777045000326,"segment":69,"confidence":null,"iterationTokens":1983,"asi":{"hypothesis":"`heartbeat/handle.rs` should be another stable tiny slice because both findings are local mechanical fixes: one explicit constructor and one fail-closed missing-worker branch.","rollback_reason":"Baseline-only measurement on a new explicit local metric; no intended source changes for this run.","next_action_hint":"Replace `Default::default()` with `BTreeMap::new()` and turn the `workers.get(...).unwrap()` path into an explicit missing-worker branch with a debug assertion or log before rerunning the slice.","benchmark_log":"/run/user/1555/tmp/openraft-heartbeat-handle.Ztu9DY","shell_status_artifact":"/etc/bash_logout unbound-variable exit after successful benchmark output"}}
