{"run":426,"commit":"f1e668e","metric":0,"metrics":{},"status":"keep","description":"Finished the explicit `openraft` heartbeat-handle Tiger Style slice: replaced the worker-map `Default::default()` with `BTreeMap::new()` and turned the broadcast-time `workers.get(...).unwrap()` into an explicit missing-worker branch that debug-asserts and skips the send fail-closed. `cargo test -p openraft send_heartbeat_test --lib` and `cargo check -p openraft` stayed green, and the explicit heartbeat-handle slice dropped from 2 to 0 unique findings.","timestamp":1777045094438,"segment":69,"confidence":null,"iterationTokens":2667,"asi":{"hypothesis":"`heartbeat/handle.rs` should fully clean with one explicit constructor and one fail-closed missing-worker branch, because both findings are tightly local and behavior-preserving.","lessons":"For internal handle maps, replacing `Default::default()` with the concrete constructor is an easy explicit-defaults win, and a missing-worker branch can fail closed with a debug assertion instead of panicking. Stable explicit slices remain the right strategy; the broad recalibration idea is still deferred, not stale.","next_action_hint":"Keep harvesting tiny explicit openraft slices while the local wins remain cheap. Candidates still visible from the current frontier include `openraft/openraft/src/engine/handler/leader_handler/mod.rs` and other 2-finding helper modules before any broad-metric revisit.","benchmark_log":"/run/user/1555/tmp/openraft-heartbeat-handle.SJkvDM","validation":"Passed `cargo test -p openraft send_heartbeat_test --lib` and `cargo check -p openraft`.","shell_status_artifact":"/etc/bash_logout unbound-variable exit after successful benchmark output"}}
{"type":"config","name":"Openraft leader_handler module Tiger Style slice","metricName":"openraft_leader_handler_slice_findings","metricUnit":"","bestDirection":"lower"}
{"run":427,"commit":"f1e668e","metric":2,"metrics":{},"status":"checks_failed","description":"Baseline for the explicit `openraft` leader-handler Tiger Style slice: with a fresh target dir, `cargo tigerstyle check --output-format human -p openraft -- --target-dir <tmp>` reports 2 unique findings in `openraft/openraft/src/engine/handler/leader_handler/mod.rs`, both `unbounded_loop` hits on the long-lived append and read-log helper methods. No source changes yet.","timestamp":1777046478898,"segment":70,"confidence":null,"iterationTokens":2667,"asi":{"hypothesis":"`leader_handler/mod.rs` should be another stable tiny explicit slice because the remaining warning set is only two local `unbounded_loop` hits and likely maps to the same `#[tracing::instrument]` false-positive pattern seen elsewhere in vendored openraft.","rollback_reason":"Baseline-only measurement on a new explicit local metric; no intended source changes for this run.","next_action_hint":"Inspect the counted lines at `mod.rs:53` and `mod.rs:94`, likely remove the `#[tracing::instrument]` false positives by switching to explicit entered spans or another non-loop-shaped tracing pattern, then rerun the same slice benchmark.","benchmark_log":"/run/user/1555/tmp/openraft-leader-handler-slice.9I9iuP","counted_lines":["unbounded_loop openraft/openraft/src/engine/handler/leader_handler/mod.rs:53","unbounded_loop openraft/openraft/src/engine/handler/leader_handler/mod.rs:94"]}}
{"run":428,"commit":"eec044e","metric":0,"metrics":{},"status":"keep","description":"Finished the explicit `openraft` leader-handler Tiger Style slice: replaced the two `#[tracing::instrument]` attributes in `leader_handler/mod.rs` with explicit entered debug spans, which removes the local `unbounded_loop` false positives without changing leader append or heartbeat behavior. Baseline and post-change `cargo test -p openraft leader_handler --lib` stayed green, `cargo check -p openraft` stayed green, and the explicit leader-handler slice dropped from 2 to 0 unique findings.","timestamp":1777046555428,"segment":70,"confidence":null,"iterationTokens":7477,"asi":{"hypothesis":"The two leader-handler `unbounded_loop` findings were the same vendored `#[tracing::instrument]` false-positive pattern seen in other openraft files, so replacing the attributes with explicit entered spans should clean the slice without semantic changes.","benchmark_log":"/run/user/1555/tmp/openraft-leader-handler-slice.CYKzQP","validation":"Passed `cargo test -p openraft leader_handler --lib` before editing and again after the span rewrite, plus `cargo check -p openraft` after the change.","lessons":"For these tiny vendored openraft slices, explicit `debug_span!(...).entered()` calls are an honest replacement when Tiger Style misreads `#[tracing::instrument]` as loop-shaped control flow on short synchronous helpers.","next_action_hint":"Keep harvesting stable tiny explicit openraft slices before touching the drifting broad rail. The next likely candidate is another 2-finding helper module such as `openraft/openraft/src/engine/handler/leader_handler/mod.rs`'s neighboring modules or `openraft/openraft/src/engine/handler/leader_handler/transfer_leader_test.rs` if the summary points there."}}
{"type":"config","name":"Openraft snapshot_handler module Tiger Style slice","metricName":"openraft_snapshot_handler_slice_findings","metricUnit":"","bestDirection":"lower"}
{"run":429,"commit":"eec044e","metric":2,"metrics":{},"status":"checks_failed","description":"Baseline for the explicit `openraft` snapshot-handler Tiger Style slice: with a fresh target dir, `cargo tigerstyle check --output-format human -p openraft -- --target-dir <tmp>` reports 2 unique findings in `openraft/openraft/src/engine/handler/snapshot_handler/mod.rs`, both `unbounded_loop` hits on the short snapshot trigger/update helpers. No source changes yet.","timestamp":1777046610211,"segment":71,"confidence":null,"iterationTokens":467,"asi":{"hypothesis":"`snapshot_handler/mod.rs` should be another stable tiny explicit slice because the remaining warning set is only two local `unbounded_loop` hits and matches the vendored `#[tracing::instrument]` false-positive pattern cleaned in `leader_handler`.","rollback_reason":"Baseline-only measurement on a new explicit local metric; no intended source changes for this run.","next_action_hint":"Replace the two `#[tracing::instrument]` attributes in `snapshot_handler/mod.rs` with explicit entered spans, rerun the module tests plus `cargo check -p openraft`, then rerun the slice benchmark.","benchmark_log":"/run/user/1555/tmp/openraft-snapshot-handler-slice.kbji9E","counted_lines":["unbounded_loop openraft/openraft/src/engine/handler/snapshot_handler/mod.rs:30","unbounded_loop openraft/openraft/src/engine/handler/snapshot_handler/mod.rs:53"]}}
{"run":430,"commit":"89e8b4b","metric":0,"metrics":{},"status":"keep","description":"Finished the explicit `openraft` snapshot-handler Tiger Style slice: replaced the two `#[tracing::instrument]` attributes in `snapshot_handler/mod.rs` with explicit entered debug spans, which removes the local `unbounded_loop` false positives without changing snapshot trigger or update behavior. Baseline and post-change `cargo test -p openraft snapshot_handler --lib` stayed green, `cargo check -p openraft` stayed green, and the explicit snapshot-handler slice dropped from 2 to 0 unique findings.","timestamp":1777046684131,"segment":71,"confidence":null,"iterationTokens":3923,"asi":{"hypothesis":"The two snapshot-handler `unbounded_loop` findings were the same vendored `#[tracing::instrument]` false-positive pattern as the cleaned leader handler, so explicit entered spans should remove them without semantic change.","benchmark_log":"/run/user/1555/tmp/openraft-snapshot-handler-slice.WS7Jte","validation":"Passed `cargo test -p openraft snapshot_handler --lib` before editing and again after the span rewrite, plus `cargo check -p openraft` after the change.","lessons":"The local openraft handler modules are following a consistent pattern: short synchronous helpers tagged with `#[tracing::instrument]` are easy explicit-slice wins by switching to `debug_span!(...).entered()` at the top of the function.","next_action_hint":"Stay on small stable explicit openraft slices. `openraft/openraft/src/raft/api/app.rs` currently has three more `unbounded_loop` hits that likely respond to the same tracing-macro cleanup."}}
{"type":"config","name":"Openraft raft api app module Tiger Style slice","metricName":"openraft_raft_api_app_slice_findings","metricUnit":"","bestDirection":"lower"}
{"run":431,"commit":"89e8b4b","metric":3,"metrics":{},"status":"checks_failed","description":"Baseline for the explicit `openraft` raft-api-app Tiger Style slice: with a fresh target dir, `cargo tigerstyle check --output-format human -p openraft -- --target-dir <tmp>` reports 3 unique findings in `openraft/openraft/src/raft/api/app.rs`, all `unbounded_loop` hits on the thin async application API wrappers. No source changes yet.","timestamp":1777046778154,"segment":72,"confidence":null,"iterationTokens":453,"asi":{"hypothesis":"`raft/api/app.rs` should be another stable explicit slice because its remaining warning set is three local `unbounded_loop` hits that match the vendored `#[tracing::instrument]` false-positive pattern already cleaned in the handler modules.","rollback_reason":"Baseline-only measurement on a new explicit local metric; no intended source changes for this run.","next_action_hint":"Replace the three `#[tracing::instrument]` attributes in `raft/api/app.rs` with explicit async span instrumentation, validate the relevant app-api rails, then rerun the same slice benchmark.","benchmark_log":"/run/user/1555/tmp/openraft-raft-api-app-slice.E30ebN","counted_lines":["unbounded_loop openraft/openraft/src/raft/api/app.rs:41","unbounded_loop openraft/openraft/src/raft/api/app.rs:52","unbounded_loop openraft/openraft/src/raft/api/app.rs:68"]}}
{"run":432,"commit":"eab2f76","metric":0,"metrics":{},"status":"keep","description":"Finished the explicit `openraft` raft-api-app Tiger Style slice: replaced the three `#[tracing::instrument]` attributes on the thin async app API wrappers with explicit future instrumentation via `tracing::Instrument`, which removes the local `unbounded_loop` false positives without changing linearizable-read or client-write behavior. Baseline and post-change `cargo check -p openraft` stayed green, the available targeted rails (`cargo test -p openraft client_write --lib` and `cargo test -p openraft linearizable --lib`) stayed green before and after, and the explicit raft-api-app slice dropped from 3 to 0 unique findings.","timestamp":1777046851861,"segment":72,"confidence":null,"iterationTokens":6270,"asi":{"hypothesis":"The three `raft/api/app.rs` `unbounded_loop` findings were the async form of the same vendored tracing-macro false positives, so moving to explicit `.instrument(debug_span!(...))` calls should fully clean the slice without semantic change.","benchmark_log":"/run/user/1555/tmp/openraft-raft-api-app-slice.wMmmFg","validation":"Passed `cargo check -p openraft` before and after the change. The available targeted rails also stayed green before and after: `cargo test -p openraft client_write --lib` (0 matching tests, compile+link only) and `cargo test -p openraft linearizable --lib` (1 passing test).","lessons":"Async wrappers need explicit future instrumentation rather than an entered span guard: `.instrument(tracing::debug_span!(...)).await` preserves the original tracing scope across await points and avoids holding a non-Send guard inside the future.","next_action_hint":"Keep harvesting stable tiny explicit openraft slices. The next low-risk frontier is likely another tracing-macro false-positive file such as `openraft/openraft/src/type_config/async_runtime/watch/mod.rs` or one-finding helper modules from the latest summary."}}
{"type":"config","name":"Openraft state machine handle Tiger Style slice","metricName":"openraft_sm_handle_slice_findings","metricUnit":"","bestDirection":"lower"}
{"run":433,"commit":"eab2f76","metric":1,"metrics":{},"status":"checks_failed","description":"Baseline for the explicit `openraft` state-machine-handle Tiger Style slice: with a fresh target dir, `cargo tigerstyle check --output-format human -p openraft -- --target-dir <tmp>` reports 1 unique finding in `openraft/openraft/src/core/sm/handle.rs`, an `ignored_result` on the snapshot-request send path. No source changes yet.","timestamp":1777047031414,"segment":73,"confidence":null,"iterationTokens":438,"asi":{"hypothesis":"`core/sm/handle.rs` should be a small stable explicit slice because the only remaining finding is a real ignored send result on `SnapshotReader::get_snapshot()`, which can likely become an explicit early error instead of being silently deferred to the oneshot await.","rollback_reason":"Baseline-only measurement on a new explicit local metric; no intended source changes for this run.","next_action_hint":"Validate the snapshot-related rails, make `cmd_tx.send(cmd)` fail explicitly in `SnapshotReader::get_snapshot()`, then rerun the slice benchmark.","benchmark_log":"/run/user/1555/tmp/openraft-sm-handle-slice.7Pk09l","counted_lines":["ignored_result openraft/openraft/src/core/sm/handle.rs:71"]}}
{"run":434,"commit":"ca0e4d7","metric":0,"metrics":{},"status":"keep","description":"Finished the explicit `openraft` state-machine-handle Tiger Style slice: `SnapshotReader::get_snapshot()` now handles `cmd_tx.send(cmd)` explicitly and returns an immediate send-failure error instead of silently ignoring the result and only failing later on the oneshot receive path. Baseline and post-change `cargo test -p openraft snapshot --lib` stayed green, `cargo check -p openraft` stayed green, and the explicit `core/sm/handle.rs` slice dropped from 1 to 0 unique findings.","timestamp":1777047083731,"segment":73,"confidence":null,"iterationTokens":5020,"asi":{"hypothesis":"The lone `core/sm/handle.rs` finding is a real ignored-result bug, so handling `cmd_tx.send(cmd)` explicitly should improve the error path and fully clean the slice without benchmark gaming.","benchmark_log":"/run/user/1555/tmp/openraft-sm-handle-slice.sIfKmO","validation":"Passed `cargo test -p openraft snapshot --lib` before editing and again after the change, plus `cargo check -p openraft` before and after.","lessons":"This one was not a false positive: the previous code could mask an immediate command-send failure and defer it into a less precise oneshot receive error. Tiny one-finding explicit slices are still worthwhile when they improve real error reporting.","next_action_hint":"Continue harvesting small stable explicit openraft slices, but prefer real behavioral fixes like this over pure warning suppression. A good next candidate is `openraft/openraft/src/config/error.rs` or another one-finding helper with an obviously local fix; keep deferring the unstable broad recalibration rail until these cheap explicit wins slow down."}}
{"type":"config","name":"Openraft config error module Tiger Style slice","metricName":"openraft_config_error_slice_findings","metricUnit":"","bestDirection":"lower"}
{"run":435,"commit":"ca0e4d7","metric":1,"metrics":{},"status":"checks_failed","description":"Baseline for the explicit `openraft` config-error Tiger Style slice: with a fresh target dir, `cargo tigerstyle check --output-format human -p openraft -- --target-dir <tmp>` reports 1 unique finding in `openraft/openraft/src/config/error.rs`, an `acronym_style` hit on the `ElectionTimeoutLTHeartBeat` variant. No source changes yet.","timestamp":1777047139035,"segment":74,"confidence":null,"iterationTokens":433,"asi":{"hypothesis":"`config/error.rs` should be a tiny stable explicit slice because the only remaining finding is a variant name with acronym-heavy spelling, and renaming it plus the local config/test call sites should not change behavior.","rollback_reason":"Baseline-only measurement on a new explicit local metric; no intended source changes for this run.","next_action_hint":"Run the config rails, rename `ElectionTimeoutLTHeartBeat` to Tiger Style casing, update config/tests call sites, then rerun the slice benchmark.","benchmark_log":"/run/user/1555/tmp/openraft-config-error-slice.jZIC3d","counted_lines":["acronym_style openraft/openraft/src/config/error.rs:31"]}}
{"run":436,"commit":"997f7ae","metric":0,"metrics":{},"status":"keep","description":"Finished the explicit `openraft` config-error Tiger Style slice: renamed `ConfigError::ElectionTimeoutLTHeartBeat` to `ElectionTimeoutLtHeartbeat` and updated the local config parser plus regression test, keeping behavior identical while removing the acronym-style finding. Baseline and post-change `cargo test -p openraft config --lib` stayed green, `cargo check -p openraft` stayed green, and the explicit `config/error.rs` slice dropped from 1 to 0 unique findings.","timestamp":1777047197939,"segment":74,"confidence":null,"iterationTokens":4052,"asi":{"hypothesis":"The lone `config/error.rs` finding is a pure spelling issue on one error variant, so renaming it and the local call sites should fully clean the slice with no semantic impact.","benchmark_log":"/run/user/1555/tmp/openraft-config-error-slice.10QyuW","validation":"Passed `cargo test -p openraft config --lib` before editing and again after the rename, plus `cargo check -p openraft` before and after.","lessons":"Single-variant acronym cleanup is a good late-stage slice when the call-site surface is tiny and test coverage is direct. This was a real naming improvement, not a benchmark-only refactor.","next_action_hint":"Keep preferring small explicit slices with direct behavioral or naming wins. The next honest one-finding candidates are `openraft/openraft/src/base/histogram/mod.rs` (documented allow) or `openraft/openraft/src/core/heartbeat/worker.rs` if its numeric-units site can be fixed without inventing misleading names."}}
{"type":"config","name":"Openraft heartbeat worker Tiger Style slice","metricName":"openraft_heartbeat_worker_slice_findings","metricUnit":"","bestDirection":"lower"}
{"run":437,"commit":"997f7ae","metric":1,"metrics":{},"status":"checks_failed","description":"Baseline for the explicit `openraft` heartbeat-worker Tiger Style slice: with a fresh target dir, `cargo tigerstyle check --output-format human -p openraft -- --target-dir <tmp>` reports 1 unique finding in `openraft/openraft/src/core/heartbeat/worker.rs`, a `numeric_units` hit on the heartbeat timeout local in `do_run()`. No source changes yet.","timestamp":1777047253979,"segment":75,"confidence":null,"iterationTokens":439,"asi":{"hypothesis":"`core/heartbeat/worker.rs` should be another tiny stable slice because the only remaining finding is a timer-like local name on a `Duration`, and an explicit helper or non-quantity name should fix it without touching heartbeat semantics.","rollback_reason":"Baseline-only measurement on a new explicit local metric; no intended source changes for this run.","next_action_hint":"Run the heartbeat-related rails, replace the warning-bearing local with either an inline duration expression or a clearer helper, then rerun the slice benchmark.","benchmark_log":"/run/user/1555/tmp/openraft-heartbeat-worker-slice.u75iFX","counted_lines":["numeric_units openraft/openraft/src/core/heartbeat/worker.rs:93"]}}
{"run":438,"commit":"49eff1b","metric":0,"metrics":{},"status":"keep","description":"Finished the explicit `openraft` heartbeat-worker Tiger Style slice: removed the warning-bearing `Duration` local in `HeartbeatWorker::do_run()` by constructing the heartbeat timeout inline at the two actual use sites (`RPCOption::new` and `C::timeout`), keeping heartbeat behavior unchanged while clearing the last local `numeric_units` hit. Baseline and post-change `cargo test -p openraft send_heartbeat_test --lib` stayed green, `cargo check -p openraft` stayed green, and the explicit `core/heartbeat/worker.rs` slice dropped from 1 to 0 unique findings.","timestamp":1777047317073,"segment":75,"confidence":null,"iterationTokens":4727,"asi":{"hypothesis":"The lone `core/heartbeat/worker.rs` finding is purely the warning-bearing `Duration` local name, so removing that local and keeping the same timeout expression at the two use sites should fully clean the slice without changing heartbeat semantics.","benchmark_log":"/run/user/1555/tmp/openraft-heartbeat-worker-slice.6PsLIa","validation":"Passed `cargo test -p openraft send_heartbeat_test --lib` before editing and again after the change, plus `cargo check -p openraft` before and after.","lessons":"For non-numeric timer values, deleting the warning-bearing local can be cleaner than inventing a new name that may still trip `numeric_units`. This was a narrow, behavior-preserving cleanup rather than a suppression.","next_action_hint":"Continue with small stable explicit openraft slices, but favor ones with direct code improvements over documentation-only allow cleanups. Revisit `core/sm/worker.rs`, `engine/command.rs`, or another one-finding module before considering the noisy broad recalibration idea."}}
{"type":"config","name":"Openraft log_id_option_ext Tiger Style slice","metricName":"openraft_log_id_option_ext_slice_findings","metricUnit":"","bestDirection":"lower"}
