{"run":187,"commit":"8fb71b9","metric":2837,"metrics":{},"status":"keep","description":"Stayed honest on `crates/aspen-testing/src/suite_inventory.rs`: manifest deserialization now uses explicit serde default helpers instead of implicit external defaults, inventory metadata/path discovery uses saturating capacity bounds, generated manifest lists reserve explicit discovery capacity, and validation/record-conversion helpers now carry real invariants without changing inventory semantics. Fresh-target-dir repo-owned workspace metric dropped from 2855 to 2837 (-18).","timestamp":1776550341478,"segment":2,"confidence":8.875219683655535,"iterationTokens":16106,"asi":{"hypothesis":"`crates/aspen-testing/src/suite_inventory.rs` had a concentrated mechanical Tiger Style cluster around implicit serde defaults, missing helper invariants, unchecked vector-capacity math, and unreserved manifest-path collection growth, so explicit default constructors plus bounded-capacity cleanup should remove another double-digit batch without changing suite-inventory behavior.","lessons":"This was another good late-stage target: `cargo check -p aspen-testing` stayed green and the file-local Tiger Style run went to zero after one pass. Replacing repeated `#[serde(default)]` on external collection/option types with tiny local helper constructors is an honest high-yield pattern in this repo.","next_action_hint":"Verify keep reality again, then mine the fresh cold-workspace histogram. Best next honest dense targets now look like `crates/aspen-ci-executor-shell/src/agent/executor.rs`, `crates/aspen-federation/src/sync/client.rs`, `crates/aspen-jobs/src/dlq_inspector.rs`, `crates/aspen-testing-patchbay/src/node.rs`, or another remaining CLI file such as `commands/cluster.rs`.","measurement_note":"Cold benchmark used the same fresh-target-dir full-workspace cargo-tigerstyle wrapper and repo-owned `warning:` parser as prior runs, so 2837 is directly comparable to the 2855 baseline."}}
{"run":188,"commit":"8fb71b9","metric":2819,"metrics":{},"status":"keep","description":"Stayed honest on `crates/aspen-jobs/src/dlq_inspector.rs`: DLQ types now use Tiger Style casing, wall-clock reads flow through one explicit UTC helper, limit expansion/indexing uses saturating `u32` helpers instead of unchecked `* 2` and `as usize`, DLQ export serialization avoids quantity-heuristic locals while keeping checked counts, and job-type share math now guards zero/division and overflow without changing DLQ analysis semantics. Fresh-target-dir repo-owned workspace metric dropped from 2837 to 2819 (-18).","timestamp":1776550829712,"segment":2,"confidence":8.647260273972602,"iterationTokens":15096,"asi":{"hypothesis":"`crates/aspen-jobs/src/dlq_inspector.rs` had a compact mechanical Tiger Style cluster around acronym casing, ambient time reads, unchecked limit multiplication and `usize` casts, and unsafe percentage arithmetic, so renaming types plus adding checked helper boundaries should remove another double-digit batch without changing DLQ behavior.","lessons":"DLQ inspector cleaned up cleanly in one pass: `cargo check -p aspen-jobs` stayed green and the file-local Tiger Style run went to zero. For this lint set, inline construction is sometimes better than naming a local when the quantity-name heuristic keeps firing on otherwise harmless temporaries.","next_action_hint":"Verify keep reality again, then mine the fresh cold-workspace histogram. Best next honest dense targets now look like `crates/aspen-ci-executor-shell/src/agent/executor.rs`, `crates/aspen-federation/src/sync/client.rs`, `crates/aspen-testing-patchbay/src/node.rs`, `crates/aspen-cli/src/bin/aspen-cli/commands/cluster.rs`, or `crates/aspen-sops-install-secrets/src/manifest.rs`.","measurement_note":"Cold benchmark used the same fresh-target-dir full-workspace cargo-tigerstyle wrapper and repo-owned `warning:` parser as prior runs, so 2819 is directly comparable to the 2837 baseline."}}
{"run":189,"commit":"8fb71b9","metric":2802,"metrics":{},"status":"keep","description":"Kept an honest `crates/aspen-sops-install-secrets/src/manifest.rs` cleanup on top of the current dirty batch: manifest deserialization now uses explicit local serde default helpers instead of implicit external defaults for vectors, options, strings, maps, booleans, and logging config, preserving the existing manifest semantics while removing the whole file-local warning cluster. Fresh-target-dir repo-owned workspace metric dropped from 2819 to 2802 (-17).","timestamp":1776551058550,"segment":2,"confidence":8.581138487680544,"iterationTokens":29902,"asi":{"hypothesis":"`crates/aspen-sops-install-secrets/src/manifest.rs` was a concentrated mechanical Tiger Style target made almost entirely of implicit serde-default warnings, so replacing those with explicit local default helper functions should remove another double-digit batch without changing sops manifest semantics.","lessons":"This file was extremely high-yield and low-risk: one explicit-default pass drove the file-local Tiger Style count to zero. For serde-heavy structs in this repo, helper constructors for `Vec`, `Option`, `String`, maps, booleans, and nested config defaults are an honest cleanup pattern that avoids behavior changes.","next_action_hint":"Verify keep reality again, then mine the fresh cold-workspace histogram. Best next honest dense targets now look like `crates/aspen-ci-executor-shell/src/agent/executor.rs`, `crates/aspen-federation/src/sync/client.rs`, `crates/aspen-testing-patchbay/src/node.rs`, `crates/aspen-cli/src/bin/aspen-cli/commands/cluster.rs`, or `crates/aspen-ci/src/orchestrator/pipeline/status.rs`.","error_detail":"Targeted `cargo check -p aspen-sops-install-secrets --bin sops-install-secrets` remains blocked by the pre-existing unrelated `crates/aspen-secrets/src/sops/edit.rs` `tokio::process::Command` missing-feature error, but the full cold workspace benchmark stayed green and `manifest.rs` itself no longer emits local Tiger Style warnings."}}
{"run":190,"commit":"8fb71b9","metric":2785,"metrics":{},"status":"keep","description":"Benchmarked the large staged Tiger Style cleanup batch across calendar, CI, CLI commands, client/blob, cluster config, dogfood, jobs workers, net, secrets, sops installer, testing, and TUI KV. Cold repo-owned warning-site count dropped from 4525 to 2785 (-1740) while the full workspace Tiger Style run finished successfully.","timestamp":1776551712193,"segment":2,"confidence":8.617747440273037,"iterationTokens":29902,"asi":{"hypothesis":"The current staged multi-crate cleanup batch removes a large real slice of repo-owned Tiger Style warnings without cheating or suppressing diagnostics.","lessons":"Cold workspace benchmark stayed stable and showed a very large drop, so the broad staged batch was worth keeping. Need verify commit reality afterward because past `log_experiment keep` runs have reported committed while HEAD/status stayed stale.","next_action_hint":"Confirm HEAD moved and working tree is clean, then re-scan the new warning histogram to pick the next dense repo-owned hotspot."}}
{"run":191,"commit":"8fb71b9","metric":2757,"metrics":{},"status":"keep","description":"Cleaned the remaining warning tail in currently staged files: `aspen-client/src/blob_client.rs` now uses bounded wait polling and unit-suffixed names, `aspen-dogfood/src/main.rs` removes swap-prone helper params plus silent cleanup discards, and `aspen-sops-install-secrets` splits install/finalize flow with explicit install options and bounded unit-slot sizing. Cold repo-owned warning-site count dropped from 2785 to 2757 (-28).","timestamp":1776552512215,"segment":2,"confidence":8.573853989813243,"iterationTokens":72869,"asi":{"hypothesis":"Finishing the current staged-file warning tail in blob-client, dogfood main, and sops install should yield another real cold-workspace drop without broad refactors.","lessons":"Localized cleanup after a big batch still pays off when the remaining staged-file warnings are isolated and measurable. A quick changed-file Tiger Style filter is enough to find the next cheap wins before another cold workspace run.","next_action_hint":"Verify HEAD/status again, then re-scan changed-file or full-workspace warnings and pick the next dense mechanical hotspot, likely `aspen-cli/commands/federation.rs` or another still-dirty staged file."}}
{"run":192,"commit":"8fb71b9","metric":2748,"metrics":{},"status":"keep","description":"Finished the remaining warning tail in the staged CLI/client slice: `aspen-cli/commands/federation.rs` now pushes nested success-path printing into small helpers/input structs, `aspen-cli/cli.rs` replaces panicing `unreachable!` dispatcher arms with explicit errors, and `aspen-client/src/blob_client.rs` renames the final list-limit binding. Cold repo-owned warning-site count dropped from 2757 to 2748 (-9).","timestamp":1776552847650,"segment":2,"confidence":8.487394957983193,"iterationTokens":21810,"asi":{"hypothesis":"Clearing the last staged warnings in federation CLI dispatch and blob-client naming should still produce a measurable cold-workspace improvement.","lessons":"Once the staged-file filter reaches zero, even small cold-workspace wins are reliable and cheap. Helper extraction is enough to remove conditional-depth warnings without changing command semantics.","next_action_hint":"Verify HEAD/status again, then either rescan staged-file warnings or pull a fresh workspace histogram to choose the next dense mechanical hotspot from the remaining staged batch."}}
{"run":193,"commit":"8fb71b9","metric":2733,"metrics":{},"status":"keep","description":"Refactored `aspen-cli/commands/counter.rs` to share a single counter-response printer, renamed the repeated JSON flag to `is_json_output`, and collapsed seven duplicated success/error blocks into short wrappers. Cold repo-owned warning-site count dropped from 2748 to 2733 (-15).","timestamp":1776553090123,"segment":2,"confidence":8.480268681780016,"iterationTokens":16705,"asi":{"hypothesis":"The repetitive counter CLI command file is a cheap Tiger Style hotspot: one shared response helper should remove both the boolean-prefix warnings and the assertion-density warnings in one pass.","lessons":"Small highly repetitive CLI files remain excellent yield late in the loop. Helper extraction removes multiple warning classes at once without semantic risk or broad refactors.","next_action_hint":"Pull a fresh workspace histogram and keep farming the repetitive CLI tail (`hooks`, `semaphore`, `blob`, etc.) or another dense mechanical hotspot with similar duplicated handlers."}}
{"run":194,"commit":"8fb71b9","metric":2723,"metrics":{},"status":"keep","description":"Refactored `aspen-cli/commands/semaphore.rs` along the same repetitive-CLI path as counter: renamed permit-capacity fields to `max_permits`, switched JSON flags to `is_json_output`, and collapsed the duplicated success/exit handling into a shared printer. Cold repo-owned warning-site count dropped from 2733 to 2723 (-10).","timestamp":1776553372340,"segment":2,"confidence":8.416666666666666,"iterationTokens":14225,"asi":{"hypothesis":"`semaphore.rs` repeats the same mechanical warning pattern as `counter.rs`, so one shared output path and clearer capacity naming should remove another small batch cheaply.","lessons":"The repetitive CLI command family is still yielding steady low-risk wins. Renaming confusing quantity fields while preserving clap flags (`--capacity`) keeps UX stable and removes multiple lint classes at once.","next_action_hint":"Continue farming the CLI tail with another repetitive command file like `hooks.rs`, `blob.rs`, or `lease.rs`, or switch to a denser non-CLI hotspot once these easy slices thin out."}}
{"run":195,"commit":"8fb71b9","metric":2714,"metrics":{},"status":"keep","description":"Cleaned two more repetitive CLI coordination commands: `aspen-cli/commands/lease.rs` now shares a generic checked-output printer with `is_json_output` naming, and `aspen-cli/commands/semaphore.rs` got final local invariants so its shared-output refactor is fully Tiger Style-clean. Cold repo-owned warning-site count dropped from 2723 to 2714 (-9).","timestamp":1776553567653,"segment":2,"confidence":8.423686405337781,"iterationTokens":9131,"asi":{"hypothesis":"Finishing the same helper-extraction pattern on `lease.rs`, plus closing the remaining semaphore assertion-density tail, should yield another small but real workspace drop.","lessons":"Related CLI subcommands can be cleaned in clusters; once one pattern works, applying it to sibling files is fast and low-risk. Also, benchmark after the follow-up cleanup, not halfway through a partially warning-free refactor.","next_action_hint":"Keep harvesting the coordination/CLI family (`lock.rs`, `ratelimit.rs`, `sequence.rs`, maybe `blob.rs`) or switch back to a denser non-CLI hotspot if the per-file wins shrink too far."}}
{"run":196,"commit":"8fb71b9","metric":2705,"metrics":{},"status":"keep","description":"Resumed from missing repo-local `autoresearch.md` plus git log/autoresearch.jsonl context, then cleaned another repetitive CLI coordination file: `aspen-cli/commands/lock.rs` now uses predicate-style `is_json_output`, a shared checked-output printer, and explicit command-boundary invariants across acquire/try/release/renew without changing lock RPC behavior. Cold repo-owned warning-site count dropped from 2714 to 2705 (-9).","timestamp":1776553799317,"segment":2,"confidence":8.430717863105174,"iterationTokens":26378,"asi":{"hypothesis":"`lock.rs` matches the same low-risk repetitive CLI pattern as lease/semaphore, so one shared output path plus local invariants should remove about nine workspace-visible warning sites cheaply.","lessons":"`autoresearch.md` is still absent in this repo, so resume context continues to come from git log plus `autoresearch.jsonl`. The repetitive coordination CLI family keeps yielding stable late-stage wins when normalized with the same honest helper pattern.","next_action_hint":"Verify keep reality again, then keep harvesting the CLI coordination tail (`ratelimit.rs`, `sequence.rs`, maybe `blob.rs`) or pivot to a denser non-CLI hotspot like `aspen-ci-executor-shell/src/agent/executor.rs` once these easy slices thin out."}}
{"run":197,"commit":"8fb71b9","metric":2692,"metrics":{},"status":"keep","description":"Kept another repetitive CLI coordination cleanup: `aspen-cli/commands/ratelimit.rs` now preserves `--capacity` through `max_tokens`, uses predicate-style `is_json_output`, shares one checked-output printer, and adds explicit command-boundary invariants across try-acquire/acquire/available/reset without changing rate-limiter RPC behavior. Cold repo-owned warning-site count dropped from 2705 to 2692 (-13).","timestamp":1776554043192,"segment":2,"confidence":8.444816053511706,"iterationTokens":12361,"asi":{"hypothesis":"`ratelimit.rs` matches the same low-risk repetitive CLI pattern as lock/lease/semaphore, so one shared output path plus clearer capacity naming should remove about a dozen workspace-visible warning sites cheaply.","lessons":"The coordination CLI family is still fertile this late in the loop; renaming internal capacity bindings while preserving clap flags removes both naming and assertion-density warnings at once. `autoresearch.md` remains absent, so git log plus `autoresearch.jsonl` stay the durable resume path.","next_action_hint":"Verify keep reality again, then finish the last nearby coordination CLI tail (`sequence.rs`) or pivot to a denser non-CLI hotspot like `aspen-ci-executor-shell/src/agent/executor.rs` once the easy sibling files run out."}}
{"run":198,"commit":"8fb71b9","metric":2685,"metrics":{},"status":"keep","description":"Finished the remaining small coordination CLI tail: `aspen-cli/commands/sequence.rs` now uses predicate-style `is_json_output`, one shared checked-output printer, and explicit command-boundary invariants across next/reserve/current without changing sequence RPC behavior. Cold repo-owned warning-site count dropped from 2692 to 2685 (-7).","timestamp":1776554175614,"segment":2,"confidence":8.458961474036851,"iterationTokens":4315,"asi":{"hypothesis":"`sequence.rs` is the same repetitive late-stage coordination CLI shape as lock/lease/ratelimit, so the same helper-and-invariant cleanup should remove its remaining workspace-visible warning sites cheaply.","lessons":"The coordination CLI subfamily is now mostly exhausted; the next returns from sibling files will likely shrink, so it is time to pivot back toward denser non-CLI hotspots. `autoresearch.md` still absent; git log plus `autoresearch.jsonl` remain the real session memory.","next_action_hint":"Verify keep reality again, then pivot to a denser non-CLI file such as `aspen-ci-executor-shell/src/agent/executor.rs`, `aspen-jobs-worker-maintenance/src/lib.rs`, `aspen-client/src/observability.rs`, or `aspen-forge-web/src/templates.rs`."}}
{"run":199,"commit":"25d729b","metric":2666,"metrics":{},"status":"keep","description":"Cleaned `crates/aspen-ci-executor-shell/src/agent/executor.rs`: executor timing now routes tokio monotonic reads through explicit helpers, heartbeat/timeout locals avoid quantity-name lint traps, nix DB dump loading is split into focused helpers with command-boundary invariants, and the file-local Tiger Style slice is now clean. Fresh-target-dir repo-owned workspace metric dropped from 2685 to 2666 (-19).","timestamp":1776562844703,"segment":2,"confidence":8.437761069340016,"iterationTokens":4315,"asi":{"hypothesis":"`crates/aspen-ci-executor-shell/src/agent/executor.rs` had a small honest late-stage cluster around ambient tokio clock reads, quantity-style local names, and an overlong nix-db loader helper, so boundary helpers plus helper extraction should remove its remaining local Tiger Style warnings and yield a measurable workspace drop.","lessons":"Current full-workspace cold run shows this file was worth the cleanup: a targeted package check stayed green and the file-local Tiger Style output went to zero before the benchmark. Even when the stale histogram says 19 warnings, rerunning the package-local linter first gives a better measure of the remaining real tail.","next_action_hint":"Verify keep reality again, then mine `/tmp/aspen-tigerstyle-log.u8nfeX` for the next current dense repo-owned hotspot. Likely remaining honest targets include `crates/aspen-forge-web/src/templates.rs`, `crates/aspen-blob/src/{replication/manager.rs,store/iroh_store.rs}`, `crates/aspen-jobs/src/job.rs`, `crates/aspen-federation/src/sync/client.rs`, or another still-dirty CLI file like `commands/cluster.rs`."}}
{"run":200,"commit":"25d729b","metric":2650,"metrics":{},"status":"keep","description":"Cleaned the repeated cluster CLI handler tail in `crates/aspen-cli/src/bin/aspen-cli/commands/cluster.rs`: cluster subcommands now carry explicit command-boundary invariants for init/status/health/metrics/network/membership/deploy/rollback paths, leaving only the known overlong `deploy_wait` helper in that file. Fresh-target-dir repo-owned workspace metric dropped from 2666 to 2650 (-16).","timestamp":1776563043904,"segment":2,"confidence":8.416666666666666,"iterationTokens":11268,"asi":{"hypothesis":"`crates/aspen-cli/src/bin/aspen-cli/commands/cluster.rs` was a classic late-stage repetitive CLI hotspot: many short RPC wrapper functions had zero assertion density, so adding real input/output invariants should clear almost the whole file cheaply while leaving semantics unchanged.","lessons":"This repetitive CLI pattern is still paying off: targeted `cargo check -p aspen-cli` stayed green and the cluster file fell from 17 local warnings to just the pre-existing `deploy_wait` length warning. Also, `log_experiment keep` still reports a commit without advancing HEAD in this repo state, so verify `git rev-parse --short HEAD` plus `git status --short` after each keep instead of trusting the tool banner.","next_action_hint":"Verify keep reality again, then mine `/tmp/aspen-tigerstyle-log.z0dgqk` for the next current dense repo-owned hotspot. Best next honest targets likely include `crates/aspen-forge-web/src/templates.rs`, `crates/aspen-blob/src/{replication/manager.rs,store/iroh_store.rs}`, `crates/aspen-jobs/src/job.rs`, `crates/aspen-federation/src/sync/client.rs`, or the remaining `deploy_wait` split in `commands/cluster.rs`."}}
