{"run":276,"commit":"a9614f0","metric":4,"metrics":{},"status":"checks_failed","description":"Rebased the loop onto the next explicit sharding-only Tiger Style sub-slice: `crates/aspen-sharding/src/automation.rs`. The new stable metric counts unique Tiger Style finding locations only in that file, and the current baseline is 4 locations centered on timer/byte unit naming, two shell-boundary wall-clock reads, and the combined-size arithmetic line.","timestamp":1776971301418,"segment":13,"confidence":null,"iterationTokens":928,"asi":{"hypothesis":"A dedicated automation-only location slice will provide a stable monotonic benchmark for the remaining `automation.rs` findings after the router slice reached zero.","rollback_reason":"Baseline-only measurement on a newly stabilized target; no intended code changes for this cycle.","next_action_hint":"Rename the interval and combined-size locals with unit suffixes, isolate the two timestamp reads behind a documented shell-boundary helper, and make the combined-size sum saturating so the automation slice can drop to zero."}}
{"run":277,"commit":"aad2e9f","metric":0,"metrics":{},"status":"keep","description":"Finished the explicit `crates/aspen-sharding/src/automation.rs` Tiger Style sub-slice: automation now routes topology timestamps through one documented shell-boundary helper, uses non-quantity timer naming plus `combined_size_bytes` with saturating arithmetic, and targeted `cargo test -p aspen-sharding --lib` plus the automation-only Tiger Style slice both stayed green. The explicit automation-only location slice dropped from 4 to 0.","timestamp":1776971435549,"segment":13,"confidence":null,"iterationTokens":1241,"asi":{"hypothesis":"Renaming the timer local away from quantity heuristics, isolating the two topology timestamp reads behind one shell-boundary helper, and making the combined-size sum unit-explicit plus saturating should eliminate the remaining automation.rs findings without changing automation behavior.","lessons":"For small sharding files, a location-based per-file metric is stable enough to drive clean zero-finding slices. The automation timer warning showed that even names containing `interval` can trip the unit-suffix lint, so non-quantity timer names like `check_tick_timer` are the right escape hatch when the value is not itself a numeric quantity.","next_action_hint":"Choose the next explicit sharding-only slice instead of returning to the noisy broad rail. `sharded.rs` is the last dense file in this crate, so split it into smaller sub-slices around lock-order docs, scan limit/capacity handling, and test assertion/overflow cleanup."}}
{"type":"config","name":"Aspen sharding Tiger Style slice (sharded scan unique finding locations)","metricName":"sharded_scan_slice_findings","metricUnit":"","bestDirection":"lower"}
{"run":278,"commit":"aad2e9f","metric":3,"metrics":{},"status":"checks_failed","description":"Rebased the loop onto the next explicit sharding-only Tiger Style sub-slice: the `scan()` hot path in `crates/aspen-sharding/src/sharded.rs`. The new stable metric counts unique Tiger Style finding locations only at the current scan-limit/capacity sites, and the baseline is 3 locations: one unchecked division for per-shard limits, one unbounded result growth, and one limit cast/name site.","timestamp":1776971507072,"segment":14,"confidence":null,"iterationTokens":405,"asi":{"hypothesis":"A dedicated sharded-scan location slice will provide a stable monotonic benchmark for the remaining `scan()` findings after the automation slice reached zero.","rollback_reason":"Baseline-only measurement on a newly stabilized target; no intended code changes for this cycle.","next_action_hint":"Bound the shard-count division explicitly, reserve `all_entries` from the overall request limit, and route the overall limit through a checked helper with clearer `max_results` naming so the scan slice can drop to zero."}}
{"run":279,"commit":"39e1b90","metric":0,"metrics":{},"status":"keep","description":"Finished the explicit `scan()` Tiger Style sub-slice in `crates/aspen-sharding/src/sharded.rs`: scan limits now flow through named checked helpers, the merged result buffer pre-reserves bounded capacity from the overall request limit, and per-shard limits use an explicit nonzero divisor path instead of raw division/casts. Targeted `cargo test -p aspen-sharding --lib` plus the scan-only Tiger Style slice both stayed green, and the explicit scan location slice dropped from 3 to 0.","timestamp":1776971683126,"segment":14,"confidence":null,"iterationTokens":8012,"asi":{"hypothesis":"Bounding the overall scan limit through small checked helpers, pre-reserving the merged result vector, and normalizing the shard-count divisor should eliminate the remaining `scan()` findings without changing sharded scan behavior.","lessons":"For dense files like `sharded.rs`, splitting work into tiny sub-slices around concrete line clusters keeps the metric stable and the edits low-risk. Shared local helpers for requested limits/capacity/divisors remove multiple warning classes at once and are easier to reason about than patching each site inline.","next_action_hint":"Stay on explicit sharding-only sub-slices rather than returning to the noisy broad rail. Remaining good `sharded.rs` candidates are the lock-order doc at the struct boundary, the sorted-result test overflow lines, or the four assertion-density request-path tests."}}
{"type":"config","name":"Aspen sharding Tiger Style slice (sharded lock+sorted-test unique finding locations)","metricName":"sharded_tail_slice_findings","metricUnit":"","bestDirection":"lower"}
{"run":280,"commit":"39e1b90","metric":3,"metrics":{},"status":"checks_failed","description":"Rebased the loop onto the next explicit sharding-only Tiger Style sub-slice: the `ShardedKeyValueStore` lock-order doc plus the sorted-scan test overflow lines in `crates/aspen-sharding/src/sharded.rs`. The new stable metric counts unique finding locations only at those three sites, and the baseline is 3 locations: one missing lock-order note and two overflow-prone sorted-result test lines.","timestamp":1776972000835,"segment":15,"confidence":null,"iterationTokens":376,"asi":{"hypothesis":"A dedicated sharded tail slice around the lock-order doc and sorted-result test lines will provide a stable monotonic benchmark for the next low-risk `sharded.rs` cleanup after the scan slice reached zero.","rollback_reason":"Baseline-only measurement on a newly stabilized target; no intended code changes for this cycle.","next_action_hint":"Document the `topology` -> `shards` lock ordering on `ShardedKeyValueStore`, then rewrite the sorted-result check to compare adjacent `windows(2)` entries so the two overflow-prone index lines disappear without changing test coverage."}}
{"run":281,"commit":"a5a0900","metric":0,"metrics":{},"status":"keep","description":"Finished the explicit `ShardedKeyValueStore` lock-order plus sorted-scan-test Tiger Style sub-slice in `crates/aspen-sharding/src/sharded.rs`: the struct now documents `topology` -> `shards` ordering, and the sorted-result test now compares adjacent `windows(2)` entries instead of overflow-prone index arithmetic. Targeted `cargo test -p aspen-sharding --lib` plus the sharded-tail Tiger Style slice both stayed green, and the explicit tail slice dropped from 3 to 0.","timestamp":1776972062370,"segment":15,"confidence":null,"iterationTokens":1402,"asi":{"hypothesis":"Documenting the intended lock ordering on `ShardedKeyValueStore` and rewriting the sorted-result assertion around adjacent windows should eliminate those three remaining `sharded.rs` tail findings without changing behavior.","lessons":"Tiny explicit tail slices still work well once a file has only a few mechanical warnings left. `windows(2)` is the cleanest non-cheating fix for sorted-order test comparisons because it removes both overflow-prone index sites and keeps the ordering property visible.","next_action_hint":"Stay on explicit sharding-only sub-slices rather than returning to the noisy broad rail. The remaining dense `sharded.rs` work is now the four assertion-density request-path tests, so define a test-only assertion slice for lines 544/582/620/667 next."}}
{"type":"config","name":"Aspen sharding Tiger Style slice (sharded request-path test unique finding locations)","metricName":"sharded_request_test_slice_findings","metricUnit":"","bestDirection":"lower"}
{"run":282,"commit":"a5a0900","metric":4,"metrics":{},"status":"checks_failed","description":"Rebased the loop onto the next explicit sharding-only Tiger Style sub-slice: the four request-path tests in `crates/aspen-sharding/src/sharded.rs` that still lack enough visible invariants. The stable metric counts unique warning locations in the request-path test range, and the baseline is 4 locations at the four test entrypoints for shard-moved/not-ready behavior.","timestamp":1776972164948,"segment":16,"confidence":null,"iterationTokens":405,"asi":{"hypothesis":"A dedicated sharded request-path test slice will provide a stable monotonic benchmark for the remaining assertion-density findings after the lock-order and sorted-test tail reached zero.","rollback_reason":"Baseline-only measurement on a newly stabilized target; no intended code changes for this cycle.","next_action_hint":"Add real post-search invariants to each request-path test: assert the discovered key is non-empty and routes to the expected shard/transition state before exercising the error path."}}
{"run":283,"commit":"c894e73","metric":0,"metrics":{},"status":"keep","description":"Finished the explicit sharded request-path test Tiger Style sub-slice in `crates/aspen-sharding/src/sharded.rs`: the shard-moved/tombstone/splitting/merging tests now assert that each discovered key is non-empty and still routes to the expected shard before exercising the error path. Targeted `cargo test -p aspen-sharding --lib` plus the request-path test slice both stayed green, and the explicit request-path test slice dropped from 4 to 0.","timestamp":1776972250676,"segment":16,"confidence":null,"iterationTokens":1956,"asi":{"hypothesis":"Adding real post-search invariants to the four sharded request-path tests should eliminate their remaining assertion-density findings without changing behavior.","lessons":"Assertion-density cleanup in tests is cleanest when the new checks capture the exact preconditions the test depends on—in this case, finding a non-empty key that still hashes to the intended shard. A range-based per-file metric is stable enough for small test clusters as long as the slice is narrowly scoped.","next_action_hint":"Keep the explicit sharding-only loop going. Remaining candidates in `sharded.rs` are now tiny, so either define one more narrow slice for any leftover locations or re-scan the crate and pick the next densest coherent file instead of broadening back to the noisy full-workspace rail."}}
{"type":"config","name":"Aspen sharding Tiger Style slice (sharded remaining unique finding locations)","metricName":"sharded_remaining_slice_findings","metricUnit":"","bestDirection":"lower"}
{"run":284,"commit":"c894e73","metric":2,"metrics":{},"status":"checks_failed","description":"Rebased the loop onto the last explicit sharding-only Tiger Style sub-slice in `crates/aspen-sharding/src/sharded.rs`. The stable metric counts unique warning locations only at the remaining lock-order and sentinel-fallback sites, and the baseline is 2 locations: one missing lock-order note on `ShardedKeyValueStore` and one sentinel fallback in `scan_result_capacity()`.","timestamp":1776972422667,"segment":17,"confidence":null,"iterationTokens":371,"asi":{"hypothesis":"A final sharded-only tail slice around the lock-order doc and scan-capacity conversion will provide a stable monotonic benchmark for clearing the crate without widening back to the noisy broad rail.","rollback_reason":"Baseline-only measurement on a newly stabilized target; no intended code changes for this cycle.","next_action_hint":"Move the lock-order note onto the actual lock field docs so Tiger Style sees it, and turn `scan_result_capacity()` into an explicit fallible conversion that returns a `KeyValueStoreError` instead of masking conversion failure with `usize::MAX`."}}
{"run":285,"commit":"aba96ec","metric":0,"metrics":{},"status":"keep","description":"Finished the last explicit `sharded.rs` Tiger Style tail slice: the `shards` field now carries the visible `topology` -> `shards` lock-order note that Tiger Style expects, and `scan_result_capacity()` now returns an explicit `KeyValueStoreError` instead of masking conversion failure with `usize::MAX`. Targeted `cargo test -p aspen-sharding --lib` plus the remaining-tail Tiger Style slice both stayed green, and the explicit final sharded slice dropped from 2 to 0.","timestamp":1776972502132,"segment":17,"confidence":null,"iterationTokens":2233,"asi":{"hypothesis":"Moving the lock-order note onto the actual lock field docs and turning `scan_result_capacity()` into an explicit fallible conversion should eliminate the last two `sharded.rs` findings without changing behavior.","lessons":"For lock-order lints in this repo, the note must live on the lock field itself, not only in the surrounding struct docs. When a conversion failure is genuinely impossible on current targets but still part of the type contract, propagating an explicit `KeyValueStoreError` is cleaner and less benchmark-fragile than hiding it behind a sentinel fallback.","next_action_hint":"Re-scan `cargo tigerstyle check -p aspen-sharding`; if the crate is now clean, promote the loop back to a broader honest sharding or coordination+sharding rail only after establishing a fresh baseline rather than assuming the old noisy metric still applies."}}
{"type":"config","name":"Aspen coordination Tiger Style slice (production unique finding locations)","metricName":"coordination_prod_slice_findings","metricUnit":"","bestDirection":"lower"}
{"run":286,"commit":"aba96ec","metric":0,"metrics":{},"status":"crash","description":"Baseline parser bug on the new coordination production slice: the regex collector took the first character of each matched location string, so the reported metric `1` was meaningless (`c` printed instead of a real path). No code signal from this run.","timestamp":1776972826675,"segment":18,"confidence":null,"iterationTokens":384,"asi":{"hypothesis":"A focused coordination production slice around `registry/discovery.rs` and `verified/lockset.rs` should provide a stable next benchmark after sharding cleanup.","rollback_reason":"The measurement script was wrong, so this cycle did not produce a trustworthy metric.","next_action_hint":"Rerun the exact baseline with a corrected parser that records the full matched location string before making any source changes."}}
{"run":287,"commit":"aba96ec","metric":3,"metrics":{},"status":"checks_failed","description":"Rebased the loop onto a focused coordination production slice after the sharding cleanup. The stable metric counts unique production warning locations only in `crates/aspen-coordination/src/registry/discovery.rs` and `crates/aspen-coordination/src/verified/lockset.rs`, and the corrected baseline is 3 locations: one sentinel fallback in discovery-limit conversion and two sentinel fallbacks in lockset member/takeover counts.","timestamp":1776972865602,"segment":18,"confidence":null,"iterationTokens":1125,"asi":{"hypothesis":"A narrow coordination production slice around discovery limit conversion and lockset count helpers will provide a stable next benchmark after the sharding crate reached zero findings.","rollback_reason":"Baseline-only measurement on a newly stabilized target; no intended code changes for this cycle.","next_action_hint":"Turn the discovery limit conversion into an explicit `anyhow::Result<usize>` path, and replace the two `unwrap_or(...::MAX)` lockset count conversions with explicit branches that preserve semantics without sentinel fallbacks."}}
{"run":288,"commit":"88105b0","metric":0,"metrics":{},"status":"keep","description":"Finished the focused coordination production Tiger Style slice after the sharding cleanup: service discovery limit conversion now returns an explicit `anyhow::Result<usize>` instead of masking failure with `usize::MAX`, `validate_lockset_count()` now returns an explicit `TooManyMembers` branch on oversized member lists, and lockset takeover counting now stays in `u64` with saturating accumulation instead of sentinel-capped `u32` conversion. Targeted `cargo test -p aspen-coordination --lib` plus the coordination production slice both stayed green, and the explicit production slice dropped from 3 unique findings to 0.","timestamp":1776973074979,"segment":18,"confidence":null,"iterationTokens":5286,"asi":{"hypothesis":"Replacing the remaining sentinel fallbacks in coordination discovery and verified lockset helpers with explicit error/typed-count paths should eliminate the last production warnings in that focused slice without changing behavior.","lessons":"Once sharding was cleaned, a narrow coordination production slice became stable enough to drive real wins. For pure helpers, changing the type contract (`u32` -> `u64`) can be cleaner and less benchmark-fragile than preserving a narrower type plus sentinel overflow handling.","next_action_hint":"Refresh the broader honest rail before touching more files. Good next steps are to re-baseline `cargo tigerstyle check -p aspen-coordination -p aspen-sharding` or a slightly wider workspace-owned slice and then pick the next densest production hotspot rather than staying on solved files."}}
{"type":"config","name":"Aspen layer Tiger Style slice (count accessor unique finding locations)","metricName":"layer_count_slice_findings","metricUnit":"","bestDirection":"lower"}
{"run":289,"commit":"88105b0","metric":4,"metrics":{},"status":"checks_failed","description":"Rebased the loop onto a focused layer production slice after cleaning sharding and the remaining coordination production helpers. The stable metric counts unique production warning locations only at the four count-accessor sites in `aspen-layer` (`index/{registry,scan,updates}.rs` and `tuple/tuple_type.rs`), and the baseline is 4 sentinel-fallback locations.","timestamp":1776973345968,"segment":19,"confidence":null,"iterationTokens":364,"asi":{"hypothesis":"A narrow layer slice around the four count-accessor sentinel fallbacks will provide a stable next benchmark after the sharding and coordination production slices reached zero.","rollback_reason":"Baseline-only measurement on a newly stabilized target; no intended code changes for this cycle.","next_action_hint":"Make the `u32` saturation behavior explicit in the four count accessors instead of hiding it behind `unwrap_or(u32::MAX)`, then rerun the same focused layer slice with `cargo test -p aspen-layer --lib`."}}
{"run":290,"commit":"c57055c","metric":0,"metrics":{},"status":"keep","description":"Finished the focused `aspen-layer` count-accessor Tiger Style slice: the four remaining `u32` count accessors in `index/{registry,scan,updates}.rs` and `tuple/tuple_type.rs` now spell out saturation with explicit `match u32::try_from(...)` branches instead of hiding it behind `unwrap_or(u32::MAX)`. Targeted `cargo test -p aspen-layer --lib` plus the focused layer slice both stayed green, and the explicit layer count slice dropped from 4 to 0.","timestamp":1776973442989,"segment":19,"confidence":null,"iterationTokens":1759,"asi":{"hypothesis":"Making the `u32` saturation behavior explicit in the four count accessors should eliminate the remaining `aspen-layer` production warnings in that narrow slice without changing observable behavior.","lessons":"Explicit saturation branches are acceptable here because the API contract already returns bounded `u32` counts; the problem was hidden fallback, not the saturation semantics themselves. The focused production-slice approach remains stable even when measured against full-workspace `cargo tigerstyle check`, as long as the parser filters only the intended repo-owned locations.","next_action_hint":"Refresh the workspace production histogram again. The remaining repo-owned production hotspots now look concentrated in `aspen-auth-core`, so a narrow pure-helper slice there is the next honest target."}}
{"type":"config","name":"Aspen hooks-ticket Tiger Style slice (lib unique finding locations)","metricName":"hooks_ticket_slice_findings","metricUnit":"","bestDirection":"lower"}
{"run":291,"commit":"c57055c","metric":5,"metrics":{},"status":"checks_failed","description":"Rebased the loop onto a focused `aspen-hooks-ticket` production slice. The stable metric counts unique Tiger Style warning locations only in `crates/aspen-hooks-ticket/src/lib.rs`, and the baseline is 5 locations: two const-multiplication overflow sites, one `expect()` in `Ticket::to_bytes`, one assertion-density site in `validate_ticket_fields`, and one sentinel fallback in the `usize`→`u32` helper.","timestamp":1776973886827,"segment":20,"confidence":null,"iterationTokens":351,"asi":{"hypothesis":"A narrow hooks-ticket slice around the five production warning locations will provide a stable next benchmark after the sharding, coordination, and layer slices reached zero.","rollback_reason":"Baseline-only measurement on a newly stabilized target; no intended code changes for this cycle.","next_action_hint":"Replace the hour/day second constants with direct named values, make `to_bytes` handle serialization failure explicitly in a fail-closed way, add real local invariants inside `validate_ticket_fields`, and turn the `usize`→`u32` helper into an explicit saturation branch."}}
