{"run":453,"commit":"ab90c2c","metric":0,"metrics":{"cargo_status":2},"status":"crash","description":"Bad baseline attempt for the explicit `openraft` state-machine-worker slice: the Tiger Style run produced a valid summary, but my parser omitted the crate column in summary rows, so it falsely reported 0 findings while the log contains `unbounded_loop openraft/openraft/src/core/sm/worker.rs:102`. No source changes were made.","timestamp":1777170829308,"segment":83,"confidence":null,"iterationTokens":458,"asi":{"hypothesis":"`core/sm/worker.rs` likely has one structural `unbounded_loop` finding on the main state-machine event loop, but the first measurement command parsed the summary format incorrectly.","rollback_reason":"Metric was invalid because the parser expected `lint path` but Tiger Style summary rows are `lint crate path`.","next_action_hint":"Rerun the same baseline with a parser that accounts for the crate column, then inspect `worker.rs:102` before deciding whether an allow with documented event-loop bounds or a shell refactor is better.","benchmark_log":"/run/user/1555/tmp/openraft-sm-worker-slice.D5Vj07","error_details":"Parser missed rows like `F85 unbounded_loop openraft openraft/openraft/src/core/sm/worker.rs:102`."}}
{"run":454,"commit":"ab90c2c","metric":1,"metrics":{"cargo_status":2},"status":"checks_failed","description":"Corrected baseline for the explicit `openraft` state-machine-worker Tiger Style slice: with a fresh target dir and the fixed summary parser, `cargo tigerstyle check --output-format human -p openraft -- --target-dir <tmp>` reports 1 unique finding in `openraft/openraft/src/core/sm/worker.rs`, an `unbounded_loop` hit on the main state-machine worker receive loop. No source changes yet.","timestamp":1777170850696,"segment":83,"confidence":null,"iterationTokens":5125,"asi":{"hypothesis":"`core/sm/worker.rs` is now a one-finding structural slice; the remaining warning is likely the intentional long-lived state-machine event loop and needs either a documented bounded-shell justification or a small refactor that exposes its shutdown and backpressure bounds.","rollback_reason":"Baseline-only measurement on a corrected local metric; no intended source changes for this run.","next_action_hint":"Inspect `worker.rs:102` and surrounding loop/shutdown logic, then prefer a narrow explicit allow with reason only if the loop is a necessary service loop with bounded channel/backpressure and deterministic shutdown. Otherwise refactor the loop shell into a small named event-step helper and rerun the slice benchmark.","benchmark_log":"/run/user/1555/tmp/openraft-sm-worker-slice.cwq6Ux","counted_lines":["unbounded_loop openraft/openraft/src/core/sm/worker.rs:102"],"note":"Run #453 is an invalid parser crash and should not be treated as a real 0 baseline."}}
{"run":455,"commit":"ab90c2c","metric":1,"metrics":{"cargo_status":2},"status":"discard","description":"Tried to clear the explicit `core/sm/worker.rs` slice with a documented `#[allow(unbounded_loop)]` on `worker_loop()` plus explicit install-snapshot response-send handling, but Tiger Style still reported the same `unbounded_loop` at the inner async block loop. Primary metric stayed 1, so discard and look for a structural rewrite instead of relying on the function-level allow.","timestamp":1777171015750,"segment":83,"confidence":null,"iterationTokens":20241,"asi":{"hypothesis":"A documented function-level allow might be sufficient for the intentional state-machine service loop while preserving ordinary behavior and improving a nearby ignored send result.","rollback_reason":"Primary metric did not improve: the custom Tiger Style lint still reported `unbounded_loop openraft/openraft/src/core/sm/worker.rs:102`, likely because the loop lives inside an inner async block/instrumentation closure and the function-level allow did not apply.","next_action_hint":"Try moving the allow onto the inner async block or, better, refactor `worker_loop()` into a loop shell that calls a `process_command()` helper and see whether the lint can be satisfied without suppressing. Keep the explicit dropped-send handling only if the primary metric improves in the same run.","benchmark_log":"/run/user/1555/tmp/openraft-sm-worker-slice.uFho7v","counted_lines":["unbounded_loop openraft/openraft/src/core/sm/worker.rs:102"],"lesson":"Custom Tiger Style suppression scope may not cross inner async blocks created for tracing instrumentation."}}
{"run":456,"commit":"ab90c2c","metric":1,"metrics":{"cargo_status":2},"status":"discard","description":"Tried moving the documented `unbounded_loop` allow onto the loop statement in `core/sm/worker.rs`, keeping the explicit dropped install-snapshot response handling, but Tiger Style still reported the same worker-loop finding. Primary metric stayed 1, so discard this suppression route and avoid further allow-only attempts.","timestamp":1777171077247,"segment":83,"confidence":null,"iterationTokens":6573,"asi":{"hypothesis":"The custom lint might respect statement-scoped `#[allow(unbounded_loop)]` even though function-scoped allow did not cross the inner async block.","rollback_reason":"Primary metric did not improve; `unbounded_loop openraft/openraft/src/core/sm/worker.rs:102` remained in the summary. Suppression attributes are not honored by this Tiger Style run for this lint/site.","next_action_hint":"Stop trying allow scopes. Revert or overwrite the suppression patch with a structural change: extract command dispatch into a helper so the loop body is trivial, or change the explicit slice target to a different remaining one-finding file if the service loop is intentionally out of scope for code changes.","benchmark_log":"/run/user/1555/tmp/openraft-sm-worker-slice.yPHhVt","counted_lines":["unbounded_loop openraft/openraft/src/core/sm/worker.rs:102"],"lesson":"For this Dylint/Tiger Style configuration, `#[allow(unbounded_loop)]` did not suppress the custom lint at function or statement scope."}}
{"type":"config","name":"Openraft storage callback Tiger Style slice","metricName":"openraft_storage_callback_slice_findings","metricUnit":"","bestDirection":"lower"}
{"run":457,"commit":"ab90c2c","metric":1,"metrics":{"cargo_status":2},"status":"checks_failed","description":"Baseline for the explicit `openraft` storage-callback Tiger Style slice: with a fresh target dir, `cargo tigerstyle check --output-format human -p openraft -- --target-dir <tmp>` reports 1 unique finding in `openraft/openraft/src/storage/callback.rs`, a `bool_naming` hit on the `send_if_modified` result local. No source changes yet.","timestamp":1777171276981,"segment":84,"confidence":null,"iterationTokens":471,"asi":{"hypothesis":"`storage/callback.rs` should be a tiny stable slice because the only remaining finding is a boolean local named `modified`; renaming it to a predicate-shaped name should remove the lint without behavior change.","rollback_reason":"Baseline-only measurement on a new explicit local metric; no intended source changes for this run.","next_action_hint":"Run the storage-callback tests, rename `modified` to `has_modified` or similar, rerun the slice benchmark and targeted tests.","benchmark_log":"/run/user/1555/tmp/openraft-storage-callback-slice.PcRaPp","counted_lines":["bool_naming openraft/openraft/src/storage/callback.rs:100"]}}
{"run":458,"commit":"ab90c2c","metric":1,"metrics":{"cargo_status":2},"status":"crash","description":"Invalid post-change measurement for `storage/callback.rs`: the experiment command ran from the main Aspen checkout instead of the active session worktree, so Tiger Style still saw the old `let modified` source and reported the baseline finding. No conclusion about the patch.","timestamp":1777171328608,"segment":84,"confidence":null,"iterationTokens":3013,"asi":{"hypothesis":"Renaming the boolean local in the active worktree should remove the bool-naming finding, but this run did not test that tree.","rollback_reason":"Wrong working directory: run_experiment defaulted to `/home/brittonr/git/aspen` while the edited files live under `/home/brittonr/git/aspen/.pi/worktrees/session-1777170434993-idwn`.","next_action_hint":"Rerun the same slice command with an explicit `cd /home/brittonr/git/aspen/.pi/worktrees/session-1777170434993-idwn` prefix, then validate with `cargo test -p openraft storage::callback --lib`.","benchmark_log":"/run/user/1555/tmp/openraft-storage-callback-slice.WTH9Uc","counted_lines":["bool_naming openraft/openraft/src/storage/callback.rs:100"],"error_details":"Log snippet still showed `let modified`, while active worktree source had `let has_modified`."}}
{"run":459,"commit":"a6761bf","metric":0,"metrics":{"cargo_status":2},"status":"keep","description":"Finished the explicit `openraft` storage-callback Tiger Style slice: renamed the `send_if_modified` boolean local from `modified` to `has_modified`, preserving IO completion behavior while removing the local `bool_naming` finding. Baseline-compatible callback tests stayed green, post-change `cargo test -p openraft storage::callback --lib` and `cargo check -p openraft` stayed green, and the explicit `storage/callback.rs` slice dropped from 1 to 0 unique findings.","timestamp":1777171412847,"segment":84,"confidence":null,"iterationTokens":4944,"asi":{"hypothesis":"The lone `storage/callback.rs` finding is a boolean local with a non-predicate name, so renaming it to `has_modified` should fully clean the slice with no semantic change.","benchmark_log":"/run/user/1555/tmp/openraft-storage-callback-slice.34BL98","validation":"Passed `cargo test -p openraft storage::callback --lib` before editing in the equivalent session tree, and passed post-change `cargo test -p openraft storage::callback --lib` plus `cargo check -p openraft` in `/home/brittonr/git/aspen`.","lessons":"Use explicit `cd /home/brittonr/git/aspen` or operate on absolute root paths for autoresearch runs; `run_experiment`/`log_experiment` use the root checkout, while ordinary bash/edit calls in this session initially targeted `.pi/worktrees/session-*`. `sm/worker.rs` was parked in `autoresearch.ideas.md` because suppression did not work and a real fix needs bounded-channel/backpressure design.","next_action_hint":"Continue with tiny explicit one-finding slices in root checkout. Good candidates from the current summary include `openraft/openraft/src/storage/helper.rs` (`unchecked_division`), `openraft/openraft/src/raft/trigger.rs` (`bool_naming`), or the paired `raft/raft_inner.rs` arithmetic/numeric-units slice."}}
{"type":"config","name":"Openraft storage helper chunk count Tiger Style slice","metricName":"openraft_storage_helper_slice_findings","metricUnit":"","bestDirection":"lower"}
{"run":460,"commit":"a6761bf","metric":1,"metrics":{"cargo_status":2},"status":"checks_failed","description":"Baseline for the explicit `openraft` storage-helper Tiger Style slice: with a fresh target dir, `cargo tigerstyle check --output-format human -p openraft -- --target-dir <tmp>` reports 1 unique finding in `openraft/openraft/src/storage/helper.rs`, an `unchecked_division` hit in `ChunkCountBounds::chunk_count()`. No source changes yet.","timestamp":1777171449213,"segment":85,"confidence":null,"iterationTokens":481,"asi":{"hypothesis":"`storage/helper.rs` should be another tiny stable slice because the only remaining finding is ceiling-division math that already guards zero; switching the `/` to `checked_div()` should make the fail-safe explicit without changing normal behavior.","rollback_reason":"Baseline-only measurement on a new explicit local metric; no intended source changes for this run.","next_action_hint":"Run storage-helper related tests, replace the checked-zero `/ self.step_count` with `checked_div(self.step_count)` and an explicit fallback, then rerun the slice benchmark.","benchmark_log":"/run/user/1555/tmp/openraft-storage-helper-slice.WsU9GV","counted_lines":["unchecked_division openraft/openraft/src/storage/helper.rs:513"]}}
