{"run":439,"commit":"49eff1b","metric":1,"metrics":{},"status":"checks_failed","description":"Baseline for the explicit `openraft` log-id-option-ext Tiger Style slice: with a fresh target dir, `cargo tigerstyle check --output-format human -p openraft -- --target-dir <tmp>` reports 1 unique finding in `openraft/openraft/src/log_id/log_id_option_ext.rs`, a `raw_arithmetic_overflow` hit on `next_index()`. No source changes yet.","timestamp":1777047469932,"segment":76,"confidence":null,"iterationTokens":446,"asi":{"hypothesis":"`log_id/log_id_option_ext.rs` should be a tiny stable explicit slice because its only remaining finding is an unchecked `index() + 1`, and converting that helper to saturating arithmetic should preserve intended max-index behavior while removing the overflow risk.","rollback_reason":"Baseline-only measurement on a new explicit local metric; no intended source changes for this run.","next_action_hint":"Run the log-id rails, switch `next_index()` to `saturating_add(1)`, then rerun the slice benchmark.","benchmark_log":"/run/user/1555/tmp/openraft-log-id-option-ext-slice.ErFTk8","counted_lines":["raw_arithmetic_overflow openraft/openraft/src/log_id/log_id_option_ext.rs:29"]}}
{"run":440,"commit":"0bdf37c","metric":0,"metrics":{},"status":"keep","description":"Finished the explicit `openraft` log-id-option-ext Tiger Style slice: `LogIdOptionExt::next_index()` now uses `saturating_add(1)` instead of unchecked `index() + 1`, preserving the helper's intent while removing the overflow edge case. Baseline and post-change `cargo test -p openraft log_id --lib` stayed green, `cargo check -p openraft` stayed green, and the explicit `log_id/log_id_option_ext.rs` slice dropped from 1 to 0 unique findings.","timestamp":1777047519965,"segment":76,"confidence":null,"iterationTokens":4655,"asi":{"hypothesis":"The lone `log_id/log_id_option_ext.rs` finding is a real unchecked increment in a foundational helper, so saturating arithmetic should fully clean the slice without affecting ordinary call sites.","benchmark_log":"/run/user/1555/tmp/openraft-log-id-option-ext-slice.5JKU0Y","validation":"Passed `cargo test -p openraft log_id --lib` before editing and again after the change, plus `cargo check -p openraft` before and after.","lessons":"These tiny arithmetic helpers are worth cleaning because they sit on hot foundational paths used by many engine/state checks. Saturating behavior is the right fail-safe for `next_index()` at `u64::MAX`.","next_action_hint":"Stay on nearby real arithmetic slices: `openraft/openraft/src/log_id/option_raft_log_id_ext.rs` has the same unchecked increment pattern and should respond to the same treatment with the same validation rails."}}
{"type":"config","name":"Openraft option_raft_log_id_ext Tiger Style slice","metricName":"openraft_option_raft_log_id_ext_slice_findings","metricUnit":"","bestDirection":"lower"}
{"run":441,"commit":"0bdf37c","metric":1,"metrics":{},"status":"checks_failed","description":"Baseline for the explicit `openraft` option-raft-log-id-ext Tiger Style slice: with a fresh target dir, `cargo tigerstyle check --output-format human -p openraft -- --target-dir <tmp>` reports 1 unique finding in `openraft/openraft/src/log_id/option_raft_log_id_ext.rs`, a `raw_arithmetic_overflow` hit on `next_index()`. No source changes yet.","timestamp":1777047560289,"segment":77,"confidence":null,"iterationTokens":459,"asi":{"hypothesis":"`log_id/option_raft_log_id_ext.rs` should be another tiny stable explicit slice because it has the same unchecked `index() + 1` helper pattern just cleaned in `log_id_option_ext.rs`, so the same saturating fix should remove the warning without changing ordinary behavior.","rollback_reason":"Baseline-only measurement on a new explicit local metric; no intended source changes for this run.","next_action_hint":"Reuse the log-id validation rails, switch `next_index()` to `saturating_add(1)`, then rerun the slice benchmark.","benchmark_log":"/run/user/1555/tmp/openraft-option-raft-log-id-ext-slice.ILPcMv","counted_lines":["raw_arithmetic_overflow openraft/openraft/src/log_id/option_raft_log_id_ext.rs:42"]}}
{"run":442,"commit":"2b1437f","metric":0,"metrics":{},"status":"keep","description":"Finished the explicit `openraft` option-raft-log-id-ext Tiger Style slice: `OptionRaftLogIdExt::next_index()` now uses `saturating_add(1)` instead of unchecked `index() + 1`, matching the adjacent public helper and removing the overflow edge case without affecting ordinary behavior. Baseline and post-change `cargo test -p openraft log_id --lib` stayed green, `cargo check -p openraft` stayed green, and the explicit `log_id/option_raft_log_id_ext.rs` slice dropped from 1 to 0 unique findings.","timestamp":1777047617627,"segment":77,"confidence":null,"iterationTokens":4715,"asi":{"hypothesis":"The lone `log_id/option_raft_log_id_ext.rs` finding is the same real unchecked increment pattern as the adjacent helper, so the same saturating fix should fully clean the slice and keep the semantics aligned.","benchmark_log":"/run/user/1555/tmp/openraft-option-raft-log-id-ext-slice.MUv6O8","validation":"Passed `cargo test -p openraft log_id --lib` before editing and again after the change, plus `cargo check -p openraft` before and after.","lessons":"Mirroring arithmetic safety across paired helper traits avoids subtle divergence: both public and crate-local `next_index()` helpers now saturate at `u64::MAX`. This is a legitimate correctness hardening, not benchmark gaming.","next_action_hint":"Continue harvesting real one-finding slices near the same area—`log_id_range.rs` or `raft_state/log_state_reader.rs` are plausible next arithmetic candidates—while the stable explicit-slice rail is still paying off."}}
{"type":"config","name":"Openraft log_id_range Tiger Style slice","metricName":"openraft_log_id_range_slice_findings","metricUnit":"","bestDirection":"lower"}
{"run":443,"commit":"2b1437f","metric":1,"metrics":{},"status":"checks_failed","description":"Baseline for the explicit `openraft` log-id-range Tiger Style slice: with a fresh target dir, `cargo tigerstyle check --output-format human -p openraft -- --target-dir <tmp>` reports 1 unique finding in `openraft/openraft/src/log_id_range.rs`, a `raw_arithmetic_overflow` hit on `len()`. No source changes yet.","timestamp":1777047734141,"segment":78,"confidence":null,"iterationTokens":438,"asi":{"hypothesis":"`log_id_range.rs` should be another tiny stable explicit slice because its only remaining finding is an unchecked subtraction between `next_index()` values, and converting that helper to saturating arithmetic should preserve ordinary behavior while removing the overflow edge case.","rollback_reason":"Baseline-only measurement on a new explicit local metric; no intended source changes for this run.","next_action_hint":"Run the log-id rails, switch `LogIdRange::len()` to a saturating subtraction, then rerun the slice benchmark.","benchmark_log":"/run/user/1555/tmp/openraft-log-id-range-slice.OYO5QP","counted_lines":["raw_arithmetic_overflow openraft/openraft/src/log_id_range.rs:62"]}}
{"run":444,"commit":"7716157","metric":0,"metrics":{},"status":"keep","description":"Finished the explicit `openraft` log-id-range Tiger Style slice: `LogIdRange::len()` now uses `saturating_sub()` across `next_index()` values instead of unchecked subtraction, preserving ordinary range sizing while removing the overflow edge case on invalid or saturated endpoints. Baseline and post-change `cargo test -p openraft log_id --lib` stayed green, `cargo check -p openraft` stayed green, and the explicit `log_id_range.rs` slice dropped from 1 to 0 unique findings.","timestamp":1777047789095,"segment":78,"confidence":null,"iterationTokens":4845,"asi":{"hypothesis":"The lone `log_id_range.rs` finding is a real unchecked subtraction in a foundational helper, so `saturating_sub()` should fully clean the slice and keep normal range calculations intact.","benchmark_log":"/run/user/1555/tmp/openraft-log-id-range-slice.LDwUnX","validation":"Passed `cargo test -p openraft log_id --lib` before editing and again after the change, plus `cargo check -p openraft` before and after.","lessons":"The paired `next_index()` hardening naturally propagates into range math: once the endpoints can saturate, `len()` should also fail safely instead of assuming perfect invariants forever.","next_action_hint":"Stay on adjacent arithmetic slices. `openraft/openraft/src/raft_state/log_state_reader.rs` still has a one-line raw-arithmetic finding and shares the same validation rails, so it is the next honest candidate before moving to different lint classes."}}
{"type":"config","name":"Openraft log_state_reader Tiger Style slice","metricName":"openraft_log_state_reader_slice_findings","metricUnit":"","bestDirection":"lower"}
{"run":445,"commit":"7716157","metric":1,"metrics":{},"status":"checks_failed","description":"Baseline for the explicit `openraft` log-state-reader Tiger Style slice: with a fresh target dir, `cargo tigerstyle check --output-format human -p openraft -- --target-dir <tmp>` reports 1 unique finding in `openraft/openraft/src/raft_state/log_state_reader.rs`, a `raw_arithmetic_overflow` hit on `prev_log_id()`. No source changes yet.","timestamp":1777047836986,"segment":79,"confidence":null,"iterationTokens":441,"asi":{"hypothesis":"`raft_state/log_state_reader.rs` should be another tiny stable explicit slice because the only remaining finding is an unchecked `index - 1` in `prev_log_id()`, and converting it to a checked subtraction should preserve the current `index == 0` behavior while removing the overflow risk.","rollback_reason":"Baseline-only measurement on a new explicit local metric; no intended source changes for this run.","next_action_hint":"Reuse the log-id / log-state validation rails, switch `prev_log_id()` to `checked_sub(1)`, then rerun the slice benchmark.","benchmark_log":"/run/user/1555/tmp/openraft-log-state-reader-slice.kSsaqo","counted_lines":["raw_arithmetic_overflow openraft/openraft/src/raft_state/log_state_reader.rs:17"]}}
{"run":446,"commit":"78e4498","metric":0,"metrics":{},"status":"keep","description":"Finished the explicit `openraft` log-state-reader Tiger Style slice: `prev_log_id()` now uses `checked_sub(1)` instead of unchecked `index - 1`, preserving the current `index == 0` behavior while removing the overflow edge case. Baseline and post-change `cargo test -p openraft log_id --lib` stayed green, `cargo check -p openraft` stayed green, and the explicit `raft_state/log_state_reader.rs` slice dropped from 1 to 0 unique findings.","timestamp":1777047911101,"segment":79,"confidence":null,"iterationTokens":4924,"asi":{"hypothesis":"The lone `raft_state/log_state_reader.rs` finding is a real unchecked decrement in a foundational helper, so `checked_sub(1)` should fully clean the slice and preserve the existing `None` behavior at index zero.","benchmark_log":"/run/user/1555/tmp/openraft-log-state-reader-slice.pHhx5L","validation":"Passed `cargo test -p openraft log_id --lib` before editing and again after the change, plus `cargo check -p openraft` before and after.","lessons":"`checked_sub()` is the cleaner fit than saturating arithmetic for predecessor lookups: it naturally encodes the existing `index == 0 => None` contract without risking accidental `get_log_id(0)` behavior.","next_action_hint":"Continue with one-finding arithmetic/behavior slices while this stable rail remains productive. `engine/command.rs` (ignored result) and `storage/log_reader_ext.rs` or `network/snapshot_transport.rs` are good next candidates before revisiting the noisy broad benchmark."}}
{"type":"config","name":"Openraft engine command Tiger Style slice","metricName":"openraft_engine_command_slice_findings","metricUnit":"","bestDirection":"lower"}
{"run":447,"commit":"78e4498","metric":1,"metrics":{},"status":"checks_failed","description":"Baseline for the explicit `openraft` engine-command Tiger Style slice: with a fresh target dir, `cargo tigerstyle check --output-format human -p openraft -- --target-dir <tmp>` reports 1 unique finding in `openraft/openraft/src/engine/command.rs`, an `ignored_result` hit on `ValueSender::send()`. No source changes yet.","timestamp":1777047987393,"segment":80,"confidence":null,"iterationTokens":434,"asi":{"hypothesis":"`engine/command.rs` should be a small stable explicit slice because the only remaining finding is a real ignored oneshot send result, and making that failure explicit should improve dropped-responder diagnostics without changing normal behavior.","rollback_reason":"Baseline-only measurement on a new explicit local metric; no intended source changes for this run.","next_action_hint":"Run the pending-respond / engine rails, make `ValueSender::send()` log or otherwise handle the failed oneshot send explicitly, then rerun the slice benchmark.","benchmark_log":"/run/user/1555/tmp/openraft-engine-command-slice.RzYz95","counted_lines":["ignored_result openraft/openraft/src/engine/command.rs:457"]}}
{"run":448,"commit":"81f7875","metric":0,"metrics":{},"status":"keep","description":"Finished the explicit `openraft` engine-command Tiger Style slice: `ValueSender::send()` now handles a failed oneshot send explicitly and emits a debug trace when the response receiver has already been dropped instead of silently ignoring the result. Baseline and post-change `cargo test -p openraft pending_responds --lib` stayed green, `cargo check -p openraft` stayed green, and the explicit `engine/command.rs` slice dropped from 1 to 0 unique findings.","timestamp":1777048059983,"segment":80,"confidence":null,"iterationTokens":5165,"asi":{"hypothesis":"The lone `engine/command.rs` finding is a real ignored oneshot send result, so making the dropped-receiver path explicit should fully clean the slice while improving diagnostics for lost responses.","benchmark_log":"/run/user/1555/tmp/openraft-engine-command-slice.TgphaB","validation":"Passed `cargo test -p openraft pending_responds --lib` before editing and again after the change, plus `cargo check -p openraft` before and after.","lessons":"Late-stage one-finding slices are still valuable when they improve observability instead of just renaming locals. Here the normal path is unchanged, but dropped response receivers are no longer completely silent.","next_action_hint":"Keep favoring real behavioral fixes. `core/sm/worker.rs` and `storage/log_reader_ext.rs` are still attractive one-finding candidates; defer the broad benchmark recalibration until these explicit low-risk wins taper off."}}
{"type":"config","name":"Openraft storage log_reader_ext Tiger Style slice","metricName":"openraft_log_reader_ext_slice_findings","metricUnit":"","bestDirection":"lower"}
{"run":449,"commit":"81f7875","metric":1,"metrics":{},"status":"checks_failed","description":"Baseline for the explicit `openraft` storage-log-reader-ext Tiger Style slice: with a fresh target dir, `cargo tigerstyle check --output-format human -p openraft -- --target-dir <tmp>` reports 1 unique finding in `openraft/openraft/src/storage/log_reader_ext.rs`, a `raw_arithmetic_overflow` hit in `try_get_log_entry()`. No source changes yet.","timestamp":1777048171935,"segment":81,"confidence":null,"iterationTokens":440,"asi":{"hypothesis":"`storage/log_reader_ext.rs` should be another tiny stable explicit slice because the only remaining finding is the unchecked `log_index + 1` range end, and replacing it with saturating arithmetic should preserve the helper's intent while removing the overflow edge case.","rollback_reason":"Baseline-only measurement on a new explicit local metric; no intended source changes for this run.","next_action_hint":"Reuse the log/storage validation rails, switch the single-entry range end to `saturating_add(1)`, then rerun the slice benchmark.","benchmark_log":"/run/user/$UID/tmp/openraft-log-reader-ext-slice.Axme9q","counted_lines":["raw_arithmetic_overflow openraft/openraft/src/storage/log_reader_ext.rs:20"]}}
{"run":450,"commit":"f648e37","metric":0,"metrics":{},"status":"keep","description":"Finished the explicit `openraft` storage-log-reader-ext Tiger Style slice: `try_get_log_entry()` now uses `log_index.saturating_add(1)` for its single-entry range end instead of unchecked `log_index + 1`, preserving the helper's behavior for normal indices while removing the overflow edge case at `u64::MAX`. Baseline and post-change `cargo test -p openraft log_id --lib` stayed green, `cargo check -p openraft` stayed green, and the explicit `storage/log_reader_ext.rs` slice dropped from 1 to 0 unique findings.","timestamp":1777048239178,"segment":81,"confidence":null,"iterationTokens":5878,"asi":{"hypothesis":"The lone `storage/log_reader_ext.rs` finding is a real unchecked range-end increment, so `saturating_add(1)` should fully clean the slice and preserve the helper's ordinary semantics.","benchmark_log":"/run/user/1555/tmp/openraft-log-reader-ext-slice.Jl67WD","validation":"Passed `cargo test -p openraft log_id --lib` before editing and again after the change, plus `cargo check -p openraft` before and after.","lessons":"Even small convenience wrappers deserve overflow-safe range math because they sit on storage access paths reused by test harnesses and helper APIs. The saturating end still yields a single-entry query except at `u64::MAX`, where it fails closed instead of wrapping.","next_action_hint":"Keep favoring adjacent one-finding behavioral fixes. `network/snapshot_transport.rs` is still a straightforward next slice, and `core/sm/worker.rs` remains the next structural case once the cheap arithmetic/naming wins taper off."}}
{"type":"config","name":"Openraft snapshot_transport Tiger Style slice","metricName":"openraft_snapshot_transport_slice_findings","metricUnit":"","bestDirection":"lower"}
{"run":451,"commit":"f648e37","metric":1,"metrics":{},"status":"checks_failed","description":"Baseline for the explicit `openraft` snapshot-transport Tiger Style slice: with a fresh target dir, `cargo tigerstyle check --output-format human -p openraft -- --target-dir <tmp>` reports 1 unique finding in `openraft/openraft/src/network/snapshot_transport.rs`, a `numeric_units` hit on the chunk-length conversion local near the send loop. No source changes yet.","timestamp":1777048287960,"segment":82,"confidence":null,"iterationTokens":438,"asi":{"hypothesis":"`network/snapshot_transport.rs` should be another tiny stable explicit slice because the only remaining finding is a warning-bearing chunk-length local, and inlining or otherwise deleting that local should preserve behavior while removing the lint.","rollback_reason":"Baseline-only measurement on a new explicit local metric; no intended source changes for this run.","next_action_hint":"Reuse the snapshot rails, remove the `read_size_bytes_u64` local by folding the checked conversion directly into the next-offset calculation, then rerun the slice benchmark.","benchmark_log":"/run/user/1555/tmp/openraft-snapshot-transport-slice.GkUpYE","counted_lines":["numeric_units openraft/openraft/src/network/snapshot_transport.rs:100"]}}
{"run":452,"commit":"db0fd3d","metric":0,"metrics":{},"status":"keep","description":"Finished the explicit `openraft` snapshot-transport Tiger Style slice: removed the warning-bearing `read_size_bytes_u64` local by folding the checked `u64::try_from(buf.len())` conversion directly into the `next_offset_bytes` calculation, keeping chunk-send behavior unchanged while clearing the last local `numeric_units` hit. Baseline and post-change `cargo test -p openraft snapshot --lib` stayed green, `cargo check -p openraft` stayed green, and the explicit `network/snapshot_transport.rs` slice dropped from 1 to 0 unique findings.","timestamp":1777048345464,"segment":82,"confidence":null,"iterationTokens":4488,"asi":{"hypothesis":"The lone `snapshot_transport.rs` finding is only the warning-bearing chunk-length conversion local, so deleting that local while keeping the same checked conversion and overflow error path should fully clean the slice without changing transport semantics.","benchmark_log":"/run/user/$UID/tmp/openraft-snapshot-transport-slice.TYmrE6","validation":"Passed `cargo test -p openraft snapshot --lib` before editing and again after the change, plus `cargo check -p openraft` before and after.","lessons":"Inlining checked conversions is often the cleanest late-stage fix for Tiger Style numeric-units warnings on non-domain locals. The benchmark still stayed focused on one file and did not require touching the noisier broad metric.","next_action_hint":"The remaining low-risk explicit frontier is now more structural. `core/sm/worker.rs` is the next meaningful case, but it likely needs an intentional documented unbounded-loop justification or a refactor of the event-loop shell rather than another arithmetic micro-fix."}}
{"type":"config","name":"Openraft state machine worker Tiger Style slice","metricName":"openraft_sm_worker_slice_findings","metricUnit":"","bestDirection":"lower"}
