{"run":217,"commit":"f4ca830","metric":0,"metrics":{},"status":"keep","description":"Re-established the cold repo-owned Tiger Style baseline on the current checkpoint after stashing unrelated staged OpenSpec work. This tree already sits at the repo-owned floor: zero warnings under `crates/`, `src/`, or `build.rs`; only vendored `openraft-macros` still fails the full workspace run.","timestamp":1776876239195,"segment":3,"confidence":3.45,"iterationTokens":1419,"asi":{"hypothesis":"Current checkpoint may already include enough cleanup that the repo-owned Tiger Style metric is effectively at floor.","lessons":"With the current cargo-tigerstyle output, repo-owned warning parsing sees zero local sites while the full run still exits non-zero because `openraft-macros` has one remaining warning. The old 2488 durable-checkpoint baseline no longer matches this checkout.","next_action_hint":"Start a new experiment segment for the remaining full-workspace Tiger Style tail (currently the single vendored `openraft-macros` warning) or explicitly confirm that repo-owned cleanup is complete on this branch."}}
{"type":"config","name":"Aspen full-workspace Tiger Style cleanup (vendored tail)","metricName":"workspace_tigerstyle_violations","metricUnit":"","bestDirection":"lower"}
{"run":218,"commit":"f4ca830","metric":0,"metrics":{},"status":"crash","description":"Full-workspace Tiger Style baseline parser was wrong for this extension output: the remaining vendored finding appears only in the summary/index (`F1 ... openraft/macros/src/utils.rs:18`), not as a normal `path:line:col: warning:` line, so the run mis-measured the workspace tail as zero.","timestamp":1776876309411,"segment":4,"confidence":null,"iterationTokens":1039,"asi":{"hypothesis":"Establish a fresh full-workspace Tiger Style baseline for the vendored tail before touching `openraft-macros`.","rollback_reason":"Benchmark parser matched the wrong output shape and undercounted the remaining vendored finding.","next_action_hint":"Rerun the full-workspace benchmark counting `F<number>` summary index entries or direct Tiger Style finding totals, then edit `openraft/macros/src/utils.rs` against that corrected baseline."}}
{"run":219,"commit":"2e7ea95","metric":1,"metrics":{},"status":"keep","description":"Established the new full-workspace Tiger Style baseline for the vendored tail. Current checkpoint has exactly one remaining workspace finding, all in `openraft/macros/src/utils.rs` (`assertion_density` on `is_doc`).","timestamp":1776876350625,"segment":4,"confidence":null,"iterationTokens":1793,"asi":{"hypothesis":"The current branch has finished repo-owned cleanup, leaving only the vendored `openraft-macros` `is_doc` assertion-density finding as the remaining full-workspace Tiger Style tail.","lessons":"For this extension output, the trustworthy full-workspace metric is the Tiger Style summary index count (`F1 ...`) rather than `path:line:col: warning:` matching.","next_action_hint":"Add real local invariants inside `openraft/macros/src/utils.rs::is_doc`, rerun the full-workspace benchmark, and confirm the workspace warning count reaches zero."}}
{"run":220,"commit":"2e7ea95","metric":0,"metrics":{},"status":"crash","description":"The first vendored-tail baseline was still wrong: after fixing `openraft-macros`, the same summary-index parser exposed 18 workspace Tiger Style findings in repo code (`aspen-auth-core`, `aspen-kv-types`, `aspen-cluster-types`, `aspen-ci-core`), so the earlier baseline of 1 was not comparable and this run cannot be judged as an improvement/regression yet.","timestamp":1776876512983,"segment":4,"confidence":null,"iterationTokens":9603,"asi":{"hypothesis":"Fixing the single vendored `openraft-macros` finding would drive the full-workspace Tiger Style metric to zero.","rollback_reason":"Benchmark target was mis-specified: the previous baseline only captured the vendored tail instead of the full Tiger Style summary index, so this cycle revealed a measurement-definition bug rather than a code regression.","next_action_hint":"Re-initialize the workspace metric using the summary-index parser as the canonical measure, then keep the `openraft-macros` fix in the candidate while targeting the new top files (`aspen-auth-core/src/capability.rs`, `verified_credential.rs`, `token.rs`, `verified_auth.rs`)."}}
{"type":"config","name":"Aspen Tiger Style cleanup (summary-index full workspace)","metricName":"workspace_tigerstyle_findings","metricUnit":"","bestDirection":"lower"}
{"run":221,"commit":"2e7ea95","metric":0,"metrics":{},"status":"crash","description":"The summary-index baseline is still incomplete on the unpatched tree: `openraft-macros` fails first, so the workspace stops after one visible finding and hides the downstream Tiger Style tail. Need re-measure with the `is_doc` blocker fixed to get a stable full-workspace count.","timestamp":1776876570711,"segment":5,"confidence":null,"iterationTokens":479,"asi":{"hypothesis":"A fresh summary-index baseline on the current clean tree would reveal the full workspace Tiger Style tail.","rollback_reason":"The vendored `openraft-macros` failure short-circuits the workspace, so the measured `1` finding is only the first blocker, not the stable full-workspace metric.","next_action_hint":"Reapply the `openraft/macros/src/utils.rs` assertion-density fix, rerun the summary-index benchmark, and use that post-blocker count as the real baseline for the full-workspace cleanup loop."}}
{"run":222,"commit":"0af5295","metric":18,"metrics":{},"status":"keep","description":"Applied the vendored `openraft-macros` blocker fix in `openraft/macros/src/utils.rs` so the full workspace can lint through, then established the first stable summary-index baseline for this segment: 18 Tiger Style findings remain, led by `aspen-auth-core/src/capability.rs` (7) plus smaller tails in `verified_credential.rs`, `token.rs`, `verified_auth.rs`, `aspen-kv-types/src/validation.rs`, `aspen-cluster-types/src/lib.rs`, and `aspen-ci-core/src/verified/pipeline.rs`.","timestamp":1776876627717,"segment":5,"confidence":null,"iterationTokens":2874,"asi":{"hypothesis":"Clearing the vendored `openraft-macros` blocker will expose the real remaining full-workspace Tiger Style tail and give a stable baseline for continued cleanup.","lessons":"The summary-index metric only becomes trustworthy after the first fatal blocker is removed; before that, downstream warnings are hidden by early compile failure.","next_action_hint":"Target the densest remaining honest hotspot next: `crates/aspen-auth-core/src/capability.rs`, then follow with the smaller `verified_credential.rs`/`token.rs`/`verified_auth.rs` tails on the same stable 18-finding baseline."}}
{"run":223,"commit":"2a6f637","metric":8,"metrics":{},"status":"keep","description":"Cleaned the dense `aspen-auth-core` tail that was blocking the visible workspace count: `capability.rs` now routes glob/prefix/mount/shell matching through typed inputs with checked substring math, and `token.rs` uses explicit serde default helpers plus checked max-size helpers instead of foreign defaults and platform-sized casts. The stable full-workspace summary-index metric dropped from 18 to 8.","timestamp":1776877127040,"segment":5,"confidence":null,"iterationTokens":58523,"asi":{"hypothesis":"`aspen-auth-core` was the current workspace blocker, so clearing the glob/helper/default/cast slice in `capability.rs` and `token.rs` should cut most visible findings before the next crate tail appears.","lessons":"When a blocker crate dominates the workspace summary, fixing its internal helper signatures and explicit-default/cast issues can reduce the visible tail sharply without needing a full crate rewrite. The current remaining visible files are `verified_credential.rs` (3), `verified_auth.rs` (2), `aspen-kv-types/src/validation.rs` (1), `aspen-cluster-types/src/lib.rs` (1), and `aspen-ci-core/src/verified/pipeline.rs` (1).","next_action_hint":"Target the remaining `aspen-auth-core` blocker files next if possible without test churn: add real invariants in `verified_credential.rs` and consider typed inputs for the public time helpers only if that does not force broad consumer fallout; otherwise pivot to the one-warning non-test files to keep the workspace count moving."}}
{"type":"config","name":"Aspen Tiger Style and clippy cleanup to zero violations","metricName":"violations","metricUnit":"","bestDirection":"lower"}
{"run":224,"commit":"bd486f3","metric":16,"metrics":{},"status":"checks_failed","description":"Baseline count from fresh lint logs: 10 Tiger Style findings plus 6 clippy errors. Errors are concentrated in repo-owned crates aspen-auth-core, aspen-layer, aspen-time, aspen-core, and aspen-client-api, so optimize against real workspace diagnostics rather than vendor noise.","timestamp":1776917674909,"segment":6,"confidence":null,"iterationTokens":22038}
{"run":225,"commit":"bd486f3","metric":78,"metrics":{},"status":"discard","description":"First fix batch removed the original 16 blockers but triggered a much larger Tiger Style surface (especially aspen-client-api explicit-default/acronym debt and existing coordination/openraft clippy errors) when the workspace advanced further. Keep the auth/time/layer/core direction in mind, but discard this broad workspace state and pivot to smaller crates or targeted lint-scope sequencing.","timestamp":1776917970672,"segment":6,"confidence":null,"iterationTokens":38514}
{"run":226,"commit":"0fd53a5","metric":15,"metrics":{},"status":"keep","description":"Restricted the optimization target to Aspen-owned diagnostics and removed one owned clippy blocker by fixing `aspen-core` test-support/style issues plus `aspen-client-api` enum-prefix/test assertions. The cold full-workspace rail now reports 15 owned violations; the remaining owned clippy tail is concentrated in aspen-sharding and aspen-coordination while the openraft error is ignored for this scope.","timestamp":1776952849001,"segment":6,"confidence":1,"iterationTokens":38514}
{"run":227,"commit":"1338ff4","metric":10,"metrics":{},"status":"keep","description":"Resumed the Aspen-owned loop and reduced the owned violation count from 15 to 10 by bundling several too-many-arguments shells into input structs in aspen-sharding and aspen-coordination (`barrier`, `ack_nack`, `semaphore`, `rwlock`). The remaining owned blockers are now narrower: two queue/rate-limiter/registration shell functions plus four verified helper functions that still need FCIS-style input bundling.","timestamp":1776953413387,"segment":6,"confidence":2,"iterationTokens":42081}
{"run":228,"commit":"1338ff4","metric":10,"metrics":{},"status":"discard","description":"Tried to continue the argument-count cleanup by broadening several aspen-coordination APIs to input structs at once (`queue::dequeue`, `registry::register`, and multiple verified helpers), but that change splashed into many internal call sites and tests without reducing the owned metric yet. Roll this batch back and resume with a narrower per-function migration so each cycle stays measurable and avoids interface churn overfitting.","timestamp":1776953906338,"segment":6,"confidence":1.2,"iterationTokens":42081}
{"run":229,"commit":"1338ff4","metric":10,"metrics":{},"status":"discard","description":"Tried a narrower continuation focused on `rate_limiter` plus verified helper input structs, but once `registry::register` and queue shells moved, the churn still spilled into many registry and queue callers/tests before producing a reduced owned count. Discard again and continue even more locally: keep public signatures stable while extracting only internal helper structs first.","timestamp":1776954438332,"segment":6,"confidence":2.4,"iterationTokens":42081}
{"run":230,"commit":"b02c09c","metric":9,"metrics":{},"status":"keep","description":"Resumed with an even narrower step that kept public signatures stable and only bundled the private rate-limiter CAS retry state into an internal struct. That removed one owned clippy blocker without triggering caller churn, dropping the Aspen-owned violation count from 10 to 9. Remaining blockers are queue/registry public methods plus verified helper argument bundles.","timestamp":1776954603538,"segment":6,"confidence":7,"iterationTokens":76343}
{"run":231,"commit":"b02c09c","metric":0,"metrics":{},"status":"crash","description":"Benchmark wrapper bug again: the inline Python post-processor referenced the shell `status` variable directly, so the run emitted a bogus zero repo-owned Tiger Style metric even though cargo finished. No code signal from this cycle.","timestamp":1776955075879,"segment":6,"confidence":7,"iterationTokens":76343,"asi":{"hypothesis":"Replacing `unwrap_or(MAX)` sentinel fallbacks in small core/raft/coord helper functions should shave a few more repo-owned Tiger Style warnings.","rollback_reason":"Measurement invalid because the benchmark wrapper crashed in post-processing and reported a bogus zero metric.","next_action_hint":"Rerun the cold workspace benchmark with the exit status passed into Python via argv or environment, then compare against the 16-warning baseline before deciding whether to keep this helper cleanup.","error_detail":"`run_experiment` parsed repo_owned_tigerstyle_violations=0 only because the Python script crashed with `NameError: status is not defined` after printing the default metric line."}}
{"run":232,"commit":"b02c09c","metric":16,"metrics":{},"status":"discard","description":"Rerun after fixing the wrapper showed the previous core/raft/coord helper edits were measuring the wrong scope: the cold workspace tail is now 10 findings in `aspen-auth-core`, `aspen-layer`, and `aspen-time`, so the helper changes in `aspen-raft`/`aspen-coordination` do not improve the current optimization target. Discard and pivot to the actual remaining hotspots.","timestamp":1776955136877,"segment":6,"confidence":2.3333333333333335,"iterationTokens":851,"asi":{"hypothesis":"Replacing `unwrap_or(MAX)` sentinel fallbacks in small core/raft/coord helper functions should shave a few more repo-owned Tiger Style warnings.","rollback_reason":"Cold full-workspace benchmark stayed at the 16-warning baseline for the active optimization target and exposed a different remaining hotspot set (`aspen-auth-core`, `aspen-layer`, `aspen-time`), so the local raft/coord helper edits were off-target.","next_action_hint":"Target the actual remaining files: sentinel fallbacks in `aspen-time`/`aspen-layer` and ambiguous-parameter plus assertion-density issues in `aspen-auth-core`."}}
{"run":233,"commit":"b02c09c","metric":49,"metrics":{},"status":"discard","description":"The targeted fixes successfully removed the old `aspen-time`/`aspen-layer`/`aspen-auth-core` tail, but the active cold-workspace metric shifted to a much larger remaining frontier (49 repo-owned findings, dominated by `aspen-client-api` and `aspen-redb-storage`) because the benchmark is now surfacing a different broader slice than the earlier 16-warning tail. Discard this local batch and pivot to the actual current hotspots rather than keeping an incomparable measurement.","timestamp":1776955764571,"segment":6,"confidence":1.4,"iterationTokens":2733,"asi":{"hypothesis":"Clearing the remaining `aspen-time`, `aspen-layer`, and `aspen-auth-core` Tiger Style findings should reduce the cold repo-owned workspace tail below the 16-warning baseline.","rollback_reason":"Result is not comparable to the 16-warning baseline: the cold benchmark now exposed a broader hotspot set (49 findings across `aspen-client-api`, `aspen-redb-storage`, and one `aspen-auth-core` cast), so this batch does not produce a trustworthy improvement for the active metric.","next_action_hint":"Re-baseline explicitly on the newly surfaced scope or immediately target the current visible hotspots, starting with the single remaining `aspen-auth-core` cast and then the dense `aspen-client-api` acronym/default cluster."}}
{"run":234,"commit":"56c4ace","metric":8,"metrics":{},"status":"keep","description":"Resumed from git log plus autoresearch.jsonl because repo-local `autoresearch.md` is absent, then took a measurable Aspen-owned clippy step in `aspen-coordination`: `queue::dequeue_excluding_groups`, `queue::dequeue_wait`, and `registry::register` now use typed input structs instead of 6-arg public shells, with internal coordination call sites/tests/docs updated accordingly. The owned clippy violation count dropped from 9 to 8.","timestamp":1776956143001,"segment":6,"confidence":2.2857142857142856,"iterationTokens":25217,"asi":{"hypothesis":"Narrowly bundling one public coordination shell at a time into typed input structs can keep interface churn manageable while still reducing the Aspen-owned clippy `too_many_arguments` count.","lessons":"Public-shell migration is tractable if done one API at a time and immediately propagated through local call sites/tests/docs. The remaining owned blockers are now the verified coordination helpers plus a few coordination test-only clippy issues.","next_action_hint":"Continue with the next narrow coordination slice: convert one verified helper or one test helper at a time (`verified/barrier.rs`, `verified/fencing.rs`, `verified/queue/dequeue.rs`, `verified/registry.rs`, `verified/worker.rs`, or the test helper/default-reassign warnings)."}}
{"run":235,"commit":"1b549b9","metric":0,"metrics":{},"status":"keep","description":"Finished the Aspen-owned clippy tail for the active scope: converted the remaining verified coordination helpers (`barrier`, `fencing`, `queue::dequeue`, `registry`, `worker`) to typed FCIS-style input structs, updated coordination discovery/worker call sites and local tests, and cleaned the remaining coordination test helpers/default-init reassignment warnings. The owned clippy violation count for `aspen-coordination` + `aspen-sharding` dropped from 8 to 0.","timestamp":1776956976550,"segment":6,"confidence":2.2857142857142856,"iterationTokens":38883,"asi":{"hypothesis":"Bundling the remaining verified coordination helpers into typed FCIS-style inputs, then cleaning the small coordination test-only clippy issues, should clear the rest of the Aspen-owned clippy tail for the active scope.","lessons":"The remaining tail was concentrated enough that one bounded coordination-only pass could finish it cleanly. Re-exporting new verified input structs through `verified::queue` / `verified::mod` and updating local tests immediately kept churn contained and measurable.","next_action_hint":"Refresh the owned-clippy top-level baseline beyond `aspen-coordination` + `aspen-sharding` to see whether other Aspen-owned crates remain, or if this scope is done, pivot back to the broader workspace cleanup target with a new explicit baseline."}}
{"run":236,"commit":"1b549b9","metric":45,"metrics":{},"status":"checks_failed","description":"Refreshed the broader Aspen-owned clippy baseline beyond the completed `aspen-coordination` + `aspen-sharding` scope. Counting only repo-owned workspace errors (excluding `openraft/` and `vendor/`) gives a new baseline of 45 owned clippy violations across the workspace; total workspace clippy errors are 58 including vendored/openraft tails. This is a re-baseline run, not a regression in the finished coordination slice.","timestamp":1776957117501,"segment":6,"confidence":1.6,"iterationTokens":9271,"asi":{"hypothesis":"After clearing the coordination/sharding-owned tail, the next honest step is to re-baseline the broader Aspen-owned workspace clippy surface before choosing another hotspot.","rollback_reason":"Baseline-only measurement; no intended code changes for this cycle.","next_action_hint":"Target the highest-yield owned hotspot from `/tmp/aspen-owned-clippy-all.P16p19`, likely `aspen-trust`, `aspen-hooks-types`, `aspen-testing-network`, or `aspen-core` test-only clippy issues, while continuing to ignore vendored/openraft noise for this scope."}}
{"run":237,"commit":"1b549b9","metric":48,"metrics":{},"status":"discard","description":"Tried a broader workspace pass by cleaning `aspen-trust`'s current local clippy blockers first, but the full owned-workspace baseline remains unstable and surfaced 48 owned errors—worse than the 45-error re-baseline—because additional downstream crates become visible as earlier blockers clear. Discard this batch rather than overfitting to a shifting global count.","timestamp":1776957441884,"segment":6,"confidence":1.3333333333333333,"iterationTokens":11592,"asi":{"hypothesis":"Cleaning the current top owned hotspot (`aspen-trust`) should reduce the broader owned-workspace clippy baseline after the coordination scope reached zero.","rollback_reason":"The broader owned-workspace metric is still unstable and not directly comparable run-to-run because new downstream crates surface as earlier blockers are cleared, so the observed 48 is not a trustworthy regression/improvement signal for this batch.","next_action_hint":"Stabilize the benchmark scope before further keeps: either re-baseline by hotspot slice (e.g. `cargo clippy -p aspen-trust -p aspen-hooks-types -p aspen-testing-network -p aspen-core --all-targets`) or continue with one top crate at a time and measure that explicit scope instead of the entire workspace."}}
