{"run":156,"commit":"2a2a983","metric":3339,"metrics":{},"status":"keep","description":"Kept a focused `aspen-docs-handler` cleanup: docs service dispatch now returns an explicit INVALID_REQUEST response instead of `unreachable!`, docs list limits use checked `u32`→`usize` conversion, peer-ticket priorities narrow through a checked helper, and set-enabled uses a predicate-style flag. Cold repo-owned workspace metric dropped from 3343 to 3339 (-4).","timestamp":1776536685620,"segment":2,"confidence":10.32719836400818,"iterationTokens":15961,"asi":{"hypothesis":"The next densest workspace-visible tail is `aspen-docs-handler/src/executor.rs`; replacing the unreachability, unchecked limit/priority conversions, and vague enabled flag with explicit checked helpers should remove four real warning sites without changing docs behavior.","lessons":"Even when crate-local lints still complain about nearby naming, the full-workspace benchmark can improve if the visible production warnings are removed. At this stage, keep following the fresh workspace log rather than treating crate-local clean as the optimization target.","next_action_hint":"Verify the keep commit actually landed, then refresh the workspace histogram. After this pass, the remaining visible top items are small one-off tails in secrets handlers plus the recurring catch-all request-handler warnings in blob/core/cluster handlers."}}
{"run":157,"commit":"a163c91","metric":3338,"metrics":{},"status":"keep","description":"Kept a tiny honest `aspen-net` naming cleanup: SOCKS5 and tunnel code now use explicit port/port-bytes names instead of unit-ambiguous local variables, preserving behavior while trimming one more workspace-visible Tiger Style site. Cold repo-owned workspace metric dropped from 3339 to 3338 (-1).","timestamp":1776536842626,"segment":2,"confidence":10.306122448979592,"iterationTokens":7180,"asi":{"hypothesis":"The next visible `aspen-net` tail is just quantity-style naming in SOCKS5/tunnel locals; renaming those to unit-explicit port fields should remove the remaining workspace-visible site without semantic risk.","lessons":"Near the tail, a file can show several crate-local warnings while only one of them participates in the cold workspace metric. Small wins are still real, but recheck the full histogram before assuming all local cleanup will pay on the primary metric.","next_action_hint":"Verify the keep commit actually landed, then re-scan the workspace histogram. Best next honest targets now look like the remaining one-off handler dispatch warnings (`secrets` executor/nix-cache, blob/core/cluster handlers) rather than more crate-local `aspen-net` cleanup."}}
{"run":158,"commit":"9dd7c0b","metric":3336,"metrics":{},"status":"keep","description":"Kept a small honest net+secrets tail batch: `aspen-secrets-handler` now returns explicit INVALID_REQUEST errors instead of `unreachable!`/catch-all match dispatch, and the net tunnel/SOCKS5 path keeps clearer local naming while preserving behavior. Cold repo-owned workspace metric dropped from 3338 to 3336 (-2).","timestamp":1776537150710,"segment":2,"confidence":10.120240480961924,"iterationTokens":8937,"asi":{"hypothesis":"Bundling the easy secrets executor/nix-cache dispatch fixes with the in-flight `aspen-net` naming cleanup should remove a couple more workspace-visible warning sites without changing protocol behavior.","lessons":"At this stage, mixed small batches still move the stable metric, but the full-workspace log matters more than crate-local cleanup counts. The recurring remaining tail is now dominated by a few big-service catch-all dispatch warnings plus isolated `aspen-net` local issues.","next_action_hint":"Verify the keep commit actually landed, then refresh the histogram. Best next honest targets are the remaining one-off handler dispatch warnings in `blob`, `core-essentials`, and `cluster`, or another fresh top file from the new full-workspace log."}}
{"run":159,"commit":"1261924","metric":3333,"metrics":{},"status":"keep","description":"Kept an honest handler-dispatch batch: blob, core-essentials, and cluster handlers now return explicit INVALID_REQUEST errors instead of catch-all deny matches, preserving behavior while removing three more workspace-visible Tiger Style warning sites. Cold repo-owned workspace metric dropped from 3336 to 3333 (-3).","timestamp":1776537363457,"segment":2,"confidence":10.1,"iterationTokens":3103,"asi":{"hypothesis":"The remaining full-workspace tail includes three one-off catch-all request-handler warnings in blob/core-essentials/cluster; converting them to explicit INVALID_REQUEST responses should remove those sites without changing successful dispatch behavior.","lessons":"One-off dispatch warnings are still worth taking near the tail when they are visible in the cold workspace log. Full-workspace counts, not crate-local warning totals, remain the only trustworthy optimization target here.","next_action_hint":"Verify whether keep actually committed, then refresh the histogram. Likely next honest targets are the remaining net/secrets one-offs or whatever new top file the fresh workspace log surfaces."}}
{"run":160,"commit":"8fb71b9","metric":0,"metrics":{},"status":"crash","description":"Cold workspace benchmark command failed before cargo started: nested shell/Python quoting broke the inline regex parser, so this run produced no Tiger Style signal for the current `aspen-net` dirty slice.","timestamp":1776537953976,"segment":2,"confidence":10.1,"iterationTokens":3103,"asi":{"hypothesis":"Current `aspen-net` forward/SOCKS5/tunnel cleanup should remove at least one more workspace-visible Tiger Style site.","rollback_reason":"Benchmark command syntax was invalid, so metric was unusable.","next_action_hint":"Rerun the exact cold benchmark with a quoting-safe one-line Python parser or an external temp script, then decide keep/discard on the measured result.","error_detail":"bash parsed the Python regex line (`pattern = re.compile(...)`) as shell input and exited 2 before cargo tigerstyle ran."}}
{"run":161,"commit":"8fb71b9","metric":3322,"metrics":{},"status":"keep","description":"Kept an honest `aspen-net` cleanup slice: forward parsing now uses a typed port-spec input, SOCKS5 handling carries a small connection context plus explicit finish/error handling and checked `u8`→`usize` conversions, and tunnel locals use clearer port-byte naming without changing behavior. Cold repo-owned workspace metric dropped from 3333 to 3322 (-11).","timestamp":1776538050665,"segment":2,"confidence":9.853658536585366,"iterationTokens":2387,"asi":{"hypothesis":"The remaining `aspen-net` forward/SOCKS5/tunnel tail still had enough workspace-visible arity, result-handling, cast, and naming warnings to remove about ten sites without touching runtime behavior.","lessons":"The stable target remains the fresh-target-dir full-workspace warning count, not crate-local Tiger Style totals. Also, run_experiment command strings should use direct heredocs instead of nested shell/Python quoting; otherwise bash can fail before cargo starts.","next_action_hint":"Verify the keep commit actually landed, then refresh the cold workspace histogram. Best next honest targets are the new top files (`aspen-jobs-worker-replication`, CLI docs/federation, calendar ical parse/serialize, ci shell/vm helpers, dogfood CI, secrets PKI store) rather than more local `aspen-net` cleanup."}}
{"run":162,"commit":"8fb71b9","metric":3299,"metrics":{},"status":"keep","description":"Kept a focused `aspen-cli` docs cleanup on top of the current `aspen-net` tail slice: docs list now reserves bounded output capacity, `--limit` flows through a clearer `max_results` field without changing the flag, human output uses unit-explicit size names, command handlers rename `json`/failure booleans to predicate-style names, and docs set/get/delete/list/status/ticket add real response invariants. Cold repo-owned workspace metric dropped from 3322 to 3299 (-23).","timestamp":1776538371841,"segment":2,"confidence":9.805825242718447,"iterationTokens":23089,"asi":{"hypothesis":"`crates/aspen-cli/src/bin/aspen-cli/commands/docs.rs` still had a dense, low-risk cluster of quantity naming, predicate naming, missing reservations, and zero-assert handler warnings that should remove a couple dozen workspace-visible sites without changing CLI behavior.","lessons":"`docs.rs` was better ROI than its raw file count suggested: one concentrated naming/invariant pass removed the file from the workspace top list entirely. Also, the auto-commit path still needs explicit verification afterward here because prior `keep` cycles have reported success while HEAD stayed put.","next_action_hint":"Verify commit reality again. Then follow the refreshed cold histogram: strongest next low-risk targets are `aspen-jobs-worker-replication/src/lib.rs`, `aspen-calendar/src/ical/{serialize,parse}.rs`, `aspen-ci-executor-shell/src/common.rs`, `aspen-ci-executor-vm/src/pool.rs`, `aspen-cli/src/bin/aspen-cli/commands/federation.rs`, `aspen-dogfood/src/ci.rs`, and `aspen-secrets/src/pki/store.rs`."}}
{"run":163,"commit":"8fb71b9","metric":3276,"metrics":{},"status":"keep","description":"Kept a focused `aspen-jobs-worker-replication` cleanup on top of the current dirty net/docs slices: replication paths now route wall-clock and elapsed-time reads through explicit helpers, use checked `u128`/len conversions instead of raw casts, stream snapshot/backup JSON lines directly into bounded buffers, pre-reserve sample/error vectors, and replace the 4-way restore-point condition chain with a typed helper. Cold repo-owned workspace metric dropped from 3299 to 3276 (-23).","timestamp":1776538752956,"segment":2,"confidence":9.749034749034749,"iterationTokens":31171,"asi":{"hypothesis":"`crates/aspen-jobs-worker-replication/src/lib.rs` still had a dense mechanical cluster of ambient-clock reads, unchecked duration/length casts, unreserved vectors, and one overly dense restore filter; helper extraction should remove another couple dozen workspace-visible sites without changing replication behavior.","lessons":"Streaming snapshot/backup JSON lines directly into a pre-sized byte buffer removes both growth warnings and unnecessary intermediate allocations. The auto-commit path still needs post-keep verification here because `log_experiment` can claim success while HEAD stays at the old commit.","next_action_hint":"Verify commit reality again, then refresh the histogram. Next best honest hotspots now look like `aspen-calendar/src/ical/{serialize,parse}.rs`, `aspen-ci-executor-shell/src/common.rs`, `aspen-cli/src/bin/aspen-cli/commands/federation.rs`, `aspen-ci-executor-vm/src/pool.rs`, `aspen-dogfood/src/ci.rs`, `aspen-secrets/src/pki/store.rs`, `aspen-jobs-worker-shell/src/lib.rs`, or `aspen-client/src/blob_client.rs`."}}
{"run":164,"commit":"8fb71b9","metric":3256,"metrics":{},"status":"keep","description":"Kept a focused `aspen-jobs-worker-shell` cleanup on top of the current dirty slices: serde payload defaults are now explicit local constructors, output/process timing reads go through explicit monotonic helpers, blob output metadata uses `size_bytes`, output capture/inline truncation use checked `u64`↔`usize` helpers and saturating byte accounting, and Unix/non-Unix process-group termination now logs reap/kill failures instead of discarding them. Cold repo-owned workspace metric dropped from 3276 to 3256 (-20).","timestamp":1776539148440,"segment":2,"confidence":9.692898272552783,"iterationTokens":29756,"asi":{"hypothesis":"`crates/aspen-jobs-worker-shell/src/lib.rs` still had a dense mechanical cluster of implicit foreign defaults, direct clock reads, unchecked size conversions, ignored termination results, and quantity/predicate naming warnings that should remove about twenty workspace-visible sites without changing shell-worker behavior.","lessons":"Late-stage worker files still yield solid wins when one pass collapses several warning classes at once. Also, the keep path remains non-durable in this repo state: `log_experiment` reports a commit, but HEAD stays at `8fb71b9`, so every keep still needs explicit post-run verification.","next_action_hint":"Verify commit reality again, then follow the refreshed histogram. Best next honest hotspots remain `aspen-calendar/src/ical/{serialize,parse}.rs`, `aspen-ci-executor-shell/src/common.rs`, `aspen-cli/src/bin/aspen-cli/commands/federation.rs`, `aspen-ci-executor-vm/src/pool.rs`, `aspen-dogfood/src/ci.rs`, `aspen-secrets/src/pki/store.rs`, `aspen-client/src/blob_client.rs`, or `aspen-cluster/src/config/mod.rs`."}}
{"run":165,"commit":"8fb71b9","metric":3234,"metrics":{},"status":"keep","description":"Kept a focused `aspen-calendar` serializer cleanup on top of the current dirty slices: `serialize_vevent` now delegates optional/status/attendee/alarm rendering through small helpers with real invariants, and `unix_secs_to_date` now uses the same saturating Gregorian conversion pattern as `rrule.rs` instead of unchecked casts and arithmetic. Cold repo-owned workspace metric dropped from 3256 to 3234 (-22).","timestamp":1776539375388,"segment":2,"confidence":9.702209414024976,"iterationTokens":9829,"asi":{"hypothesis":"`crates/aspen-calendar/src/ical/serialize.rs` still had a dense cluster of unchecked date arithmetic plus one oversized serializer function; reusing the safer `rrule.rs` conversion shape and splitting the VEVENT emitter should remove another couple dozen workspace-visible sites without changing iCal output.","lessons":"Calendar date helpers are a good place to reuse already-hardened math patterns from sibling modules instead of inventing a new fix. The keep path is still non-durable here: `log_experiment` reports success, but HEAD remains pinned at `8fb71b9`, so the working tree—not git history—is carrying the optimization state.","next_action_hint":"Verify commit reality again, then follow the refreshed histogram. Best next honest hotspots now look like `aspen-ci-executor-shell/src/common.rs`, `aspen-ci-executor-vm/src/pool.rs`, `aspen-cli/src/bin/aspen-cli/commands/federation.rs`, `aspen-dogfood/src/ci.rs`, `aspen-secrets/src/pki/store.rs`, `aspen-calendar/src/ical/parse.rs`, `aspen-client/src/blob_client.rs`, `aspen-cluster/src/config/mod.rs`, or `aspen-fuse/src/fs/operations.rs`."}}
{"run":166,"commit":"8fb71b9","metric":3194,"metrics":{},"status":"keep","description":"Kept the staged dirty Tiger Style batch plus a focused `aspen-calendar/src/ical/parse.rs` cleanup: event/alarm parsing now uses typed state/helpers, bounded reservations, safer property/date parsing, and saturating Gregorian conversion, while the earlier net/docs/replication/shell/serialize slices remain in place. Fresh-target-dir repo-owned workspace metric dropped from 3234 to 3194 (-40).","timestamp":1776540285110,"segment":2,"confidence":9.711538461538462,"iterationTokens":9829}
{"run":167,"commit":"8fb71b9","metric":3172,"metrics":{},"status":"keep","description":"Kept another honest dirty-worktree slice: `aspen-ci-executor-shell/src/common.rs` now uses bounded size helpers, explicit wall-clock/log-chunk boundaries, safer artifact/archive accounting, typed log targets, and explicit error handling for tar-drain/completion writes, while the earlier net/docs/replication/shell/calendar parse+serialize cleanup remains in place. Fresh-target-dir repo-owned workspace metric dropped from 3194 to 3172 (-22).","timestamp":1776540821765,"segment":2,"confidence":9.655831739961759,"iterationTokens":46786}
{"run":168,"commit":"8fb71b9","metric":3152,"metrics":{},"status":"keep","description":"Resumed loop from missing repo-local autoresearch.md plus git log/autoresearch.jsonl context, then kept an honest `aspen-dogfood/src/ci.rs` cleanup on top of the dirty worktree: CI pipeline polling now uses typed repo/run/log targets, explicit monotonic timing boundary helpers, visible timeout-bounded loops, and real invariants instead of swap-prone `&str` groups and attr-like clock reads. Fresh-target-dir repo-owned workspace metric dropped from 3172 to 3152 (-20).","timestamp":1776541365235,"segment":2,"confidence":9.67432950191571,"iterationTokens":55338}
{"run":169,"commit":"8fb71b9","metric":3181,"metrics":{},"status":"discard","description":"Discard current dirty batch on top of `8fb71b9`: fresh-target-dir workspace metric regressed from the last logged 3152 to 3181. The staged tail after the measured docs/replication/shell/calendar/CI slices likely mixed in unbenchmarked federation/cluster/dogfood changes and a new `aspen-secrets/src/pki/store.rs` pass that did not offset the regression. Saved staged/unstaged backup patches under /tmp before rollback so the next loop can selectively recover only genuinely improving slices.","timestamp":1776542370352,"segment":2,"confidence":9.702209414024976,"iterationTokens":55338}
{"run":170,"commit":"8fb71b9","metric":3169,"metrics":{},"status":"discard","description":"Discard partial salvage attempt on top of `8fb71b9`: cleaning `crates/aspen-dogfood/src/main.rs` and `crates/aspen-secrets/src/pki/store.rs` improved the fresh-target-dir workspace metric from the prior failed 3181 to 3169, but it still stayed above the last logged keep at 3152. Current dirty batch still needs more cleanup—likely the unmeasured `aspen-cli` federation tail or other remaining staged files—before it is worth keeping.","timestamp":1776542693099,"segment":2,"confidence":9.730250481695569,"iterationTokens":16637}
{"run":171,"commit":"8fb71b9","metric":3195,"metrics":{},"status":"discard","description":"Discard second salvage pass on top of `8fb71b9`: rewriting `aspen-dogfood/src/main.rs`, cleaning `aspen-secrets/src/pki/store.rs`, and flattening `aspen-cli` federation response handling still measured worse at 3195 on the fresh-target-dir workspace benchmark. The dirty staged batch remains unstable/non-monotonic relative to the last keep at 3152, so continue from a smaller, cleaner slice instead of stacking more rescue edits onto this bundle.","timestamp":1776542972761,"segment":2,"confidence":9.777347531461762,"iterationTokens":18777}
{"run":172,"commit":"8fb71b9","metric":3162,"metrics":{},"status":"discard","description":"Discard restored-worktree candidate on top of `8fb71b9`: applying the staged docs/calendar/worker/net batch to the worktree, then adding real cleanup in `aspen-dogfood/src/main.rs`, `aspen-cli/commands/federation.rs`, and `aspen-secrets/src/pki/store.rs`, improved the fresh-target-dir workspace metric from the clean-worktree 3181 down to 3162. Still not enough to beat the last logged keep at 3152, so the next loop should take one more double-digit slice before attempting another keep.","timestamp":1776543640928,"segment":2,"confidence":9.901960784313726,"iterationTokens":24082}
{"run":173,"commit":"8fb71b9","metric":3170,"metrics":{},"status":"discard","description":"Discard isolated `crates/aspen-secrets/src/pki/store.rs` cleanup on top of the current dirty candidate: explicit certificate/CRL constructors, checked SAN-count conversions, saturating TTL math, and one wall-clock helper improved the fresh-target-dir workspace metric from 3191 to 3170, but it still stayed above the last keep at 3152. Good signal, not enough yet; next pass should stack another 20+ warning file such as `aspen-ci-executor-vm/src/pool.rs` or `aspen-forge-web/src/templates.rs` onto the same candidate.","timestamp":1776544566198,"segment":2,"confidence":9.911678115799804,"iterationTokens":16004}
{"run":174,"commit":"8fb71b9","metric":3104,"metrics":{},"status":"keep","description":"Recovered the stalled dirty Tiger Style batch and benchmarked it honestly against a fresh target dir: current worktree—with calendar parse/serialize, CI shell executor, CLI docs, jobs replication/shell, dogfood CI, and net forward/SOCKS5/tunnel cleanup plus the remaining staged tail—drops the repo-owned cold-workspace warning-site metric from the last logged keep at 3152 to 3104 (-48).","timestamp":1776545349901,"segment":2,"confidence":9.901960784313726,"iterationTokens":16004,"asi":{"hypothesis":"The accumulated staged-but-uncommitted handler/worker/calendar/net cleanup batch already beats the last durable 3152 baseline once measured directly from the current worktree.","lessons":"The worktree had real progress despite earlier salvage/discard churn. Fresh-target-dir full-workspace measurement is still the only trustworthy primary metric here, and keep results must be verified manually because auto-commit can claim success while HEAD stays put.","next_action_hint":"Verify whether the keep commit actually landed, then refresh the histogram from the current 3104 baseline and target the next dense honest file such as CI VM pool, CLI federation, blob client, cluster config, or secrets PKI store."}}
