{"run":292,"commit":"3920ae8","metric":0,"metrics":{},"status":"keep","description":"Finished the focused `aspen-hooks-ticket` production slice: hour/day second constants now use direct named values, `Ticket::to_bytes` handles postcard serialization failure explicitly with a debug-asserted fail-closed empty payload instead of `expect()`, `validate_ticket_fields` now exposes the validated bounds/invariants locally, and the `usize`→`u32` helper spells out saturation with an explicit match. Targeted `cargo test -p aspen-hooks-ticket --all-targets` plus the focused hooks-ticket slice both stayed green, and the explicit hooks-ticket slice dropped from 5 to 0.","timestamp":1776974057467,"segment":20,"confidence":null,"iterationTokens":3218,"asi":{"hypothesis":"Making overflow handling, serialization failure handling, and validation invariants explicit in `aspen-hooks-ticket/src/lib.rs` should eliminate its five remaining production Tiger Style locations without changing the public ticket format or validation behavior.","lessons":"The hooks-ticket `to_bytes` trait boundary cannot return a `Result`, so the honest fix is an explicit fail-closed branch rather than pretending serialization cannot fail. Also, assertion-density cleanup on validation code works well when the added assertions restate the exact postconditions enforced by the earlier error checks.","next_action_hint":"Refresh the workspace production histogram again. After hooks-ticket is clean, the remaining repo-owned production hotspots should be concentrated in `aspen-auth-core`, so define a narrow pure-helper slice there next."}}
{"type":"config","name":"Aspen auth-core Tiger Style slice (pure helper unique finding locations)","metricName":"auth_core_slice_findings","metricUnit":"","bestDirection":"lower"}
{"run":293,"commit":"3920ae8","metric":9,"metrics":{},"status":"checks_failed","description":"Rebased the loop onto a focused `aspen-auth-core` pure-helper Tiger Style slice. The stable metric counts unique warning locations only in `crates/aspen-auth-core/src/verified_auth.rs` and `crates/aspen-auth-core/src/verified_credential.rs`, and the baseline is 9 locations: four ambiguous-parameter helpers, one assertion-density site, and four raw-arithmetic-overflow test lines.","timestamp":1776974560894,"segment":21,"confidence":null,"iterationTokens":3218,"asi":{"hypothesis":"A narrow auth-core pure-helper slice will provide a stable monotonic benchmark after the hooks-ticket production slice reached zero.","rollback_reason":"Baseline-only measurement on a newly stabilized target; no intended code changes for this cycle.","next_action_hint":"Wrap the repeated `u64` helper inputs in small typed structs, then replace the four test-side `+` expressions with saturating or named checked constants before rerunning the same slice."}}
{"run":294,"commit":"db56aa7","metric":0,"metrics":{},"status":"keep","description":"Finished the focused `aspen-auth-core` pure-helper Tiger Style slice. `verified_auth.rs` now uses explicit time-input structs plus named millisecond constants, `verified_credential.rs` uses typed expiry/refresh inputs with clearer local invariants, and the downstream auth/federation call sites moved to the new explicit interfaces. `cargo test -p aspen-auth-core --lib`, `cargo check -p aspen-auth -p aspen-federation`, and the focused auth-core Tiger Style slice all stayed green while the slice metric dropped from 9 to 0.","timestamp":1776975316005,"segment":21,"confidence":null,"iterationTokens":24990,"asi":{"hypothesis":"Wrapping the repeated auth-core `u64` helper inputs in small typed structs and replacing the remaining test-side overflow arithmetic with explicit saturating/named constants should clear the focused pure-helper slice without changing semantics.","lessons":"This slice behaved like the recent sharding and hooks-ticket work: a narrow per-file benchmark plus small typed input structs yields monotonic wins. One extra boolean-naming warning appeared after the first pass, and renaming that local predicate was enough to keep the slice honest at zero.","next_action_hint":"Refresh the workspace production histogram again before choosing the next slice. Remaining repo-owned production hotspots are likely elsewhere now that `aspen-auth-core` pure helpers are clean."}}
{"type":"config","name":"Aspen Tiger Style cleanup (production workspace summary-index)","metricName":"production_tigerstyle_findings","metricUnit":"","bestDirection":"lower"}
{"run":295,"commit":"db56aa7","metric":745,"metrics":{},"status":"crash","description":"First attempt at a production-workspace baseline used the wrong parser: it matched vendored `openraft` paths like `src/...` as if they were repo-root production files, inflating the metric to 745 and surfacing non-Aspen hotspots. No trustworthy signal from this run.","timestamp":1776975490234,"segment":22,"confidence":null,"iterationTokens":1139,"asi":{"hypothesis":"A full-workspace summary-index parser over repo-owned production files will reveal the next honest Tiger Style hotspot after the auth-core slice reached zero.","rollback_reason":"Measurement invalid because the path regex treated vendored crate-relative `src/...` entries as repo-root files, so the baseline mixed Aspen and vendored findings.","next_action_hint":"Re-run the baseline with a parser keyed off the summary index crate column and explicit crate/path allowlist (for example `aspen_*` crates plus repo-root `src/` and `build.rs`) before choosing the next slice."}}
{"run":296,"commit":"db56aa7","metric":35,"metrics":{},"status":"checks_failed","description":"Rebased the loop onto a corrected production-workspace summary-index metric. The stable parser now counts only summary-index findings whose crate column starts with `aspen` and whose paths stay in production sources (excluding tests/examples), giving a trustworthy baseline of 35 unique locations. Current top files are `crates/aspen-ticket/src/v2.rs` (15), `crates/aspen-ticket/src/signed.rs` (6), `crates/aspen-client-api/src/lib.rs` (5), and smaller tails in `aspen-dag`, `aspen-plugin-api`, `aspen-hooks-types`, and `aspen-testing-network`.","timestamp":1776975676180,"segment":22,"confidence":null,"iterationTokens":6767,"asi":{"hypothesis":"A corrected summary-index parser over Aspen-only production sources will reveal the next honest Tiger Style hotspot after the auth-core slice reached zero.","rollback_reason":"Baseline-only measurement on the corrected metric; no intended code changes for this cycle.","next_action_hint":"Target the dense `crates/aspen-ticket` hotspot next, starting with `src/v2.rs` and then `src/signed.rs`, because it dominates the corrected production histogram."}}
{"run":297,"commit":"fd19be4","metric":17,"metrics":{},"status":"keep","description":"Read `autoresearch.md` as requested, confirmed this repo still has no such file, and resumed from git log plus `autoresearch.jsonl`. Then cleaned the dense `aspen-ticket` hotspot honestly: `src/v2.rs` now uses explicit fail-closed postcard serialization, bounded direct-address reservation, and explicit `usize`→`u32` saturation branches instead of sentinel fallbacks; `src/signed.rs` now uses typed timestamp/signing inputs, fail-closed serialization helpers, and a documented wall-clock boundary helper. `cargo test -p aspen-ticket --all-targets` stayed green, package-local Tiger Style is down to test-only findings, and the corrected Aspen-only production workspace metric dropped from 35 to 17.","timestamp":1776976908927,"segment":22,"confidence":40.44444444444444,"iterationTokens":41566,"asi":{"hypothesis":"The `aspen-ticket` hotspot dominates the corrected production-workspace histogram, so replacing its hidden panics/sentinel fallbacks with explicit fail-closed and typed-input logic should produce a large honest drop without gaming the benchmark.","context_recovery":"User asked to resume from autoresearch context; `autoresearch.md` is absent in this repo, so I resumed from git log plus `autoresearch.jsonl` after verifying that fact.","lessons":"The corrected production parser is working: after this pass the remaining tail is much smaller and led by `aspen-client-api/src/lib.rs` plus a tiny `aspen-ticket/src/v2.rs` remainder. `cargo tigerstyle check -p aspen-ticket` is now clean for production sources and only reports standalone test-crate warnings.","next_action_hint":"Re-scan the remaining `aspen-ticket/src/v2.rs` tail to see if the last 3 locations are cheap, otherwise pivot to the new top hotspot `crates/aspen-client-api/src/lib.rs` on the same corrected production-workspace metric."}}
{"run":298,"commit":"fd19be4","metric":65,"metrics":{},"status":"discard","description":"Tried to continue by cleaning the visibly remaining `aspen-client-api` tail in `src/lib.rs` plus the `messages/secrets.rs` suppression comment, but that widened the measured frontier instead of shrinking it. Fixing the scoped-lint/tool-comment issue let the workspace summary advance into a much larger `aspen-client-api` backlog (`messages/federation.rs`, `messages/cluster.rs`, `messages/ci.rs`), so the corrected production metric regressed from 17 to 65. Discard this batch and keep the stable post-`aspen-ticket` baseline.","timestamp":1776977599865,"segment":22,"confidence":30.333333333333332,"iterationTokens":31807,"asi":{"hypothesis":"The remaining visible `aspen-client-api` lines in `src/lib.rs` and `messages/secrets.rs` looked like a cheap next step on the corrected production-workspace metric.","rollback_reason":"The change was not monotonic on the active metric: fixing the currently visible `aspen-client-api` tail exposed a much broader hidden frontier and worsened the corrected production workspace count from 17 to 65.","next_action_hint":"Do not nibble `aspen-client-api` on the broad workspace rail. Either establish an explicit `aspen-client-api` sub-slice if you want to work that crate, or pivot to another monotonic hotspot already visible at the 17-finding baseline such as the remaining `aspen-ticket/src/v2.rs` or the small `aspen-dag` files.","lessons":"This matches earlier autoresearch history: `aspen-client-api` often has hidden warning frontiers that emerge only after an initial blocker is removed. It needs an explicit slice, not a blind broad-workspace iteration."}}
{"run":299,"commit":"fd19be4","metric":19,"metrics":{},"status":"discard","description":"Tried a small `aspen-dag` sentinel-fallback cleanup in `src/handler.rs` and `src/traversal.rs`: explicit `usize`/`u32` conversion helpers replaced the visible `unwrap_or(MAX)` sites and the previously visible `aspen_dag` lines disappeared from the summary index. But on the active corrected production-workspace metric this was not monotonic: clearing the DAG lines exposed a slightly larger hidden frontier in other crates (`aspen-nostr-relay`, `aspen-kv-branch`), so the metric regressed from 17 to 19. Discard and keep the stable post-`aspen-ticket` baseline.","timestamp":1776978051915,"segment":22,"confidence":40.44444444444444,"iterationTokens":21911,"asi":{"hypothesis":"The small visible `aspen-dag` sentinel-fallback cluster looked like a cheap next win on the 17-finding production-workspace baseline.","rollback_reason":"Although the visible `aspen_dag` lines disappeared, the active broad metric worsened from 17 to 19 because new hidden locations surfaced elsewhere. This is not a trustworthy monotonic improvement on the current benchmark.","next_action_hint":"Do not keep shaving tiny visible files on the broad 17-finding rail. Either establish an explicit sub-slice for the next crate you want to clean, or target a hotspot whose broad-workspace visibility is less likely to reveal a larger hidden frontier.","lessons":"At this stage the broad workspace rail is fragile: removing one small hotspot can immediately expose a new tranche elsewhere. For crates like `aspen-dag`, use explicit sub-slices if you want to keep local progress without losing monotonicity on the main benchmark."}}
{"type":"config","name":"Aspen ticket runtime conversion Tiger Style slice","metricName":"ticket_runtime_slice_findings","metricUnit":"","bestDirection":"lower"}
{"run":300,"commit":"fd19be4","metric":3,"metrics":{},"status":"checks_failed","description":"Rebased the loop onto an explicit `aspen-ticket` runtime-conversion Tiger Style slice. The stable metric counts only the three `no_unwrap` convenience wrappers in `crates/aspen-ticket/src/v2.rs` (runtime `to_endpoint_addr`, `endpoint_addrs`, and `endpoint_ids`) that currently panic instead of surfacing conversion failure explicitly.","timestamp":1776978213470,"segment":23,"confidence":null,"iterationTokens":409,"asi":{"hypothesis":"A narrow `aspen-ticket` runtime-conversion slice will provide a stable next target after the broad production-workspace rail became fragile at 17 visible findings.","rollback_reason":"Baseline-only measurement on a newly stabilized local slice; no intended code changes for this cycle.","next_action_hint":"Change the three convenience wrappers to return `ClusterTicketResult`, then update the handful of repo call sites and tests to use `?` or explicit `unwrap()` in test code before rerunning the same slice."}}
{"run":301,"commit":"56635e3","metric":0,"metrics":{},"status":"keep","description":"Finished the explicit `aspen-ticket` runtime-conversion Tiger Style slice. The three `v2.rs` convenience wrappers (`to_endpoint_addr`, `endpoint_addrs`, `endpoint_ids`) now surface `ClusterTicketResult` instead of panicking on conversion failure, and the repo call sites were updated to use `?` in production code or explicit `unwrap()` in tests. `cargo test -p aspen-ticket --all-targets` and `cargo check -p aspen-ticket --features iroh,std` stayed green, and the focused runtime-conversion slice dropped from 3 to 0.","timestamp":1776978726132,"segment":23,"confidence":null,"iterationTokens":14631,"asi":{"hypothesis":"Converting the remaining `aspen-ticket` runtime convenience wrappers from panic-based helpers to explicit `Result` returns would clear the last three locations in the stable local slice without changing successful behavior.","lessons":"This slice was a good fit for a local experiment: the change was mechanically safe, the `aspen-ticket` rails stayed green, and the local metric went clean without needing the fragile broad workspace rail. Updating both runtime modules plus explicit production/test call sites kept the API behavior consistent across cfgs.","next_action_hint":"Return to a fresh broad workspace baseline or pick another explicit local slice with good validation rails. Avoid `aspen-client-api` on the broad rail unless you first stabilize it as its own explicit slice."}}
{"type":"config","name":"Aspen Tiger Style cleanup (production workspace summary-index)","metricName":"production_tigerstyle_findings","metricUnit":"","bestDirection":"lower"}
{"run":302,"commit":"56635e3","metric":14,"metrics":{},"status":"checks_failed","description":"Returned from the explicit `aspen-ticket` slice to the corrected Aspen-only production-workspace metric. The fresh baseline is now 14 unique locations, down from the prior 17 broad baseline after the `aspen-ticket` runtime-conversion cleanup landed. Current visible hotspots are `crates/aspen-client-api/src/lib.rs` (5), `crates/aspen-dag/src/{traversal.rs,handler.rs}` (5 total), plus single-file tails in `aspen-plugin-api`, `aspen-testing-network`, `aspen-hooks-types`, and `aspen-client-api/src/messages/secrets.rs`.","timestamp":1776978794710,"segment":24,"confidence":null,"iterationTokens":460,"asi":{"hypothesis":"Re-basing the broad production-workspace metric after the local `aspen-ticket` slice should confirm whether that local win translated into a better global Tiger Style baseline.","rollback_reason":"Baseline-only measurement on the refreshed broad metric after changing optimization target back from the local ticket slice.","next_action_hint":"Pick the next step carefully on the 14-finding broad rail. `aspen-dag` is still visible but previously exposed hidden frontier when changed directly, so either stabilize it as its own slice or pursue one of the remaining single-file tails with low frontier risk."}}
{"type":"config","name":"Aspen client-api visible Tiger Style slice","metricName":"client_api_visible_slice_findings","metricUnit":"","bestDirection":"lower"}
{"run":303,"commit":"56635e3","metric":6,"metrics":{},"status":"checks_failed","description":"Rebased the loop onto an explicit `aspen-client-api` visible Tiger Style slice. The stable metric counts only the currently visible six locations: the `messages/secrets.rs` documented suppression line plus five `src/lib.rs` lines for the two golden-table assertion-density tests and the three numeric-unit locals in `test_constants_are_bounded`.","timestamp":1776979084339,"segment":25,"confidence":null,"iterationTokens":510,"asi":{"hypothesis":"A narrow `aspen-client-api` visible slice will let us fix the currently exposed compile and test-style issues honestly without letting the broader hidden frontier dominate the metric.","rollback_reason":"Baseline-only measurement on a newly stabilized local slice; no intended code changes for this cycle.","next_action_hint":"Replace the scoped tigerstyle allow with a normal documented clippy allow comment, add local invariants to the two golden-table tests, and simplify the constants test to direct assertions before rerunning the slice."}}
{"run":304,"commit":"c334b8e","metric":0,"metrics":{},"status":"keep","description":"Finished the explicit `aspen-client-api` visible Tiger Style slice. `messages/secrets.rs` now uses a normal documented clippy allow comment instead of the scoped `tigerstyle::unjustified_allow` that broke plain cargo builds, the two golden-table tests in `src/lib.rs` now expose local invariants explicitly, and `test_constants_are_bounded` uses direct assertions instead of numeric-unit-triggering boolean locals. `cargo test -p aspen-client-api --lib` now passes again, `cargo check -p aspen-dag --lib` is unblocked and green, and the focused visible slice dropped from 6 to 0.","timestamp":1776979297786,"segment":25,"confidence":null,"iterationTokens":8119,"asi":{"hypothesis":"A narrow `aspen-client-api` visible slice would let us clear the currently exposed compile/test-style problems honestly without needing to solve the crate's broader hidden Tiger Style frontier.","lessons":"This was a good slice choice because it restored normal cargo usability for `aspen-client-api` and unblocked downstream compile rails without pretending the crate is fully Tiger Style-clean. When a scoped `tigerstyle::*` allow trips E0710 on plain cargo, replacing it with an ordinary documented allow plus a nearby comment is the right non-cheating fix.","next_action_hint":"Refresh the broad Aspen-only production baseline next. The `aspen-client-api` visible tail should disappear from the broad rail, which will likely leave `aspen-dag` plus a few single-file tails as the next honest targets."}}
{"type":"config","name":"Aspen Tiger Style cleanup (production workspace summary-index)","metricName":"production_tigerstyle_findings","metricUnit":"","bestDirection":"lower"}
{"run":305,"commit":"c334b8e","metric":62,"metrics":{},"status":"checks_failed","description":"Rebased the broad Aspen-only production workspace metric after the `aspen-client-api` visible slice landed. As expected, removing that blocker exposed the next hidden frontier: the fresh broad baseline is now 62 unique production locations, dominated by `crates/aspen-client-api/src/messages/{mod.rs,federation.rs,cluster.rs,ci.rs}` plus the smaller `aspen-dag` tail and a few single-file stragglers.","timestamp":1776979375929,"segment":26,"confidence":null,"iterationTokens":460,"asi":{"hypothesis":"Refreshing the broad production metric after the local `aspen-client-api` visible slice would reveal the next honest frontier, even if the visible count increased because hidden warnings became reachable.","rollback_reason":"Baseline-only measurement on a newly re-exposed broader target; no intended code changes for this cycle.","next_action_hint":"Do not treat 62 as a regression of the local slice. Use it as the new broad baseline, then carve out an explicit `aspen-client-api messages defaults` slice (likely `messages/federation.rs`, `messages/mod.rs`, `messages/cluster.rs`, `messages/ci.rs`) with `cargo test -p aspen-client-api --lib` as the validation rail."}}
{"type":"config","name":"Aspen client-api message defaults Tiger Style slice","metricName":"client_api_defaults_slice_findings","metricUnit":"","bestDirection":"lower"}
{"run":306,"commit":"c334b8e","metric":13,"metrics":{},"status":"checks_failed","description":"Rebased the loop onto an explicit `aspen-client-api` message-defaults Tiger Style slice. The stable metric counts the currently visible `explicit_defaults` locations in `messages/{ci.rs,cluster.rs,federation.rs,mod.rs}` where `#[serde(default)]` on optional fields is still using the foreign default instead of an explicit local helper.","timestamp":1776979538942,"segment":27,"confidence":null,"iterationTokens":660,"asi":{"hypothesis":"A dedicated client-api message-defaults slice will let us remove the largest currently coherent group on the newly exposed `aspen-client-api` frontier without mixing in the crate's separate raw-arithmetic and no_unwrap/no_panic tails.","rollback_reason":"Baseline-only measurement on a newly stabilized local slice; no intended code changes for this cycle.","next_action_hint":"Replace the visible `#[serde(default)]` sites with file-local explicit helper functions for the affected `Option<String>`, `Option<u32>`, `Option<u64>`, and `Vec<(String,String)>` fields, then rerun `cargo test -p aspen-client-api --lib` and the slice benchmark."}}
