{"run":307,"commit":"c334b8e","metric":0,"metrics":{},"status":"crash","description":"Benchmark wrapper bug: the inline Python parser used an invalid f-string while trying to print temp-log paths, so the run failed after tests/lint invocation setup and produced no usable client-api defaults metric. Saved the staged candidate patch to /tmp/aspen-client-api-defaults.patch before logging so it can be reapplied after the crash rollback.","timestamp":1776980915992,"segment":27,"confidence":null,"iterationTokens":660}
{"run":308,"commit":"44eec7d","metric":0,"metrics":{},"status":"keep","description":"Finished the explicit aspen-client-api message-defaults Tiger Style slice: `messages/{ci,cluster,federation,mod}.rs` now use file-local explicit serde default helpers for the previously visible `Option`/`Vec` fields instead of foreign `#[serde(default)]` defaults. `cargo test -p aspen-client-api --lib` stayed green, and the fixed defaults slice dropped from 13 to 0. The experiment wrapper itself exited via `/etc/bash_logout` after cargo finished, but the lint/test logs confirm the code result is valid.","timestamp":1776981004069,"segment":27,"confidence":null,"iterationTokens":2165}
{"type":"config","name":"Aspen client-api message constant Tiger Style slice","metricName":"client_api_message_constant_slice_findings","metricUnit":"","bestDirection":"lower"}
{"run":309,"commit":"44eec7d","metric":2,"metrics":{},"status":"checks_failed","description":"Baseline for the new aspen-client-api message-constant slice: `cargo test -p aspen-client-api --lib` stays green, and the fixed Tiger Style slice currently has 2 unique `raw_arithmetic_overflow` locations in `messages/mod.rs` (`MAX_CLIENT_MESSAGE_SIZE`, `MAX_GIT_CHUNK_SIZE_BYTES`). The wrapper still exits through `/etc/bash_logout` after cargo finishes, but the parsed metric/log are valid.","timestamp":1776981141335,"segment":28,"confidence":null,"iterationTokens":594}
{"run":310,"commit":"e9b905b","metric":0,"metrics":{},"status":"keep","description":"Finished the explicit aspen-client-api message-constant Tiger Style slice: `messages/mod.rs` now uses named byte-count constants for the client-message and git-chunk limits instead of raw multiplication chains, and the docs now match the actual 16 MiB / 1 MiB / 4 MiB values. `cargo test -p aspen-client-api --lib` stayed green, and the fixed raw-arithmetic slice dropped from 2 to 0.","timestamp":1776981333234,"segment":28,"confidence":null,"iterationTokens":4708}
{"type":"config","name":"Aspen Tiger Style cleanup (production workspace summary-index)","metricName":"production_tigerstyle_findings","metricUnit":"","bestDirection":"lower"}
{"run":311,"commit":"e9b905b","metric":9,"metrics":{},"status":"checks_failed","description":"Refreshed the corrected Aspen-only production workspace summary-index baseline after the aspen-client-api default/helper slices landed. The stable broad parser now reports 9 unique production Tiger Style locations across repo-owned crates; this is the new honest baseline for the next slice.","timestamp":1776981475617,"segment":29,"confidence":null,"iterationTokens":814}
{"type":"config","name":"Aspen DAG handler and traversal Tiger Style slice","metricName":"dag_handler_traversal_slice_findings","metricUnit":"","bestDirection":"lower"}
{"run":312,"commit":"e9b905b","metric":5,"metrics":{},"status":"checks_failed","description":"Baseline for the explicit aspen-dag handler/traversal Tiger Style slice: `cargo tigerstyle check -p aspen-dag` currently reports 5 unique locations across `src/handler.rs` and `src/traversal.rs` (two sentinel-fallback conversions in the protocol handler and three traversal locations covering sentinel fallback plus a quantity-style local).","timestamp":1776981588160,"segment":30,"confidence":null,"iterationTokens":493}
{"run":313,"commit":"a749dcb","metric":0,"metrics":{},"status":"keep","description":"Finished the explicit aspen-dag handler/traversal Tiger Style slice: the DAG sync handler now uses explicit checked `u32`→`usize` branches with unit-suffixed request-size naming, and traversal visited/skip bounds now use explicit saturation branches plus clearer `max_visited_entries` naming instead of hidden sentinel fallbacks. `cargo check -p aspen-dag --lib` stayed green, and the fixed handler/traversal slice dropped from 5 to 0.","timestamp":1776981659390,"segment":30,"confidence":null,"iterationTokens":2680}
{"type":"config","name":"Aspen Tiger Style cleanup (production workspace summary-index)","metricName":"production_tigerstyle_findings","metricUnit":"","bestDirection":"lower"}
{"run":314,"commit":"a749dcb","metric":9,"metrics":{},"status":"checks_failed","description":"Refreshed the corrected Aspen-only production workspace summary-index after the aspen-dag slice landed. The stable broad parser still reports 9 unique production Tiger Style locations, so the next work should target whichever newly surfaced files replaced the cleaned client-api and DAG tails.","timestamp":1776981721328,"segment":31,"confidence":null,"iterationTokens":502}
{"type":"config","name":"Aspen Tiger Style cleanup (non-test production workspace summary-index)","metricName":"non_test_production_tigerstyle_findings","metricUnit":"","bestDirection":"lower"}
{"run":315,"commit":"a749dcb","metric":0,"metrics":{},"status":"crash","description":"Baseline parser command for the non-test production workspace rail was malformed: the shell wrapped the inline Python in single quotes, so `#[cfg(test)]` lines broke the command before cargo ran. No code signal from this cycle; rerun with a quoting-safe heredoc or external temp script.","timestamp":1776981865167,"segment":32,"confidence":null,"iterationTokens":1183}
{"type":"config","name":"Aspen testing support and time Tiger Style slice","metricName":"testing_support_time_slice_findings","metricUnit":"","bestDirection":"lower"}
{"run":316,"commit":"a749dcb","metric":9,"metrics":{},"status":"checks_failed","description":"Baseline for the explicit testing-support/time Tiger Style slice: `cargo tigerstyle check -p aspen-time -p aspen-testing-core -p aspen-testing-fixtures` currently reports 9 unique locations across `aspen-time::current_time_ms`, two sentinel fallbacks in `aspen-testing-core`, and six small fixture issues in `builders.rs`, `coordination_helper.rs`, and `mock_endpoint.rs`.","timestamp":1776982081287,"segment":33,"confidence":null,"iterationTokens":561}
{"run":317,"commit":"7e800e6","metric":0,"metrics":{},"status":"keep","description":"Finished the explicit testing-support/time Tiger Style slice: `aspen-time::current_time_ms` and the testing-core/testing-fixtures helpers now use explicit checked saturation branches instead of hidden sentinel fallbacks, `ClusterBuilder`/`ClusterConfig` expose `u32` node counts, mock-endpoint lock ordering plus boolean naming are explicit, and fixture writes/lock assertions handle results without ignored `Result` or `unwrap()`. `cargo check -p aspen-time -p aspen-testing-core -p aspen-testing-fixtures` stayed green, and the fixed slice dropped from 9 to 0.","timestamp":1776982147478,"segment":33,"confidence":null,"iterationTokens":3272}
{"type":"config","name":"Aspen Tiger Style cleanup (non-test production workspace summary-index)","metricName":"non_test_production_tigerstyle_findings","metricUnit":"","bestDirection":"lower"}
{"type":"config","name":"Aspen kv-branch and nostr-relay sentinel fallback Tiger Style slice","metricName":"kv_nostr_sentinel_slice_findings","metricUnit":"","bestDirection":"lower"}
{"run":318,"commit":"7e800e6","metric":5,"metrics":{},"status":"checks_failed","description":"Baseline for the explicit kv-branch + nostr-relay sentinel-fallback Tiger Style slice: `cargo tigerstyle check -p aspen-kv-branch -p aspen-nostr-relay` currently reports 5 unique locations across `scan_merge.rs`, `connection.rs`, `filters.rs`, `iroh_transport.rs`, and `subscriptions.rs`, all from hidden `unwrap_or(...::MAX)` conversion fallbacks.","timestamp":1776982332946,"segment":35,"confidence":null,"iterationTokens":455}
{"run":319,"commit":"d07ccd4","metric":1,"metrics":{},"status":"keep","description":"Kept the production part of the explicit kv-branch + nostr-relay Tiger Style slice: the visible sentinel fallbacks in `scan_merge.rs`, `connection.rs`, `filters.rs`, `iroh_transport.rs`, and `subscriptions.rs` now use explicit checked/saturating branches instead of hidden `unwrap_or(...::MAX)` fallbacks, and `cargo check -p aspen-kv-branch -p aspen-nostr-relay` stayed green. The fixed slice dropped from 5 to 1; the remaining location is the test-only `kv(key, value)` helper in `scan_merge.rs`, which I am leaving alone because this repo's guidance is to avoid test modifications unless explicitly requested.","timestamp":1776982466954,"segment":35,"confidence":null,"iterationTokens":1902}
{"type":"config","name":"Aspen Tiger Style cleanup (non-test production workspace summary-index)","metricName":"non_test_production_tigerstyle_findings","metricUnit":"","bestDirection":"lower"}
{"run":320,"commit":"d07ccd4","metric":2,"metrics":{},"status":"checks_failed","description":"Refreshed the non-test production Tiger Style workspace baseline after the latest slices landed. The corrected summary-index parser now reports 2 remaining non-test production findings across repo-owned crates; this is the stable broad baseline for the next slice.","timestamp":1776982590054,"segment":36,"confidence":null,"iterationTokens":897}
{"type":"config","name":"Aspen core no-std smoke Tiger Style slice","metricName":"core_no_std_smoke_slice_findings","metricUnit":"","bestDirection":"lower"}
{"run":321,"commit":"d07ccd4","metric":0,"metrics":{},"status":"crash","description":"Baseline wrapper bug on the explicit aspen-core-no-std-smoke slice: the single-quoted shell command stripped Python string quotes inside the heredoc, so the parser crashed with `NameError` before producing a usable metric. No code signal from this cycle.","timestamp":1776982639942,"segment":37,"confidence":null,"iterationTokens":418}
{"run":322,"commit":"d07ccd4","metric":2,"metrics":{},"status":"checks_failed","description":"Baseline for the explicit aspen-core-no-std-smoke Tiger Style slice: `cargo check -p aspen-core-no-std-smoke` stays green, and the fixed slice currently has 2 locations in `src/lib.rs` (one numeric-units local and one bool-naming local).","timestamp":1776982653302,"segment":37,"confidence":null,"iterationTokens":838}
{"run":323,"commit":"cd47ce0","metric":0,"metrics":{},"status":"keep","description":"Finished the explicit aspen-core-no-std-smoke Tiger Style slice: the smoke helper now uses predicate-style naming, inlines the normalized scan limit instead of a quantity-ambiguous local, and adds real invariants for key validity, token roundtrip, and entry payload preservation. `cargo check -p aspen-core-no-std-smoke` stayed green, and the fixed slice dropped from 2 to 0.","timestamp":1776982778957,"segment":37,"confidence":null,"iterationTokens":1673}
{"type":"config","name":"Aspen Tiger Style cleanup (non-test production workspace summary-index)","metricName":"non_test_production_tigerstyle_findings","metricUnit":"","bestDirection":"lower"}
{"run":324,"commit":"cd47ce0","metric":34,"metrics":{},"status":"checks_failed","description":"Refreshed the non-test production Tiger Style workspace baseline after the latest local slices landed. The corrected summary-index parser now reports 34 remaining non-test production locations; this is the new honest broad baseline for the next slice, even though it is higher than the earlier 2-location frontier because previously blocked files are now fully reachable.","timestamp":1776982854026,"segment":38,"confidence":null,"iterationTokens":897}
{"type":"config","name":"Aspen contacts vCard parse Tiger Style slice","metricName":"contacts_vcard_parse_slice_findings","metricUnit":"","bestDirection":"lower"}
{"run":325,"commit":"cd47ce0","metric":11,"metrics":{},"status":"checks_failed","description":"Baseline for the explicit aspen-contacts vCard parse Tiger Style slice: `cargo test -p aspen-contacts --lib` stays green, and `crates/aspen-contacts/src/vcard/parse.rs` currently has 11 unique locations covering `parse_vcard` length/assertion-density, bool naming, unbounded growth, raw slice arithmetic, and the quoted-colon parser state.","timestamp":1776982923772,"segment":39,"confidence":null,"iterationTokens":440}
{"run":326,"commit":"f18b1b4","metric":0,"metrics":{},"status":"keep","description":"Finished the explicit aspen-contacts vCard parse Tiger Style slice: `parse_vcard` now delegates property handling through smaller helpers, vCard block parsing uses predicate-style state names with real invariants, unfolding/parameter parsing pre-reserve capacity and avoid raw slice arithmetic via checked suffix extraction, and quoted-colon parsing uses explicit boolean naming. `cargo test -p aspen-contacts --lib` stayed green, and the fixed `vcard/parse.rs` slice dropped from 11 to 0.","timestamp":1776983096481,"segment":39,"confidence":null,"iterationTokens":2982}
{"type":"config","name":"Aspen Tiger Style cleanup (non-test production workspace summary-index)","metricName":"non_test_production_tigerstyle_findings","metricUnit":"","bestDirection":"lower"}
{"run":327,"commit":"f18b1b4","metric":23,"metrics":{},"status":"checks_failed","description":"Refreshed the non-test production Tiger Style workspace baseline after the aspen-contacts vCard parser slice landed. The corrected summary-index parser now reports 23 remaining non-test production locations across repo-owned crates; this is the new stable broad baseline for the next slice.","timestamp":1776983181181,"segment":40,"confidence":null,"iterationTokens":897}
{"type":"config","name":"Aspen contacts store Tiger Style slice","metricName":"contacts_store_slice_findings","metricUnit":"","bestDirection":"lower"}
{"run":328,"commit":"f18b1b4","metric":12,"metrics":{},"status":"checks_failed","description":"Baseline for the explicit aspen-contacts store Tiger Style slice: `cargo test -p aspen-contacts --lib` stays green, and `crates/aspen-contacts/src/store.rs` currently has 12 unique locations covering assertion density, quantity-style naming, unchecked count conversions, unbounded growth, and one `unwrap_or_default()` serialization fallback in `import_vcard`.","timestamp":1776983813586,"segment":41,"confidence":null,"iterationTokens":897,"asi":{"hypothesis":"Establish a stable per-file Tiger Style slice for `crates/aspen-contacts/src/store.rs` before making any contacts-store cleanup.","rollback_reason":"Baseline-only measurement on a newly stabilized local slice; no intended code changes for this cycle.","next_action_hint":"Inspect the 12 reported store.rs lines, then fix the mechanical production issues first: bounded capacities/count conversions, explicit serialization error handling in `import_vcard`, and real command-boundary invariants on CRUD/group helpers."}}
{"run":329,"commit":"0a5beee","metric":2,"metrics":{},"status":"keep","description":"Cleaned the production part of the explicit aspen-contacts store Tiger Style slice: list/search limits now use clearer result-count naming, search result and prefix-scan accumulation are bounded with explicit capacity/page helpers tied to `MAX_SCAN_RESULTS`, key/ID helpers now use typed inputs instead of swap-prone `&str` pairs, and contact query matching asserts its lowercase precondition. `cargo test -p aspen-contacts --lib` stayed green, and the fixed `store.rs` slice dropped from 12 to 2; the remaining two locations are test-only lines that I am leaving alone because this repo's guidance is to avoid test modifications unless explicitly requested.","timestamp":1776984269233,"segment":41,"confidence":null,"iterationTokens":35388,"asi":{"hypothesis":"Most of `crates/aspen-contacts/src/store.rs` is an honest production-only Tiger Style cleanup target: bounded scan/search helpers plus typed key/id inputs should remove nearly all visible findings without touching tests.","lessons":"This slice behaved like several earlier Aspen late-stage runs: once production helper churn is cleaned, the remaining tail can be test-only and should not force test edits against repo guidance. Reusing the existing `MAX_SCAN_RESULTS` resource bound from Aspen core is cleaner than inventing a new arbitrary page limit for `scan_all`.","next_action_hint":"Verify whether the keep actually advanced HEAD, then either rebaseline this slice as non-test `store.rs` production-only (now effectively zero) or pivot to the next explicit contacts-store/contacts-domain production hotspot from the refreshed histogram."}}
{"type":"config","name":"Aspen Tiger Style cleanup (non-test production workspace summary-index)","metricName":"non_test_production_tigerstyle_findings","metricUnit":"","bestDirection":"lower"}
{"run":330,"commit":"0a5beee","metric":0,"metrics":{},"status":"crash","description":"Broad non-test production baseline wrapper was malformed: embedding the Python regex parser inside a single-quoted `bash -lc` command let the shell break on inner quotes before cargo ran, so this cycle measured nothing useful.","timestamp":1776984339391,"segment":42,"confidence":null,"iterationTokens":1332,"asi":{"hypothesis":"Refresh the broad non-test production Tiger Style histogram after the contacts-store keep so the next honest slice can be chosen from current repo-owned hotspots.","rollback_reason":"Benchmark command was malformed by shell quoting, so cargo never ran and the metric is invalid.","next_action_hint":"Rerun the same baseline with a quoting-safe heredoc or temp Python script, then choose the next explicit slice from the resulting top-file histogram.","error_detail":"`bash -c` hit `syntax error near unexpected token '('` on the embedded Python regex line before starting `cargo tigerstyle check`."}}
{"run":331,"commit":"0a5beee","metric":13,"metrics":{},"status":"checks_failed","description":"Refreshed the corrected non-test production Tiger Style workspace baseline after the aspen-contacts store keep. The broad summary-index parser now reports 13 remaining repo-owned non-test production locations, dominated by `crates/aspen-calendar/src/ical/rrule.rs` (7), `crates/aspen-calendar/src/store.rs` (3), and `crates/aspen-contacts/src/vcard/serialize.rs` (2), with one more in `crates/aspen-calendar/src/ical/parse.rs` or `serialize.rs`.","timestamp":1776984411555,"segment":42,"confidence":null,"iterationTokens":1305,"asi":{"hypothesis":"A fresh broad non-test production baseline after the contacts-store keep will reveal the next honest hotspots for continued Tiger Style cleanup.","rollback_reason":"Baseline-only measurement on a refreshed broad target; no intended code changes for this cycle.","next_action_hint":"Take an explicit calendar or contacts serialization slice next, starting with the dense `crates/aspen-calendar/src/ical/rrule.rs` cluster or the compact `crates/aspen-contacts/src/vcard/serialize.rs` tail."}}
{"type":"config","name":"Aspen calendar RRULE production Tiger Style slice","metricName":"calendar_rrule_production_slice_findings","metricUnit":"","bestDirection":"lower"}
{"run":332,"commit":"0a5beee","metric":7,"metrics":{},"status":"checks_failed","description":"Baseline for the explicit aspen-calendar RRULE production Tiger Style slice: `cargo test -p aspen-calendar --lib` stays green, and `crates/aspen-calendar/src/ical/rrule.rs` currently has 7 non-test unique locations covering one swap-prone `should_stop_expansion` signature plus six hidden `unwrap_or(...MAX)`/`unwrap_or(...::MAX)` sentinel fallbacks in capacity and time/count conversions.","timestamp":1776984492523,"segment":43,"confidence":null,"iterationTokens":531,"asi":{"hypothesis":"A focused production-only `rrule.rs` slice will let us clean the visible RRULE helper tail honestly without touching test helpers in the same file.","rollback_reason":"Baseline-only measurement on a new explicit local slice; no intended code changes for this cycle.","next_action_hint":"Replace the six sentinel-fallback conversions with explicit saturation helpers/branches and wrap the `should_stop_expansion` time pair in a small struct before rerunning the slice."}}
{"run":333,"commit":"8f012b9","metric":0,"metrics":{},"status":"keep","description":"Finished the explicit aspen-calendar RRULE production Tiger Style slice: RRULE expansion now uses explicit saturation helpers for instance-capacity and time conversions instead of hidden `unwrap_or(...MAX)` fallbacks, and the stop-condition time pair flows through an `ExpansionBounds` struct instead of swap-prone raw `u64` arguments. `cargo test -p aspen-calendar --lib` stayed green, and the fixed non-test `rrule.rs` slice dropped from 7 to 0 without touching the test-only helpers at the bottom of the file.","timestamp":1776984561961,"segment":43,"confidence":null,"iterationTokens":4959,"asi":{"hypothesis":"Replacing the visible RRULE sentinel fallbacks with explicit saturation helpers and wrapping the stop-condition time pair in a typed struct should clear the whole production tail cleanly.","lessons":"`rrule.rs` was a good explicit-slice target: all seven visible production findings were local mechanical issues, so one focused pass brought the slice to zero while leaving test-only helpers untouched. Filtering per-file slices by the first `#[cfg(test)]` line is a reliable way to respect this repo's 'do not modify tests unless asked' rule while still benchmarking file-local progress.","next_action_hint":"Verify the keep actually advanced HEAD, then refresh the broad non-test production workspace baseline. The next honest hotspots should now be the smaller calendar/store or contacts-serialize tails surfaced by that refreshed histogram."}}
{"type":"config","name":"Aspen Tiger Style cleanup (non-test production workspace summary-index)","metricName":"non_test_production_tigerstyle_findings","metricUnit":"","bestDirection":"lower"}
