{"run":261,"commit":"c89d721","metric":51,"metrics":{},"status":"discard","description":"Resumed from git log plus autoresearch.jsonl because repo-local `autoresearch.md` is still absent, then tried the narrower `topology/shard.rs` plus `topology/topology_map.rs` slice on the fixed coordination+sharding Tiger Style rail. This also crossed into a worse frontier: helper-based checked conversions introduced fresh `ambiguous_params` and `unchecked_division` findings in `topology/shard.rs`, and touching topology APIs caused the overall tail to expand rather than shrink. Discard this batch and keep the stable 51-finding baseline unchanged.","timestamp":1776963216591,"segment":6,"confidence":1,"iterationTokens":1362,"asi":{"hypothesis":"A focused `topology/shard.rs` plus `topology/topology_map.rs` pass could remove the public `usize`, narrowing, and raw-arithmetic findings on the fixed 51-finding coordination+sharding Tiger Style rail without changing the broader tail.","rollback_reason":"The changes opened a larger lint frontier instead of shrinking the active benchmark; helper-based checked conversions triggered new Tiger Style findings and the fixed rail became incomparable as a local improvement.","next_action_hint":"Avoid helper-heavy rewrites in the sharding topology files. Revert this batch and either target one-file, inline-only cleanups in `automation.rs`/`router.rs`, or establish a narrower explicit sub-slice if you want to continue on sharding without disturbing the broader rail."}}
{"run":262,"commit":"c89d721","metric":51,"metrics":{},"status":"discard","description":"Resumed from git log plus autoresearch.jsonl because repo-local `autoresearch.md` is still absent, then tried a very narrow inline-only `aspen-sharding/src/router.rs` pass on the fixed coordination+sharding Tiger Style rail. Tightening the distribution test removed one platform-dependent cast site, but the file still carries the same raw-arithmetic test finding and the overall rail stayed flat at the kept 51-finding baseline. Discard this no-op batch and keep the stable baseline unchanged.","timestamp":1776963340229,"segment":6,"confidence":0.782608695652174,"iterationTokens":1362,"asi":{"hypothesis":"A very small inline-only cleanup in `aspen-sharding/src/router.rs` could shave one predictable test-side Tiger Style finding off the fixed 51-finding coordination+sharding rail without opening a broader lint frontier.","rollback_reason":"No measurable improvement on the active fixed rail; the local router edit removed too little to move the stable benchmark.","next_action_hint":"Do not spend more loops on tiny one-finding router nibbles. Either define a narrower explicit sub-slice for duplicated sharding test findings, or pivot to a denser stable hotspot where a single honest change can remove multiple findings at once."}}
{"type":"config","name":"Aspen sharding topology Tiger Style slice (constants+routing unique findings)","metricName":"topology_slice_findings","metricUnit":"","bestDirection":"lower"}
{"run":263,"commit":"c89d721","metric":8,"metrics":{},"status":"checks_failed","description":"Rebased the loop onto an explicit sharding-only Tiger Style sub-slice because the broader coordination+sharding rail had too much unrelated noise for honest one-step wins. The new stable metric counts unique Tiger Style findings only in `crates/aspen-sharding/src/topology/constants.rs` and `crates/aspen-sharding/src/topology/routing.rs`, and the current baseline is 8 unique findings (4 raw-arithmetic-overflow in constants, 2 sentinel_fallback and 2 unchecked_division in routing).","timestamp":1776963724089,"segment":7,"confidence":null,"iterationTokens":424,"asi":{"hypothesis":"A narrower explicit sub-slice around sharding topology constants+routing will give a stable monotonic benchmark after the broader 51-finding rail proved too noisy for small honest iterations.","rollback_reason":"Baseline-only measurement on a newly stabilized target; no intended code changes for this cycle.","next_action_hint":"Eliminate the 4 const arithmetic findings by using named precomputed byte/second constants, then rewrite routing to avoid sentinel fallback and unchecked division without helper-heavy churn."}}
{"run":264,"commit":"80884f2","metric":0,"metrics":{},"status":"keep","description":"Took the first real step on the new sharding-only topology rail and cleared it completely. `crates/aspen-sharding/src/topology/constants.rs` now uses direct named byte/second constants instead of overflow-prone const arithmetic chains, and `crates/aspen-sharding/src/topology/routing.rs` now builds boundaries/ranges with explicit iteration plus checked division branches instead of sentinel-fallback conversion helpers. The explicit sub-slice `topology/constants.rs + topology/routing.rs` dropped from 8 unique Tiger Style findings to 0.","timestamp":1776963935684,"segment":7,"confidence":null,"iterationTokens":4506,"asi":{"hypothesis":"Replacing const arithmetic chains with direct named constants and rewriting routing boundary helpers to avoid sentinel fallbacks and unchecked division can zero the explicit sharding topology sub-slice without touching the noisier rest of the crate.","lessons":"A narrower explicit sub-slice was the right move: the 8 unique findings in constants+routing were fully tractable once measured separately from the broader sharding tail. Also, explicit iteration beat helper-heavy checked-conversion wrappers here because it avoided reopening sentinel/ambiguous-params lints.","next_action_hint":"Pick the next explicit sharding-only sub-slice instead of returning to the noisy broad rail immediately; `topology/shard.rs + topology/topology_map.rs` or `metrics.rs` are good next candidates, but keep the metric focused on one coherent lint cluster at a time."}}
{"type":"config","name":"Aspen sharding topology Tiger Style slice (shard+topology_map unique findings)","metricName":"topology_slice_findings","metricUnit":"","bestDirection":"lower"}
{"run":265,"commit":"18045b3","metric":1,"metrics":{},"status":"keep","description":"Took the first real step on the new sharding topology sub-slice `topology/shard.rs + topology/topology_map.rs`: `ShardMetrics::qps` now uses checked division plus saturating totals and a checked `u32` conversion, `record_write` now takes unit-suffixed fixed-width byte lengths with saturating size math, `shard_count()` now returns a bounded `u32`, and `next_shard_id()` uses saturating addition. The explicit sub-slice dropped from 8 unique Tiger Style findings to 1, and targeted `cargo test -p aspen-sharding topology:: -- --nocapture` stayed green.","timestamp":1776964379304,"segment":8,"confidence":null,"iterationTokens":2754,"asi":{"hypothesis":"An inline, non-helper-heavy cleanup of `topology/shard.rs` and `topology/topology_map.rs` can remove most of the public-usize, narrowing, and arithmetic findings on the explicit sharding topology sub-slice without reopening new lint frontiers.","lessons":"Inline checked conversions and saturating arithmetic worked much better here than helper-heavy rewrites; the slice now has only one remaining `unchecked_division` in `ShardMetrics::qps`. The targeted topology tests are a reliable pre/post safety rail for this sub-slice.","next_action_hint":"Stay on the same explicit sub-slice for one more pass and remove the last `unchecked_division` in `crates/aspen-sharding/src/topology/shard.rs`, then rerun the same parsed benchmark and topology tests."}}
{"run":266,"commit":"fe738d9","metric":0,"metrics":{},"status":"keep","description":"Finished the explicit sharding topology sub-slice `topology/shard.rs + topology/topology_map.rs`. The last remaining `unchecked_division` in `ShardMetrics::qps` now uses checked division all the way through, leaving the slice clean at 0 unique Tiger Style findings. Targeted `cargo test -p aspen-sharding topology:: -- --nocapture` stayed green after the final pass.","timestamp":1776964444333,"segment":8,"confidence":null,"iterationTokens":2577,"asi":{"hypothesis":"One more inline pass in `ShardMetrics::qps` can remove the last remaining division finding on the explicit sharding topology sub-slice without reopening a helper-driven lint frontier.","lessons":"For this slice, repeated small inline changes beat large rewrites: once the API/narrowing findings were removed, the final checked-division cleanup landed cleanly and the targeted topology tests remained a dependable guardrail.","next_action_hint":"Define the next explicit sharding-only sub-slice instead of returning to the noisy broad rail. The next best coherent target is likely `metrics.rs` or a transport-independent non-automation sharding file, with a parser that counts only unique findings in that chosen slice."}}
{"type":"config","name":"Aspen sharding Tiger Style slice (metrics unique findings)","metricName":"metrics_slice_findings","metricUnit":"","bestDirection":"lower"}
{"run":267,"commit":"fe738d9","metric":11,"metrics":{},"status":"checks_failed","description":"Rebased the loop onto the next explicit sharding-only Tiger Style sub-slice: `crates/aspen-sharding/src/metrics.rs`. The new stable metric counts unique Tiger Style findings only in that file, and the current baseline is 11 unique findings covering public `usize` APIs, numeric-unit naming, raw arithmetic overflow, unchecked division/narrowing, and one ambient-clock boundary.","timestamp":1776964582320,"segment":9,"confidence":null,"iterationTokens":388,"asi":{"hypothesis":"A dedicated metrics-only sub-slice will provide a stable monotonic benchmark after the topology slices reached zero.","rollback_reason":"Baseline-only measurement on a newly stabilized target; no intended code changes for this cycle.","next_action_hint":"Use inline conversions and a single explicit time-boundary helper to clear the public-usize, numeric-unit, arithmetic, division, and ambient-clock findings in `metrics.rs` without reintroducing helper-driven Tiger Style lints."}}
{"run":268,"commit":"2f3e7d4","metric":1,"metrics":{},"status":"keep","description":"Took the first real pass on the explicit `crates/aspen-sharding/src/metrics.rs` Tiger Style slice. The metrics atomics now use fixed-width byte-length inputs with unit-suffixed names, saturating size math, checked QPS division and `u32` conversion, and bounded monotonic elapsed-ms conversion in the collector time helper. The explicit metrics sub-slice dropped from 11 unique Tiger Style findings to 1, while targeted `cargo test -p aspen-sharding metrics:: -- --nocapture` stayed green.","timestamp":1776964744202,"segment":9,"confidence":null,"iterationTokens":3611,"asi":{"hypothesis":"An inline metrics-only cleanup can remove most of the public-usize, numeric-unit, arithmetic, and division findings in `metrics.rs` without reopening the helper-heavy lint frontier that hurt the broader rail.","lessons":"The metrics slice behaves like the topology slices: inline fixed-width conversions and checked divisions are effective, while bigger abstraction jumps are risky. Only one ambient-clock finding remains, and the test rail stayed stable before and after the change.","next_action_hint":"Stay on the explicit `metrics.rs` slice for one more pass and remove the remaining ambient-clock finding with a boundary approach that Tiger Style accepts, or if that proves noisy, keep this improvement and re-slice again."}}
{"run":269,"commit":"a297795","metric":0,"metrics":{},"status":"keep","description":"Finished the explicit `crates/aspen-sharding/src/metrics.rs` Tiger Style sub-slice. The last remaining ambient-clock finding is now handled by marking `ShardMetricsCollector::new()` as the documented monotonic timing boundary with the repo-standard `unknown_lints` companion allow, leaving the metrics-only slice clean at 0 unique Tiger Style findings. Targeted `cargo test -p aspen-sharding metrics:: -- --nocapture` stayed green after the final pass.","timestamp":1776964893749,"segment":9,"confidence":null,"iterationTokens":6478,"asi":{"hypothesis":"A documented, item-scoped monotonic timing-boundary allow on `ShardMetricsCollector::new()` can remove the final ambient-clock finding in `metrics.rs` without changing collector behavior or reintroducing noisy lint warnings.","lessons":"The repo’s established `#[allow(unknown_lints)]` + `#[allow(ambient_clock, reason = ...)]` pattern is the right way to handle legitimate monotonic timing boundaries outside `aspen-time`. The explicit metrics-only sub-slice is now fully clean, confirming that narrow, coherent rails are much more effective than the earlier broad sharding benchmark.","next_action_hint":"Choose the next explicit sharding-only slice rather than returning to the noisy broad rail immediately. Good next candidates are `consistent_hash.rs`, `lib.rs`, or a small automation-only slice if you want to tackle the remaining non-topology findings coherently."}}
{"type":"config","name":"Aspen sharding Tiger Style slice (consistent_hash unique findings)","metricName":"consistent_hash_slice_findings","metricUnit":"","bestDirection":"lower"}
{"run":270,"commit":"a297795","metric":5,"metrics":{},"status":"checks_failed","description":"Rebased the loop onto the next explicit sharding-only Tiger Style sub-slice: `crates/aspen-sharding/src/consistent_hash.rs`. The new stable metric counts unique Tiger Style findings only in that file, and the current baseline is 5 unique findings: two test assertion-density sites plus one each for unchecked narrowing, platform-dependent cast, and unchecked division.","timestamp":1776965221093,"segment":10,"confidence":null,"iterationTokens":392,"asi":{"hypothesis":"A dedicated consistent-hash-only sub-slice will provide a stable monotonic benchmark after the topology and metrics slices reached zero.","rollback_reason":"Baseline-only measurement on a newly stabilized target; no intended code changes for this cycle.","next_action_hint":"Tackle the low-risk test-side findings first with extra invariants, checked bucket indexing, and checked division, then revisit the remaining production unchecked narrowing in `hash_u64` with an inline bounded conversion."}}
{"run":271,"commit":"941f18b","metric":0,"metrics":{},"status":"keep","description":"Finished the explicit `crates/aspen-sharding/src/consistent_hash.rs` Tiger Style sub-slice. `hash_u64` now uses an inline bounded `u32::try_from(j)` update instead of the final unchecked narrowing cast, `test_distribution` now uses checked bucket indexing plus explicit invariants/constants, and `test_minimal_redistribution` adds a real moved-count bound assertion. The consistent-hash-only slice dropped from 5 unique findings to 0, and targeted `cargo test -p aspen-sharding consistent_hash:: -- --nocapture` stayed green.","timestamp":1776965466264,"segment":10,"confidence":null,"iterationTokens":1545,"asi":{"hypothesis":"A consistent-hash-only slice should be fully tractable with inline conversions and stronger test invariants, allowing the remaining unchecked narrowing/cast/division/assertion-density findings to go to zero without opening a broader lint frontier.","lessons":"The pattern from earlier sharding slices holds: small explicit sub-slices plus inline changes are far more reliable than broad rails or helper-heavy rewrites. Test-side platform casts and assertion-density findings were easy wins once isolated, and the remaining production unchecked narrowing in `hash_u64` was also fixable without semantic drift.","next_action_hint":"Choose the next explicit sharding-only slice instead of returning to the noisy broad rail. `crates/aspen-sharding/src/lib.rs` is a good next candidate because its remaining findings are tightly grouped around node-id encoding arithmetic and checked narrowing."}}
{"type":"config","name":"Aspen sharding Tiger Style slice (lib unique findings)","metricName":"lib_slice_findings","metricUnit":"","bestDirection":"lower"}
{"run":272,"commit":"941f18b","metric":6,"metrics":{},"status":"checks_failed","description":"Rebased the loop onto the next explicit sharding-only Tiger Style sub-slice: `crates/aspen-sharding/src/lib.rs`. The new stable metric counts unique Tiger Style findings only in that file, and the current baseline is 6 unique findings centered on node-id mask/shift arithmetic and two unchecked shard-id narrowing sites in the decode helpers.","timestamp":1776965627345,"segment":11,"confidence":null,"iterationTokens":387,"asi":{"hypothesis":"A dedicated lib-only sub-slice will provide a stable monotonic benchmark for the remaining node-id encoding/decoding Tiger Style findings after the consistent-hash slice reached zero.","rollback_reason":"Baseline-only measurement on a newly stabilized target; no intended code changes for this cycle.","next_action_hint":"Replace the mask/shift arithmetic with named shift constants and byte-based shard extraction so the decode helpers avoid unchecked narrowing while preserving the existing wire-compatible node-id layout."}}
{"run":273,"commit":"4b260fa","metric":0,"metrics":{},"status":"keep","description":"Finished the explicit `crates/aspen-sharding/src/lib.rs` Tiger Style sub-slice: node-id shard extraction now uses byte-based prefix decoding plus named physical-ID constants instead of shift/mask narrowing casts, and targeted `cargo test -p aspen-sharding --lib` plus the lib-only Tiger Style slice both stayed green. The explicit lib-only slice dropped from 6 unique findings to 0.","timestamp":1776970883095,"segment":11,"confidence":null,"iterationTokens":387,"asi":{"hypothesis":"Byte-based shard-prefix extraction plus named physical-node constants should remove the remaining lib.rs node-id encoding/decoding findings without changing the wire-compatible layout.","lessons":"For tiny sharding files, an explicit per-file unique-finding slice is much more stable than the broad workspace metric. `cargo tigerstyle check -p aspen-sharding` still needs `env -u CARGO_INCREMENTAL RUSTC_WRAPPER=` in this repo to avoid the sccache incremental abort while benchmarking.","next_action_hint":"Choose the next explicit sharding-only slice instead of returning to the noisy broad rail. Good next candidates are `automation.rs`, `sharded.rs`, or a small router-only slice depending on which file has the cleanest grouped remaining findings."}}
{"type":"config","name":"Aspen sharding Tiger Style slice (router unique findings)","metricName":"router_slice_findings","metricUnit":"","bestDirection":"lower"}
{"run":274,"commit":"4b260fa","metric":3,"metrics":{},"status":"checks_failed","description":"Rebased the loop onto the next explicit sharding-only Tiger Style sub-slice: `crates/aspen-sharding/src/router.rs`. The new stable metric counts unique Tiger Style findings only in that file, and the current baseline is 3 unique findings: one overflow-prone test bound, one platform-dependent shard-index cast, and one compound distribution assertion.","timestamp":1776971031929,"segment":12,"confidence":null,"iterationTokens":391,"asi":{"hypothesis":"A dedicated router-only sub-slice will provide a stable monotonic benchmark for the remaining shard-routing Tiger Style findings after the lib slice reached zero.","rollback_reason":"Baseline-only measurement on a newly stabilized target; no intended code changes for this cycle.","next_action_hint":"Replace the `MAX_SHARDS + 1` panic test input with a saturating helper, index the distribution buckets through a checked helper, and split the compound shard-distribution assertion into separate bounds so the router slice can drop to zero."}}
{"run":275,"commit":"a9614f0","metric":0,"metrics":{},"status":"keep","description":"Finished the explicit `crates/aspen-sharding/src/router.rs` Tiger Style sub-slice: panic-bound and distribution tests now use named sample/bound constants, checked shard-index conversion, saturating bucket counts, and split distribution assertions, while targeted `cargo test -p aspen-sharding --lib` and the router-only Tiger Style slice both stayed green. The explicit router-only slice dropped from 3 unique findings to 0.","timestamp":1776971175517,"segment":12,"confidence":null,"iterationTokens":3191,"asi":{"hypothesis":"A small router-test cleanup using saturating bounds, checked shard indexing, and separate distribution assertions should eliminate the remaining router.rs findings without changing routing behavior.","lessons":"Small explicit sharding sub-slices remain highly tractable: once the benchmark narrows to one file, even test-only arithmetic/cast/assertion cleanup can go straight to zero in a single pass. Named constants plus checked conversion are enough to satisfy Tiger Style here without touching production router code.","next_action_hint":"Choose the next explicit sharding-only slice rather than returning to the noisy broad rail. `automation.rs` is the next best candidate because its remaining findings are tightly grouped around two wall-clock reads, one overflow-prone combined-size calculation, and repeated numeric-units locals."}}
{"type":"config","name":"Aspen sharding Tiger Style slice (automation unique findings)","metricName":"automation_slice_findings","metricUnit":"","bestDirection":"lower"}
