{"run":364,"commit":"aec21e8","metric":419,"metrics":{},"status":"keep","description":"Cleaned `openraft/openraft/src/engine/engine_impl.rs` for the corrected broad workspace rail: replaced the sync `#[tracing::instrument]` wrappers with explicit entered spans to remove repeated `unbounded_loop` false positives, converted several `unwrap()`/ignored-result paths into explicit fail-closed branches or debug-asserted early returns, and tightened small naming/default sites (`Duration::ZERO`, predicate-style booleans, explicit IO flush condition handling) without changing engine semantics. Targeted `cargo check -p openraft`, `cargo test -p openraft install_full_snapshot_test --lib`, and `cargo test -p openraft trigger_snapshot_test --lib` stayed green, and the corrected fresh-target-dir full-workspace summary-index metric dropped from 443 to 419 (-24).","timestamp":1776991906155,"segment":58,"confidence":4.111111111111111,"iterationTokens":43708,"asi":{"hypothesis":"`openraft/openraft/src/engine/engine_impl.rs` is the best next corrected broad-workspace hotspot because it combines a large cluster of sync `#[tracing::instrument]` false positives with several low-risk unwrap/result/naming/default issues that can be fixed without touching the giant `raft_core.rs` frontier.","lessons":"For this summary-index parser, the stable regex must allow leading spaces before `F<number>` and capture the four-column format (`F lint crate path:line`). `engine_impl.rs` was excellent ROI: most of its visible tail was attr-macro noise plus a handful of mechanical unwrap/result/default issues, so one focused pass cut the full-workspace metric materially while targeted openraft validation stayed green.","next_action_hint":"Stay on the corrected broad rail and keep picking medium-size vendored openraft files with mechanical findings before attempting `raft_core.rs`. The refreshed top candidates are now `openraft/openraft/src/config/config.rs`, `openraft/openraft/src/replication/mod.rs`, and `openraft/openraft/src/raft/raft_inner.rs`; prefer a file with explicit arithmetic/default/result-handling wins over heavy public-API churn."}}
{"run":365,"commit":"6d1771b","metric":403,"metrics":{},"status":"keep","description":"Cleaned `openraft/openraft/src/replication/mod.rs` for the corrected broad workspace rail: replication task spawn now uses a typed `ReplicationSpawnInput`, backoff/timeout locals and loop bounds are explicit, the log-range debug assertion uses checked/saturating math instead of `as usize` and `end - start`, inflight continuation no longer unwraps, and several sync/async tracing wrappers were simplified to avoid repeated false positives without changing replication behavior. Previously-run targeted validation stayed green (`cargo check -p openraft`, `cargo test -p openraft append_membership_test --lib`, `cargo test -p openraft update_matching_test --lib`), and the corrected fresh-target-dir full-workspace summary-index metric dropped from 419 to 403 (-16).","timestamp":1776992488590,"segment":58,"confidence":3.3333333333333335,"iterationTokens":45819,"asi":{"hypothesis":"`openraft/openraft/src/replication/mod.rs` is a strong corrected broad-workspace target because it mixes a big cluster of tracing/loop warnings with mechanical parameter-shape, unwrap, and arithmetic issues that can be fixed locally without diving into `raft_core.rs`.","lessons":"For this broad rail, medium-size vendored modules continue to yield honest double-digit wins when the work stays on typed input structs, explicit loop bounds, and checked/saturating arithmetic. Also, package-local validation for the replication slice needs the replication-handler unit rails (`append_membership_test`, `update_matching_test`) rather than unrelated snapshot tests.","next_action_hint":"Stay on the corrected broad workspace rail and keep harvesting medium-size openraft files before the `raft_core.rs` cliff. The refreshed top candidates are now `openraft/openraft/src/config/config.rs`, `openraft/openraft/src/raft/raft_inner.rs`, `openraft/openraft/src/network/snapshot_transport.rs`, and `openraft/openraft/src/engine/handler/following_handler/mod.rs`; prefer a file with arithmetic/default/result-handling wins and limited public-API churn."}}
{"run":366,"commit":"fa4daf8","metric":394,"metrics":{},"status":"keep","description":"Resumed from missing repo-local `autoresearch.md` plus recent git log/autoresearch context, then cleaned `openraft/openraft/src/raft/raft_inner.rs` for the corrected broad workspace rail: core-state locking now recovers poisoned mutexes instead of unwrapping, `call_core`/`join_core_task` use explicit spans plus visible wait bounds instead of attr-macro loop false positives, the stop-error path no longer panics on impossible states, and the long default wait timeout now uses named saturating constants with clearer unit-bearing naming. Targeted `cargo check -p openraft` and `cargo test -p openraft metrics::wait_test --lib` stayed green, and the corrected fresh-target-dir full-workspace summary-index metric dropped from 403 to 394 (-9).","timestamp":1776992811579,"segment":58,"confidence":3.3,"iterationTokens":16874,"asi":{"hypothesis":"`openraft/openraft/src/raft/raft_inner.rs` is a good resumed broad-workspace target because it combines several mechanical lock/unwrap/panic issues with attr-macro `unbounded_loop` false positives and one raw-arithmetic timeout literal, all fixable without changing public Raft behavior.","lessons":"`autoresearch.md` is still absent in this repo, so durable resume context comes from `git log` plus `autoresearch.jsonl`. In vendored openraft async helpers, explicit `.instrument(...)` spans are still the honest fix for wrapper-level `unbounded_loop` false positives, while poisoned `std::sync::Mutex` recovery and explicit non-panicking fallbacks remove real `no_unwrap`/`no_panic` debt at the same time.","next_action_hint":"Stay on the corrected broad workspace rail and keep harvesting medium-sized vendored openraft files before the `raft_core.rs` cliff. The refreshed top mechanical targets are now `openraft/openraft/src/config/config.rs`, `openraft/openraft/src/network/snapshot_transport.rs`, `openraft/openraft/src/engine/handler/following_handler/mod.rs`, and `openraft/openraft/src/raft/api/{management,protocol}.rs`; prefer a file with explicit arithmetic/default/result-handling wins and limited public-API churn."}}
{"run":367,"commit":"fa4daf8","metric":0,"metrics":{},"status":"crash","description":"Broad workspace Tiger Style benchmark for the staged `openraft/src/network/snapshot_transport.rs` slice failed in the environment, not the code: the fresh target dir under `/tmp` hit disk-full linker errors (`mold: failed to write to an output file`), so the parsed zero-finding metric is invalid. Saved the staged diff to `/tmp/openraft-snapshot-transport.patch` before logging so the candidate can be restored and rerun against a healthier target dir.","timestamp":1776995967566,"segment":58,"confidence":3.3,"iterationTokens":16874}
{"run":368,"commit":"de1fdd8","metric":386,"metrics":{},"status":"keep","description":"Cleaned `openraft/openraft/src/network/snapshot_transport.rs` for the corrected broad workspace rail: chunked snapshot send/receive now use explicit offset/size units, fail-closed missing-chunk and stalled-reader branches, typed non-panicking snapshot-init/finalize handling, and clearer `is_done`/`snapshot_size_bytes` naming instead of hidden unwraps and raw progress math. Targeted `cargo check -p openraft` and `cargo test -p openraft test_chunked_reset_offset_if_snapshot_id_mismatch --lib` stayed green, and rerunning the fresh-target-dir full-workspace summary-index benchmark from disk-backed `/run/user/$UID/tmp` dropped the corrected metric from 394 to 386 (-8).","timestamp":1776996068235,"segment":58,"confidence":2.9722222222222223,"iterationTokens":11742}
{"run":369,"commit":"ae956f6","metric":378,"metrics":{},"status":"keep","description":"Cleaned `openraft/openraft/src/engine/handler/following_handler/mod.rs` for the corrected broad workspace rail: thin sync snapshot/append/membership handlers now use explicit debug spans instead of `#[tracing::instrument]`, snapshot install fails closed without `unwrap()`, membership buffering pre-reserves its bounded two-entry window, and the snapshot-update predicate now uses clearer boolean naming. Targeted `cargo check -p openraft` and `cargo test -p openraft following_handler --lib` stayed green, and the fresh-target-dir full-workspace summary-index benchmark from `/run/user/$UID/tmp` dropped the corrected metric from 386 to 378 (-8).","timestamp":1776996251859,"segment":58,"confidence":3.484848484848485,"iterationTokens":12414}
{"run":370,"commit":"d6e656b","metric":372,"metrics":{},"status":"keep","description":"Cleaned `openraft/openraft/src/engine/handler/vote_handler/mod.rs` for the corrected broad workspace rail: vote entrypoints now use explicit debug spans instead of `#[tracing::instrument]`, zero-duration fallback is spelled as `Duration::ZERO`, leader-state transitions fail closed without `unwrap()`, and replication/noop append paths now build handlers only after explicit leader-state checks. Targeted `cargo check -p openraft` and `cargo test -p openraft vote_handler --lib` stayed green, and the fresh-target-dir full-workspace summary-index benchmark from `/run/user/$UID/tmp` dropped the corrected metric from 378 to 372 (-6).","timestamp":1776996382247,"segment":58,"confidence":3.6666666666666665,"iterationTokens":10138}
{"run":371,"commit":"7a20ee2","metric":367,"metrics":{},"status":"keep","description":"Cleaned `openraft/openraft/src/utime.rs` for the corrected broad workspace rail: leased-value defaults now use explicit `Duration::ZERO`, and `touch()` no longer unwraps the prior timestamp but handles the missing-last-update branch explicitly before asserting monotonicity. Targeted `cargo check -p openraft`, `cargo test -p openraft startup_test --lib`, and `cargo test -p openraft handle_vote_req_test --lib` stayed green, and the fresh-target-dir full-workspace summary-index benchmark from `/run/user/$UID/tmp` dropped the corrected metric from 372 to 367 (-5).","timestamp":1776996508173,"segment":58,"confidence":3.5,"iterationTokens":20852}
{"run":372,"commit":"76d9427","metric":362,"metrics":{},"status":"keep","description":"Cleaned `openraft/openraft/src/metrics/serde_instant.rs` for the corrected broad workspace rail: SerdeInstant now treats serialize/deserialize as explicit wall-clock boundaries with item-scoped ambient-clock allows, deserialization handles both duration branches without `unwrap()`, and the visitor instantiation now uses plain `PhantomData` instead of a foreign default. `cargo check -p openraft` stayed green, and rerunning the fresh-target-dir full-workspace summary-index benchmark from `/run/user/$UID/tmp` dropped the corrected metric from 367 to 362 (-5).","timestamp":1776997055692,"segment":58,"confidence":3.638888888888889,"iterationTokens":2277}
{"run":373,"commit":"1294e52","metric":358,"metrics":{},"status":"keep","description":"Resumed from missing repo-local `autoresearch.md` plus recent git log/autoresearch context, then cleaned `openraft/openraft/src/progress/entry/mod.rs` for the corrected broad workspace rail: progress range computation now uses explicit saturating max-end math, midpoint search uses named distance constants with unit-bearing locals instead of raw `end - matching_next` arithmetic, and the file's targeted progress-entry tests stayed green. Targeted `cargo check -p openraft` and `cargo test -p openraft progress::entry:: --lib` stayed green, and the fresh-target-dir full-workspace summary-index benchmark from `/run/user/$UID/tmp` dropped the corrected metric from 362 to 358 (-4).","timestamp":1776997339702,"segment":58,"confidence":3.9705882352941178,"iterationTokens":12427}
{"run":374,"commit":"665f942","metric":349,"metrics":{},"status":"keep","description":"Cleaned `openraft/openraft/src/core/tick.rs`: documented mutex lock ordering, recovered poisoned shutdown/join locks without `unwrap()`, replaced the raw `loop` with an explicit stop-flag tick loop, and used saturating tick-index increments. `cargo test -p openraft test_shutdown --lib` and `cargo check -p openraft` passed before and after, and the corrected full-workspace Tiger Style summary-index metric dropped from 358 to 349 (-9).","timestamp":1776998325613,"segment":58,"confidence":4.5,"iterationTokens":12427}
{"run":375,"commit":"91f34ad","metric":342,"metrics":{},"status":"keep","description":"Cleaned `openraft/openraft/src/raft/api/management.rs`: replaced async attr-macro spans with explicit `.instrument(...)` spans, renamed retain/blocking flags to predicate-style names, handled missing membership metadata without `unwrap()`, and used an explicit empty `BTreeSet` for the noop flatten step. `cargo test -p openraft initialize_test --lib`, `cargo test -p openraft test_membership_add_learner --lib`, and `cargo check -p openraft` passed before and after, and the corrected full-workspace Tiger Style summary-index metric dropped from 349 to 342 (-7).","timestamp":1776998651088,"segment":58,"confidence":4.950819672131147,"iterationTokens":26674}
{"run":376,"commit":"8a8dc18","metric":336,"metrics":{},"status":"keep","description":"Cleaned `openraft/openraft/src/raft/api/protocol.rs`: replaced async attr-macro spans with explicit `.instrument(...)` spans on the protocol entrypoints and inlined the transfer-leader wait duration so the remaining numeric-units warning disappeared. `cargo test -p openraft vote_handler --lib`, `cargo test -p openraft following_handler --lib`, and `cargo check -p openraft` passed before and after, and the corrected full-workspace Tiger Style summary-index metric dropped from 342 to 336 (-6).","timestamp":1776998934670,"segment":58,"confidence":4.757575757575758,"iterationTokens":14787}
{"run":377,"commit":"07c7290","metric":330,"metrics":{},"status":"keep","description":"Cleaned `openraft/openraft/src/vote/raft_term/raft_term_impls.rs`: the vendored `RaftTerm::next()` macro now uses `saturating_add(1)` instead of raw `+ 1`, so the repeated raw-arithmetic findings disappear while integer behavior stays fail-closed at the type bounds. `cargo test -p openraft test_raft_term_impls --lib` and `cargo check -p openraft` passed before and after, and the corrected full-workspace Tiger Style summary-index metric dropped from 336 to 330 (-6).","timestamp":1776999057524,"segment":58,"confidence":4.6571428571428575,"iterationTokens":4171}
{"run":378,"commit":"67325d3","metric":326,"metrics":{},"status":"keep","description":"Cleaned `openraft/openraft/src/replication/snapshot_transmitter.rs`: replaced the async attr-macro with explicit span instrumentation, made the retry loop exit through a visible `should_retry` condition instead of a raw `loop`, routed snapshot chunk sizing through a checked `u64`→`usize` helper, and named the fallback backoff timer explicitly. `cargo test -p openraft install_full_snapshot_test --lib` and `cargo check -p openraft` passed before and after, and the corrected full-workspace Tiger Style summary-index metric dropped from 330 to 326 (-4).","timestamp":1776999387474,"segment":58,"confidence":4.638888888888889,"iterationTokens":1294}
{"run":379,"commit":"e9699dc","metric":322,"metrics":{},"status":"keep","description":"Cleaned `openraft/openraft/src/raft/impl_raft_blocking_write.rs`: replaced async attr-macro spans with explicit `.instrument(...)` spans and renamed the retain/blocking flags to predicate-style names in the thin blocking-write wrappers. `cargo test -p openraft initialize_test --lib`, `cargo test -p openraft test_membership_add_learner --lib`, and `cargo check -p openraft` passed before and after, and the corrected full-workspace Tiger Style summary-index metric dropped from 326 to 322 (-4).","timestamp":1776999622930,"segment":58,"confidence":4.75,"iterationTokens":18624}
{"run":380,"commit":"e9699dc","metric":0,"metrics":{},"status":"crash","description":"Broad workspace benchmark for the staged `openraft/openraft/src/engine/log_id_list.rs` cleanup failed in the environment, not the code: the fresh target dir under `/run/user/$UID/tmp` hit disk-full linker errors (`No space left on device` / `mold: failed to write to an output file`), so the parsed zero-finding metric is invalid. Saved the staged patch to `/tmp/openraft-log-id-list.patch` before logging so it can be reapplied after rollback.","timestamp":1776999785979,"segment":58,"confidence":4.75,"iterationTokens":10949}
{"run":381,"commit":"9e34776","metric":318,"metrics":{},"status":"keep","description":"Cleaned `openraft/openraft/src/engine/log_id_list.rs`: replaced same-type log-index helper signatures with a small `LogIndexBounds` value, reused it for midpoint/adjacency/count math, and removed the stale `clone_on_copy` allow. `cargo test -p openraft log_id_list --lib` and `cargo check -p openraft` passed before and after, and the corrected full-workspace Tiger Style summary-index metric dropped from 322 to 318 (-4).","timestamp":1776999967722,"segment":58,"confidence":4.861111111111111,"iterationTokens":8843}
{"run":382,"commit":"622dbc3","metric":315,"metrics":{},"status":"keep","description":"Cleaned `openraft/openraft/src/replication/mod.rs`: replaced the raw replication loop with a visible `should_run` condition, kept higher-vote/storage exits fail-closed after notification, and renamed the timeout/backoff temporaries to unit-safe names. `cargo test -p openraft append_membership_test --lib`, `cargo test -p openraft update_matching_test --lib`, and `cargo check -p openraft` passed before and after, and the corrected full-workspace Tiger Style summary-index metric dropped from 318 to 315 (-3).","timestamp":1777000130066,"segment":58,"confidence":4.876712328767123,"iterationTokens":6799}
{"run":383,"commit":"6a391df","metric":312,"metrics":{},"status":"keep","description":"Cleaned `openraft/openraft/src/metrics/wait.rs`: renamed the instant/timer locals away from quantity-name false positives and replaced the same-type span helper parameters with a small `WaitTraceContext` struct. `cargo test -p openraft metrics::wait_test --lib` and `cargo check -p openraft` passed before and after, and the corrected full-workspace Tiger Style summary-index metric dropped from 315 to 312 (-3).","timestamp":1777000269727,"segment":58,"confidence":4.891891891891892,"iterationTokens":7514}
{"run":384,"commit":"975cb34","metric":305,"metrics":{},"status":"keep","description":"Cleaned `openraft/openraft/src/progress/vec_progress.rs` without benchmark gaming: moved the neighbor-slot arithmetic to a saturating named index in `move_up`, renamed the quorum-comparison booleans to explicit predicates, gated the test-only `get()` trait path out of production, and stopped silently discarding quorum-upgrade update results. `cargo test -p openraft vec_progress --lib` and `cargo check -p openraft` passed before and after, and the corrected full-workspace Tiger Style summary-index metric dropped from 312 to 305 (-7).","timestamp":1777000488756,"segment":58,"confidence":4.883116883116883,"iterationTokens":2316,"asi":{"hypothesis":"The remaining `vec_progress.rs` findings are mechanical production issues—raw neighbor index math, ambiguous bool naming, one production-only test helper, and one silently discarded update result—so a local cleanup should remove the whole file from the workspace hotspot list without changing quorum-progress semantics.","lessons":"`autoresearch.md` is still absent in this repo, so durable resume context remains `git log` plus `autoresearch.jsonl`. For this broad rail, targeting a dense single file with several independent mechanical warnings is better ROI than scattering tiny fixes across many 1-warning files.","next_action_hint":"Continue the broad honest rail with the new top file `openraft/openraft/src/error/mod.rs` or another 4-5 finding hotspot like `storage/helper.rs`, keeping the same before/after targeted test pattern and strict metric parser."}}
{"run":385,"commit":"48da87d","metric":302,"metrics":{},"status":"keep","description":"Cleaned `openraft/openraft/src/storage/helper.rs`: replaced the foreign default lease duration with `Duration::ZERO`, moved `last_membership_in_log()` off the async attr-macro onto an explicit span, and folded the chunk-count arithmetic into a small `ChunkCountBounds` helper with a visible zero-step guard. `cargo test -p openraft startup_test --lib`, `cargo test -p openraft log_state_reader_test --lib`, and `cargo check -p openraft` passed before and after, and the corrected full-workspace Tiger Style summary-index metric dropped from 305 to 302 (-3).","timestamp":1777000762478,"segment":58,"confidence":4.775,"iterationTokens":12133,"asi":{"hypothesis":"`storage/helper.rs` still had a compact mechanical warning cluster—one foreign default, one async attr-macro false positive, and one same-type chunk-count helper with unchecked division—so a local helper cleanup should remove the whole file from the top hotspot list without changing storage recovery semantics.","lessons":"For the broad vendored rail, helper extraction continues to beat API churn: one explicit span plus one small bounds struct removed all remaining `storage/helper.rs` findings cleanly. Running the full workspace rail after each keep remains important, because removing one hotspot can reshuffle the next frontier more than the raw local count suggests.","next_action_hint":"Continue the honest broad rail with the new top file `openraft/openraft/src/error/mod.rs` (5) or another small 3-finding helper file like `core/heartbeat/worker.rs`, keeping the same before/after targeted-test discipline."}}
