{"run":24,"commit":"bd486f3","metric":5021,"metrics":{},"status":"keep","description":"Finished the last local `aspen-exec-cache` assertion-density cleanup: split `evict_lru_entries` to isolate the removal loop and extracted `hash_env_var` from `verified/cache_key.rs`, leaving the crate's Tiger Style run clean. Full exec-cache tests/checks stayed green, and the cold repo-owned warning-site count dropped from 5023 to 5021 (-2).","timestamp":1776372835970,"segment":2,"confidence":6.461538461538462,"iterationTokens":6702,"asi":{"hypothesis":"Eliminating the final two `aspen-exec-cache` assertion-density warnings should still shave a small but real amount off the repo-owned workspace metric.","lessons":"Even tiny local wins remain measurable when the cold benchmark is stable. `cargo tigerstyle check -p aspen-exec-cache -- --message-format short` now reports zero source warnings for that crate, so it is a good point to switch hotspots instead of overworking it.","next_action_hint":"Move to the next denser repo-owned hotspot. `aspen-plugin-api` looked large in the last cold benchmark, so inspect its manifest/resolve helpers next for another high-yield, low-risk slice."}}
{"run":25,"commit":"bd486f3","metric":5008,"metrics":{},"status":"keep","description":"Started `aspen-plugin-api` cleanup by replacing implicit serde defaults in `manifest.rs` with explicit helper constructors for optional strings/u64s, string lists, permissions, signatures, and dependency lists. Plugin-api tests/checks stayed green, and the cold repo-owned Tiger Style warning-site count dropped from 5021 to 5008 (-13).","timestamp":1776373056513,"segment":2,"confidence":5.542857142857143,"iterationTokens":17696,"asi":{"hypothesis":"The many implicit-serde-default warnings in `crates/aspen-plugin-api/src/manifest.rs` are a low-risk, high-yield slice that should cut the workspace count materially without semantic changes.","lessons":"One manifest/default pass removed more workspace warning sites than the crate-local count suggested, likely because the same source warnings surfaced across multiple target compilations. Good reminder not to overfit only to per-crate raw warning counts.","next_action_hint":"Stay in `aspen-plugin-api` next: `resolve.rs` still has the biggest local warning cluster and should yield another meaningful drop before touching the ambient-time helpers in `lib.rs`."}}
{"run":26,"commit":"bd486f3","metric":4999,"metrics":{},"status":"keep","description":"Refactored `crates/aspen-plugin-api/src/resolve.rs`: split load-order resolution into smaller graph/toposort helpers, pre-sized maps/queues/vectors, renamed version comparison to `version_at_least`, and tightened install/reverse-dependent bookkeeping without changing semantics. Plugin-api tests/checks stayed green, and the cold repo-owned Tiger Style warning-site count dropped from 5008 to 4999 (-9).","timestamp":1776380317515,"segment":2,"confidence":5.888888888888889,"iterationTokens":17696,"asi":{"hypothesis":"The remaining `resolve.rs` hotspot in `aspen-plugin-api` should yield another real workspace drop if I remove the long-function, reservation, and parameter-order warnings with pure helper extraction.","lessons":"A focused structural refactor in one warning-dense file can remove several lint classes at once while preserving behavior. Also, if an experiment response gets lost, rerun the exact benchmark and log that completed cycle rather than guessing a metric.","next_action_hint":"Stay in `aspen-plugin-api` and tackle `src/lib.rs` ambient-time and narrowing-cast warnings next, or pivot to another large hotspot after checking whether those time helpers can be isolated cleanly without overfitting."}}
{"run":27,"commit":"bd486f3","metric":0,"metrics":{},"status":"crash","description":"Benchmark invocation returned immediately with empty output and exit code 1, so the parsed workspace metric was meaningless. No signal on the `aspen-plugin-api/src/lib.rs` timestamp cleanup from this run.","timestamp":1776381671210,"segment":2,"confidence":5.888888888888889,"iterationTokens":17696,"asi":{"hypothesis":"Isolating wall-clock reads in `crates/aspen-plugin-api/src/lib.rs` and making plugin metrics timestamps explicit should reduce the repo-owned Tiger Style count below 4999.","rollback_reason":"run_experiment produced an empty log and exit code 1, so this cycle did not measure the current code state.","next_action_hint":"Sanity-check the workspace benchmark command with a direct shell run, fix any command/environment issue, then rerun the cold workspace benchmark before deciding whether to keep the plugin-api lib changes."}}
{"run":28,"commit":"bd486f3","metric":4990,"metrics":{},"status":"keep","description":"Finished the remaining `aspen-plugin-api` warning slice: `lib.rs` now uses an explicit wall-clock helper plus checked epoch-ms conversion and an explicit memory-size constant, and `resolve.rs` wraps version strings in tiny newtypes so the comparison helper cannot take swapped `&str` parameters. Plugin-api tests/checks stayed green, and the cold repo-owned Tiger Style warning-site count dropped from 4999 to 4990 (-9).","timestamp":1776381836577,"segment":2,"confidence":4.6938775510204085,"iterationTokens":5699,"asi":{"hypothesis":"The remaining `aspen-plugin-api` time-boundary and same-type-parameter warnings are still low-risk and should yield another measurable workspace drop once isolated cleanly.","lessons":"Public API cleanup can stay honest if the semantic boundary remains explicit: keeping wall-clock reads in one helper and making request timestamps caller-provided avoids lint-silencing while preserving testability. Also, the cold benchmark command is stable again after the earlier empty-log hiccup.","next_action_hint":"Pick the next high-yield hotspot from a fresh workspace warning scan, likely `src/bin/aspen-token.rs` or another dense repo-owned crate, and avoid tiny single-warning edits unless they sit inside a broader slice."}}
{"run":29,"commit":"bd486f3","metric":4978,"metrics":{},"status":"keep","description":"Started a low-risk `aspen-fuse/src/chunking.rs` cleanup: introduced fixed-width chunk-size constants, replaced several unchecked chunk-count/offset conversions with checked helpers, made small-file overwrite cleanup propagate real errors, and ignored missing chunk deletions only when the OS reports NotFound. Targeted aspen-fuse tests/checks stayed green, and the cold repo-owned Tiger Style warning-site count dropped from 4990 to 4978 (-12).","timestamp":1776382265101,"segment":2,"confidence":5.08,"iterationTokens":38462,"asi":{"hypothesis":"A narrow chunking-safety pass in `crates/aspen-fuse/src/chunking.rs` can remove a meaningful batch of cast/result warnings without redesigning the file-chunking algorithm.","lessons":"Even partial cleanup in a warning-dense file can pay off: the safest fixes were checked integer conversions and explicit delete semantics, not a full structural refactor. `aspen-fuse` still has many remaining chunking warnings, so the next pass can stay localized instead of hopping crates immediately.","next_action_hint":"Continue in `crates/aspen-fuse/src/chunking.rs` with helper-based `usize` conversions and `_bytes` naming for offsets/sizes, or stop if the next slice starts requiring behavioral redesign rather than mechanical safety cleanup."}}
{"run":30,"commit":"bd486f3","metric":4950,"metrics":{},"status":"keep","description":"Continued `crates/aspen-fuse/src/chunking.rs` cleanup with conversion helpers and byte-unit naming: rewrote `chunked_read_range` and `chunked_write_range` around checked `u64`/`u32`→`usize` conversions, removed many platform-size casts, and kept range math explicit in `_bytes` locals. Targeted aspen-fuse tests/checks stayed green, and the cold repo-owned Tiger Style warning-site count dropped from 4978 to 4950 (-28).","timestamp":1776382507814,"segment":2,"confidence":5.254237288135593,"iterationTokens":4874,"asi":{"hypothesis":"A second localized `chunking.rs` pass focused on checked indexing conversions and byte-suffixed range math should remove a larger batch of remaining Tiger Style warnings without changing chunking semantics.","lessons":"This file is still high-yield: converting shared offset/index math through a few helpers removed many warnings at once, much more than the first pass. Big wins are still coming from mechanical safety cleanup rather than benchmark-cheating suppressions.","next_action_hint":"Stay in `crates/aspen-fuse/src/chunking.rs` for one more pass if the remaining warnings are still mechanical (nonzero-division guards, assertion density, `chunked_rename` parameter swap). Otherwise re-scan the workspace and switch to the next dense hotspot."}}
{"run":31,"commit":"bd486f3","metric":4943,"metrics":{},"status":"keep","description":"Tightened another `aspen-fuse` chunking slice: replaced remaining chunk math divisions with checked division/remainder paths, added real invariant assertions to `chunked_read`/`chunked_write`, and switched `chunked_rename` to a small `RenameKeys` struct so source/destination key order is explicit. Targeted aspen-fuse tests/checks stayed green, and the cold repo-owned Tiger Style warning-site count dropped from 4950 to 4943 (-7).","timestamp":1776382750398,"segment":2,"confidence":4.764705882352941,"iterationTokens":11702,"asi":{"hypothesis":"One more localized `chunking.rs` pass on nonzero-division guards, invariant assertions, and rename-key parameter safety should still reduce workspace warning sites without changing behavior.","lessons":"Even when one new local helper warning appears, the wider workspace can still improve if the refactor removes several higher-frequency warning sites. Small parameter structs are an honest way to fix swap-prone APIs without suppressing lints.","next_action_hint":"Re-scan the workspace before another edit. `aspen-fuse/src/chunking.rs` now looks close to diminishing returns, so the next best move may be a denser repo-owned hotspot like `crates/aspen-cli/src/bin/aspen-cli/commands/verify.rs`."}}
{"run":32,"commit":"bd486f3","metric":4928,"metrics":{},"status":"keep","description":"Took a focused first pass through `crates/aspen-cli/src/bin/aspen-cli/commands/verify.rs`: introduced explicit wall-clock/elapsed helpers for KV verification, renamed JSON/replication booleans to predicate-style names, replaced silent cleanup deletes with checked cleanup reporting, and collapsed the swap-prone 8-argument KV result builder into a small input struct. `cargo check -p aspen-cli` stayed green, and the cold repo-owned Tiger Style warning-site count dropped from 4943 to 4928 (-15).","timestamp":1776383056674,"segment":2,"confidence":4.657894736842105,"iterationTokens":23307,"asi":{"hypothesis":"A localized `verify.rs` KV-slice cleanup should remove several real Tiger Style warnings at once without redesigning the whole verification command tree.","lessons":"`verify.rs` is indeed a high-yield hotspot: even one bounded sub-slice around KV verification produced a larger workspace drop than the last fuse pass. Using explicit boundary helpers for wall-clock and elapsed timing avoids cheating while making later CLI verification helpers easier to normalize.","next_action_hint":"Stay in `crates/aspen-cli/src/bin/aspen-cli/commands/verify.rs` for another pass, likely the docs/blob helpers that still have the same direct-clock, bool-prefix, and discarded-result patterns."}}
{"run":33,"commit":"bd486f3","metric":4851,"metrics":{},"status":"keep","description":"Took a second focused pass through `crates/aspen-cli/src/bin/aspen-cli/commands/verify.rs`: removed remaining direct clock reads via explicit boundary helpers, replaced unsafe count/time conversions, split blob/KV helper paths, reserved cross-node collections, made docs/blob availability parsing explicit, and cleaned the file to zero local Tiger Style warnings while keeping `cargo check -p aspen-cli` green. Cold repo-owned warning-site count dropped from 4928 to 4851 (-77).","timestamp":1776384075253,"segment":2,"confidence":5.906976744186046,"iterationTokens":23307,"asi":{"hypothesis":"A broader cleanup of the remaining `verify.rs` warning cluster—especially all-mode helper paths, cross-node collection growth, and ambient time boundaries—should remove a large local batch and produce a double-digit cold-workspace drop.","lessons":"`verify.rs` had much more latent density than the first pass suggested: once the helper structure was normalized, many warnings collapsed together. Local `cargo tigerstyle check -p aspen-cli` is now clean for this file, so next loop should pivot to another dense file instead of nibbling the same area further.","next_action_hint":"Re-scan the cold workspace warning histogram and target the next dense repo-owned file, likely `crates/aspen-cli/src/bin/aspen-cli/commands/git.rs` or a non-CLI hotspot like `crates/aspen-tui/src/ui/jobs.rs`."}}
{"run":34,"commit":"bd486f3","metric":4825,"metrics":{},"status":"keep","description":"Took a low-risk `crates/aspen-cli/src/bin/aspen-cli/commands/git.rs` naming/API pass: renamed boolean output flags to predicate-style names, made `git diff`'s content toggle explicit at the request boundary, and retitled CLI pagination/interval fields to less warning-prone names while preserving existing `--limit/--offset/--interval` flags. `cargo check -p aspen-cli` stayed green, and the cold repo-owned warning-site count dropped from 4851 to 4825 (-26).","timestamp":1776384456721,"segment":2,"confidence":6.363636363636363,"iterationTokens":35606,"asi":{"hypothesis":"A purely mechanical naming cleanup in `git.rs`—especially the many `json` booleans plus a few quantity-like CLI arg fields—should shave off a couple dozen warning sites without touching git behavior.","lessons":"Large command files can still yield good wins without structural refactors if a warning class repeats everywhere. Preserving clap long-option names while renaming internal fields kept the CLI stable and removed the noisy boolean-parameter cluster.","next_action_hint":"Pivot to another dense but still mechanical hotspot, likely `src/bin/aspen-token.rs` or one of the remaining `aspen-cli` command files, before taking on the much heavier assertion-density/conditional-nesting refactors in `git.rs`."}}
{"run":35,"commit":"bd486f3","metric":4807,"metrics":{},"status":"keep","description":"Cleaned `src/bin/aspen-token.rs` without changing CLI semantics: introduced a single wall-clock helper for expiry checks, made duration parsing use saturating arithmetic, wrapped delegate command inputs in a small struct, and split capability parsing into short domain helpers so the token CLI file now runs Tiger Style-clean. `cargo check -p aspen` stayed green, and the cold repo-owned warning-site count dropped from 4825 to 4807 (-18).","timestamp":1776384888740,"segment":2,"confidence":6.622222222222222,"iterationTokens":24100,"asi":{"hypothesis":"`aspen-token` has a compact, low-risk warning cluster—time boundaries, saturating duration math, and one oversized capability parser—that can be cleared completely with helper extraction and small API cleanup.","lessons":"Small root-bin tools are good cleanup targets: one focused refactor can zero a whole file and keep compile validation cheap. The remaining workspace tail now points at root-library helpers like `src/utils.rs` and `src/protocol_adapters.rs`, which may offer another honest low-risk slice.","next_action_hint":"Inspect `src/utils.rs` and `src/protocol_adapters.rs` next; they appear in the cold benchmark tail with only a handful of mechanical ambient-time/conversion/overflow warnings."}}
{"run":36,"commit":"bd486f3","metric":4798,"metrics":{},"status":"keep","description":"Cleared another small root-crate slice: `src/utils.rs` now uses checked/saturating time and disk arithmetic with explicit boundary annotations, and `src/protocol_adapters.rs` bounds direct-scan limits without platform-size casts or vague quantity names. `cargo check -p aspen` stayed green, and the cold repo-owned warning-site count dropped from 4807 to 4798 (-9).","timestamp":1776385110197,"segment":2,"confidence":5.903846153846154,"iterationTokens":11619,"asi":{"hypothesis":"The benchmark tail in `src/utils.rs` and `src/protocol_adapters.rs` is purely mechanical—ambient time boundaries, checked conversions, and saturating arithmetic—so it should be a quick single-digit workspace win.","lessons":"Tail-chasing the fresh benchmark output works well once the big hotspots thin out. Small root-lib helper files can be cleaned in one pass and remove the noisy tail lines that keep reappearing in cold runs.","next_action_hint":"Continue from the new tail: inspect `crates/aspen-rpc-handlers/src/{client.rs,registry.rs,verified/validation.rs}` next for another low-risk batch of boolean naming, reservation, and ambient-time warnings."}}
{"run":37,"commit":"bd486f3","metric":4787,"metrics":{},"status":"keep","description":"Trimmed another `aspen-rpc-handlers` slice: `registry.rs` now reserves handler vectors and isolates dispatch timing behind one boundary helper, `verified/validation.rs` uses predicate-style lock-match names with explicit invariants, and `client.rs` now avoids the external `CounterConfig::default()` lint plus clearer rate-limit/blob-handled naming. Targeted `cargo check -p aspen-rpc-handlers` stayed green, and the cold repo-owned warning-site count dropped from 4798 to 4787 (-11).","timestamp":1776385406549,"segment":2,"confidence":5.482758620689655,"iterationTokens":15296,"asi":{"hypothesis":"The current benchmark tail in `aspen-rpc-handlers` contains several cheap non-semantic fixes—reservation, ambient-time boundaries, predicate naming, and explicit config literals—that should remove another small batch of warnings without touching RPC behavior.","lessons":"Even when a crate still has harder leftovers, shaving off the easy tail warnings is worthwhile and measurable. `aspen-rpc-handlers` now mostly contains the heavier client-loop/long-function issues plus a few isolated files, so the next pass should either tackle those directly or move to the fresh benchmark tail.","next_action_hint":"Inspect the new top tail files `crates/aspen-rpc-handlers/src/error_sanitization.rs` and `crates/aspen-rpc-handlers/src/verified/conversions.rs`, or pivot to another crate if the remaining client loop warnings look too structural for a quick pass."}}
{"run":38,"commit":"bd486f3","metric":4782,"metrics":{},"status":"keep","description":"Cleaned the remaining easy `aspen-rpc-handlers` tail outside the structural client loop: `error_sanitization.rs` now uses shared keyword tables plus explicit postconditions instead of deep if-chains, and `verified/conversions.rs` renames the DLQ helper type to Tiger Style casing. Targeted `cargo check -p aspen-rpc-handlers` stayed green, and the cold repo-owned warning-site count dropped from 4787 to 4782 (-5).","timestamp":1776385671857,"segment":2,"confidence":5.252032520325203,"iterationTokens":9957,"asi":{"hypothesis":"The fresh benchmark tail in `error_sanitization.rs` and `verified/conversions.rs` is isolated enough that a small refactor and naming cleanup should remove a few more warnings without changing any RPC behavior.","lessons":"Once a crate is mostly cleaned, the benchmark tail becomes a good work queue: isolated files can still produce measurable single-digit wins. `aspen-rpc-handlers` is now dominated by the structural `client.rs` leftovers, so the next decision is whether to attack that long-loop path or pivot to another crate with cheaper density.","next_action_hint":"Re-scan the cold workspace histogram and compare the cost of tackling `crates/aspen-rpc-handlers/src/client.rs` against a fresh dense file elsewhere; avoid getting stuck in a hard single-file refactor if another crate offers easier double-digit wins."}}
{"run":39,"commit":"bd486f3","metric":4714,"metrics":{},"status":"keep","description":"Cleared `crates/aspen-tui/src/ui/jobs.rs` with non-cheating UI-only cleanup: replaced dozens of implicit ratatui defaults with explicit constructors (`Style::new`, `Block::new`, `Layout::vertical/horizontal`), converted selection indexing to checked helpers, and added small render helpers/invariants to keep the jobs view Tiger Style-clean without changing displayed content or keybindings. `cargo check -p aspen-tui` stayed green, and the cold repo-owned warning-site count dropped from 4782 to 4714 (-68).","timestamp":1776386214908,"segment":2,"confidence":5.835820895522388,"iterationTokens":26034,"asi":{"hypothesis":"`crates/aspen-tui/src/ui/jobs.rs` is a dense, mostly mechanical hotspot dominated by implicit ratatui defaults and a couple unchecked selection casts, so an explicit-constructor pass should remove a large batch without changing TUI behavior.","lessons":"Ratatui UI files are excellent cleanup targets when warnings cluster around `Default::default()` usage. Switching to explicit constructors plus tiny index helpers produced a large honest win with minimal behavioral risk, and the benchmark tail still points at structural `aspen-rpc-handlers/src/client.rs` leftovers rather than any regression in TUI code.","next_action_hint":"Re-scan the warm/cold histogram and compare the remaining structural `crates/aspen-rpc-handlers/src/client.rs` cleanup against the next dense easier hotspot, likely another `aspen-tui` view such as `src/ui/ci.rs` or a large CLI command file."}}
{"run":40,"commit":"bd486f3","metric":4661,"metrics":{},"status":"keep","description":"Cleaned `crates/aspen-tui/src/ui/ci.rs` with the same honest ratatui-style pass used in jobs UI: replaced many implicit defaults with explicit constructors/helpers, tightened checked index/count conversions, and trimmed UI warning density without changing rendered behavior. Cold repo-owned Tiger Style warning-site count dropped from 4714 to 4661 (-53).","timestamp":1776386638014,"segment":2,"confidence":6.297872340425532,"iterationTokens":26034}
